text,created_at,favorite_count,retweet_count,lang
"Haiku

on the phone, holding,
the old saxophonist hears
his finest solo",2015-12-28 21:38:04,796,183,en
"I've said it before &amp; I'll say it again, I've never seen a paranormal investigator who didn't look like a paranormal investigator",2015-12-28 05:49:03,1119,266,en
"""Nothing but the finest horse oil for your face, my darling."" https://t.co/QdCG9WDUsH",2015-12-27 21:59:21,349,84,en
"Damn, this car smell like blang https://t.co/H9QOK5NG7x",2015-12-27 21:57:55,722,159,en
https://t.co/ykDEYSjWXP,2015-12-27 21:56:58,331,58,und
Getting pretty tired of not being Pierce Brosnan,2015-12-27 18:20:56,867,177,en
Woke up w televangelist bed head https://t.co/5HQdWZEPoi,2015-12-27 16:21:55,655,47,et
Movie Idea: a hapless harmless doofus gets pulled into a bunch of murderous crime shit by chance &amp; George W Bush plays the doofus,2015-12-27 08:17:19,369,50,en
My cousin just had her first sonogram &amp; found out she's having twins! https://t.co/awSIWvRoVG,2015-12-27 07:43:26,470,37,en
"I just watched a really great modern-noir movie on Netflix called ""Man From Reno,"" fyi. Recommend you do the same sometime.",2015-12-27 07:15:32,262,41,en
My son &amp; I went on a 17 mile bike ride today &amp; I'm now wondering if they make a full body Salonpas,2015-12-27 03:00:44,373,21,en
Stopped to fill up my car on the way to my daughter's accordion lesson and OH YEAH https://t.co/1GaIRqxKAX,2015-12-26 19:04:00,2446,420,en
The lack of toilet paper in this bathroom has ruined Christmas,2015-12-26 01:27:01,542,98,en
"Tonight, on Christmas night, more so than any other night, people of all creeds will likely be able to find a Tom Wopat movie on",2015-12-26 00:47:54,215,32,en
Twitter: Giving artless clods the opportunity to get interactive humor wrong since 2006,2015-12-25 18:18:13,406,52,en
My sister in law sent us a Christmas King Cake https://t.co/AZtFSkM3h3,2015-12-25 18:05:35,480,43,en
"...so Nick, Martini's bartender, never realized his dream of owning a bar &amp; always wondered why George Bailey acted so strangely towards him",2015-12-25 08:08:23,300,45,en
so fucked up on myrrh rn,2015-12-25 01:49:03,2131,746,en
"Sometimes life makes perfect sense. For instance, there's a classical music DJ on Sirius XM named Preston Trombly",2015-12-24 22:46:50,413,67,en
Watch @FoodNetwork tonight @ 10PM EST as I host another #CelebrityFoodFight! It's a game show that'll change your life! Prob for the better!,2015-12-23 21:48:29,120,27,en
Great thing about LA is the Arclight has actual movie costumes you can see close up. Wow! From the Danish girl! https://t.co/jyBQsCxnaA,2015-12-23 21:44:17,364,33,en
Having the hardest time finding Santa hat diva cups for all the ladies on my list,2015-12-23 18:51:39,381,75,en
"🎄What do these songs have in common:🎄
White Christmas
The Christmas Song
Silver Bells
Little Drummer Boy
Rudolph the Red Nosed Reindeer",2015-12-23 18:22:26,118,21,en
Mute vs. Block is sort of the dual-flush toilet of twitter,2015-12-23 08:32:46,709,213,en
"I'm horny, but I'm also looking to save some money. Does anyone know of a partial-release massage parlor in the Burbank area?",2015-12-23 07:10:31,346,51,en
"I'm not a complete snob, &amp; to prove it I'd like to announce that it will only take $100 to get me to see the Point Break reboot",2015-12-23 07:05:51,354,60,en
"Star Trek Into Darkness is on, &amp; noticed this 1st time I saw it: we'll still have shitty pull-chain roller blinds? https://t.co/q8reKAr4pp",2015-12-23 06:58:50,500,87,en
"Wait, the IMF in Mission: Impossible stands for ""Impossible Mission Force""? Why not ""Super Awesome Spy Squad"" or ""Get It Done Gang""?",2015-12-23 04:58:42,326,40,en
"My daughter's watching some awful Care Bears movie. Are there internet weirdos that want to fuck these things, too?",2015-12-23 03:42:04,646,108,en
https://t.co/7geOdUWhun,2015-12-23 01:23:15,778,87,und
"A donation to @MotherJones is a ""yes"" vote to keeping independent journalism alive https://t.co/69eAcxpbhn",2015-12-22 19:59:11,124,28,en
"Thanks for answering those calls on spkr phone, lady in coffee shop. I had a hunch you were an asshole, &amp; the confirmation is v appreciated",2015-12-22 19:13:11,569,84,en
Nobody in this family will butt chug nog with me. #ButtChugNog,2015-12-22 00:12:06,721,166,en
"&amp; white power types calling me ""cuck"". Who's gonna cuckold me? U? My wife already sleeps w a fat guy, except I don't buy swords at the mall",2015-12-21 23:45:46,4637,1152,en
Lotsa white nationalists in TL insulting my career. A supposedly talentless Caucasian w 25 yr show biz career should be encouraging to them,2015-12-21 23:40:32,1372,299,en
Barista at this Starbucks called me Steve twice. Prob thinks I'm @steveaustinBSR,2015-12-21 18:10:09,305,23,en
