text,created_at,favorite_count,retweet_count,lang
"i feel like a lot of ppl who got into fights were just asking for clarification: ""are you talking to me?"" ""what are you looking at?"" ""what?""",2015-11-05 21:59:53,145,34,en
please sign my petition to ban pistachio shells that haven't been cracked enough &amp; look like tiny alien mouths,2015-11-05 20:38:06,284,78,en
"Two people share a moment. One person remembers it forever, the other one didn't even notice it the first time. Welcome to life.",2015-11-05 16:50:50,531,200,en
"I am only going to say this once, so listen to me very carefully: I miss Marcy Playground",2015-11-05 16:27:41,124,11,en
HEAR ME OUT: therapathy - healing through utter indifference,2015-11-05 01:33:03,195,57,en
dat futility of lasting human connection doe,2015-11-04 20:46:43,309,104,en
"if you guys need me, i'll be in the cloud",2015-11-04 15:47:53,102,21,en
showbiz at its disgusting finest is someone you've met 5x doesnt remember you &amp; but you've magically been getting their e-newsletter for yrs,2015-11-04 04:03:41,164,23,en
What would crime shows do without abandoned warehouses (besides rot I mean),2015-11-04 03:30:44,83,13,en
"I think to balance out all the first-person shooter games, there should be at least a couple first-person innocent victim games",2015-11-03 17:44:39,174,43,en
"I call overly attractive people ""offensively symmetrical""",2015-11-03 06:01:59,390,100,en
One great way to construct an argument is to not let anyone else hear it,2015-11-03 02:31:06,157,33,en
New Subway slogan pitch: Don't be a hero,2015-11-02 20:03:46,81,20,en
"""you wouldnt believe me if i trolled you!!!""-the internet",2015-11-02 02:42:21,99,15,en
"Did you guys use your extra hour to watch another episode of 60
Minutes because at that point, you are truly living",2015-11-01 23:06:46,138,39,en
I ran into a celebrity!!! https://t.co/RTsyz8OQNJ,2015-11-01 17:28:14,196,31,en
Going home when everyone else is about to go out feels like beating the system,2015-11-01 02:44:18,286,64,en
"I AM A SANDWICH ARTIST, winning back subway's brand for them https://t.co/emuhbjRY0s",2015-10-31 23:40:19,618,69,en
"""You would be so much prettier if you put on a little makeup.""-Joker's Mom",2015-10-31 21:54:41,152,40,en
"Hey couples at farmers markets, we get it, you don't have to hold hands to test tomato firmness",2015-10-31 18:48:47,291,65,en
Halloween is the one time of year people wear their masks on the outside,2015-10-31 16:21:49,184,65,en
"I don't demand a lot of people, but please have a minimal web presence",2015-10-31 16:02:12,133,30,en
I see a lotta people dressed up as Mets fans for Halloween this year,2015-10-31 04:12:56,262,78,en
You know how hiphop artists often drop their names in songs? I consider that responsible artistry.,2015-10-30 21:35:31,69,6,en
halloween costume pitch: that awkward moment when you ain't got no costume,2015-10-30 18:47:32,69,10,en
YOOHOO. Here is my appearance on @LateNightSeth last night! Brought to you by the delicious mind of @benwarheit: https://t.co/OGhlgMdN4g,2015-10-30 17:23:38,54,6,en
A pop song is a worthy nemesis for a brain,2015-10-30 03:14:19,149,48,en
Hey ya doodles! My skin-wrapped skull appears in tonight's @LateNightSeth &amp; so does the ghoulishly funny @benwarheit! 12:35am/11:35 c on NBC,2015-10-29 23:50:39,54,8,en
Can we ever know what anyone else is really talking about,2015-10-29 21:30:08,91,15,en
Social media is everyone's last ditch PR campaign to retain a fickle public's affection,2015-10-29 03:50:00,96,20,en
He died doing what he thought he loved: being mind controlled,2015-10-28 22:04:47,186,53,en
"""Been there, dread that""-anxiety",2015-10-28 21:39:58,223,77,en
Halloween costume pitch: Sexy Benghazi Trial,2015-10-28 05:18:42,218,59,en
I will never not be intrigued by adults who drink full glasses of milk,2015-10-27 16:38:53,536,122,en
"The next time someone tells you about the weather, say ""don't you DARE talk to me like that!""",2015-10-26 19:38:40,125,32,en
something you should know about me is i apologize whenever i thumbs down a song on pandora,2015-10-26 17:40:45,198,22,en
When u in the laundromat &amp; it's fall https://t.co/AZWFvfcGyf,2015-10-26 00:00:53,221,32,en
A memory is a gif your heart makes,2015-10-25 14:00:51,1781,978,en
I spilled my latte hitchhiking in the back of a fireman's pickup truck in Mississippi is an improv scene I just real-life experienced,2015-10-24 21:24:34,181,16,en
"All hail airport salads, the saddest of the salads",2015-10-23 16:36:28,174,23,en
"If you like goofball drawings &amp; cartoons, you'll love my pal @JudahWorldChamp's new book, If the Raindrops United. 💧 https://t.co/hym8G4acwj",2015-10-23 15:12:29,44,2,en
My cabbie's driving philosophy is what if nothing matters,2015-10-23 03:07:29,415,83,en
The nice thing about getting older is you don't care if anyone else does anything,2015-10-23 02:03:38,218,68,en
Tonight i sing two words find out which ones they are https://t.co/2LPi1sEGkG,2015-10-22 20:17:28,16,2,en
"Quick fact about me: if i see someone carrying sports equipment, i have to say the sport out loud like i am in a children's book",2015-10-22 18:30:16,171,33,en
The hummus versus pita chip ratio politics in my snack pack is truly grim,2015-10-22 03:11:48,129,13,en
Changin' the nap game one z at a time,2015-10-21 19:05:33,72,20,en
What's my beauty secret? Waving my hands in front of my face at all times,2015-10-21 16:40:53,130,36,en
Imagine a baby with salt &amp; pepper hair &amp; a loose stock portfolio,2015-10-21 04:37:10,133,13,en
"when people are like ""i get what you're going through"", the meanest part of my brain is like ""can you get what im going through OVER THERE?""",2015-10-21 01:04:40,148,35,en
I am not saying men are often just handed job offers without deserving them but they are often just offered handjobs without deserving them.,2015-10-20 19:23:42,340,86,en
One devastating way to hang out with friends is to take an instagram pic together &amp; then periodically update them on how many likes it has,2015-10-20 18:37:13,207,39,en
My phone's at 1 percent #ScaryStoryIn5Words,2015-10-20 16:09:03,192,128,en
"Carrie Bradshaw, typing on gigantic desktop in a void: ""Is flaky the new black?""

*all the keys fly off*

Also it was Miranda the whole time",2015-10-20 15:26:32,107,16,en
"Paper bag head 1: who are you?
Paper bag head 2: here's a better question, why dont more people do this?",2015-10-20 04:46:31,81,13,en
"""Heyyyyyyy don't I know you from somewhere?""-me, pointing at a stop sign",2015-10-19 20:42:57,83,19,en
"NY! Women's Education Project, an amazing charity, is having a fundraiser this wed @ 7: https://t.co/s45f9VNrFV (discount code: APARNA) go!!",2015-10-19 18:15:43,15,8,en
app idea: HEARSAY; everyone posts vicious rumors about each other &amp; no one has the chance to defend themselves &amp; we call it a day,2015-10-18 22:05:28,420,106,en
"*tapes full-length mirror to vision board*

(beat)

*universe gets sucked into itself*",2015-10-18 21:28:54,84,16,en
I am such a great communicator in my head,2015-10-18 20:01:50,151,62,en
When you in a different city waiting for a 3:15am train because you booked the wrong one http://t.co/ucxnqw95Jd,2015-10-18 05:11:41,83,13,en
"Whenever bartenders ask you to do a shot with them, it feels like for one fine moment you in the illuminati",2015-10-18 02:39:09,481,98,en
Every bad week for me is a great week for hozier's take me to church,2015-10-17 20:55:39,139,17,en
I am a ghost in the sheets &amp; a ghost in the streets. I am wearing a costume.,2015-10-17 16:45:19,497,140,en
Thank holy hell for men on the internet or i wouldn't know what my number or inherent worth is!!!,2015-10-17 03:28:12,632,165,en
I almost got run over by a falafel cart today &amp; honestly it woulda hit the spot,2015-10-17 00:51:30,274,34,en
I wonder if nice strangers realize they can be a whole damage control PR campaign for someone's day,2015-10-16 04:43:28,211,60,en
My musical taste could best be described as playing the same song 79 times in a row until i hate it but i hate the system more,2015-10-15 23:53:41,349,101,en
Show me a man who isn't easily impressed &amp; i will show you oh i'll show you alright,2015-10-15 20:05:32,126,19,en
The will to not google people to learn self-destructive information about them is strong in this one,2015-10-15 17:42:50,83,14,en
Oops i forgot to be a person today,2015-10-15 04:28:30,201,88,en
Sometimes when i feel sad&amp;lonely i pretend i am walking an invisible dog &amp; she is peeing on everyone &amp; they dont know oh they dont even know,2015-10-13 23:21:57,660,218,en
"Whenever I see a gang of cronies in music videos, I always wonder about #7's hopes and dreams",2015-10-13 14:30:24,67,13,en
Failure is just growth with an attitude,2015-10-12 19:28:15,170,75,en
Thaenks goodnesp fur asutocurrkect!,2015-10-12 04:15:18,64,23,en
Getting back from a trip is both the most comforting &amp; depressing thing. Especially when you bend down to hug your kids that don't exist.,2015-10-11 23:25:55,338,60,en
I accept compliments like I am a spy: 1) deny 2) deflect 3) cyanide pill,2015-10-11 15:20:35,361,134,en
My favorite thing to do in hotel rooms is pace around with my head in my hands wondering how long before the feds get me,2015-10-11 05:24:30,494,151,en
LA is fun because whenever you have nothing to say in a convo everyone just assumes it is your crest white strip time,2015-10-10 23:39:21,242,27,en
Sometimes when i am supertired i give baby girl an extra treat by referring to myself as baby girl,2015-10-10 18:32:14,253,60,en
Whenever there is a bird trapped in the airport it feels like they just came in to see why we make flight such a mundane spectacle,2015-10-10 11:10:17,649,177,en
There is no sweeter joy than wildly insulting people you barely know at all to make a friend feel better,2015-10-09 21:30:36,309,92,en
Will the real imposter syndrome please stand up,2015-10-09 21:12:48,109,27,en
You can lead a horse to water on Mars but you cant make it in show business,2015-10-09 21:08:35,86,12,en
"Every like on social media is the gentlest ""k""",2015-10-09 02:18:39,209,45,en
All hail the tiny male ponytail reveal,2015-10-09 00:32:56,55,5,en
I feel like some girls are a Jemma no matter what their real name is,2015-10-08 22:24:00,102,6,en
"Pretty obvious that when I write my tell-all memoir someday, there will be four to six chapters about strangers who hurt my feelings",2015-10-08 19:40:51,287,80,en
"*pointing on date's menu*
I highly recommend the why are we putting ourselves through this again",2015-10-08 03:41:40,267,49,en
Good friends pulling you out of bad moods are like your foot falling asleep. At first you dread it then you are twitching &amp; jumping &amp; alive!,2015-10-08 02:57:27,155,37,en
my favorite kind of hiphop is reflective where they look at their life &amp; really stop to count all the cristal bubbles,2015-10-07 19:54:48,86,15,en
I wish you could curl up inside songs &amp; dance your way out,2015-10-07 03:26:28,185,78,en
"I unsubscribed to a list-serv &amp; they sent me an email saying ""You've changed."" Yeah, yeah I have. And I ain't never goin' back to that life.",2015-10-06 18:35:12,145,19,en
the @CW_CrazyXGF show is about to start at UCBeast! Hosted by @RubyKarp &amp; @jennyjaffe tune in for tales of love gone awry,2015-10-06 01:52:42,16,4,en
I wish you could dial 9 to get out of work!!!,2015-10-05 19:44:12,102,15,en
I wish you could mark conversations as unsaid.,2015-10-05 17:46:56,416,193,en
A woman ahead of me just ordered a no-lettuce salad &amp; basically sent my notions of everything packing,2015-10-05 16:30:41,175,27,en
Imagine if Kim Jong Un tried to Halloween his name and all his advisors were like sure great idea boss you do you,2015-10-05 02:44:17,57,11,en
When it sunday and u realize u a pile of mud http://t.co/yKc2WGYbmk,2015-10-04 23:23:35,223,89,en
Thank you toronto &amp; #jfl42 for a truly heartmushing week! 💞💟💖💓🇨🇦,2015-10-04 20:43:15,50,4,en
I can't promise I know what I am talking about but I can promise I know what I am not talking about,2015-10-04 17:23:52,126,41,en
They can put a man on the moon but then they cant just leave him there!?! It's crazy!!!,2015-10-04 14:51:20,137,28,en
Where my mental prisoners at make some whimperzzzzz,2015-10-03 18:00:24,85,9,en
My outfit is generally a museum for what I have eaten that day,2015-10-02 18:10:57,241,56,en
"hey internet commenters, your out of you're damn minds",2015-10-02 05:13:12,193,34,en
"If we are at a point where mass shootings fail to surprise us, something is broken.",2015-10-01 19:54:29,541,511,en
Wifi art thou roaming-o,2015-10-01 18:00:19,183,51,en
give a man a fish &amp; he'll eat for a day but teach a man how to do a podcast &amp; he'll never stop asking you if you've listened to it yet,2015-09-30 19:44:39,1102,518,en
god grant me the serenity to question religion sometimes,2015-09-30 19:04:31,119,20,en
Imagine someone who loved you enough to slowly poison you little by little every day for years!!!!,2015-09-30 03:36:18,123,27,en
"In terms of having some real dirt on me rock bottom-wise, i think nutella wins",2015-09-30 01:35:40,181,30,en
Sometimes I feel bonkers! And other times I also feel that way!,2015-09-29 13:40:44,100,24,en
"I want to be one of those older women who wears so many accessories people are like ""is it me or did that pile of scarves just move?""",2015-09-29 04:34:14,402,105,en
Is Matt Damon trying to make an airtight argument on why he should be left on Mars,2015-09-28 19:36:13,315,112,en
*pretends to listen by nodding so hard my neck snaps*,2015-09-28 16:48:28,103,26,en
Crazy to think we are all looking up at the same super blood moon right now but some of us are undeniably rascals,2015-09-28 02:46:10,242,59,en
Did u guys kno that the super blood moon is just a promo for fox's scream queens™,2015-09-28 02:27:17,251,49,en
date idea: watch the super blood moon together then slowly back away from the relationship,2015-09-28 01:03:46,207,49,en
It is always a blood moon if you are in the sisterhood,2015-09-27 18:17:44,298,92,en
Sometimes it feels like no one in this elevator gets me!!!!!,2015-09-27 17:49:23,138,17,en
Do you hear that? It is everyone else!!!,2015-09-26 21:06:20,53,15,en
"""That is soooo random. K fire again.""-a general in the military, probably",2015-09-26 17:03:14,64,6,en
Not the first time a Boehner has resigned for reasons it does not wish to go into,2015-09-26 16:22:58,152,29,en
"Super late night commercials comfortingly offer the blanket of ""neither of us are where we'd like to be right now, are we""",2015-09-26 04:24:49,177,36,en
here is a real fun thing i got to do with some hilarious ladies you might recognize (@lenadunham &amp; @amyschumer): http://t.co/1bWUnGt5Y0.,2015-09-25 15:05:22,69,8,en
"When someone tells you ""this isnt a game"" they usually mean it is a game but you need to follow their rules",2015-09-25 02:53:55,434,166,en
I am a romantic hopeless,2015-09-24 19:28:12,271,116,en
"date idea: get flu shots together, then hope for the best",2015-09-24 03:33:34,174,47,en
Disappointment is a dish best served to the person next to you,2015-09-24 01:46:20,142,43,en
LISTEN UP &amp; LISTEN UP GOOD I will GO DOWN WITHOUT A FIGHT,2015-09-23 21:33:28,92,16,en
If you are eating cereal but thinking about a sandwich is that food adultery,2015-09-23 19:41:45,178,52,en
"irrationally proud of a monologue joke i wrote from yesterday's @LateNightSeth (starts at 3:15), yeehaw: http://t.co/N8CDAL8PUV",2015-09-23 17:39:52,85,5,en
"Everyone should have at least 12 to 34 contacts in their phone labeled ""spy?""",2015-09-23 02:15:36,292,82,en
"oh hello, i couldn't help but notice you are also screaming in public",2015-09-22 22:25:57,330,96,en
"yesternight the cold open on @LateNightSeth was a real hoot (jtimber fans, look sharp): http://t.co/UUJ2U04cLo",2015-09-22 13:49:05,20,6,en
The Emmys remind us what is important in the world: who pretended the best,2015-09-21 01:38:05,253,84,en
Brunch like nobody else showed up,2015-09-20 19:04:27,152,35,en
Congrats @BloomersComedy for putting on a spectacular fest &amp; thanks for having me on your shindig! ✌🏽️😍🍕😍🍕😍✌🏽,2015-09-20 17:14:15,33,9,en
"Whoever keeps farting in the Quiet Car on the Amtrak train, you are both my greatest enemy &amp; hero",2015-09-20 03:55:58,203,36,en
When two friends you introduced like each other better http://t.co/3JBmOFGTAB,2015-09-19 20:02:26,199,58,en
Just said hi to a statue,2015-09-19 15:46:37,176,32,en
Quick make eye contact with the other person in the bar who's floundering,2015-09-19 02:49:44,131,19,en
"We should think of people who don't like us as mental demons that somehow escaped to follow their dreams. Way to motivate, ya lil goblins!",2015-09-18 23:34:33,199,54,en
"What is life is one long bit &amp; you only ""get it"" after it is done *gently places mic on floor*",2015-09-18 21:34:29,92,16,en
Would love to hear what you are obsessively overanalyzing these days,2015-09-18 21:11:59,285,121,en
The best time to reevaluate your life is when the online video you're watching is buffering,2015-09-18 03:41:18,446,161,en
"this is a fascinating read, highly recommend: http://t.co/czyPDU7MAR",2015-09-18 00:08:38,82,16,en
What if I told you this sentence falls apart at the dje dndndshs,2015-09-17 21:38:45,82,8,en
The GOP debate is a nice reminder that adults get scared too,2015-09-17 01:58:44,228,80,en
ALL MY SOCIOPATHS OUT THERE MAKE SOME CAREFULLY CALCULATED NOISEEEEEEEEE,2015-09-17 00:13:01,152,33,en
"Grounding thought: We are all ""that guy"" to somebody",2015-09-16 22:01:08,164,61,en
I WILL NOT APOLOGIZE FOR HOW MUCH I SAY SORRY,2015-09-16 02:27:45,274,81,en
I never relate more than to the example of the person who keeps making the mistakes in the self-help book,2015-09-16 01:05:31,134,33,en
I always underestimate how quickly my brain can go full rom-com,2015-09-15 02:13:42,242,71,en
"Salad bars are all like ""do you hate making decisions? How about all of them at once???""",2015-09-14 16:37:12,165,50,en
Hurrying through small talk is like skipping that ad to get to the real video,2015-09-14 02:35:22,158,57,en
I hate to say it but fantasy has way better writers than reality,2015-09-13 21:06:22,289,153,en
IDEA: a club just for bouncers,2015-09-13 20:34:00,525,147,en
Listen I'd love to chat but the first part was a lie,2015-09-13 17:25:53,351,163,en
PICK UP LINE: has anyone ever told you that you look like a shadow of a man BUT IN A GOOD WAY,2015-09-13 02:44:27,112,28,en
When you run into your ex on the street &amp; you realize you gotta stop dating mailboxes http://t.co/kxRryhlojI,2015-09-12 22:09:29,195,39,en
"If New York City had a catchphrase, a strong contender would be ""are you serious rn?""",2015-09-12 16:11:59,134,25,en
If you wanted to take a selfie in prehistoric times you had to find a cave wall &amp; go crazy with some berry juices,2015-09-12 03:30:40,285,123,en
Oops i just lived vicariously through a couple's entire relationship on instagram,2015-09-12 00:08:59,329,56,en
Statutes of limitations seem to be the law's way of saying get over it girlfrienddddd,2015-09-11 20:41:53,124,29,en
"Roberta Vinci's first words after beating Serena Williams in the U.S. Open Semifinal were ""Sorry."" Classic.",2015-09-11 19:14:43,126,48,en
I like sitting at airplane gates &amp; deciding who could be an emergency pilot,2015-09-11 02:40:57,116,15,en
Plants actin' thirsty as hell,2015-09-11 01:12:43,189,52,en
The percentage of time I have earbuds in to when I am actually listening to anything is chilling,2015-09-10 16:28:20,109,15,en
Photos be shopping,2015-09-09 15:44:31,86,24,en
ALL I ASK FOR IS A SHOCKINGLY SPECIFIC AMOUNT OF RESPECT,2015-09-09 02:42:19,412,123,en
Sometimes the only way to do a positive reframe on a picture is to turn it so it's facing the wall,2015-09-08 20:54:31,84,17,en
"When someone says they are boring, LISTEN TO THEM &amp; don't launch the dullest investigation of all time",2015-09-07 21:53:24,218,48,en
"One of the worst thoughts I have is ""lemme go ahead &amp; bump your 'likes' up to a nice round number""",2015-09-07 19:49:32,130,12,en
"Hey people who arent impressed with anything, guess what? I impressed with you *leans over, boops nose*",2015-09-07 14:38:50,255,54,en
Ask your doctor if the current person you're seeing is right for you,2015-09-07 02:24:31,274,61,en
"You should be allowed to plead ""adorable"" in court",2015-09-06 22:43:47,200,84,en
First known incidence of #iwokeuplikethis http://t.co/Y88ADu80nB,2015-09-06 19:52:27,127,28,en
First known incidence of #squadgoals http://t.co/cbIhyj1pBN,2015-09-06 19:33:47,326,134,en
"First known incidence of ""the rachel"" http://t.co/IpUE8LemmJ",2015-09-06 19:25:30,148,22,en
There wasnt a dry eye in the room = I threw chopped onions at everyone,2015-09-06 02:25:09,372,134,en
Scrolling thru social media is a ticking time bomb before something triggers you emotionally &amp; you have to yolo yourself back to life,2015-09-05 19:23:26,338,129,en
I bet Serena Williams cares so very deeply about all the male approval of her &amp; it is in fact what keeps her going every second of every day,2015-09-05 03:26:58,623,189,en
"Half empty wine glass outside of hotel room, i'd love to know what's next for your career",2015-09-04 22:04:02,74,7,en
Can I transcribe a scene from COOL RUNNINGS for a wedding toast or is it considered old hat?,2015-09-04 19:42:47,146,19,en
Saying sorry when correcting people on your name feels like the ultimate betrayal of self,2015-09-04 01:20:51,328,113,en
"REAL WORLD MATH PROBLEM: 3 people are hanging out, 2 of them are checking their phones, how long before the 3rd person takes out their phone",2015-09-03 16:41:35,854,598,en
This man using a panera as his home office is NOT happy with my contributions to the company thus far (mustard),2015-09-03 15:13:04,149,19,en
"""Blart imitates life.""-at least three studio executives",2015-09-03 01:55:36,180,37,en
"How many times do you guys think ""what is life"" per day? I am up to 7000",2015-09-02 21:43:11,375,184,en
"""I wonder if blue man groupies are called bloopies"" is a captivating thought i just had",2015-09-02 18:33:33,159,30,en
I like when clocks are caged like time is the ultimate bad boy,2015-09-02 16:36:06,188,57,en
My therapist said it was ok: a life story,2015-09-02 05:11:46,270,94,en
Weird moods feel like that person you didn't want to run into on the street &amp; then they insist you grab a coffee &amp; catch up,2015-09-01 21:19:40,133,41,en
Secrets to whisper into a seashell: one time i showed up early to an appointment so i could work on an aspirational instagram collage,2015-09-01 19:48:14,101,16,en
Vulnerability hotspot: waiting for a friend,2015-09-01 16:58:32,189,68,en
Please Venmo me for that great face I made last night,2015-08-31 19:22:06,45,4,en
Oh to have the perseverance of an unwanted thought,2015-08-31 15:52:55,553,333,en
"Sunday is the New Year's Eve of the week, so much pressure to make it count &amp; then you always drop the ball at some point",2015-08-31 04:28:49,179,43,en
"One gracious way to take compliments is to go ""omg you noticed!!!""",2015-08-30 23:59:45,117,16,en
Better to have loved &amp; lost than to have gotten the toaster in the divorce,2015-08-30 21:50:32,134,32,en
"Emotions are a circle and laughter is right next to tears, she mumbled into the sky, and the sky said omg yas girl",2015-08-30 05:29:49,300,98,en
"""I just feel like my arguments are never valid.""-straw man, to therapist",2015-08-29 22:31:17,178,51,en
"If you cut me, do I not bleed slime?!

Yeah, you're right. I should get that checked out.",2015-08-29 17:01:29,83,13,en
Take (borat voice) *mah wiiffee* please,2015-08-29 16:46:03,45,10,en
Hope i meet a nice sandwich &amp; fall in love tonight!!!,2015-08-29 04:00:25,256,68,en
I feel torn when guys mansplain doors open for me,2015-08-28 16:09:15,116,16,en
"A woman behind me in line just called someone &amp; said ""ok i totally dont understand your text"" so she wins advanced communicator of the day",2015-08-28 15:49:20,210,33,en
Taking a self-help book on a bus feels like a lot of pressure for that ride to be transformational,2015-08-28 02:25:19,118,21,en
I never feel like a more vital part of the universe than when i can provide a lady with an emergency tampon,2015-08-27 21:49:33,438,89,en
This could just be the coffee talking but AGHHHHHHHHHHHHHHHHHHHHHHHHHHHHHHHHHHHHHHHHHHHHHHHHHHHHHHHHHHHHHHHHHHHHHHHHHHH *lights car on fire*,2015-08-26 20:16:07,278,75,en
Zoops i gots caught up in a scrumble of tourists &amp; now find myself atop the empire state building waiting for love stay safe out there folks,2015-08-26 15:42:13,138,15,en
Make the cha-ching noise whenever someone networks with you so they know you serious about bizness deals,2015-08-26 04:06:40,244,66,en
I wonder if ed sheeran thinks about us sometimes too,2015-08-25 18:32:32,92,16,en
I wish there was a Dilly Dally time zone where you are always off an hour from everyone else no matter where you are,2015-08-25 18:14:37,69,20,en
Yay for this! https://t.co/Ck2f93tAYq,2015-08-25 17:07:30,6,2,en
"Mindfulness exercise: dont scratch an itch, you will be so in the moment you will explode into a million itchy stars",2015-08-25 16:39:01,90,22,en
"Make new friends but keep the old, one gotta baby now &amp; now the other one gotta baby oh no so many babies so many babies baby baby baby baby",2015-08-25 05:21:25,209,48,en
"""You should know I don't just share my opinions with anyone...I share them with everyone.""-commenters",2015-08-24 21:31:17,94,20,en
Sometimes I see what the person NEXT to me in the coffee shop is doing in case I could be procrastinating better,2015-08-24 17:39:30,157,28,en
