text,created_at,favorite_count,retweet_count,lang
An important question to ask businesses you frequent is if they accept chump change,2015-08-23 23:37:49,124,23,en
"A fun thing to do after you see a movie by yourself is to stand up at the end &amp; say ""has anyone seen my betrothed?!?!??""",2015-08-23 20:53:27,179,26,en
"If you can't celebrate someone else's happiness, you should play the most upbeat song on the world's smallest drums",2015-08-22 23:08:53,84,23,en
IDEA: BLINDR: an app to alert you if there are people you need to avoid nearby,2015-08-22 19:17:44,469,153,en
I am FINALLY old enough to wear Chico's! HOPPY BLURFDAY TO ME.,2015-08-22 16:36:48,126,9,en
When it u birthday and u be like http://t.co/UbKSKupj5m,2015-08-22 04:03:56,64,4,en
Baes walk among us,2015-08-22 02:55:43,170,50,en
WHY WONT MY BUS MATE ACCEPT MY TAMPON OF FRANDSHIPS,2015-08-21 21:19:46,133,14,en
I am thrilled &amp; honored to announce I have joined the delightfully on fleek writing staff at Late Night with Seth Meyers (@LateNightSeth)!!!,2015-08-21 16:56:48,2607,132,en
53 celebrity baby burps you wont even believe,2015-08-20 22:40:41,104,13,en
"I don't have opinions. I thought I had one once, but it was just gas.",2015-08-20 19:22:30,119,31,en
"Garbageman taking a selfie, you are everything",2015-08-20 13:21:59,273,33,en
Thank you summer for teaching me to sweat in places i didnt even realize were possible like behind my eyeballs,2015-08-20 01:12:32,162,38,en
All these goofs &amp; myself will be appearing on @gaffiganshow tonight at 10 on TV Land! Tune yourselves to it. http://t.co/nQxyLcUKtO,2015-08-19 21:43:47,100,7,en
"no fair how when musicians move real weird onstage, everyone's like oooh, but if u move real weird, it's like u ruining the dentist's appt",2015-08-19 19:42:17,123,29,en
"Every time i go through a buffet and look at the results i think ""what happened back there""",2015-08-19 17:48:59,103,10,en
"""Pardon my reach.""-internet celebrities",2015-08-19 04:31:21,94,17,en
"""k""-society",2015-08-17 21:37:03,111,40,en
Monday: it's like if Sunday got a job,2015-08-17 03:27:41,181,44,en
Is everyone googling on all cylinders,2015-08-16 23:16:13,76,11,en
"Reply all once, shame on you. Reply all twice, the resulting boom of silence forms a hole in the universe that swallows us all.",2015-08-16 21:35:56,110,18,en
That's me in the corner donating money to public radio,2015-08-16 20:10:40,143,23,en
All up in the club trying to find one good personality,2015-08-16 04:46:03,399,135,en
People say there is no set of feelings quite like having a child but I have had my food arrive at a restaurant so,2015-08-16 00:00:46,392,178,en
I love that motorcycle drivers definitely have nothing to prove,2015-08-15 06:11:13,219,49,en
Starting to get the feeling at least 17 people on the Internet have opinions,2015-08-14 20:36:48,126,27,en
"Where do I see myself in five years? Why right here in this time loop, silly",2015-08-14 19:08:29,127,39,en
Waiting for stuff: a psychological thriller,2015-08-14 14:39:54,222,115,en
"Whenever I see a couple on the street fighting, I wanna be like ""hey buds, next time I'LL pick the restaurant""",2015-08-14 04:05:13,172,38,en
"""how may i embroil your psyche today?""-the fiona apple genius bar",2015-08-13 21:40:23,88,14,en
"I feel like no matter how great your day is going, Jason Mraz is having a better one",2015-08-13 14:51:49,428,178,en
The refresh button is not here to make friends,2015-08-13 01:43:21,67,12,en
I feel like both the best date ever &amp; worst date ever would end the same way: suicide pact,2015-08-13 01:15:23,219,47,en
"Is everyone stretching enough? Is anyone stretching too much? I definitely mean you, businessman at the bank power lunging.",2015-08-12 16:01:55,122,14,en
"ROMAN: hey guys remember when i made that joke &amp; nobody got it? i'm bringin' it back!

*entire civilization crumbles*",2015-08-11 22:11:26,56,7,en
What time do you guys do your afternoon cup of dread?,2015-08-11 17:38:49,87,17,en
"just had the thought ""yay, dessert!"" when thinking about my calcium chew like the saddest stock image lady",2015-08-11 01:31:58,231,25,en
"Whenever someone tells me to ""make myself at home"" it feels like an open invite to find all the chocolate &amp; start building a nest prototype.",2015-08-11 01:24:53,184,28,en
Fox News: You heard it here worst.,2015-08-09 16:59:19,503,184,en
People Facetiming With Their Parents: a tragedy in 5000 freeze frames,2015-08-09 15:12:53,102,7,en
Free wifi aint free,2015-08-09 14:58:48,84,14,en
A RT is just a wish a fav makes,2015-08-09 03:02:31,257,76,en
There is nothing quite as inexplicably upsetting as a hair in the water fountain,2015-08-08 21:36:18,78,7,en
"How many misogynists does it take to change a lightbulb? Just one, but you know he'll somehow use it as proof that he doesn't hate women.",2015-08-08 17:59:09,595,309,en
"Let me slip into something more comfortable.

*slides into a vat of pudding, gestures you to leave*",2015-08-08 17:12:40,897,390,en
FOMO for introverts is being out &amp; thinking omg i wonder what my carpet pattern is up to rn,2015-08-08 04:14:01,249,50,en
I feel like emotions are frequently like transit intercom announcements: unreasonably loud yet impossible to understand,2015-08-07 22:35:05,357,172,en
Wanna feel the years pile on??? Overshare with someone you used to be close with!!!,2015-08-07 18:47:29,150,27,en
I think my middle school binder art says it better than I ever could (barely inspirational quotes amidst a sea of cagey looking male actors),2015-08-07 05:20:41,99,7,en
Nothing like a hotel gym to remind you treadmills can have potholes in them,2015-08-06 20:44:48,85,5,en
Eating pizza in bed &amp; now I have no more goals,2015-08-06 03:52:27,180,46,en
It's National Underwear Day! Consider doing nothing at all differently.,2015-08-05 19:13:50,168,62,en
I dunno who Drake Meek is &amp; why he's trying to defund Planned Parenthood but he better cool it. This has been another hot ep of news mashup!,2015-08-05 14:47:01,182,38,en
GOP DEBATE DRINKING GAME: keep drinking,2015-08-05 14:08:23,219,73,en
Occasionally it's nice to ask the GPS lady where she wanna go,2015-08-05 05:17:43,294,77,en
"You guys seen these signs, just say stop on them? Crazy",2015-08-04 16:19:58,81,11,en
Stuck behind a jeep :( http://t.co/IAUgxUzcJ6,2015-08-03 17:05:39,140,6,en
Are you guys on ChapSnoot? It automatically posts all your farts in real time,2015-08-03 16:48:19,70,10,en
"whenever I see kids sitting in first class, I think ""eyes, i thought we blocked this type of violent imagery""",2015-08-03 14:21:34,80,7,en
"PROSPECTIVE MILLENNIAL BABY NAMES:
1) wut
2) tinyselfie
3) 👾🍒🗿🍬🌵🍕
4) newnumberwhodis
5) #GameofThronesFinale",2015-08-03 13:02:23,527,260,en
"TODAY I AM TWEETING FOR THE INDISPENSABLE TIG @TigNotaro &amp; ALSO ATTENDING A HINDU-JEWISH WEDDING!!! Catch me over there, ya cuties 😜🎈😜🎈😜",2015-08-02 16:50:54,117,1,en
Dat deer doe,2015-08-02 02:49:45,88,19,nl
PICK UP LINE: Are you the lovable scamp that Gotham doesn't want but needs?,2015-08-02 00:14:33,98,20,en
"If these walls could talk they'd be like ""these people really seem to care about our opinions""",2015-08-01 22:14:40,132,47,en
"If I marry the sea, can we register at a puddle",2015-08-01 19:08:28,39,7,en
"Tips to be as popular as babies at family gatherings:
1) pick up more blocks
2) burp in sudden shock
3) fall down with much buildup
4) leave",2015-08-01 17:06:26,178,33,en
"Whenever I try to act more natural, my brain gives me an error message",2015-08-01 16:16:17,104,37,en
"Blue moon
You saw me standing alone
Trying to leave this hangout
Without making it known",2015-08-01 03:50:42,159,39,en
"There is no right way to introduce yourself to a cutie but ""I'LL SEE YOU IN COURT"" is a start",2015-07-31 19:03:35,102,28,en
SELF-PRANK: use one of the dirty spoons at a coffee condiment station!!!! nobody will know what to do!!! especially you!!!,2015-07-31 16:41:44,67,8,en
"You know those jokes you make that only you like? That proves even your own demons have moments of ""let her have this, the poor fool""",2015-07-31 16:21:18,146,49,en
"Sometimes I google ""half-eaten cake"" &amp; dream about lives I could have lived",2015-07-30 22:05:22,97,19,en
"Based on the amount of rescheduling I do, I would say my dentist is really impressed by my teeth's career right now",2015-07-30 20:43:08,90,13,en
Current fear: making notable eye contact with a writer in this coffee shop looking for inspiration,2015-07-30 19:15:31,141,34,en
"Social media is like a dinner party where every two minutes, a new person goes ""Wanna see a magic trick? I'M RACIST!!!""",2015-07-29 19:01:21,343,140,en
Is the Pixels movie entirely blurred out?,2015-07-29 18:33:49,97,10,en
"Text me once, shame on you. Text me twice, congratulations, we are now trapped in an infinite emotional prison.",2015-07-29 16:43:48,312,124,en
Can't decide what to wear to this wedding I am gonna ruin,2015-07-29 04:12:04,184,18,en
ugh like that dentist's mom didn't have a tough enough time at dinner parties,2015-07-28 20:40:32,81,7,en
"Friendships are like a box of chocolates. A few are heaven all the way, others are immediate skips, &amp; then some gotta SECRET GARBAGE CENTER.",2015-07-28 20:08:51,452,184,en
"Donald Trump, Bobby Jindal, and Ted Cruz walk into a bar. Everyone else leaves.",2015-07-28 16:25:59,745,428,en
"Blue check, please",2015-07-28 06:49:37,99,8,en
"Don't get mad, get steven. He started it.",2015-07-28 03:59:49,297,102,en
"First dates are like podcasts where it's like ""oh no real theme we just hang"" &amp; then halfway through there's an ad for audiblescream dot com",2015-07-27 20:36:17,354,91,en
Anxiety on fleek,2015-07-27 17:38:32,285,154,en
DID U KNO: the California drought is primarily from people being offered water before LA meetings,2015-07-27 16:17:18,158,19,en
I feel like god's cell only gets one text message: u up?,2015-07-27 15:02:44,80,15,en
Opinions on the internet are like buttholes. Given a platform they never deserved.,2015-07-27 03:26:25,278,104,en
"Why do so many dramas start with a person swimming laps? As if to say, yes, it's great low impact exercise but there have to be consequences",2015-07-26 23:00:13,582,182,en
"TANKS A MILLION @aikenpromotions &amp; all for a lubbly dubbly time at the #VCF15! 
🇮🇪🍀🍀💫💥🌈⭐️🌈⭐️🌈💥💫🍀🍀🇮🇪",2015-07-26 19:55:10,18,1,en
"Some people come from old money, some from young money, I come from prenatal money. It hasnt been born yet.",2015-07-26 18:38:02,163,43,en
Pretty sure I have been listening to the same podcast episode on cars for most of my life,2015-07-26 17:11:05,52,3,en
nm gently spiraling wut abouchoo,2015-07-26 15:10:49,76,36,en
"boarding group 7 = instead of letting you on the plane, they tell you to stick your arms out &amp; make jet noises &amp; be a good sport about it",2015-07-26 07:18:48,183,28,en
One way to handle social anxiety is to pretend you are a ghost &amp; people are staring at you because they have a gift they never asked for,2015-07-25 23:00:22,1052,487,en
Why do we call it going to sleep when in fact i never left,2015-07-25 14:16:12,108,24,en
WELL IT'S OFFICIAL: i overannounce things,2015-07-25 02:02:42,459,95,en
"""ARE YOU A HOMICIDAL MANIAC? We want your story!!!""-the news",2015-07-24 13:16:57,167,43,en
"No, guns do kill people.",2015-07-24 02:59:32,643,264,en
You will never believe the thing I said to that lady after she was out of hearing range!!!,2015-07-23 04:46:46,140,30,en
"If a teardrop tattoo represents number of personal hardships endured, a gumdrop tattoo should represent number of toots not given",2015-07-23 02:42:05,112,19,en
Can't stop writing my memoir. Story of my life.,2015-07-22 23:41:40,477,110,en
Would anyone be interested in optioning rights to the pebble in my shoe,2015-07-22 20:51:31,63,3,en
the ancestry dot com results are in: i got minion blood,2015-07-22 18:35:04,129,25,en
Heads up if you dont fave my insta photo i will not make through the night but no presh,2015-07-22 01:45:15,84,9,en
I am so rarely on time that when I am I feel like I have to prove to everyone I cant pull off my face like a cheap mask,2015-07-22 01:34:23,69,13,en
I wonder if dog faces realize they are constantly killing it,2015-07-21 17:32:57,169,43,en
I take naps on naps on naps,2015-07-20 20:12:32,98,27,en
I'm in between inside jobs right now,2015-07-20 18:26:31,125,19,en
Hit the semi-colon &amp; then press the right parenthesis key until your finger bleeds NOW WHO IS FUN,2015-07-20 03:41:23,137,37,en
dunno which I like better: pretending to be asleep to listen to people talk or pretending to listen to people talk but actually being asleep,2015-07-20 02:01:19,265,77,en
My mood ranges from puppy emerging from pumpkin to Usher music video,2015-07-19 18:09:38,101,26,en
"If you still have a hotmail address, I feel deep,  endearing affection for you against my very will",2015-07-19 16:04:35,149,24,en
"TOP NEWS HEADLINES
1. Monster revealed to be, in fact, monster
2. Worldwide burning sensation
3. Fake War!!!*
4. Actress hiccups

*sports",2015-07-19 13:02:15,151,28,en
Have you guys tried not caring? Didnt care for it,2015-07-19 01:34:02,158,43,en
"I bet the person who invented the first alarm clock was told ""Congratulations! You've essentially ruined everything forever!!""",2015-07-18 22:23:43,174,48,en
Body language like whoa what do i do with this body,2015-07-18 19:10:31,82,28,en
"Man entering a White Castle at 7:30 in the morning, tell me all your secrets",2015-07-18 11:27:43,159,24,en
"Where my party people at 

so i can back away from you slowly",2015-07-18 03:16:56,387,172,en
Meditating in the backs of cabs: the aparna nancherla story,2015-07-17 23:47:34,73,5,en
"sometimes you get a request to connect on LinkedIn &amp; it's like ""geez, I thought we were friends, Dad.""",2015-07-17 18:43:21,57,8,en
"Imagine an NSA agent reading ""this user is private"" &amp; giggling",2015-07-17 17:13:57,311,101,en
"No Three Little Pigs spoilers please, finally getting to it",2015-07-17 16:10:11,131,17,en
Why does it feel like every cab driver thinks they're a contestant on The Amazing Race,2015-07-17 04:42:18,111,7,en
Pretty sure I've made it clear that I am vague,2015-07-17 01:43:41,213,64,en
"there are definitely conversations where both people at the end are like ""are we extras because none of that moved the plot forward""",2015-07-16 21:15:12,214,68,en
Thanks @marieclaire for the sparkle (#16 &amp; lookin' very over it): http://t.co/FP4HpVtEEO,2015-07-16 18:02:04,48,7,en
I like my men like I like my credit cards: compromised,2015-07-16 17:27:01,122,24,en
bedtime? not on my watch,2015-07-16 04:27:10,140,29,en
"Remixes are like if a song put on a fun wig &amp; said ""dya like it????""",2015-07-16 02:52:36,162,41,en
Every line item on my bucket list has drink more water next to it in parentheses,2015-07-15 18:15:57,92,20,en
Do you think people in salon school ask their professors for hair extensions?! THANK YA GOODNIGHT *triple axles into an open grave*,2015-07-14 23:54:58,330,79,en
"FREE SHOW WED 7PM feat. naomi ekperigin (@Blacktress), jo firestone (@kingfirestorm) &amp; @GiuliaRozzi! code: HAPPIER http://t.co/Cg5wwBXsKx",2015-07-14 18:16:17,5,3,en
Is being on the View now just essentially jury duty for celebrity women?,2015-07-14 15:11:07,376,87,en
"Someone sneezed at jury duty &amp; only one person said bless you. I guess everyone else needs to hear the nose's side first,",2015-07-14 13:44:11,121,25,en
"Everyone at jury duty is watching live with kelly &amp; michael with somber, measured integrity",2015-07-14 13:18:30,88,7,en
yes estrogen courses through my veins because i just teared up that my shoe was untied,2015-07-13 23:54:41,90,14,en
"Suicide notes: can't live with em, that's it",2015-07-13 20:18:17,159,13,en
"Hosting a FREE SHOW @CarolinesonBway WED at 7 with @Blacktress, @kingfirestorm, &amp; @GiuliaRozzi! promo code: HAPPIER http://t.co/Cg5wwBXsKx",2015-07-13 17:10:07,14,7,en
Imagine bob dylan having to re-record his voicemail greeting because he keeps exceeding the time limit,2015-07-13 15:16:10,212,47,en
Just call me Miss Independent...Bookstore,2015-07-13 13:54:31,79,9,en
I overthink therefore I am. Or am I? I mean there was that one time that I wasn't but then it's like nobody really was that day but then aga,2015-07-13 01:46:17,333,166,en
"I bet the phrase ""left to our own devices"" feels it's got a long bright future ahead",2015-07-12 21:57:59,159,48,en
WWJD for a Klondike Bar,2015-07-12 03:01:48,233,58,in
Drink more water? But that's what the Big Obvious lobby wants!!!,2015-07-11 19:58:20,67,6,en
LET THE RECORD SHOW THAT I TRIED,2015-07-11 04:55:43,227,92,en
"When a person from work writes you a jokey email, it truly feels like you beat the system",2015-07-11 00:36:40,88,12,en
"sometimes you say the wrong thing &amp; then you cant stop saying the wrong things until the other person's like ""so no fresh ground pepper?""",2015-07-10 17:22:17,112,24,en
There is only one ideal dance partner &amp; it is an empty apartment,2015-07-10 01:42:23,806,423,en
HEAR ME OUT: open bar in terms of standards,2015-07-10 01:07:10,61,12,en
Dating means one person's like I thought you'd be taller &amp; the other person's like I thought you'd be a better metaphor for my childhood pet,2015-07-09 20:17:27,225,63,en
Oh hi i didnt choose to see you there,2015-07-09 17:02:45,524,230,en
The older you get the more your knees are like never cared for ya honestly,2015-07-09 03:14:49,218,47,en
Pitbull feels like a lil kid brother who runs into every song &amp; goes NOW MY TURN!!!,2015-07-09 01:52:00,313,94,en
"If I was ignoring you, would I have marked you as unread dont answer that",2015-07-08 20:02:18,42,13,en
DIS IN ONE WEEK at SWeeEeet @carolines! 7PM! Feat. gems @kingfirestorm @Blacktress  @GiuliaRozzi TIX (use code BKFUN) http://t.co/Cg5wwBXsKx,2015-07-08 19:53:58,11,0,en
The doctor told me I have beautiful veins &amp; it is like duh my best feature after my stomach noises,2015-07-08 15:42:55,318,105,en
"""Fulllllllly crowning babe""-overly casual ob-gyn",2015-07-07 21:57:03,63,7,en
HEAR ME OUT: bookmarks for relationships,2015-07-07 04:41:44,254,44,en
My Sunday persona makes goths seem upbeat,2015-07-06 02:03:03,146,30,en
Shhhhh this is katy perry's writing time,2015-07-05 02:07:48,405,121,en
Honestly America doesn't look a day over 60 (segregation still existed),2015-07-05 00:57:17,164,49,en
Instead of live streaming the fireworks consider doing literally anything else,2015-07-05 00:39:08,204,56,en
HAPPY INDEPENDENCE DAY!!! Make it count by pushing people standing near you in crowds &amp; claiming you know the fireworks' agent.,2015-07-05 00:22:28,62,17,en
"Magic Mike XXL is the best absploitation film I have ever seen. Boundless sangria of thanks, @guybranum.",2015-07-04 23:30:17,79,9,en
July the 4th be with you. Did I do it right? AMURICA!!!! 🇺🇸🇺🇸🇺🇸🇺🇸🇺🇸🇺🇸🇺🇸🇺🇸🇺🇸🇺🇸,2015-07-04 16:34:25,116,38,en
Sometimes the best way to fit in at a party is to pretend you're a reporter doing a story,2015-07-04 04:39:35,488,156,en
Hey guys i am going to sleep. Does anyone want anything?,2015-07-03 20:03:27,307,103,en
"""Hey do I know you?"" is a nice way of saying ""Hey wanna second chance at potentially mattering to me?""",2015-07-03 18:03:54,147,38,en
I'm haunted by the ghost updates of everyone I've muted on social media,2015-07-02 19:24:53,102,7,en
The number of summer reading pizza parties I have continued to win for my 4th grade class is chillingly high,2015-07-02 17:43:03,160,26,en
"LEAKED TWEET DRAFT: i was a nightmare in my diaper

*does the worm into hot lava*",2015-07-02 04:27:17,45,3,en
I love how people threaten to move to Canada. Like it is the last resort to move somewhere functional &amp; pleasant.,2015-07-01 19:58:36,391,146,en
One of the chief guilty pleasures of life is watching someone try to give you bad news that you already know,2015-07-01 18:51:40,245,74,en
"I just dropped my laptop on top of my phone as if to say ""KISS ALREADY!!!!!!!""",2015-07-01 18:15:57,88,5,en
Hey guess what every youtube is an ASMR video to somebody,2015-07-01 15:37:18,61,8,en
Yo someone left their trash literally all over new york city,2015-07-01 01:56:28,282,66,en
HEAR ME OUT: jalapeno popperonis,2015-06-30 19:00:56,95,6,en
7-11 is an inside job,2015-06-30 15:55:40,316,115,en
I honestly like chaos' earlier stuff better,2015-06-30 03:16:41,65,12,en
"Whoever sent the chopper to circle above my apartment, you could have just texted",2015-06-29 21:03:34,133,18,en
"I just asked someone if they could evacuate the sum of $ 10,570,000 Dollar units to any safe country it's like who do i think i spam",2015-06-29 20:25:55,33,7,en
I feel like all of Donald Trump's core memories are him yelling at bags of money,2015-06-29 18:38:59,587,259,en
Lil Respect feels like a rapper we all should know about by now,2015-06-29 16:18:09,89,26,en
"An edgy way to say you like cookies is say you are really into BDSM**

**butter dough sugar mounds",2015-06-29 05:03:06,378,191,en
mad love to everyone who's ever dumped me ex cetera,2015-06-29 03:47:41,105,9,en
Auto-renew has put one over on us all,2015-06-29 01:13:21,49,3,en
Do you think pop stars have time in their schedules to fart,2015-06-28 03:13:53,90,10,en
Isn't Stockholm Syndrome just the ultimate positive reframe,2015-06-27 15:13:33,123,27,en
Every club dance song seems to have a point in it where both artist &amp; listener are given a chance to self-reflect,2015-06-27 05:49:50,431,142,en
Everyone deserves the right to marry someone for their money,2015-06-26 21:07:32,460,209,en
"I get the feeling some politicians' war rooms are just them sitting in a giant beanbag chair crossing their arms &amp; going ""wah!!!!""",2015-06-26 19:18:14,134,20,en
"If you are opposed to the idea of people pursuing their own happiness while in no way  threatening yours, what are you doing",2015-06-26 19:07:24,297,150,en
"DOUBLE RAINBOW ALL THE GAYYYYY equals equals equals equals equality
🌈🌈🌈🌈🌈🌈🌈🌈🌈🌈🌈🌈🌈🌈",2015-06-26 19:01:30,101,15,en
"I like when your server warns you the plate is hot as if to say ""easy monster i know you feed with reckless abandon""",2015-06-26 18:29:50,260,82,en
Secure your staying power in any group conversation by having intensely specific reactions to routine info.,2015-06-26 18:14:52,90,16,en
Isnt getting stood up just french for being a martyr,2015-06-26 03:12:17,85,7,en
Please attend my none woman show!!!!!! I will not be there!!!!,2015-06-25 23:06:23,144,22,en
"Cool it, steam grates",2015-06-25 20:51:48,48,8,en
Almost positive the cloud doesn't care for most of us,2015-06-25 16:28:14,64,8,en
The hardest thing about asking for help is realizing that the person does not work at this store,2015-06-24 23:09:06,324,116,en
"Standing in a coffee shop waiting for someone to leave so I can sit down. Why, how do you get your news?",2015-06-24 21:23:28,53,4,en
"If you're happy &amp; you know it, write a book. It will sell at least three copies. Me, your mom, &amp; me again when I forgot I already bought it.",2015-06-24 17:11:12,178,54,en
SICKA THESE INTERNET TROLLS STEALING OUR INNER CRITICS' JOBS,2015-06-24 05:06:52,246,54,en
Isn't therapy just a podcast off the record,2015-06-23 18:43:06,334,111,en
You can find me in da club chargin my phone by standin weirdly close to da bafroom,2015-06-23 05:27:29,235,50,en
Have you listened to Mystery Show from radio/human genius @StarleeKine? The latest one is insanely fantastical: http://t.co/98sUNywhgc,2015-06-22 18:14:58,24,3,en
Unexpected eye contact in airport food courts is a deadly game.,2015-06-22 17:31:13,90,12,en
Everyone in my flight row is on their phones. We are all doing the Lord's work. The Dark Lord.,2015-06-22 14:06:04,98,20,en
Bae the change you want to text in the world,2015-06-22 06:11:52,153,36,en
"If you are a daddy &amp; you know it, clap your hands slightly off rhythm!",2015-06-21 21:00:16,147,44,en
To all dad cellphone belt holsters out there: sup,2015-06-21 19:17:59,183,67,en
"Some of the best advice my Dad has ever given me is ""Get downstairs right now!!!!!""",2015-06-21 19:12:29,144,30,en
"Anything can be a misinformed opinion if you follow it with ""BUT WHAT DO I KNOW? I WAS JUST CRYOGENICALLY UNFROZEN.""",2015-06-21 02:37:50,113,26,en
"Have you ever watched a cartoon with the sound off? That is the 24 hour news cycle. LOTTA STUFF HAPPENING, NONE OF IT MAKES A LICK OF SENSE",2015-06-21 01:48:24,243,85,en
"Did you know if you see five man buns in a row, the sixth one is free to destroy",2015-06-21 01:37:54,197,60,en
"""People trying to identify their uber driver at the airport"" got picked up for a full season!!!",2015-06-20 17:45:37,148,26,en
What are the chances I saw three white guys so far today!!!! THREE!!!! Wowowowowow,2015-06-20 17:19:28,114,15,en
hitting that point in the night where I can't stop thinking about how good cheese has been to me,2015-06-20 06:01:25,550,220,en
"I like when babies make a sudden unexpected noise like ""BUH"" followed by a sustained gurgle. That sums up most situations very nicely.",2015-06-19 14:50:35,118,29,en
"Did you NO that if you express an opinion on the internet, people are super chill &amp; reasonable about it?",2015-06-19 04:51:58,174,37,en
Why are young white men called troubled when they kill people? And young black men called killers when they didn't do anything?,2015-06-19 03:13:15,664,315,en
"I am not rescheduling again, i am giving you space you didnt even realize you needed",2015-06-18 19:17:17,134,29,en
