text,created_at,favorite_count,retweet_count,lang
My dog hides turds under his blanket so they seem to appear from nowhere. I call him Poo-dini. #DisFooCray,2015-11-03 17:44:43,13,0,en
⭐️ #RIP 🎶It's been a loooong day without you my friend...🎶,2015-11-03 17:18:09,13,3,en
Motion to make Twitter more like @reddit and include a poop icon when we don't care for a tweet. ⭐️❤️💩,2015-11-03 17:13:24,22,3,en
Lucky Charms is trending because everyone already thought of your stars-hearts joke idea first.,2015-11-03 17:03:42,22,3,en
"The proper serving size of candy corn is ""stop when your teeth look like candy corn.""",2015-11-03 16:48:50,29,6,en
Personally I'd rather splurge and get more daylight than save it.,2015-11-03 16:12:06,24,5,en
You can't always get what you want. But if you cry sometimes you just might find you get what you need ask any baby,2015-11-03 00:33:55,35,4,en
I will now tell one of my mom's favorite jokes: Sally Jesse Ravioli,2015-11-03 00:09:31,45,4,en
Some people need to win an Academy Award. Others just need to have exact change.,2015-11-02 23:26:02,16,3,en
Drifters walk alone. It's their birthright--just ask Whitesnake. Next question.,2015-11-02 21:32:45,19,4,en
You ever stop and think that maybe Mondays aren't that crazy about you either?,2015-11-02 21:16:28,34,7,en
Thanks for the cool @TigNotaro photo Mindy! @withreservation https://t.co/gVjjGE1zK0,2015-11-02 20:53:12,31,2,en
2018 will be my year,2015-11-02 19:14:06,66,12,en
Homemade biscuits and gravy. Want me to save you some? https://t.co/2sQ7RZYB4Q,2015-11-02 17:10:09,21,0,en
".@Pathmark in #Gowanus closing. ""Right before Thanksgiving,"" cashier says. https://t.co/ZMQKlqQZYO",2015-11-02 15:44:36,1,1,en
There's no law against picking an item up at a garage sale and quietly placing it back on the folding table with two things from your house,2015-11-02 15:02:12,124,26,en
Seems to me people would rather wear buttons announcing who they are NOT voting for.,2015-11-02 14:49:26,10,0,en
And when we finally got up from the final game of the #WorldSeries we had trouble walking and accidentally did Drake's Hotline Bling dance,2015-11-02 14:21:38,8,1,en
Funny how the #WorldSeries always features two teams from the same country.,2015-11-02 05:44:22,60,10,en
Whether their team won or lost everyone in that stadium's legs fell asleep. #WorldSeries,2015-11-02 05:40:06,28,5,en
the holidays don't happen in my house without,2015-11-01 23:09:11,6,2,en
Keep the Twitter polls coming. I play them all. My opinion matters!,2015-11-01 22:57:20,38,10,en
RT if you so cool you came to learn about social stuff before #SOLOCOM @ThePITLoft by @thepitnyc &amp; @blackoutpete https://t.co/F7af8lbxND,2015-11-01 22:53:05,5,2,en
Why isn't anyone cheering these guys on? #NYMarathon https://t.co/TpgRBpkS0A,2015-11-01 19:19:19,37,6,en
Just when you think you've had enough of the #NYMarathon you find you want sumo https://t.co/Wzi3G75URb,2015-11-01 18:22:09,26,6,en
The #NYMarathon is the last scene of Ghostbusters II extended for a few hours.,2015-11-01 18:14:37,7,2,en
Sure wish the #NYMarathon had told me before today you can't complete it on a bike.,2015-11-01 18:00:48,13,2,en
Turn your eyes and ears to @DustinChafin and see his comedy live why don't you. #FF,2015-11-01 17:03:30,1,1,en
My whole relationship is a lie. https://t.co/CKZNx7mNom,2015-11-01 15:08:07,62,21,en
Happy Discount Candy Day! 🍭🍬🍫,2015-11-01 14:00:28,39,17,en
If candy corn were larger it would be classified as a Yankee Candle.,2015-10-31 22:03:19,28,4,en
"Just scanned my kitchen, and the closest thing to candy I can hand out this #Halloween are loose Cocoa Puffs.",2015-10-31 19:03:34,19,2,en
Sometimes your workout is just rearranging the weights until they're in the proper order.,2015-10-31 17:11:37,30,5,en
My homemade tape of scary sounds is just recordings of old people sitting down.,2015-10-31 16:41:59,33,8,en
"Tsk tsk. These dogs are gonna get buck teeth, and then they'll need braces. https://t.co/S9ZqTJwVcd",2015-10-31 14:12:04,57,10,en
Which should I hand out to trick-or-treaters tonight?,2015-10-31 13:34:44,8,2,en
Encore was a 2lb Family-sized meal. I didn't have a family. Al was there. https://t.co/N1EfOuN5pf,2015-10-31 02:59:10,8,2,en
RT if 2018 will be your year,2015-10-31 02:17:28,19,9,en
Dream it. Draw it. Do it. @TherealTaraji #CookieLyon @EmpireFOX #CookieForHalloween https://t.co/DQsBAYlsQq,2015-10-31 02:15:43,13,5,en
My @EmpireFOX costume is in full effect. https://t.co/kF10PjBNHW,2015-10-31 00:44:58,27,5,en
#Halloween Prank: guess someone's outfit when they're clearly not dressed up yet. #goofs #sillies,2015-10-30 18:32:03,6,2,en
Do you want to watch a scary movie? *puts on The Business of Being Born*,2015-10-30 17:20:44,12,2,en
Follow Mistress of the Dark Comedy @OhNoSheTwitnt #FF 👻💀😂,2015-10-30 15:34:06,10,1,en
The first scream at a haunted house comes from hearing the price of admission.,2015-10-30 15:14:28,16,5,en
Better to remain silent and be thought a fool than to say you're voting for Trump and remove all doubt.,2015-10-30 05:44:35,35,16,en
Thanks for reminding me about Daylight Savings Time twice a year ever since we have known each other.,2015-10-30 04:03:55,15,2,en
Mark and Matt light up the stage for a full house at the 8th annual #SchtickOrTreat @KnitFactoryBK https://t.co/rfa4UpGu47,2015-10-30 03:16:26,5,2,en
"W.Sykes, S.Silverman, P.Diller, G. Wallace, and tonight T. Notaro! #SchtickOrTreat https://t.co/jyKEDc9arp https://t.co/fG1A7gYxim",2015-10-29 21:29:42,16,1,en
#SuspiciousWandaSykes doesn't trust all this snow https://t.co/0JYIU5zf8X,2015-10-29 21:14:09,66,23,en
"I ❤️ this fun new app by @MorganSpurlock @InterludeVideo Before live-tweeting debates, test your Bulls#!t Meter! https://t.co/SYKLICivsH",2015-10-29 21:08:16,4,2,en
"I'm down with the brown, tight with the white, not really comfortable referring to anyone as yellow or red, but loose with the chartreuse...",2015-10-29 19:41:05,98,11,en
Happy #NationalCatDay to my dog who doesn't come when you call him either. https://t.co/EJliifNJH7,2015-10-29 18:33:51,59,15,en
Haters gonna hate. Pumpkins gonna pump.,2015-10-29 05:04:25,50,10,en
Chris Christie making you look at him like a cat makes you look at its booty hole #GOPDebate,2015-10-29 00:53:30,17,5,en
What happens when people stop being polite and start getting spiel. The Real World: #GOPDebate,2015-10-29 00:50:38,13,4,en
"What you say: There's room for one more in the elevator!
What I hear: Want to be buried alive?",2015-10-28 23:18:24,12,4,en
We are like two ships passing gas in the night.,2015-10-28 22:44:32,37,12,en
Follow @Justin_Willman and see him LIVE @CarolinesonBway 11/5-8 #FF  https://t.co/sAy3SOHFTb https://t.co/1hlnLsWCXV,2015-10-28 22:15:23,2,1,en
Today in I Want That... https://t.co/4qAUZ9d42e,2015-10-28 21:41:11,11,3,en
"When you pass the test of meeting your friend's parents, and they think you're a nice person. https://t.co/AgHtE7x7m0",2015-10-28 18:48:46,18,5,en
#BitmojiTranslation Spent the night in my clothes from yesterday :( https://t.co/jmeggwXAmW,2015-10-28 16:33:58,8,3,en
Netflix should make feed bags.,2015-10-28 15:00:23,26,4,en
Yeah I'll put on a pant suit...if it's for @ShutupLutz https://t.co/2kDBEi3eJk,2015-10-28 14:19:40,9,0,en
"Whenever it's cloudy and rainy outside I say, ""Another beautiful day in jolly old England!"" then I call my Pop-Tarts crumpets.",2015-10-28 12:27:30,50,5,en
TBT to last #Halloween when Jay and Bey dressed up as famous artists Erykah Badu and The Weeknd. https://t.co/wysQQLUOfw,2015-10-28 02:44:22,54,16,en
You could say a lot of people in Taiwan have a Taipei personality,2015-10-28 02:15:58,92,22,en
Follow @ShutupLutz @suedgalloway two great comedians that comede great together #FF,2015-10-28 01:36:20,6,1,en
I could probably count the number of fingers I have on two hands.,2015-10-28 00:48:18,44,16,en
"I grew up on Grape Nuts, but they're the opposite of what a kid wants for breakfast. Hard to chew, not sweet, tastes like homework.",2015-10-27 19:51:38,65,18,en
Guess what I am planning to be for Halloween. https://t.co/N8IhDVemgh,2015-10-27 18:27:40,11,0,en
You're never too old to go treat or treating.,2015-10-27 12:40:26,18,3,en
Coffee for breakfast: fills you up; never lets you calm down.™,2015-10-27 11:04:27,17,5,en
Now that we definitely know red meat causes cancer I would like to be congratulated on being down to two packs of bologna a week.,2015-10-26 23:04:37,82,22,en
Happy Halloween treat yourself to some brain candy @mikeleffingwell #FF,2015-10-26 22:57:51,3,0,en
#MondayMotivation Monday is almost over,2015-10-26 19:55:38,44,33,en
Fighting me is like fighting a squirrel. Where did I go? How did I get up in that branch so high?,2015-10-26 18:10:14,25,3,en
Take a stroll through @luisadieznuts timeline and appreciate her funny insights! #FF,2015-10-26 18:03:40,6,0,en
An app that texts you when celebrities die called Your Mom,2015-10-26 15:46:13,134,25,en
"My in-flight attire can best be described as ""camp counselor who hoards Cheetos.""",2015-10-26 04:25:11,21,5,en
We have a baggage claim but no cabbage claim? Makes no sense. This is 2015.,2015-10-26 04:17:06,15,4,en
"When boarding a flight headed toward coach loudly announce to first class that you don't want your fans to forget you're ""one of them.""",2015-10-25 23:08:58,29,7,en
I would become a member of Netflix Gym,2015-10-25 21:23:02,33,10,en
🎃KAY!! *rubs butt on the pumpkins* *gets kicked out of Trader Joe's* https://t.co/6ulCXj84zV,2015-10-25 21:14:35,21,6,en
At least in this day and age you don't have to embarrass yourself by waiting by the phone. The phone waits by you.,2015-10-25 21:12:38,22,5,en
Follow @Eden_Eats for showing me around and scoring me some home cookin' away from home. #FF https://t.co/kSIseakjPO,2015-10-25 02:17:08,15,1,en
"Follow @blacksab67 who gifted me with a sunset, exercise, and dog hugs for no special reason. #FF https://t.co/fofLLP8ezL",2015-10-25 02:14:26,8,0,en
"My style can best be described as ""Do you like me yet?""",2015-10-24 21:40:07,49,8,en
Air fresheners and air conditioners need to switch names.,2015-10-24 20:14:56,32,7,en
L.A. peeps --Where are the good places to cry?,2015-10-24 19:44:55,62,12,en
"Pudding pie recipe:
1. Open pudding
2. Dump onto pie crust
3. Eat that while you look up a recipe",2015-10-24 02:50:22,33,5,en
I've learned my lesson about eating at places like this ironically. You pay too much actually. https://t.co/9VxygFCiGQ,2015-10-23 20:07:54,10,4,en
You're not nesting. You're hoarding.,2015-10-23 16:57:33,51,9,en
"Reasons Drake danced like that
1. Turnt
2. Low on sleep
3. Allergic reaction to Meek Mill
4. Just had dessert",2015-10-23 02:59:22,29,4,en
"They say there are no original ideas left, but I think baby names are a frontier. I don't know more than one Sherlock, Oprah, or Carrot Top.",2015-10-22 18:50:04,11,3,en
"Me: guess what I like?
You: attention?
Me: that's riiiight! *one of two carrot sticks slowly falls out of my nose*",2015-10-22 07:30:52,159,34,en
Cheerios aren't just for your parents. They're for your grandparents too. https://t.co/gTkQMHmshO,2015-10-22 03:05:32,77,19,en
Sorry it took me so long to text you back. I had to find the proper new emoji to express how I felt.,2015-10-22 02:48:04,23,4,en
Sometimes you just need 1/10 the confidence that Drake had to dance in the #HotlineBlingMusicVideo,2015-10-22 02:45:13,25,5,en
Bugs Bunny could have been named Roaches Rodent and we wouldn't have known the difference.,2015-10-22 00:39:01,11,3,en
Get tix to see my impression of/tribute to Tig Notaro #SchtickOrTreat 10/29 @KnitFactoryBK https://t.co/jyKEDcqLiX https://t.co/TkylmKJ1Rw,2015-10-22 00:01:29,8,1,en
"Which came first the Cadbury Creme Egg or the chocolate, goo-filled chicken?",2015-10-21 22:33:45,19,6,en
I do Drake's #HotlineBling dance when I'm waiting for stuff to heat up in the microwave.,2015-10-21 19:10:27,25,12,en
I'm disappointed because #BackToTheFuture promised me a 2015 without smart phones and Twitter.,2015-10-21 15:53:51,33,10,en
🎶I was dreamin' when I wrote this/Forgive me if it goes astray/So we were on a boat but you weren't you/You were 50cent with octopus arms🎶,2015-10-20 20:41:18,58,12,en
I'm running out of time to put a lot of thought into a Halloween costume no one will get.,2015-10-20 20:08:01,23,7,en
Staying in shape is hard so don't do it.,2015-10-20 16:22:34,28,6,en
Get so good they can't ignore you and want to use you in all kinds of dog food commercials.,2015-10-20 16:04:39,18,1,en
We'll be right back after another word from our sitcom! - commercials of the future,2015-10-20 07:59:04,34,8,en
"If you pronounce ""literally"" with three syllables instead of four I will consult you on a good restaurant before Yelp.",2015-10-19 16:44:13,13,0,en
I can tell the bird outside my window this morning is the one that all the others hate running into when they're grocery shopping.,2015-10-19 15:03:33,38,7,en
Waiters should get to take a shot before they sing to a customer so that by the end of the night they're really happy it's your birthday.,2015-10-19 05:33:55,28,6,en
"In NYC you see celebrities but don't believe it's them, and in L.A. you believe you see celebrities but it's not really them.",2015-10-19 04:58:29,26,5,en
"This Halloween I am wearing a t-shirt with these emoji 😂😂😂
And going as ""Dead.""",2015-10-18 16:39:43,40,6,en
"My friends are busy tonight, so I just saw a snail and started singing to it. I wouldn't last five minutes in solitary confinement.",2015-10-18 04:50:37,45,7,en
Beer pong is that fun game where you drink the cup's contents after the ball that has touched every surface of a fraternity lands in it.,2015-10-17 17:56:47,30,9,en
Underneath that fur Chewbacca might be a pink Gremlin. Watch this hilarious vid by @InternetAction http://t.co/44oQGRAgmg,2015-10-17 17:10:24,7,3,en
Hobbies include http://t.co/0gwpENmgG1,2015-10-17 06:48:59,136,14,en
Uber is like Air BnB on wheels. You pay way too much to get the life story of a stranger.,2015-10-17 06:39:48,27,5,en
"🎶So no one told you life was gonna be this way *clap-clap-clap-clap* A giant apartment and a new, hot, love interest each week...🎶",2015-10-16 23:38:23,82,30,en
"I spent time with you today, and time is money, so I pretty much spent money on you. Happy birthday.",2015-10-16 22:13:33,37,12,en
Save time by consuming all of your day's calories the moment you wake up. http://t.co/PdWAcyfYhF,2015-10-16 14:45:13,84,5,en
A dog expert is called a Rexpert. Next question.,2015-10-16 14:17:28,75,19,en
"Halloween costume ideas w/appliance box:
Rubik's Cube
Amazon delivery
Sexy Cardboard",2015-10-16 04:52:38,32,14,en
Be careful out there on #Halloween https://t.co/6osyCqrmma,2015-10-16 00:06:26,47,18,en
Finally I can prose for Playboy.,2015-10-15 04:32:53,124,21,en
Scarecrows might also be called Scareeverybodies,2015-10-15 04:14:30,56,15,en
Helmets save lives and embarrass kids so they're like a win-win.,2015-10-15 01:25:22,41,7,en
Please tell me more about your cleanse http://t.co/uCxCX5KXOe,2015-10-15 01:00:21,37,8,en
It's sad when you hate your boss and you're self-employed.,2015-10-15 00:48:47,41,9,en
Bit my finger again. http://t.co/PvLrGS3OaD,2015-10-15 00:35:52,46,2,en
"#LearnEmojis 
🎈Balloon
📍Robot Balloon",2015-10-14 20:37:19,25,2,en
"You're family, and I love you, but if I visit, and your toilet has a ""trick to it,"" I am putting crime scene tape in front of your house.",2015-10-14 18:48:50,64,12,en
"They just get in a giant box full of food pulled by a tractor and ride around without ever eating it. Yes, every fall! - horses",2015-10-14 17:45:19,24,8,en
I'm Anderson Cooper. From all of us here at Celebrity Death Match I wish you good fight and good night. #DemDebate,2015-10-14 02:59:27,30,12,en
Can we get Steve Harvey in here to teach Jim Webb how to wear a suit?! #DemDebate,2015-10-14 02:38:23,30,6,en
"Swap
Martin O'Malley - Mike O'Malley
Hillary - Amy Poehler
Lincoln Chaffee - Raggedy Andy
Jim Webb - Incredible Hulk
Bernie Sanders - prunes",2015-10-14 02:37:09,43,9,en
"When I see Jim Webb, I'm like, didn't Dr. Wells kill you in the second episode of The Flash? #DemDebate http://t.co/tEHKm02EKo",2015-10-14 02:25:56,28,13,en
These sound bites do nothing for me. I learned more about how the government works from School House Rocks. #DemDebate #GOPDebate,2015-10-14 02:17:49,24,6,en
Lincoln Chafee is the principal grain used in Grape Nuts. #DemDebate,2015-10-14 02:12:47,53,15,en
Take-away from the #DemDebate If you dress as Jim Webb for Halloween everyone will think you're Pat Sajak. http://t.co/XyLwkwLwBD,2015-10-14 02:11:44,8,3,en
Which grandparent do you want to win? #DemDebate,2015-10-14 02:08:28,56,14,en
Of course black wives matter... - Bernie Sanders #DemDebate,2015-10-14 02:03:02,21,3,en
Jeopardy music while the #DemDebate panel answers whether black lives matter,2015-10-14 01:57:03,29,9,en
I'm glad they thought of both the Baby Boomers and Millennials by holding the #DemDebate on the set of Star Search.,2015-10-14 01:54:41,47,8,en
I celebrate #NoBraDay every night when I sleep.,2015-10-13 23:17:37,88,72,en
Congratulation to the economist who won the Nobel Prize for proving Mo Money Mo Problems. http://t.co/pa5fhuLg4K,2015-10-13 23:05:26,15,3,en
Happy #FaceYourFearsDay from someone who apologizes when bumping into inanimate objects.,2015-10-13 19:07:17,16,2,en
"👴🏼back from your errands?
👲🏼mom is telling a story.
👵🏼...I made a left on Wilton...
👴🏼ooh! Still setting the scene! 
👲🏼📱",2015-10-13 15:50:32,10,1,en
"👵🏼Do you know the cafe on Broom St? Or is it Crest St?
👲🏼No Mom
👵🏼It has to be Broom. But it's next to a salon I was SURE was on Crest...",2015-10-13 15:41:21,9,3,en
"👵🏼This plain oatmeal is delicious! What's your secret?
👱🏿Our cafe adds just a pinch of salt. 
👵🏼I'll have to tell my son about this later.",2015-10-13 15:36:36,13,3,en
Sit in front with your Uber driver and immediately change the radio station to establish dominance.,2015-10-13 15:11:48,178,67,en
I feel validated any time I make a vocal observation that pro voice coach @kohli_calhoun likes. #FF http://t.co/SWRXwfGe9j,2015-10-13 15:07:28,2,0,en
When you ask a stranger to take your picture. http://t.co/CnkPSWvE8n,2015-10-13 03:08:30,46,6,en
Christian Slater is Norm MacDonald's voice twin. Do you have a voice twin? Besides your mom.,2015-10-13 00:39:00,18,1,en
"Follow funny @MrJonCryer , and try a little tenderness while you're at it. #FF",2015-10-13 00:32:08,14,1,en
FINALLY men can do laundry. http://t.co/HMyjXuJFxt,2015-10-12 23:04:41,56,11,en
Too much lettuce on a sandwich makes you feel like you have been tricked into eating a salad.,2015-10-12 22:57:57,45,11,en
"Great slasher stories for the season
1. Halloween
2. Saw
3. #ColumbusDay",2015-10-12 13:36:16,82,52,en
"""Actually the correct pronoun is he since his gender expression is male, Master..."" http://t.co/nmo8XJiiAs",2015-10-12 13:33:49,13,1,en
No thanks Roman numerals.,2015-10-11 21:24:34,21,3,en
"Dead things you can go as for #Halloween 
zombie
ghost
payphone",2015-10-11 02:08:55,74,20,en
Just a reminder that looking back at the piece of raised sidewalk that tripped you accomplishes nothing.,2015-10-11 01:44:06,97,40,en
"#LearnEmojis

🍢 weird stuff on a stick
🍡 weird stuff on a stick's girlfriend",2015-10-11 01:24:06,23,3,en
.@bobvulfov are you the kid from The Grinder? http://t.co/Yi5h7aSVjT,2015-10-11 01:22:57,4,0,en
Enhance what doesn't need improvement is my workout method.,2015-10-10 17:25:17,11,1,en
Follow @myqkaplan and be glad he was born! #FF,2015-10-10 17:14:15,3,0,en
.@JennyPentland 52 more replies... http://t.co/OlKDpsqQXT,2015-10-10 04:55:22,6,1,en
"👨🏼🎶All my exes live in Texas🎶
👨🏻Wow that's a fun coincidence
👨🏼🎶All my brothers live in T'rothers🎶
👨🏻Ok so it was just a rhyme. Got it.",2015-10-10 03:23:50,7,2,en
One mistake I won't make as a cultural icon who lasts through the decades is keep the same name. You gotta think like a Highlander.,2015-10-10 02:13:32,23,2,en
#Tbt 2013 when tweet ups were invented http://t.co/lnyuvCzP7E,2015-10-10 02:06:25,22,0,en
"signs you ain't ready:
Plaid pajama pants in public",2015-10-09 23:52:38,28,9,en
If you're going as Kim Davis this Halloween don't forget to make out with a woman.,2015-10-09 23:46:01,30,9,en
#FF comedy sites 🎭@AboveAverage @InternetAction @CollegeHumor @HuffPostComedy @comedynest,2015-10-09 23:24:29,5,2,en
#FF smart cookies 💡🍪 @AkilahObviously @reesewaters  @MoodyMcCarthy @BrandonEsWolf @Rollinintheseat,2015-10-09 23:22:33,6,0,en
Maybe Watermelondrea just needs an accent aigu over the e that you don't pronounce.,2015-10-09 22:23:35,16,3,en
Do you enjoy funny brains inside cool bodies? #FF @iamsambee @michaelianblack @pattonoswalt @MrGeorgeWallace @blainecapatch @ikebarinholtz,2015-10-09 22:16:12,6,0,en
Ask Me About My Trip to Trader Joe's,2015-10-09 20:36:52,16,2,en
May your kids' Halloween costume be both affordable and reflective of your superior ingenuity.,2015-10-09 01:43:06,147,41,en
"I don't have any conspiracy theories except that pop music's infused with repetitive, high frequency notes that allow the govt to control us",2015-10-08 22:24:28,30,5,en
I finally figured Twitter moments out. You have to scroll through the whole thing before they turn off the blue notification light.,2015-10-08 22:13:18,18,2,en
"No, my son is also named surfbort",2015-10-08 22:10:43,56,18,en
"👨🏼Hi pretty lady...
👩🏼*stands on tip-toes and raises arms over head to intimidate predators*
👨🏼Oh sorry Sir, didn't see you there.",2015-10-08 17:35:56,43,12,en
I have so many winter scarves they take the place of blankets for when company comes over. And they take the place of company.,2015-10-08 01:54:24,19,2,en
"Nothing says, ""Maybe I'll get to it tomorrow,"" like a hooded sweatshirt.",2015-10-08 01:46:44,137,38,en
Sports will never be the same. https://t.co/egYAo4oImy,2015-10-08 01:39:27,40,9,en
Richard Pryor is gonna suffocate you with a pillow in your sleep. https://t.co/Qxx9BFVy1q,2015-10-08 01:20:15,152,67,en
A house divided will enjoy Netflix on different devices.,2015-10-07 20:44:58,79,17,en
Follower numbers would be more impressive if you could only follow one person. Then whoever had the most would TRULY RULE *lightning crash*,2015-10-07 17:01:44,36,6,en
"I'm coming to terms with my own mortality, but the only way I can fully accept it is if I outlive all of the people I love.",2015-10-07 16:52:27,17,7,en
Match-your-nails-to-your-mom's-scarf. http://t.co/VYZjOts7jH,2015-10-07 15:56:54,26,1,en
"Today is a celebration of @trevso_electric 's life. Such a HUGE comedic talent. Impressions, shorts, parody acct @dance_blessed ❤️✨#FF",2015-10-06 18:56:18,37,5,en
Today in #BlackWhoppersMatter http://t.co/0ohG6cb8O1,2015-10-06 18:24:47,34,7,en
"Twitter moments answers the question of ""Can we have a more intense level of ADD?""",2015-10-06 16:26:02,14,4,en
I am stunned and saddened by the loss of @trevso_electric I just can't believe it. He brought so much joy to this place. #RIP,2015-10-06 05:49:18,55,4,en
You COULD pay $40 to walk through a haunted house or you could just pay a visit to your downstairs hermit neighbor for free.,2015-10-06 03:26:56,95,15,en
Great time sharing the stage with this bunch for @CW_CrazyXGF #CrazyExGirlfriend @UCBTheatreEast http://t.co/wb450Rvm2H,2015-10-06 03:08:27,6,1,en
Live comedy at @UCBTheatreEast in celebration of @CW_CrazyXGF #CrazyExGirlfriend @JessicaKirson kicks off the show! http://t.co/qmzE25hSBI,2015-10-06 02:11:13,3,0,en
#WhenIWasYourAge Burger King made the black buns stay in the kitchen.,2015-10-06 00:24:39,30,10,en
Just a reminder that people who are not famous and not rich are important and worthy of your attention too. For example your grandpa.,2015-10-06 00:21:21,33,5,en
"#WhenIWasYourAge Dunkin donuts sold donuts not tuna sandwiches, Taco Bell sold tacos not waffles, and Pizza Hut sold pizza not wings",2015-10-06 00:18:35,40,10,en
#WhenIWasYourAge the act of tweeting was done on AOL Instant Messenger in direct message form,2015-10-06 00:12:36,15,6,en
Bottle blonds have more fun for about 8 weeks.,2015-10-05 20:09:35,19,1,en
"Idea: a de-select option for elevator buttons you pressed in error. But what will I DO with my kajillions of dollars, hmmm...",2015-10-05 18:50:37,13,2,en
Mnemonic device: Columbo is who U call to solve a murder and Colombo is like O-no you spelled it wrong,2015-10-05 17:13:03,16,2,en
Your #MondayMotivation is to follow @KevinHart4real #FF,2015-10-05 17:03:52,2,0,en
That first shower after you complete a writing packet. http://t.co/cUkN0yBAzI,2015-10-05 16:47:32,34,4,en
Joke theft sucks but parallel thought is worse because you have no one to blame but yourself.,2015-10-05 16:21:00,27,4,en
"👩🏾Hey Babe I have a question
👨🏾Sure
👩🏾Take all the time u need to answer
👨🏾Oh no is this about your dream that I cheated--
👩🏾HOW COULD YOU?!",2015-10-05 16:06:49,24,7,en
It's great to see Dr. King's dream realized. #BunEquality #BlackWhoppersMatter http://t.co/UU6uL2d6Pw,2015-10-05 14:21:46,94,23,en
"With the money you save choosing generic cereal over name brand, in about a month you can afford a new car.",2015-10-05 13:27:52,24,3,en
The scariest thing about the #BlackWhopper is that you're eating at Burger King. http://t.co/V9cZsiXtRq,2015-10-04 21:18:48,33,14,en
"Always the bridesmaid, never the guest who gets to drink and eat for free with no ceremonial responsibilities.",2015-10-04 19:50:30,379,91,en
❤️&amp;💔 @hellogiggles at @UCBTheatreEast w/@aparnapkin @JessicaKirson @LouisPeitzman @eliotglazer @RubyKarp @jennyjaffe http://t.co/C4rQSXf1Yo,2015-10-04 19:35:50,16,7,und
