text,created_at,favorite_count,retweet_count,lang
I resolve to be exactly one year older by this time next year.,2016-01-04 01:12:36,30,3,en
Enjoying @michaelianblack resolutions on @CBSSunday today! https://t.co/6ZyrnaXnm4,2016-01-03 15:11:05,17,1,en
A realist is someone who is in denial about being a pessimist.,2016-01-02 16:09:19,124,61,en
Don't be afraid to declare a resolution because everyone will be too self-absorbed to know if you achieved it or not.,2016-01-02 15:12:36,17,7,en
I SAID YOU CHEW TOO LOUDLY https://t.co/L5OuRsQ6g7,2016-01-02 14:15:07,42,6,en
"I'm one of those attractive people that's afraid to go outside. You know, an adoraphobe. https://t.co/uH2FAAOKvl",2016-01-02 05:44:46,42,3,en
"One of my resolutions is to unleash my inner figure skater, but I'm afraid of falling so mainly I'm just wearing tan pantyhose under shorts.",2016-01-02 05:29:31,44,5,en
DOCTOR RICHARD KIMBAAAALL https://t.co/0ufLJvABo3,2016-01-02 05:19:03,25,3,en
The meme where the guy is yelling. I wanna plays,2016-01-02 05:18:47,18,2,en
Ferrerreerrerrorocher,2016-01-02 05:14:55,25,2,eu
"I love Twitter but ""don't get"" SnapChat. This is probably what people who embraced BetaMax felt like.",2016-01-02 04:14:53,81,16,en
I want to research which states have produced zero serial killers and move there.,2016-01-02 01:04:27,26,3,en
You know who has round glasses? The guy from commercials. What's-in-your-pocket. - my mom describing Samuel L. Jackson.,2016-01-02 00:50:41,36,3,en
"Get over yourselves, contortionists.",2016-01-02 00:37:27,36,8,en
If I ever worked for the IMF I would reject all missions and stay on the payroll. I mean they give you the option.,2016-01-02 00:22:56,21,6,en
Payback's a friend when it's money you're being paid back.,2016-01-01 20:56:13,16,3,en
🎶Do they know it's Christmas time at all?🎶 - people who work in year-round Christmas decoration shops.,2016-01-01 16:27:40,7,3,en
Got a great gif via text from @dannymichel8 that encapsulates how I feel about everyone's tweets last night. https://t.co/CNbINWKwah,2016-01-01 16:25:54,37,9,en
If you like fancy things--and who doesn't?--then follow @FancifulTweets to see dumb stuff all gussied up. And #FF creator @ZStovall,2016-01-01 16:24:20,2,0,en
I didn't know the Penguin from Gotham was in Pentatonix. Cool. https://t.co/zfRZgujvVZ,2016-01-01 05:55:53,31,3,en
Congratulations to everyone who got to celebrate #NewYearsEve in Times Square and congrats to Depends adult diapers,2016-01-01 05:50:08,26,4,en
When did Joe Jonas join a Japanese pop band?,2016-01-01 05:46:18,31,4,en
"They're called 1 D, but I bet they have at least three among them. #RockinEve",2016-01-01 05:34:09,19,0,en
I can't believe how happy Jimmy Buffett is to sing Margaritaville on #RockinEve but year after year so am I. https://t.co/zrJ6YUghHg,2016-01-01 05:19:52,32,1,en
New Year's Rockin' Eve is a great chance to finally see the faces of the people who sing today's radio hits.,2016-01-01 05:13:14,15,2,en
"BREAKIN' NEWS: two dancers in mesh cut-off shirts are doing the robot in Town Square. This has been ""Breakin'"" news.",2016-01-01 05:12:13,39,5,en
"People who say ""Happy New Years"" are Highlanders who are not to be trusted.",2016-01-01 05:09:33,21,4,en
"PEOPLE OF CALIFORNIA, I am from the FUTUUUURE! #HappyNewYear",2016-01-01 05:07:44,20,3,en
One year closer to death,2016-01-01 05:05:19,33,7,en
"""Show me where the ball is. I never see it drop. I don't think I have ever seen it."" -Mom #HappyNewYear",2016-01-01 05:04:00,14,2,en
I resolve not to vote for Trump. This should be an easy one to stick to.,2016-01-01 03:03:12,52,16,en
I just want to go to bed now at 5:48pm and wake up in 2016,2015-12-31 22:48:33,38,4,en
We were on a UCB show last year together @chrislhayes with Janeane Garofalo. Did I just see you in a coffee shop? Just checking 🙋🏽,2015-12-31 19:47:50,4,1,en
Life hack: wear NYE glasses in all pictures so you remember when it was taken.,2015-12-31 17:56:25,18,3,en
"Coffee 

#PeopleWhoMadeMyYear",2015-12-31 17:33:59,27,18,en
Drink a cup of kindness tonight and Haterade for the rest of the year B.,2015-12-31 17:31:57,13,2,en
I wish odd acquaintance could be forgot and never brought to mind. #HappyNewYear,2015-12-31 14:38:05,28,4,en
Turtles are actually the babies of the species and grow into Turts. Next question.,2015-12-31 03:38:42,38,7,en
"I am starting to get those Morgan Freeman/Bill Cosby neck freckles, and it's freaking me out. #neckles",2015-12-31 00:14:19,50,3,en
"Netflix is like a video game. To beat the first level you have to watch a crappy movie, and that unlocks the secret level of good ones.",2015-12-30 23:19:31,34,6,en
The dyed white hair trend dates back to the Stone Age. https://t.co/WrkZqYUccl,2015-12-30 23:03:56,35,4,en
Picking the perfect outfit to wear in front of my television for #NewYearsEve,2015-12-30 21:58:32,27,1,en
This barista just made it super weird that I asked for a shower cap so I can put the lid of my coffee on tight.,2015-12-30 21:29:31,11,2,en
I take this as a follow recommendation https://t.co/s8Ywg3wWDa,2015-12-30 16:49:52,11,1,en
"I asked people to send me their baby pictures, and these sweet smiles are lighting up my morning. I like seeing the real you!💗✨",2015-12-30 15:15:31,14,1,en
"Everyone has really cool clothes when they were little, and I want to wear them now.",2015-12-30 15:11:13,10,0,en
".@BethStelling I would RT you three times, but I don't want anyone to think you died.",2015-12-30 15:04:59,11,1,en
SHOW ME YOUR BABY PICTURE. This is me age 2-24 https://t.co/VSivJtQsSo,2015-12-30 15:03:36,153,1,en
#baegoals https://t.co/BzNkquhI8f,2015-12-30 02:46:30,91,18,und
"I'm sorry for calling you all losers when I thought I won the lottery. Similarly, I no longer intend to see you in hell.",2015-12-30 02:18:26,48,10,en
Do you like candy for your funny bone? @jackburditt @TraceyWigfield make everlasting gobstoppers of jokes. 🍬🍭🍬 #FF,2015-12-30 01:34:33,4,1,en
"There should be a rude bot that just replies to tweets with ""rude.""",2015-12-30 01:26:52,28,3,en
I have never performed in fleece.,2015-12-29 23:27:00,26,6,en
The safest sun tan you can get is the one you make with filters. This is a collaborative joke with @OhNoSheTwitnt https://t.co/n18nihfEPj,2015-12-29 22:39:00,17,1,en
I'll have kids when police stop killing them in cold blood. #TamirRice,2015-12-28 23:16:43,227,94,en
When your hair looks like a natural history museum mannequin wig but you just had a good latte. https://t.co/Yz1G41HEu9,2015-12-28 20:15:52,66,1,en
I pity the fool who loses one of these socks! https://t.co/40nThM1K34,2015-12-28 18:56:50,20,2,en
"Don't know what your plans are, but I accidentally said, ""doy-nut"" instead of ""donut,"" to a barista, so I'll be cringing at that all day.",2015-12-28 17:46:29,33,3,en
I can't get rid of my under-eye bags no matter how late I stay up working on a solution.,2015-12-28 13:26:18,132,25,en
Looking at your phone while your dog poops is a courtesy.,2015-12-28 00:41:03,40,6,en
#Deflategate https://t.co/DJW2gZK88t,2015-12-27 23:16:54,26,3,und
Walking is fun for one of us https://t.co/y6Zt1KGgn4,2015-12-27 21:50:16,58,4,en
.@SiliconHBO @kumailn @Middleditch you are on a show that has its own @BitmojiApp that's pretty cool. https://t.co/JwOylfmQC8,2015-12-27 17:07:14,6,1,en
I'm still writing 2015 on all my checks.,2015-12-27 16:16:01,29,2,en
My favorite popcorn smell🍿,2015-12-27 15:04:43,4,2,en
Finally saw what gluten is. https://t.co/s03eHQ7b8g,2015-12-27 02:42:33,56,11,en
Stop trying to make reading the chip on credit cards happen. https://t.co/QnC4hEplzb,2015-12-27 00:16:49,82,12,en
"1975
Remind me again of what it is you don't eat. -Grandma to teen 
2015
Remind me again of what it is you don't eat. -Everyone to everyone",2015-12-26 14:05:51,52,15,en
"👧🏻What do you see out there Dad?
👨🏻I do believe it's rain Dear. 
👧🏻👦🏻👶🏻 YAY YAY YAY *they run outside*
*trudge back in*🚪* slam*
👿👿👿💦
👨🏻What.",2015-12-26 05:26:42,15,2,en
I had coffee at 7pm so if anyone needs me to run any errands between now and 10am you got it includes out of state,2015-12-26 05:17:22,391,97,en
Already thinking of New Year's resolutions and ways to get out of them.,2015-12-26 04:54:12,26,5,en
Just staying up watching Netflix descriptions.,2015-12-26 04:47:54,42,10,en
My niece just announced she's having a baby superhero! #invisibility https://t.co/CPRSNJOvYr,2015-12-25 22:21:50,152,31,en
Christmas card 2015 #curlycomedyChristmas https://t.co/BH5mvHgs7Y,2015-12-25 22:18:25,21,0,en
.If you're not happy with your gift card I will take it. https://t.co/dqkWwP9SQU,2015-12-25 21:23:37,17,4,en
"On Xmas we take a moment to reflect on the birth of Jesus X, civil rights activist taken too soon.",2015-12-25 16:17:20,25,4,en
Do they even broadcast the news on Christmas morning? Seems rude.,2015-12-25 16:13:02,15,3,en
Sprinkling Christmas magic on the day. You welcome Babychild. https://t.co/LixyTjIWCs,2015-12-25 05:10:00,30,10,en
https://t.co/WiKpNk8gbn,2015-12-25 05:00:31,28,3,und
🎶Do they know it's Christmas time at all?🎶 https://t.co/1hQLhYaUwb,2015-12-25 03:42:10,28,8,en
I picked the wrong day to give up figgy pudding.,2015-12-24 22:17:11,130,35,en
Happy #Festivus to someone who knows more about this imagined holiday than actual ones.,2015-12-24 19:29:18,9,4,en
New Year's Eve is a time for reflecting on the year's mistakes for ten seconds before repeating them again next year.,2015-12-24 16:43:17,91,56,en
Two more days until we get to eat #KwanzaaCake! Sandra Lee and the famous Kwanzaa Cake (Food Network) https://t.co/KYyqUbmaBu,2015-12-24 15:04:29,4,3,en
Happy Festivus to someone who thinks Kwanzaa is a made up holiday.,2015-12-24 14:59:15,29,6,en
Happy birthday funny @behindyourback I got you some ping pong materials🏓 #FF,2015-12-24 14:54:49,6,0,en
"Oh hell, the opening of Star Wars 7 has leaked (Vine by @pixelatedboat) https://t.co/4GrdnD7pTO",2015-12-24 14:26:20,6,1,en
Follow @sad_tree for unsad jokes! #FF,2015-12-24 14:23:14,1,0,en
🎶It's beginning to look a lot like Florida...🎶,2015-12-24 14:07:53,32,10,en
We are down to the wire of celebs who will make the In Memoriam portion of the Oscars.,2015-12-24 02:49:42,40,9,en
Christmas spirit got me like,2015-12-24 02:43:24,3,1,en
Merry winter solstice to all and to all a good prescription medication!,2015-12-24 02:23:11,27,7,en
"Every time I hear ""Marshmallow World,"" I think of who produced it. https://t.co/jwd7v2I7pG",2015-12-23 17:42:38,23,7,en
"I would worry about a shopping deadline, but there is no day or time in America that you can't buy something.",2015-12-23 00:05:20,20,5,en
Finally finished decorating my living room. https://t.co/qzG6T6GNZj,2015-12-22 21:39:47,29,4,en
Thank you Steve Harvey for giving my visiting family something to talk about besides politics.,2015-12-22 20:32:40,152,45,en
Jessica Fletcher solved so many crimes because she secretly committed them. #MurderSheWroteProphecies https://t.co/Sm11SY87v1,2015-12-21 19:55:04,16,5,en
Nope. Sorry. I read the groomer's email wrong. Your dog died. #SteveHarveyApologies https://t.co/I1IaZcPaTn,2015-12-21 19:24:15,17,2,en
Hang on hang on. I'm sorry. I read the card wrong. You were adopted. #SteveHarveyApologies https://t.co/Q9uITIoIP4,2015-12-21 19:16:44,14,3,en
I'm sorry. I read these results wrong. You ARE the father.  #SteveHarveyApologies https://t.co/MKtzclMM1c,2015-12-21 19:10:24,33,6,en
#MissUniverse2015 teaches us it's not whether you win or lose it's how you're told.,2015-12-21 13:50:24,47,31,en
Thanks for the love @Sally5977 ! 👉🏽❤️👉🏽❤️👉🏽❤️ https://t.co/juj1obrKug,2015-12-21 13:47:01,5,0,en
That's okay #SteveHarvey I can't tell any of the #MissUniverse2015 contestants apart either.,2015-12-21 03:38:17,37,10,en
Gentlemen prefer,2015-12-21 03:29:16,10,4,en
"""A box on all your houses!"" - how to curse a mail carrier",2015-12-21 01:40:15,17,2,en
If you order broccoli at TGIFridays they give you chicken fingers wrapped in lettuce. #ThingsYouDontHaveToFactCheck,2015-12-21 00:23:30,11,3,en
"🎶Let it faux, let it faux, let it faux...🎶 https://t.co/lNU1fCldUl",2015-12-20 22:42:55,11,1,fr
"I wrap all my gifts in plastic baggies because it's pretty much the best vehicle for loose, unflavored Cheerios.",2015-12-20 22:04:12,21,6,en
Stop spoiling Star Wars by using one adjective to describe what you thought of it!,2015-12-20 21:49:07,14,1,en
Jennifer Lawrence and Bradley Cooper are still waiting to wrap Silver Linings Playbook.,2015-12-20 21:04:21,22,3,en
The problem is,2015-12-20 19:12:08,3,3,en
It doesn't matter how many times I see the JOY trailer I don't understand what it is about.,2015-12-20 14:26:13,48,11,en
If you made a sex tape don't worry too much about it getting out since no one has a VCR.,2015-12-20 05:18:16,110,51,en
🎶They say the blacker the berry the older the phone...🎶,2015-12-20 04:17:24,166,45,en
Somebody order a Snitch Uniform? https://t.co/DlDFDQB9Ef,2015-12-20 00:28:08,26,4,en
Have I told you lately that I love @bazecraze ? #FF,2015-12-20 00:27:24,13,0,en
"Still waiting for Fox News to notice that The Wise Men look like members of the Taliban. 
#WarOnChristmas",2015-12-19 21:29:36,52,24,en
"Well this simplifies things, thanks. https://t.co/V2bvNqDpAq",2015-12-19 20:38:20,32,3,en
Your holiday photo could have been worse:  https://t.co/TJRiWHMvJk,2015-12-19 14:39:33,5,3,en
"""I'll drink to that,"" she said alone to no one about nothing. *swigs*",2015-12-19 05:08:35,64,19,en
I HAVE NOT SEEN STAR FORCE YET SO DON'T SPOIL IT,2015-12-19 04:41:43,35,9,en
"Please to follow:
@gregorybrothers 
@Home_Halfway 
@robfee 
@MeMeCherry 
@kerryohbrien 
@HuffPostComedy 
@mauleePillar 
#FF",2015-12-19 04:40:38,14,2,en
"Good luck avoiding Star Wars spoilers, because it means you'll be hanging out with a bunch of toddlers.",2015-12-19 01:40:27,11,1,en
"Haven't seen Star Wars yet, but I have never been much of a Trekkie. Sorry, Trekker.",2015-12-19 00:15:24,32,5,en
Shake it off and out of your wallet https://t.co/uzMmCNXqmw,2015-12-18 19:36:41,25,8,en
While everyone is at #StarWars this morning it's a great time to enjoy GameStop without lines...,2015-12-18 13:52:09,28,12,en
You've had leftovers. Now it's time for the best-overs! *crumbles crackers on top of whatever I reheated for you*,2015-12-17 23:57:35,55,13,en
I ain't 'fraid o' no ghost (except the one from Christmas future). https://t.co/KYIuqsS7eT,2015-12-17 02:28:42,28,5,en
"Chinese dumplings = shumai 
Turkish dumplings = manti
Italian dumplings = ravioli
American dumplings = pizza rolls",2015-12-16 23:29:40,105,27,en
Feel free to shop in stores this year since everyone else does it on line.,2015-12-16 21:45:43,7,3,en
"BREAKING: U.S. Fed hikes interest rates, but my interest in U.S. Fed and hiking remains low #FedDecision",2015-12-16 19:02:55,19,3,en
Wee! My fun Twitter workshop #TweetYoSelf @thepitnyc is TONIGHT! Reply to this if you are going/ love #Ghostbusters https://t.co/WPTWSEf9HQ,2015-12-16 18:58:25,8,2,en
I hope you'll guess what to get me for Christmas by my loud and persistent requests.,2015-12-16 04:46:37,13,6,en
Secret scene from #TheForceAwakens at the very moment of the awakening https://t.co/D21ElZIo0N via youtube,2015-12-15 17:34:31,3,1,en
I'm just your average mom without kids.,2015-12-15 13:59:35,141,62,en
Willard Scott: the first Ronald McDonald and the only one that ever properly reflected the brand. #ThankYouWillard https://t.co/IB14DUyRPF,2015-12-15 13:53:40,36,5,en
"We salute Willard Scott, 90, by celebrating his departure from the Today Show with several jars of Smuckers jam. #ThankYouWillard",2015-12-15 13:47:36,11,2,en
Please! My money's no good here. Your treat.,2015-12-15 04:06:32,41,10,en
Hope the new Star Wars feels as long as it took to wait in line to see it.,2015-12-15 03:53:20,14,2,en
It's weird to see everyone wear sandals in December instead of just frat guys.,2015-12-15 00:21:35,34,11,en
"According to lyrics about him, Santa will only come if by midnight he see's you're sleeping, can kiss your mom, and kill your grandma.",2015-12-14 15:52:19,39,14,en
All I want for Christmas is everything.,2015-12-13 16:49:56,20,5,en
"#FF @nouveaucheap here and on IG for the absolute best beauty deals. It's HER birthday, but it's more of a gift for you! 🎉🎁🍰🎈",2015-12-13 13:40:12,3,1,en
"We still don't know why cats blink slowly, why dogs howl, or why people talk during movies.",2015-12-13 03:46:02,96,43,en
Sorry I only wear your Christmas gifts ironically.,2015-12-12 22:03:02,16,1,en
I've been pre-gaming for Santa Con all month long with spiked egg nog.,2015-12-12 21:45:51,2,3,en
On this #UglyChristmasSweaterDay let's remember those less fortunate who have attractive sweaters.,2015-12-12 18:59:26,16,3,en
"😎🎶What do you mean?🎶
🙅🏼 How could I be any more clear? I said, ""No,""
😎🎶What do you mean?🎶
🙆🏼Oh this is like rhetorical",2015-12-12 06:59:32,14,2,en
For about $3.47 you can get the smell of an apple pie candle in your entire home by baking an apple pie,2015-12-12 06:33:11,70,21,en
A sweater vest keeps you just as warm as a sweater. All these years they have been up-selling us on sleeves!,2015-12-12 02:00:38,20,2,en
Oh by golly have a holly jolly Crispix™ this year! Hi I am Internet's Abbi Crutchfield. The only thing I like better than crunching snow is,2015-12-12 00:06:44,25,3,en
I wish I could give a Grammy to Spotify.,2015-12-11 18:26:48,17,3,en
All I want for Christmas is you to follow @JustinGuarini #FF 🎅🏾,2015-12-11 16:35:44,10,0,en
Follow Christian Folk Band Arcade Fired Up For God @JThomasMayfield @comedynest @JoshMankiewicz @ewfeez @ZackBornstein @BadBlondeGirl #FF,2015-12-11 16:16:46,12,2,en
Follow Christian Rap Group Pray-Z @LaTiceComedy @Parteum @stockejock @wickedimproper @nathan_name @russ_jokes #FF,2015-12-11 16:15:12,6,2,ht
Follow Christian Rock band Prince of Beats #FF @CabetoMejia @Home_Halfway @everylilthing @GoTeamMegan @seanscrap @LiannaC @BethStelling,2015-12-11 16:12:04,6,1,en
Shower therapy is where you hire a professional shower to make you feel better. Odds are there is a qualified one right in your home.,2015-12-11 06:05:19,27,3,en
"Weird that the media didn't cover the #DanielHoltzclaw trial before now, but they had to be available in case any new baby names came thru",2015-12-11 02:50:20,40,16,en
"Christmas gift ideas that don't cost anything:
1. Hugs
2. A walk together 
3. Stolen electronics",2015-12-11 02:32:46,87,43,en
Happy new season of Serial people who drive.,2015-12-10 23:07:21,38,7,en
"Now is the time when we hold my dog's toys, weep, and can't believe he has been gone for a month. Join me?",2015-12-10 04:07:16,47,3,en
I got Kenneth Tigar and Sam Anderson confused a lot as a kid. #WhyDoTheyHaveTheSameFaceTho https://t.co/1RePIoL4FW,2015-12-10 02:52:21,9,1,en
"This Gwen Stefani Blake Shelton pairing is like when Taco Bell started selling waffles, and I'm weirded out.",2015-12-10 01:11:59,435,183,en
I'm so jealous of Smart cars; they can make a parking spot out of anything! I just found one in my mailbox.,2015-12-10 00:55:33,22,5,en
"One minute you're here the next you're gone,but I bet for one nanosecond you are partly here/partly gone, &amp; you get everything that ever was",2015-12-10 00:16:59,17,5,en
Celebrity opinions on politics don't mean anything unless they align with yours.,2015-12-09 23:17:40,20,8,en
"""This is my house. I have to defend it!"" declares 35 year old Kevin McCallister before he sets booby traps for Jehovah's Witnesses.",2015-12-09 22:29:35,18,9,en
What do you get for the person who has everything? More stuff. They can't get enough of it trust me.,2015-12-09 18:34:19,14,5,en
"""I see other people,"" Haley Joel Osment whispers to his dinner date during their breakup.",2015-12-09 15:41:06,201,46,en
"""This is my house. I have to defend it!"" declares 35 year old Kevin McCallister before he calls the exterminator.",2015-12-09 14:35:41,19,5,en
I like to stay up until 2AM to remind the Boogie Man he terrorizes on MY time not his.,2015-12-09 05:39:55,42,9,en
Dogs are,2015-12-09 01:48:42,8,1,en
I want to shower three times a day,2015-12-09 01:38:55,12,1,en
I judge your parenting skills if you,2015-12-08 23:11:53,6,3,en
It costs less to hire a band to play for your friend than get a musical greeting card.,2015-12-08 22:59:53,22,4,en
For people realizing for the first time that someone on Twitter has done the same jokes as them: welcome to Hell,2015-12-08 15:37:32,83,10,en
There are so many Hitler comparisons I am waiting to find out Trump is Muslim.,2015-12-08 14:26:16,31,4,en
*Adele bites into a chocolate bunny* 🎶Hollow on the insiiiiiide!🎶,2015-12-08 03:52:13,50,16,en
Well not everyone is good at baby names,2015-12-08 02:30:32,44,14,en
Are you guys excited to see Cat Man? https://t.co/s1pRkwNqNv,2015-12-07 23:03:52,13,3,en
Hair extensions rule all species of animals. Think about how much more acceptance rats would have with bushy tails.,2015-12-07 20:06:22,11,4,en
"I want a heart of gold, nerves of Teflon, and the patience of a fast food employee. They're never in a hurry. They'll be there all day.",2015-12-07 18:18:04,18,6,en
Thank you we are Scripted Improv! May we have a suggestion from the playbills we handed out?,2015-12-07 18:01:39,13,4,en
"""Bless you,"" is just the observation, ""You sneezed."" I'd like to coin the term, ""Caught you,"" for ""You picked your nose.""",2015-12-07 04:19:13,35,10,en
Eloquent children are amusing until they refuse to do your taxes.,2015-12-06 23:40:31,11,2,en
Invention: soap that won't wash off before thirty seconds.,2015-12-06 16:44:11,8,3,en
When he searches for things Michael Bublé pronounces it Goo-Glay.,2015-12-06 03:57:55,59,7,en
"""I yelled at Mommy and your siblings, but you were up here and got left out. You were an accident."" https://t.co/AlT6YnW37w",2015-12-06 03:22:46,24,4,en
#TBT @comedianluke 's version of George Bailey's prayer #ItsAWonderfulLife https://t.co/7FQENWFf0C via youtube,2015-12-06 03:17:48,5,4,en
"Mary gives him four kids, looks hot, cooks all the meals, puts up all the walls in the house, and GEORGE is the one who's sick of it?!",2015-12-06 03:05:19,26,6,en
More like It's A Depressing Life. Everything is going wrong. I don't know how George is gonna turn this around.,2015-12-06 02:58:10,17,2,en
"""Confound it Man, are you afraid of success?"" &lt;-best burn in #ItsAWonderfulLife (followed closely by ""scurvy little spider"")",2015-12-06 02:41:06,9,1,en
"Doesn't matter how many times I've seen #ItsAWonderfulLife I never get tired of hating Sam Wainwright's ""Hee-haw."" It's not a catchphrase!",2015-12-06 02:38:38,16,3,en
*slowly hops a sad tune on oversized floor piano*,2015-12-05 02:06:59,30,6,en
Can't believe it's only December 4 and I'm already bitter about who hasn't sent me a Christmas card.,2015-12-05 01:47:09,11,0,en
While you watched #TheWiz I got to see @janellejcomic @TimJDillon @emmawillmann @subhah @AlterNegroSho perform! https://t.co/Z9RgoiPbgb,2015-12-04 14:37:29,14,3,en
Some people aren't feeling  #TheWizLive #TheWiz https://t.co/HGkV4Pj3Yp,2015-12-04 02:51:43,43,18,en
If you play a Pink Floyd album at the same time as #TheWiz a grandmother will throw a #PattiPie at you.,2015-12-04 02:21:14,23,8,en
I'm waiting for the part of #TheWiz where someone climbs a ladder and swings mysteriously in the background.,2015-12-04 02:18:39,12,3,en
I know sooooo many people in Times Square who would make a good Tinman. #TheWizLive,2015-12-04 02:14:24,13,2,en
When you already got a sneak preview of #TheWizLive before your Auntie https://t.co/OMnKYDw1An,2015-12-04 02:05:19,22,1,en
"#TBT hanging out with @LuvbeingShanice on @people Meet #TheWiz Live!'s Dorothy: Shanice Williams /people/mobile/video/0,,20943196,00.html",2015-12-04 01:58:38,0,0,en
"Me: My football hurts.
Dr: And where is your ""football""?
Me: *points to ball of foot* Where everyone's is Dummy.
Dr: *looks at camera*",2015-12-04 01:50:35,25,2,en
Ay man stop snitchin'!! https://t.co/hmUORVFOBo,2015-12-03 21:12:21,13,2,en
Very excited about tonight's televised musical based on a musical film based on a musical film based on a child's ghost story.,2015-12-03 20:49:27,25,7,en
The Elf on the Shelf is a SNITCH https://t.co/OgjKJBiKYC,2015-12-03 16:28:26,33,4,en
#MondayMotivation it's Thursday!!,2015-12-03 14:51:40,14,4,en
I hate when people fight around the holidays. Can't we all just get me some of this? https://t.co/h3HCyk15mN,2015-12-03 03:20:42,22,4,en
"I believe in thoughts and prayers as a prelude to great acts of courage, wisdom and love. They're the beginning not the end.",2015-12-03 03:03:59,71,19,en
All guns on TV replaced with bubble machines. Cops carry tasers. No one can say or write the word gun anymore. These are just ideas.,2015-12-03 02:24:46,26,5,en
"I practice gun non-ownership, and I intend to teach it to my league of ninjas.",2015-12-03 01:21:42,32,4,en
You wanna see the receipts? @igorvolsky has them. https://t.co/27ANfpULqf,2015-12-03 01:18:02,114,116,en
🎶I'm dreaming of a rainy Christmas...🎶,2015-12-03 00:39:30,7,2,en
Oh look. I found one of Julie Andrews' favorite things. What a nut. https://t.co/hmANLQMRGi,2015-12-02 20:58:46,18,3,en
Sorry Kobe Bryant's retirement makes you realize how old you are.,2015-12-02 17:37:49,17,3,en
🎶How do you like your Kool-Aid?🎶 Awkward: Fox News Television Personality Asks Black Co-ho... https://t.co/iNpdlBPYaU via YouTube,2015-12-02 17:31:09,3,2,en
My son was at the front lines fighting the war on Christmas 2012-2014. He was stationed in Starbucks. Pumpkin Spice infantry.,2015-12-02 01:20:08,372,105,en
Happy #WorldAIDSDay https://t.co/JrxMgoJKAJ,2015-12-01 19:30:24,21,2,en
