text,created_at,favorite_count,retweet_count,lang
i am very excited to be speaking at and attending DevOps Days Silicon Valley! if you are coming lets have a famous #beer drink @devopsdayssv,2015-10-20 17:19:53,37,1,en
#SquadGoals #Relatable https://t.co/f24LwUQ9Mi,2015-10-20 05:24:06,249,44,und
"so weird that luke skywalker is the bad guy now, but it should be a fun flick!",2015-10-20 02:59:20,138,26,en
"new dyson airblades are out gang, and good news-- they get your shoes wet up to 2x faster",2015-10-20 02:52:04,114,7,en
folks if i had to rate tattoine as a planet.. i would give it 2 stars. thank you for clicking fav on this amazing star war joke,2015-10-19 03:11:00,722,141,en
parts of the script from #TheForceAwakens have been leaked. here they are: https://t.co/rnUhWq9qS3,2015-10-18 17:37:53,83,32,en
just saw some dude on the street and if I had to guess his name i would say it is Bigguy Runfast,2015-10-17 17:54:45,158,17,en
stop communicating with my large Son . stop inviting him to the chat rooms. i have ot keep calling the house phone to knock him off line,2015-10-15 18:42:34,214,24,en
just saw a cab run over a pigeon and my first instinct was to take a commemorative selfie http://t.co/WkG17j7Dyq,2015-10-14 19:46:18,315,20,en
jib webb talks like he's extremely full,2015-10-14 00:51:18,230,73,en
cool http://t.co/zRXBKytE3X,2015-10-14 00:03:12,94,3,en
i'm like a 4 in nyc and a 6 in San Francisco but i would be an easy 9 in chicago,2015-10-13 23:23:01,203,25,en
lets get jake fogelnest off line. #TakeEmDown #GetJakeOff #PoundSandFogelnest #BeatIt #GetOuttaHere,2015-10-13 21:27:19,66,2,en
#twitterlayoffs i wish @jakefogelnest would lay off. from tweeting. i wish he would go off the web. take him off line,2015-10-13 21:25:53,135,5,en
"FOR YOUR ENJOYMENT: several minutes of audio of my bathroom stall neighbor grunting and burping 
https://t.co/iRc2HdEgFV",2015-10-13 21:04:07,93,12,en
github employee with wallet chain spotted. do fellow employees try to steal your wallet or what dude?,2015-10-13 18:39:18,111,9,en
80% sure brendan fraser just stole my cab. fuck new york and especially fuck brendan fraser and everyone who looks like brendan fraser,2015-10-13 02:40:59,448,53,en
lol cool @bostonpolice http://t.co/tdPbm36X8M,2015-10-13 01:34:18,293,96,en
ahh new york aka sin city.. the city of angels.. city by the bay..the crescent city.. second city.. thats the great nyc baby...gotta lobe it,2015-10-12 23:59:16,246,28,en
uhhh ok san jose http://t.co/TVxrGhV8aO,2015-10-12 21:55:51,105,17,en
"""netflix and chill"" has gotten to the point where I feel bad for adults starting to say it but feel really bad for teens who still say it",2015-10-12 05:27:22,507,136,en
"""when your wife leaves you for her personal trainer, maybe check out the great gatsby or some shit"" http://t.co/B98qAEolyJ",2015-10-10 21:41:47,739,247,en
"to the foul wiki leakers who published a secret photo of my insanely dark nipples showing through a white shirt, heres what i ssay to you: g",2015-10-10 21:31:38,127,6,en
"watching tv and capt kirk said this is ""star date 3244""? folks this guy dates more celebs than taylor swift !! this web site is a hell to me",2015-10-09 22:07:52,333,59,en
here is an article i wrote a long time ago and am still embarrassed about. my friend mitch reminded me of it. http://t.co/ZvtndbwLFk,2015-10-09 21:59:46,54,8,en
"cheers to the number one bull shit of foods: dirty terry's ""pigs in a diaper"". its just pigs in a blanket terry yyou fucking freak",2015-10-09 05:30:53,157,12,en
"you work for ""micro soft""? i didnt know @dogboner's wiener had employees. #Damn #CanHeSayThat #Yowza",2015-10-08 23:36:27,432,25,en
folks did you hear about the beaker that got a diploma? well it was because it graduated . these jokes are free of charge,2015-10-08 20:45:37,197,42,en
hey look its schindler's lift. do you get it please ? http://t.co/usryL60usb,2015-10-08 20:37:24,449,71,en
passion fruit is a dumb Ass shitty fruit that no one would ever eat if it had a normal fruit name . bad taste. #badfruit,2015-10-08 19:22:37,184,30,en
need swords,2015-10-08 19:14:16,94,25,en
Having trouble viewing this email? Click here to suck my fuckin assssssssssss,2015-10-08 03:35:43,464,87,en
"the garage door is the house's ""mouth"" and the doors and windows are various other openings (nose, ass, vag/cervix, etc) #JonsRealEstateTips",2015-10-07 15:34:09,247,34,en
"instead of saying i have emotional baggage i say im ""pushing a feelbarrow"" and this is one of the many reasons everyone loves me at parties",2015-10-07 15:29:18,1011,362,en
"folks once again, the hipster's are using their selfy sticks.looks like idiocracy was a documentary ! subscribe for more of my classic rants",2015-10-07 14:43:02,500,83,en
shes playing prison rules https://t.co/lZdnVIqV0g,2015-10-06 20:38:20,121,30,en
shitty laptops you can convert into shitty tablets are soooo good. everyone loves them and nobody thinks they are bad,2015-10-06 16:52:54,275,44,en
sad about @trevso_electric. really funny and good dude.,2015-10-06 15:50:05,70,3,en
"workin real hard at that computer thats not plugged in, mother fucker? go home for the day http://t.co/6hHLq1fWTj",2015-10-05 19:55:43,371,76,en
tfw u fall in love http://t.co/ca5bdamxfU,2015-10-05 17:02:45,151,27,en
its cool to make a dimebag darrell joke because when you come back a day later your mentions look like the bathroom line at ozzfest,2015-10-05 04:55:03,365,35,en
"we can fire a missile through a bathroom window 12,000 miles away but theres no drone to bring me a bloody mary while i sleep in the park???",2015-10-04 17:17:32,305,63,en
"my name is penelope. i'm a full-figured gal. i love long walks, chilling out with friends, and… https://t.co/drKwOwFy6a",2015-10-04 16:12:10,40,4,en
just out doing a little shopping http://t.co/xO3rerwwhX,2015-10-03 20:53:22,439,119,en
today someone reminded me of Jon's Passions 2014. here is that video. if you know me irl please don't watch it. https://t.co/2xyYGhdXkx,2015-10-02 20:27:28,132,27,en
"very proud to be one notch above ""cop car with bees on it"" thanks to all http://t.co/ieL4QX1ETe",2015-10-01 07:28:55,994,230,en
hello to all the new followers of me on here. i can't wait to disappoint you,2015-10-01 03:08:29,1157,101,en
thank you to my good friend @Bronzehammer for recording my first national TV appearance. https://t.co/ePoosOoSp3,2015-09-30 17:27:12,2954,1703,en
in all sincerity i really did believe we were talking about Edward Scissorhands,2015-09-30 16:43:14,4123,1693,en
"""drone strike tracking app?""
Tim Cook: remove it. objectionable content
""immensely racist game?""
Tim Cook: thats cool http://t.co/etmVtmEgUt",2015-09-30 08:40:47,510,305,en
today i heard a really good story about a neighbor with a white supremacist boyfriend who had an allergic reaction to a couch &amp; he screamed,2015-09-30 02:26:26,159,7,en
"1996 me: Dragonheart seems cool. theres a talking dragon.
2015 me: man the internet has like 80 million guys who say they're talking dragons",2015-09-28 09:47:49,223,66,en
just ran some data and it looks like people stopped making out with me around the time i started using neutrogena t-gel as body wash,2015-09-28 06:22:57,205,17,en
"first paragraph: wow, maybe people aren't that terrible after all

second paragraph: lol http://t.co/ns2kR2s1t7",2015-09-28 06:08:42,307,96,en
is there an easy way to unfollow or at least mute everyone who moved to brooklyn in the last 10 years,2015-09-28 02:08:37,430,73,en
"new landlord just called to see if everything's ok so far and i said ""i'm feeling like a freak on a lease"" and i dont think she got it :/",2015-09-28 00:34:24,480,56,en
uh hi can i get a mcchicken and can i please have extra of that nasty ass yellow lettuce that only exists on mcchickens please,2015-09-27 22:19:00,298,57,en
going to diff bar because two different people brought up pizza rat. im trying to drink to escape this shit you guys,2015-09-27 05:06:58,252,19,en
me https://t.co/WiDGwIXvqM,2015-09-27 00:53:26,394,149,und
tfw u are moving and find a sixer of lagunitas behind some shit &gt;&gt;&gt; this isnt a joke im just excited,2015-09-26 17:58:03,132,3,en
"(in thte voice of donald Trump , the weird man everyone loves to ttalk about )""Whats With My Hair"" i beg of you , to put this on your Blog",2015-09-26 17:01:44,130,19,en
"Come find me at the DevOps Enterprise Summit (Oct 19-21 in SF) this year, where I will be bringing my incredible expertise to the enterprise",2015-09-26 02:36:40,37,3,en
"""folks when it comes to #Tech, you gotta have the #Data to go with it"" -Jon Hendren",2015-09-25 21:43:49,187,32,en
time to die http://t.co/6QInsSrXLm,2015-09-25 18:49:03,145,42,en
i'm only staying alive to see what dogs eventually do in low gravity and how they run and jump and go wild,2015-09-25 18:11:25,267,108,en
this guy figured out how to use twitter right away https://t.co/NvGdFVpnsD,2015-09-25 01:27:17,241,63,en
"a great joke when you spray windshield washer fluid is to say ""oh no my car is lactating""",2015-09-25 00:18:12,113,21,en
#SaveThePlanetIn4Words Save The Plan Et,2015-09-24 21:13:06,164,51,en
"so if every teen finds porno in the woods, and endor is the forest moon, it can be assumed that like 3% of the surface is covered in porno",2015-09-24 07:59:42,161,37,en
whenever you guys tweet at the bad celebrities and put the period in front it feels like ewoks throwing rocks at the big walking robots,2015-09-24 07:53:35,386,89,en
"""Good Burger"" is trending bc 20 year old references pass for humor/conversation now. We are becoming the species from TNG's ""Darmok""",2015-09-24 07:28:28,309,92,en
#BraHoWa (the brand holy war) is coming and it is important to ally yourself with powerful brands ahead of time,2015-09-24 05:07:26,118,16,en
this morning a shortsighted lady was mad about a Caltrain delay. how do you let your brain become so self-centered? respect caltrain please,2015-09-24 05:02:46,64,3,en
"""Miley... what's good?"" -Jon Hendren",2015-09-24 04:48:24,217,17,en
#GoAwaySupermoon I hate Supermoon !!!!,2015-09-24 03:07:02,129,18,en
the best part of twitter by far is arguing with a guy with like 4 followers and putting .s in front so everyone has to see it,2015-09-23 19:54:19,153,23,en
fuck the equinox!!!!!!!!!!!!!! im a #SolsticeGuy mothe fucker #solstice #equinoxIsShit,2015-09-23 19:37:36,262,60,en
"the ios game ""Auctioneer"" is a phenomenal display of overwrought, played-out 'design' around a shitty basic mechanic",2015-09-22 08:24:01,17,1,en
oh no shit? http://t.co/Eu0PmauptZ,2015-09-22 07:37:33,195,24,en
"doing the famous drink of beer with my friend @DanielZarick has made me feel refreshed, rejuvenated, ready to call McDonalds (long story)",2015-09-22 06:46:24,32,4,en
"""i'm a youtube celebrity. yes, youtube, that website with 80,000 videos of ppl having their enormous zits popped by a doctor""",2015-09-22 02:19:18,219,41,en
"at the urging of this unintelligible drunk man's shirt, i have decided to ""cowboy up."" please respect my privacy at this time",2015-09-22 01:59:51,268,61,en
ggghhhhhhhhhjjjkkkkkkkkkkk nnoooo https://t.co/xKTL3XOcNI,2015-09-22 01:33:50,96,24,it
had a run-in once again with the bastard scoundrel i call the  Dodge Viper Racist,2015-09-21 21:16:23,88,6,en
how good a craft beer is is inversely proportional to how colorful the label is,2015-09-21 18:51:50,88,23,en
Taylor Swift - Blank Space https://t.co/1DWv4zFZQB via @YouTube,2015-09-21 05:32:04,66,10,en
Biden Quietly Singing Pearl Jam's 'Even Flow' During Security Briefing http://t.co/RwqDsbZ0nY via @theonion,2015-09-21 02:42:53,56,9,en
the results are in and 28% of videos on youtube are ukulele song covers,2015-09-21 00:32:09,178,45,en
"they call them the emmys becaues they're all about M-E! thats the celebs for you folks. this has been my joke, please put it on your blog",2015-09-21 00:07:32,150,22,en
"folks i cant believe it , the celebs are back",2015-09-20 21:44:51,193,33,en
#DoctorWho is my favorite Christian character on television today,2015-09-20 03:32:55,130,16,en
[exhales an enormous amount of weed smoke] the california raisins are just old-ass wrinkled m&amp;ms,2015-09-19 05:58:57,250,55,en
if I'm the only guy invited to a bachelorette party does that mean they're all going to get freaky w me or do they think i'm gay,2015-09-19 03:57:27,299,29,en
this is an actual photo of what #DevOps looks like and it hangs above my desk http://t.co/1qexUvgfoV,2015-09-19 02:55:27,139,18,en
paypal... cmon man http://t.co/y61BH1Fc6M,2015-09-18 21:19:45,169,15,ht
i am moving to mountain view next week. good bye to san jose from your great friend jon h,2015-09-18 06:38:23,80,1,en
its thursday tho.. https://t.co/5nAklKvMwX,2015-09-17 17:39:29,12,1,en
#UnfortunateNames Paul Ihaveweirdballs,2015-09-17 05:12:14,131,15,en
#UnfortunateNames Timothy von Diarrhea,2015-09-17 05:10:49,94,14,de
#UnfortunateNames James Turds,2015-09-17 05:08:41,117,16,en
Incredible! Scientists Produce First Ever Photo Of The Internet http://t.co/ouVNlKU2LH,2015-09-16 16:14:07,378,103,en
imagine being the kind of person who doesn't unconditionally love every dog. I can't fathom how you live,2015-09-16 07:31:16,302,156,en
"is there any reason the ""remastered"" versions of songs arent the default? are ppl like ""oh i want the shitty old muddy one"" 51% of the time?",2015-09-16 03:59:47,92,6,en
your donald trump/hillary parody account.... well i have to say it's very good and not tiresome as damn hell,2015-09-16 02:38:02,152,15,en
helen was logged out. they took helen offline. rip helen. helen is down,2015-09-15 20:32:54,64,3,en
dishonorable discharge from Army for getting our whole platoon captured while everyone was watching me kiss my own nice abs,2015-09-15 18:12:54,162,18,en
"saw someone wearing a shirt that says ""data is new bacon"" it's a desperate cry for help",2015-09-15 15:59:28,191,42,en
"parents just gave a baby an ipad and said ""he knows how to use it"" and he opened the stocks app. can't tell if baby is smart or huge dumbass",2015-09-14 22:59:19,738,190,en
"howie_mandel_in_diaper_trips_and_falls_into_blinds.mp4 0:46 Uploaded August 30, 2004 12 Views 0 Likes",2015-09-14 22:28:56,151,12,en
in the last 3 days i have accidentally followed people like 20 times and i have no idea how to use this web site anymore,2015-09-14 18:06:14,60,6,en
11 commercial-free back-to-back jams from the 80s 90s and today for your drive at 5,2015-09-14 17:59:12,60,7,en
it's monday madness and you're in the mix with dj dickhead for a 3 hour uninterrupted classic rock block,2015-09-14 17:55:37,140,28,en
the most gaudiest shit in san jose is forever the RAINBOW LEDS ON BUILDINGS http://t.co/oam6aouYcC,2015-09-14 04:02:24,19,0,en
"""uranus, an entire planet dedicated to butthole jokes, wonderful. venus, rhymes with penis, not bad."" -the first alien to visit earth",2015-09-14 03:45:21,272,40,en
I remember Tribes 2 being a unique groundbreaking game in the sense that each of the weapons had some different quirk that made them shitty,2015-09-13 23:25:43,63,4,en
netflix and watch DS9 for 7 hours waiting for the other to make the first move,2015-09-13 22:47:02,180,39,en
i'm in the mix with 12 commercial free jams for your drive at 5 (slowed down voice) in the mix,2015-09-13 20:42:49,100,8,en
pumupkin spice lattey !!!!!!!!!!! the funny drink!!!!!!!!! please fav i need this,2015-09-13 11:47:30,464,58,en
"a voice just came on the radio to inform me that San Jose is now ""in the mix."" in case we don't survive, i love you guys",2015-09-13 04:29:27,73,5,en
its me http://t.co/1FfAweUFve,2015-09-13 03:28:00,189,20,en
"""today i would like to drink someone's sleep drool filtered through used underwear"" -coconut water inventor",2015-09-13 02:57:32,257,72,en
nooo good god what have you done http://t.co/fDyN0lbGKg,2015-09-12 04:18:44,99,6,en
not really tbh http://t.co/SgZ1U2zwfF,2015-09-11 18:21:48,246,37,en
how do i delete the pic off a draft tweet. i need help http://t.co/aj4lC5MrCm,2015-09-11 01:28:02,187,38,en
happy bday to my bff @emergingthought who makes the only writing implements i can stand to use http://t.co/AFKZPrPIYk http://t.co/2XM39jKFnB,2015-09-09 04:49:04,70,4,en
this magnet poetry is speaking to me http://t.co/NSigIsX14C,2015-09-09 01:02:25,99,18,en
"cut my wife in two pieces
this is my magic show",2015-09-08 18:59:27,704,221,en
"if u wear arrowhead jewelry to honor ancient ppl guess what, they'd just be like ""look at the dumbass who doesnt know how to use arrowheads""",2015-09-08 09:52:46,357,70,en
"""wait this isnt a toad. this is a false toad"" -the discoverer of frogs",2015-09-08 08:38:54,212,64,en
"reminder that the scoundrel animal of ""frogs"" are described by science as ""false toads."" frogs aint shit!!!! http://t.co/lSipY0kS5r",2015-09-08 08:35:36,147,39,en
subway has a lot of explaining to do. for example why the fuck is it called Cold Cut Combo in some places and Cold Cut Trio in others,2015-09-08 08:13:34,89,8,en
"""What you call 'love' is simply a obsolete chemical reaction in the more primitive parts of your brain."" -guys with anime for their avatars",2015-09-08 05:38:47,668,214,en
"i;m ready for the good content , on sociol media http://t.co/ZdUxRuI17V",2015-09-08 02:39:13,147,26,en
i wear my watch with the face on the inside of my wrist because i only want me to see it. im a psychopath,2015-09-07 23:00:53,179,20,en
don't get on the Cowboy Kiss web site from mcdonalds wifi. they will boot you off the net if they see your tablet or smartphone on there,2015-09-07 21:54:02,138,13,en
"i just renewed my personal domain http://t.co/jnUd3WcsJR for 3 years, indicating that i no longer want to die soon, haters",2015-09-07 05:59:23,228,9,en
"sorry i said your gfs bangs got her ""lookin like a damn romulan""",2015-09-07 05:39:56,334,71,en
will someone please be my paypig,2015-09-07 01:38:56,58,5,en
same http://t.co/q7EQrxvpy7,2015-09-06 07:10:15,175,25,en
i never went to college but once i took a wrong turn and got lost on Stanford's campus and had to drive over some grass to get out,2015-09-05 18:33:37,353,43,en
#YodaSingsInTheShower yet another hash tag on here i will not be caught dead clicking. you people make me sick,2015-09-05 00:47:46,120,19,en
the adults who buy childrens toys..... are very good,2015-09-04 21:28:24,161,23,en
chrome keeps trying to open a new tab. hey are you a web browser or an alcoholic. cmon #TheGoodJokes #OnlineHumor #Gags #Goofs #Alcoholism,2015-09-04 16:59:07,312,46,en
"i was just looking at my own instagram realizing i'm one hell of a guy and ""a beaut to boot"" #ThinkingAboutJon #ThatsJonBaby",2015-09-03 05:13:40,120,10,en
#BieberOnFallon scientists have finally cracked the code on the hashtag good people will click on the least,2015-09-03 04:59:02,180,24,en
[sees vision of myself in a garage slamming michelob ultras and listening to fleetwood mac] well this could be 40 years from now or tonight,2015-09-03 03:51:20,326,62,en
well there's no bones about it gang-------- i am a total babe,2015-09-03 03:15:24,134,19,en
"thank you for enjoying my classic bit, the Chad Kroeger Horny Report, documenting his horny @-replies to fans http://t.co/PpdRo4572b",2015-09-02 23:31:16,133,18,en
"Chad Kroeger Horny Report (9/2/15): It's back baby!! Chad is not horny online today, but I suspect he will become horny again in the future.",2015-09-02 23:30:03,129,18,en
sorry but I won't believe you've been to Hawaii until your car has 2 or more window decals about it,2015-09-02 16:16:00,446,108,en
my fantasy draft? why its none other than an ice cold beer...,2015-09-02 01:02:22,423,109,en
thought i was being chased by an enormous blue ghost but it was just a tarp caught in the wind #Blessed #Tarp,2015-09-02 00:29:54,178,26,en
Gamer. Hubby. Craft Beer. Poly. Beard. Doctor Who. Minecraft. Atheist. Foodie. Freethinker. Here for rational debate. RTs != endorsements,2015-09-01 18:18:55,294,57,en
"new google logo extremely sucks ass and looks like some gymboree shit. to it i give a big ""thumb down""",2015-09-01 16:56:18,126,12,en
https://t.co/nhHrFjTVzP outstanding,2015-09-01 00:54:28,48,14,en
i know a cool guy who is nice and pleasant looking to rent a 2br in mountain view.. you should contact me if u know a cool place like that,2015-09-01 00:45:33,15,1,en
"doint text me between the hours of 7-8:30 pm tonight while i get the knuckle tats ""CHAT ROOM""",2015-09-01 00:18:09,108,16,en
ahhh crisp..refreshing. i'm talking about the cold cup we all love to respect.. the cool drink known only as ''beers' #ItsTheBeerDrink,2015-08-31 23:16:17,231,45,en
eagle eye cherry = litterbug. watch the vid on tmz he throws his trash onto the sidewalk #EagleEyeDisrespectful #LitterbugWatch,2015-08-31 22:43:58,64,3,en
miley has a nip slip and the net goes nuts but my scrotum falls out my shorts and all that happens is a hawk swoops down to try and take it,2015-08-31 04:04:09,848,201,en
played by pewdiepie?????? say no more!!!!!!!!!!!! http://t.co/qyYA23g3Ok,2015-08-30 23:03:13,164,21,en
"im the type of 'dip shit ' who uses the stocks app on my phone, to see whats going on in the world of stocks",2015-08-30 20:17:12,158,9,en
imagine if your actual personality was so boring that you had to put your religion in your bio on here,2015-08-30 19:05:15,488,146,en
good http://t.co/VBjsvqhnMC,2015-08-29 23:11:38,112,22,en
when outer space looks like a painting some swingers would have above their waterbed &gt;&gt;&gt;&gt;&gt;&gt;&gt; http://t.co/VA6mmh4btC,2015-08-29 18:57:52,142,17,en
LIVE on #Periscope: can't believe i was taken offline for being on the Cowboy Kiss website at mcdonalds https://t.co/OZyFSJlCFr,2015-08-29 05:54:13,23,1,en
fastball could have been a great band. i'm not even drunk this time that's what's so fucked up,2015-08-29 05:35:34,180,25,en
"look

if you had

one shot

one opportunity

to pet every dog you ever wanted

in one moment

would you capture it

or just let it slip

yo",2015-08-29 05:19:12,2727,1672,en
in the weirdest fucking turn of events i just saw a guy using an amazon phone. like as his real phone. in publixlc. what the fuck,2015-08-29 03:02:34,163,21,en
"bad news everyone. @trill_hugs_69, @robocop_hitler and @garbagewytch left the tweetup becuase @IronyBaby vomited into @ComedianTerry's drink",2015-08-29 01:39:25,63,2,en
"tfw u remember its the classic Friday night we all love to enjoy , aka the Beer drink time #ItsTheBeerDrink http://t.co/OJFFayotAJ",2015-08-29 00:54:10,350,108,en
http://t.co/H1TBkVoCWy,2015-08-28 20:36:01,39,6,und
oh. its RSS not ASS. http://t.co/KpI9VWwdYB,2015-08-28 17:22:36,40,2,en
Mürsel Senide Bırakayımmı-Bırak Hadi Bıraktım 😂😂😂😂😂 Instagram:Thug Life Vine Türkiye (Vine by @ThugLifeVineTR) https://t.co/OChS8GB97x,2015-08-28 06:45:33,51,11,tr
"fuck stolen jokes, some of you are having your entire personalities stolen http://t.co/fuG4YdwQ5H",2015-08-28 05:46:53,239,44,en
so cute and sad rn http://t.co/YhwvfGMQtS,2015-08-28 04:47:04,202,7,en
http://t.co/lhsjdzMMyO,2015-08-28 04:20:01,90,15,und
i can't beleive it's only been 4 years since the IRC funeral for AnalDawg http://t.co/3bbfrPyFjp,2015-08-28 01:36:57,73,11,en
"twitter is pretty good for breaking news and jokes but when i log on its to see grown human adults complain about ""randos"" in their mentions",2015-08-27 07:18:07,183,24,en
Remember to set your clocks an hour behind when you go to bed tonight! #DaylightSavingsTime,2015-08-27 06:57:08,95,46,en
I published “Now I’m Literally An Award-Winning IT Security Expert On Top Of Everything Else” https://t.co/o5TVguBwoN,2015-08-26 18:16:38,83,13,en
nevermind i just decided i dont want weird gun guys yelling at me all day,2015-08-26 16:02:00,173,15,en
welp time to turn off twitter,2015-08-26 15:19:31,113,34,en
heres how you own someone in group dm http://t.co/A9e8LfbuRS,2015-08-26 02:53:20,279,24,en
I just published “Now I’m Literally An Award-Winning IT Security Expert On Top Of Everything Else” https://t.co/PvaO8W3MND,2015-08-26 01:46:08,151,21,en
"a good name for a model of car to me would be ""The Beehive"". your ""integra"" or whtaever is shit motherfucker , im rolling in a beehive",2015-08-25 22:08:15,131,13,en
Third Wave Weird Twitter https://t.co/nAHhUL9uSW,2015-08-25 18:32:06,239,50,en
http://t.co/U71GB9pUh4,2015-08-25 01:25:23,218,46,und
today i feel bad for our friends in high finance and wall street who make obscene amounts of money while adding no value,2015-08-24 21:03:12,610,233,en
"fuck country crock!!!!!! crock of shit, if you ask me. check out country crock ""the big shit of the dairy case""",2015-08-24 17:00:29,194,21,en
"On this day in history, Steve Jobs invented Windows 95, 30 years ago today.. incredible! #techtrivia #wow #amazing #apple #iphone",2015-08-24 16:45:17,229,83,en
isis... knock it off,2015-08-23 20:22:58,339,92,en
i am gucci mane's first linkedin connection http://t.co/3jp1MbCG5V,2015-08-22 00:52:01,534,83,en
"in case you missed it, you don't have to pretend to like The Doors anymore. everyone eventually realized everyone else was pretending too",2015-08-21 22:45:35,477,181,en
"saw an old guy w a shirt that said ""with a body like this, who needs hair?"" but he was NOT BALD. so now i know too much about his pube sitch",2015-08-21 22:29:00,256,27,en
if you're thinking of selling stuff on @etsy don't bother bc holy moly they treat sellers like shit. thats some advice from jon to you.,2015-08-21 20:39:46,57,4,en
reminder that there is scientific proof i am most important #DevOps person on the face of the earth https://t.co/pHvkBVBSMn,2015-08-21 17:29:59,34,1,en
"i for one cannot wait for the end of casual dining's bizarre love affair with sliders ""the small shitty burgers for people who hate food""",2015-08-21 01:28:53,391,87,en
