text,created_at,favorite_count,retweet_count,lang
"ME: pullin down to refresh and get more tweets is like a rat suckin on that shitty upside down water bottle
PROFESSOR: heres my wifes email",2015-12-21 02:59:29,241,19,en
"if a first responders ever did cpr really bad and a dying guy said ""more like worst responder"" i bet that sticks with them a while",2015-12-20 06:38:40,1908,583,en
still my fav achewood https://t.co/G2hyLfuWhE,2015-12-20 06:35:18,799,204,en
"beer before liquor, i really like liquor
liquor before beer, i also like beer",2015-12-20 01:00:34,328,102,en
"(rants for 25 tweets against an imagined potential slight committed by ""bernie bros"" or "" hillary men"") nnow this is the good content baby",2015-12-20 00:49:38,158,17,en
"today i am appreciating my favorite shape, the classic cube. we can learn so much from them.. https://t.co/TDOJ2kgohR",2015-12-19 21:54:03,234,43,en
slay queen https://t.co/tihrRXFfuw,2015-12-19 19:46:30,707,114,en
one of nature's greatest mysteries: blue cheese is delicious despite smelling like ripe dadhole ?,2015-12-18 21:21:36,168,12,en
"only putting up with this bull shit until the hour of 6pm during which time i morph into my night form """"The Dinner Boy""",2015-12-18 20:35:55,157,18,en
strange mother teresa quote here https://t.co/JLUnLfUUlR,2015-12-18 18:33:22,278,60,en
with a heavy heart i must report that it takes only 4 perfect roundhouse kicks to cave in the chest cavity of a kohls mannequin,2015-12-18 18:25:05,427,133,en
"well folks , it is the perfect time to announce that i need your follower donations in order yto buy enough tattoos to become a suicide girl",2015-12-18 17:36:19,351,45,en
i just watched the big movie sitting next to a real large fella wearing a bill murray hoodie over a bill murray tshirt. what an honor,2015-12-18 13:18:46,217,10,en
mmm yeah i want tapas give me those 2 little ass fish filets drowning in oil for $11,2015-12-18 03:21:10,202,31,en
"Foreskin Friends Forum &gt; General Topics &gt; Foreskin Life &gt; Foreign Objects &gt; FOUND CORN KERNEL IN FORESKIN,HAVENT HAD CORN IN 2 MO? &gt; Page 43",2015-12-18 02:05:10,321,45,en
#MovieNews Really exciting day for film buffs: Today is the day Marty McFly traveled to in Back to the Future Part 2! #Movies #Movie #fact,2015-12-18 00:46:46,154,33,en
"Longmont Potion Castle 12 is out. heres one of my favorite old ones ""Squid Sandwich"" https://t.co/XtFwPZ2gid #LongmontPotionCastle #hashtag",2015-12-18 00:20:37,45,11,en
"if someone yells on here and puts hand claps between the words, to me it feels like it makes the yell approx 2.5x more powerful",2015-12-17 20:45:49,197,17,en
martin shkreli looks like he was in the womb about 3 weeks too long,2015-12-17 17:44:45,309,55,en
"karmin, macklemore, and pomplamoose walk into a bar. it's the worst bar in the world and i hate it. i will never visit that bar",2015-12-17 00:02:36,474,106,en
i need to talk to a local (sfbay area) professional video production team. if u are that please dm me and link 2 yr work!!!!!!,2015-12-16 22:39:44,14,2,en
"need a last minute gift for your wife, sister, mother, or girlfriend? get her something she would love: a spicy #email from yours truly",2015-12-16 17:35:03,204,20,en
this is street fighter 2. im playing as ryu. hes an orphan and a lone warrior searching for truth. and sometimes he beats up strangers cars,2015-12-16 07:49:56,227,35,en
i bet Slash has a lot of trouble trying to tell people how to get to his website,2015-12-16 01:22:18,420,144,en
i feel like these frog jokes have legs...... frog legs that is!!!!!!!,2015-12-15 21:27:34,108,11,en
"#JokeZone
q: what is a frogs favorite kind of beer to drink ?
a: something with a lot of hops!!!!!!!!!!!!!!",2015-12-15 21:26:24,222,52,en
"#JokeZone
q: what kind of condoms do frogs buy?
a: ""ribbit"" for her pleasure!!!!!! do you get it please ?",2015-12-15 21:24:52,169,26,en
"hold on--- couldn't tell whether village elders said i'm ostracized or ""ostrich-sized"" either way its fucked up",2015-12-15 02:45:57,342,50,en
"after that trailer they should call it ""Star Trek Beyond Saving"". thats my only joke on this subject. good by",2015-12-15 01:42:06,134,27,en
VERIFIED FACT: #moms give me mimosas bc of my nail decals https://t.co/Hb1Tgc0HRj https://t.co/E8GwJXRh67,2015-12-14 18:59:45,56,3,en
one of these things is not like the others https://t.co/RmkchQiWxb,2015-12-14 18:54:16,122,14,en
just accidentally crashed the yahoo employee christmas party in redwood city. ate sooo many snacks before being escorted out,2015-12-13 22:07:38,259,23,en
quick turn on the tv! it's the episode of Reba where she falls in some quicksand,2015-12-13 03:16:09,198,25,en
hot dog https://t.co/RPE8Q7CZNr,2015-12-12 22:11:37,214,23,en
https://t.co/zqGjZdhWWh,2015-12-11 23:50:22,254,36,und
"if your name is Doug you probably have a phase where people call you ""Dirty Doug"" then you try to walk it back in your 30s with ""Nice Doug""",2015-12-11 20:59:57,84,9,en
today i'm wishing a very happy birthday to my good friend—perhaps you've heard of him—a Mr. John Elway @johnelway,2015-12-11 20:16:18,101,11,en
"#TodayInHistory on this day 8 years ago i bought a washing machine off craigslist from a guy with an email address that went ""spermguy79@""",2015-12-11 17:42:09,230,28,en
a cool jacket that only fighters can wear https://t.co/cOw2W2oLch,2015-12-11 00:04:17,27,2,en
"#JokeZone
q: what is a dogs favorite holiday song?
a: fleas navidad!!!!!!! do you get it please ?",2015-12-10 20:39:57,206,35,en
"I have been approached by Disney and asked to promote Star Wars: The Force Awakens. Here it goes: ""Now that's what I call a Star War!""",2015-12-09 20:28:17,356,74,en
are these cards breaking up with me? https://t.co/F3NFKKZzsV,2015-12-09 06:54:07,295,37,en
"rather than a forum for intellectual stimulation, this web page has more in common , witth a toilet",2015-12-09 01:58:43,157,13,en
"""Die Hard is my fav xmas movie. Now if you'll excuse me, I must fund a Kickstarter for a bacon zombie card game or whatecer"" -the internet",2015-12-08 03:40:42,851,264,en
"i am honored to be on @vice's ""best trolls of 2015"" list. it's going on my linkedin. https://t.co/249UERvJEf",2015-12-07 22:25:50,222,34,en
if you're in your 20s and wearing a vest you better be a time traveler or at least a blackjack dealer,2015-12-07 08:12:40,343,83,en
The Best Ally https://t.co/q2b4VmVQem,2015-12-07 04:53:24,185,41,en
dear disgraceful wiki admins: cite your sources for the noid's gender or fuck off with your  bull shit https://t.co/K9UKx3zQvr,2015-12-07 04:02:44,420,90,en
happy holidays. heres a garfield foot fetish video https://t.co/y0WJ0gLv0L,2015-12-07 00:28:13,74,30,en
whoa https://t.co/R6xDA9RbWa,2015-12-06 22:18:42,736,219,en
the eharmony guy is just orville redenbacher but now hes horny and wants to watch people bang,2015-12-06 05:41:05,592,95,en
i will put your elf on the shelf in the garbage can. foul christmas imp,2015-12-05 23:56:52,293,85,en
"#JokeZone
q: How do turtles stay in touch ?
a: shell phones

please just fav this and move on. this web site is a hell to me. im so ashamed",2015-12-05 23:46:20,923,131,en
i just found out about the msnbc thing. are there any good jokes left? i need to get a tweet into a blog piece. please my family is starving,2015-12-04 19:44:00,337,35,en
"nobody who calls it ""cali"" is actually from california. kind of like how ppl who call it ""the quest"" don't actually work at laser quest",2015-12-03 04:11:33,421,89,en
this could have been prevented if san bernadino itself were an enormous gun,2015-12-02 19:56:29,714,274,en
"approximately 6% of accounts on twitter are egg shapes that tweet shit like ""hello sweety dear. very pretty bby can i see your nice feet ?""",2015-12-02 04:31:55,426,60,en
hey white people with acoustic guitars: you don't have to do a hotline bling cover. it's really okay,2015-12-01 20:58:09,1090,457,en
"the first web server went live 25 years ago on christmas day. how fitting, since we all worship this cyber toilet https://t.co/Yn85uWwvV4",2015-12-01 02:48:13,143,42,en
if i cut off the milf hunter's head do i get to take his place like highlander (????) please hurry,2015-12-01 01:59:40,210,30,en
"heres some thoughts on shapes:
the cube and sphere are blood rivals
the cylinder and torus are fucking
cone can suck its own dick",2015-11-30 17:56:10,171,26,en
"https://t.co/XR2Mevk3bF Jobs - Your Application Was Denied:

ERROR: No position titled ""Clitfinder General"" exists. How did you submit this",2015-11-30 01:20:37,344,48,en
what https://t.co/kVCY5H6J2m,2015-11-29 21:53:47,292,66,en
"i'm depressed but not ""creates bernie sanders / donald trump parody accounts"" depressed",2015-11-29 19:55:29,435,85,en
i have come to the sad realization that i have never met a legendary dog,2015-11-29 18:19:55,161,25,en
i am convinced that there are no good bloody marys in Mountain View and that these nerds would probably think it's a video game or something,2015-11-29 18:13:23,90,7,en
"me, at a whiskey tasting, tryijg to keep my face from contorting as i sample the foul liquid: Ah ! its, oaky. notes of Burger and rope",2015-11-29 07:09:58,705,121,en
"5 years ago during an interview i was asked where i see myself in 5 years and i accurately guessed ""taking pics of my beer to show the guys""",2015-11-29 06:57:32,454,58,en
"in my headcanon, rottweilers love beer and are affectionately known as ""beerhounds"" but they also sometimes show up drunk to dog shows",2015-11-29 06:48:28,213,46,en
i must issue an apology. there was no episode of Dr. Quinn Medicine Woman where she restarted a horse's heart using a car battery.,2015-11-29 06:31:09,1539,404,en
https://t.co/2LZydJCytu,2015-11-28 19:29:47,512,135,und
"all of my followers on this site hate me, as evidenced by the rude man at long johns asking ""are you jon h?"" then showing his ass to me",2015-11-28 03:48:33,229,5,en
"some people will retweet anything.....
...
..
..
...
..
...AHEM",2015-11-28 03:35:42,100,62,en
i just happened upon the last bottle of bourbon county stout in mountain view. a much sought-after form of that classic beer drink. it good,2015-11-28 01:59:09,85,5,en
if you didnt see a racist uncle at your thanksgiving that means you were the racist uncle,2015-11-27 23:20:47,615,206,en
#anyonecanimproveatdrawing https://t.co/ns0hCL0InB,2015-11-27 09:10:15,227,54,und
"i bet the first scientist to suggest ""hey, we better try to help make the pandas horny"" was a total fuckin creep",2015-11-27 08:53:13,185,24,en
seems like on here we all just wait for the celebs to do something bad and then yell at them . well i say #ThankYouToTheCelebs #ThankACeleb,2015-11-27 06:07:15,233,20,en
"""i just got off the phone with my good friend- perhaps you've heard of him- a mr. john elway"" -me when asked why i was in bathroom for 45min",2015-11-27 01:46:39,249,30,en
"in online ads you get impressions, then clicks, and then conversions. i call them ""lookies,"" ""clicks,"" and ""wet clicks"" #JonsMarketingAdvice",2015-11-25 23:43:12,192,32,en
https://t.co/S5YuCNnjB0,2015-11-25 22:58:26,196,25,und
i have found the good posts by th epeople who are good at opinions .  https://t.co/JsFhyKPtSz,2015-11-25 22:54:54,124,32,en
graeyalien was so good at twitter it makes me mad https://t.co/kVxQIOAC3z,2015-11-25 20:33:29,65,3,en
star wars gets a pg-13 rating because it is revealed that r2d2 has labia,2015-11-25 19:34:57,384,81,en
"on thanksgiving eve an event occurs which i like to call the ""dark feast"" where i eat all my prized foods+candy before ppl come over",2015-11-25 19:17:49,298,65,en
"someone once got mad at me for pointing out that modest mouse's ""talking shit about a pretty sunset"" is just 4 non blondes ""whats up""",2015-11-25 05:54:24,141,10,en
"just found a really old draft in my gmail and all it says is ""powerman 5000, listen up""",2015-11-25 03:38:40,261,27,en
can i email your #mom,2015-11-25 03:28:56,133,25,en
"my new slogan is ""jon hendren... the online friendly boy"" please update your contacts",2015-11-25 03:15:02,212,11,en
when u type something in the wrong window&lt;&lt;&lt; https://t.co/2GollvIwKl,2015-11-25 00:38:04,122,14,en
he even chases me online.. this is a hell to me https://t.co/qVvTzpJabT,2015-11-25 00:16:08,110,3,en
and the award for Horniest Astronaut goes to https://t.co/Rd5DXZywdi,2015-11-24 22:17:32,620,162,en
the menu on this app is really confusing https://t.co/Pdg4X3jugH,2015-11-24 16:24:51,127,15,en
in case anyone is christmas shopping for me right now: i would love a tiny shivering teacup chihuahua in a top hat,2015-11-24 03:31:07,139,26,en
"each nov 23 on the anniversary of the tri-county bodybuilding bonanza and bbq i relive my terrible ""muscleman nightmare "" #MusclemanChasedMe",2015-11-23 19:20:53,103,12,en
"i may not have a ""degree"" but i know how to unhook a bra with one hand while slamming a beer with the other",2015-11-23 07:25:05,395,94,en
CELEB NEWS UPDATE: Macklemore still has not accepted my gchat invite.,2015-11-23 06:16:44,224,27,en
"i keep getting put into ""block off mode"" by many of the celebs on here , who are afraid of my pleasant posts and nice boy attitude",2015-11-23 05:29:08,204,10,en
if the kiddie pool breaks and the bloodwater gets on the carpet you guys are going to lose your deposit #homebirth #doula #JonsHomebirthTips,2015-11-22 09:38:46,201,24,en
"if you see any false wiki leaks that are just pics of me with my Ass showing at the public pool, please deletr them and don't look at it",2015-11-21 10:24:08,204,23,en
Those Friday feels ....🙌🙌🙌🙌 https://t.co/foJbQk6H9G,2015-11-20 20:35:26,102,23,en
jon h.. thebig online boy. is he angel.... or ddevil.,2015-11-20 20:06:30,64,6,en
"there are 10 types of people in the world:
those who understand binary
those who don't
cow boys
bodybuilder
guyswith rat face
cow boy 2
baby",2015-11-20 18:27:00,666,198,en
cheers to you on the famous day we all love. i'm talking about none other than the wonderful day of friday https://t.co/ICQMRM8Nbs,2015-11-20 16:28:46,545,160,en
Jared Fogle is in the news again—he got 15 years in prison. they were going for 12 but it turns out guac is extra!!!!! please rt i need this,2015-11-19 23:49:35,658,242,en
"for me on here , oneof the top things that can happen is when someone is in a fight online and puts a . in front of their replies. its good",2015-11-19 22:30:37,185,34,en
just watched a doordash guy put on his emergency flashers and park in this lot's only handicapped spot. another successful tech disruption,2015-11-19 20:08:22,152,40,en
#InternationalMensDay https://t.co/lf87NFQgSZ,2015-11-19 17:25:06,727,315,und
nooo the shoes are being roasted once again,2015-11-18 21:36:01,226,20,en
whole foods has hats now #hats #wholefoods #hat #GottaHaveHats #GotAHatAtWholeFoods #FoundThisHatWhileBuyingFood https://t.co/1b0Ui0BuKr,2015-11-18 05:43:19,375,91,en
belated rip to my old coach who died from complications related to when he wiped out on his dirtbike and skidded into a buffalo wild wings,2015-11-18 00:02:56,261,48,en
"folks when it comes to the ice cold taste of beer, look no further than a delicious cup of the classic drink we all love called Beer",2015-11-17 23:12:09,512,109,en
lmao some of the script for #TheForceAwakens got leaked and it's sooo bad. worse than phantom menace probably https://t.co/rnUhWq9qS3,2015-11-17 18:41:37,165,65,en
imagine being the type of person who hears about a caltrain accident and decides to yell at caltrain for it. please respect #caltrain,2015-11-17 02:53:32,88,15,en
"folks when it comes to cybersecurity...its like i always say: ""You Gotta Get It"" #JonsCyberTips #ComputerHero #OnlineGuy #BeautifulJon",2015-11-17 02:15:46,164,24,en
heading over to spencers gifts. i need a blacklight poster ofa dragon and a coffee mug with a scrotum on it congratulating me for turning 50,2015-11-16 08:50:51,367,47,en
sounds like a swamp https://t.co/EFkoLKRCh5,2015-11-14 04:34:23,91,14,en
is this real https://t.co/Rxg9rO2JRT,2015-11-14 02:00:35,368,101,en
"judging by the favs of this 11k follower @praying4paris account, it previously used to be named ""@YoNiggaVegeta"" https://t.co/wIKUEguVbt",2015-11-14 00:52:36,3070,1349,en
i live my entire life by a simple set of rules https://t.co/cP6qJygxMo,2015-11-13 07:52:02,3901,2089,en
when a mf got your pillow https://t.co/q4OS7ekuNn,2015-11-13 07:25:27,132,5,en
proof bitcoin is ridiculous: look at the weirdo proponents who insist its great. no normal people like it. this is some Babylon 5 shit,2015-11-13 07:05:08,230,37,en
"yeah right marketing, no thanks. i've known since i was a kid that drinking a ""monster energy"" is what turns people into frankensteins",2015-11-13 00:33:14,99,18,en
holy crap this smash fan started doing this when he heard about cloud https://t.co/RXWgJwmfxH,2015-11-12 22:57:52,132,61,en
"#JokeZone
q: what is a horse's favorite band
a: the answer is coltplay. do you get it please ?",2015-11-12 02:58:42,248,43,en
"and if that crude ventriloquist dummy again asks for my weight , i will answer him with my extremely powerful roundhouse kicks",2015-11-12 01:40:33,119,13,en
and the award for most bullshit shape goes to the disgraceful rhombus,2015-11-11 23:03:33,632,190,en
"i have started an email newsletter. i might send emails, or i might not. sign up for it anyway it's #free of charge https://t.co/LkkzyTBX1x",2015-11-11 22:35:05,101,13,en
is this guy throwing shade https://t.co/M0A6EP0B15,2015-11-11 20:03:09,263,21,en
"for pop songs about forming a gang, evading cops and aiding domestic terrorists, look no further than cw mccall's country classic ""Convoy""",2015-11-10 17:43:06,193,58,en
how did u get preg from a soup worm https://t.co/lS3VdenX8q,2015-11-10 06:33:28,318,77,en
someone stole rob thomas of matchbox 20 fame's stuffed animal moose and hes pissed. help him get marty back,2015-11-09 23:20:12,212,38,en
"just as there are 7 wonders of the world there are 5 ""Great Foods"" that everyone should know: chili burrito hotdog burger steak. thats them",2015-11-09 18:18:59,190,35,en
wearing my nicki nail decals bc fuck u https://t.co/gnrvzb1QEA https://t.co/UCAKwZkUlp,2015-11-09 06:28:02,98,15,en
when i guess the wifi pw https://t.co/TxqN8P72GZ,2015-11-08 07:18:39,648,153,en
my awful teenage son came home from pottery class with a clay figurine ofmy big Ass so i put it in a trashbag and busted it up with a hammer,2015-11-06 20:44:54,269,38,en
"this is how you make a big splash in the media,folks https://t.co/4LRL6lPwud",2015-11-06 20:18:46,412,59,en
i cant go out today. my dick has a venus flytrap stuck on it from an accident i will not discuss with immature children such as yoursel;ves,2015-11-06 20:17:04,467,123,en
"barack obungler rejects keystone xl. hell, if he doesn't want it i'll drink it!!! #ItsTheBeerDrinkBaby https://t.co/2lNyQz3T5r",2015-11-06 20:03:36,355,139,en
The ocean spray twitter is forced to refer to craisins as “Craisins® Dried Cranberries” at all times :( https://t.co/ekR40XVQL5,2015-11-06 17:02:27,443,110,en
salad bar had craisins so i had a bowl of craisins with thousand island dressing #HealthyJon #Foodie,2015-11-06 05:03:10,310,30,en
"Bad news, everyone: The intelligent sign language gorilla ""Koko"" has become hopelessly addicted to video poker :(",2015-11-06 00:27:18,687,129,en
on star trek every time they beam down to a new planet they get their tricorders out to find somewhere to go on yelp,2015-11-05 23:16:00,174,39,en
"#JokeZone
Q: how did the dog go over his data limit?
A: he was using too many bytes (bites). do you get it please ?",2015-11-05 21:43:40,314,55,en
dog_in_casino.jpg https://t.co/F4w1kIgO4b,2015-11-05 19:34:55,195,26,tl
just saw a dude staring at his own reflection on the back of a minivan for a long time then he blow weed smoke at it. badass,2015-11-05 17:59:59,405,63,en
all of my friends have gotten email replies from jeb bush but not me. feeling a little left out @jebbush. please #ReplyToJon,2015-11-05 03:09:22,178,12,en
i am running out of treats and need to know if there is any human alive who can wrestle my huge invincible teenage nephew into submission,2015-11-04 21:30:22,182,25,en
radical https://t.co/BRrTQRU9oE,2015-11-04 01:59:17,398,130,es
"wow, this the first news article about Twitter written back when it was called Twttr. fascinating! https://t.co/2gJdByzD04",2015-11-03 20:20:54,883,349,en
"here's how the Net works. 1) theres online banking, 2) your friends are on it 3) pics of cars. 4) your page on here is your "" online toilet""",2015-11-03 19:58:16,209,40,en
people who repost popular funny tweets with a few words changed are online version of people who steal copper wire from construction sites,2015-11-03 02:41:09,659,165,en
did you say we're going to get mimosas or phimosis,2015-11-01 19:40:58,160,41,en
i knew my neighborhood was full of nerds but i just saw someone doing a walk of shame dressed as steve jobs,2015-11-01 19:19:56,390,71,en
"HALLOWEEN TRIVIA: the jack o'lantern was originally the ""jack off lantern"" a light a guy made out of a pumpkin so he could jack it outside",2015-10-31 01:17:53,266,54,en
i spent the better part of an afternoon analyzing the technology each candidate's website uses. read this shit https://t.co/nkvqUWjwVt,2015-10-31 01:08:19,77,33,en
according to a recent study approximately 80% of bjork fans try way too hard to let everyone know they're into bjork,2015-10-31 00:56:25,177,49,en
instead of calling them EPs they shou;d call them Cold Cut Combos . thats what i say about it,2015-10-30 22:54:29,75,19,en
Here is the link to watch all 6 episodes of Devil's Manor! Try and guess which one I was extremely drunk during! https://t.co/3Wlblsof9T,2015-10-30 22:33:42,41,9,en
maybe my favorite part of all movies https://t.co/eyRMIt6J8w,2015-10-30 16:29:21,57,6,en
craft beer marketing needs to shut the fuck up https://t.co/1n8YoD70kP,2015-10-30 03:32:17,393,92,en
powerman 5000 vs. chessmaster 5000,2015-10-30 00:37:07,64,25,en
"the ""walking taco"" is a great recipe for people who are both extremely lazy and enjoy eating out of a diaper https://t.co/8Y3RQINXr6",2015-10-29 22:44:08,386,128,en
"join me in my quest to add japanese names to articles on english wikipedia. its good info, they shouldnt revert it https://t.co/MTkxlzeVtm",2015-10-29 20:19:47,419,136,en
Deal Or No Deal gains a new dimension when you realize The Banker was Howie Mandel's dad,2015-10-29 02:36:05,178,34,en
Lindsey Graham can't stop talking about security but his site is the only one without HTTPS: https://t.co/nkvqUWjwVt #GOPDebate,2015-10-28 23:11:13,84,42,en
"today in san jose: upstairs neighbor shoots himself in the foot, bullet goes through the floor and hits a kid https://t.co/pYMEMKglRx",2015-10-28 19:02:25,33,15,en
"when twitter piles on someone its just like in movies where somebody points and says ""there he is, get em!"" and everyone chases that person",2015-10-28 18:30:09,297,72,en
please vote in my poll,2015-10-28 18:07:39,30,21,en
"IBM jsut bought https://t.co/QKCx0BY0HU. i've heard of business moving into ""the cloud"" but this is ridiculous!!!! do you get it please ?",2015-10-28 15:48:28,417,97,en
pete rose looks like krang to me,2015-10-28 05:27:03,171,38,en
thinkpiece... think piss. thats what i say on it. these articles are like piss to me .,2015-10-27 21:05:35,180,19,en
"Don Lemon... well i'll tell yhou my opinion certainly is ""sour"" of him ! ""Orange"" you glad i said it please?",2015-10-27 17:22:58,109,8,en
"just spent the last 40 minutes reading about cyber threats because I didn't have my glasses on and thought it was ""cyber treats""",2015-10-27 17:03:05,292,66,en
if you ever see a knight in a suit of armor shaking and moaning it means he slid his arm into the torso part and is jacking off inside there,2015-10-26 21:12:11,436,82,en
you guys don't have to do shit like this you know? like it's not required. nobody's making you do it. https://t.co/K5jjiVroim,2015-10-26 17:53:54,659,232,en
i had a dream that i opened a condom and dropped it and got grass clippings all over it and tried to rub them off with my shirt. no sex.,2015-10-25 16:50:33,276,20,en
on star trek everyones hobby is listening to classical music. i guess no one likes to pound a few beers and lay on the floor naked anymore,2015-10-24 07:04:00,459,93,en
see if i give a shit https://t.co/q5iJysbNQz,2015-10-24 00:31:03,27,1,en
Everyone's joking around about Baby Hitler but there's no joke in the matter of him being the first #Atheist. Hitler invented #Atheism #fact,2015-10-23 19:14:41,431,80,en
this user spent well over a year believing he was hitting on the tv meteorologist he is following but never @-ing: @JimWells17,2015-10-23 05:27:02,435,186,en
sorry for the error. i accidentally posted a photo of 3 mens rumps that i meant to send to my bank,2015-10-22 15:56:21,133,14,en
ok thanks for coming https://t.co/db3d6yBShV,2015-10-22 04:47:25,181,32,en
"you're in the mix with 9 hits at 9. 9 back to back uninterrupted monster jams from the 80s, 90s and today. (slowed down voice)""monster jams""",2015-10-22 02:46:25,183,16,en
"life hack I invented: when you're ordering food tell them ""this sandwich is for NBA legend Larry bird"" and they will make it like way better",2015-10-21 23:17:10,660,213,en
we know it's back to the future day. seriously we all know. you don't have to tweet about it. we all heard. just go do something else please,2015-10-21 07:35:04,491,215,en
"I AM IN. HEADLOCK RIGHT NOWQ BEINF FORCED BY ""Brett"" OT PUBLICLY APOLOGIZE FOR WINKING AT HIS WIF.E. SORRT BRETT",2015-10-20 20:57:04,179,19,en
"""we're marketing to the worst possible internet dregs"" -new relic https://t.co/m1iyKWMMYL",2015-10-20 18:39:34,158,18,en
