text,created_at,favorite_count,retweet_count,lang
Yeah!!! Guns!!! Right??????? FUCK YOU if you call yourself pro-life and don't advocate for gun control. FUCK YOU.,2015-08-26 14:00:38,441,150,en
"And give it up for @rosannascotto, recurring character on #DifficultPeople!!!!",2015-08-26 12:13:55,9,0,en
"Finally for now, props to our props dept for Cole's headshots &amp; Nancy Grace Fortune Teller sign, that WANTED poster &amp; the dog goggles/coats",2015-08-26 12:13:34,12,1,en
"Calling Cissy a ""millenial nuisance"" &amp; making sure she knows ""we will bury [her]""=classic @jakefogelnest as is the Warhol/social media thing",2015-08-26 12:12:04,25,2,en
And both the green print &amp; leopard dresses from the ep are from @ASOS. Lips print t-shirt I wear at home is @SHARON_NEEDLES for @Pat_Field.,2015-08-26 12:08:41,17,0,en
"""...I'm interested in homoerotic things?"" To which @billyeichner replied ""I dunno, your BOY FROM OZ CREW JACKET?"" I'd never laughed harder.",2015-08-26 12:06:23,34,1,en
"Cole's ""Boy From Oz"" jacket is a tribute 2 a pre-BOTS video wherein a defensive older gay gentleman asks Billy ""why do you think... (Cont'd)",2015-08-26 12:05:26,19,1,en
Also! The role of Cissy Donato was written for @littleesther. And whenever @ColeEscola holds up those headshots I LOL http://t.co/NSQ9KWeQPX,2015-08-26 12:01:15,17,2,en
"Fun facts! ""The Children's Menu"" is the first episode we wrote &amp; @scottykingking directed the SNL sequence at the end.http://t.co/NSQ9KWeQPX",2015-08-26 11:58:45,10,1,en
Happy humpday! Here's a new episode of #DifficultPeople: http://t.co/NSQ9KWeQPX,2015-08-26 11:26:04,30,9,en
Cats hate CATS the musical,2015-08-26 03:03:19,85,17,en
"I played my cat a song from CATS: the musical earlier, and he widened his eyes, thumped his tail and then darted out of the room.",2015-08-26 03:02:46,80,13,en
One hour and two minutes until @Hulu releases the latest episode of #DifficultPeople can u even stand it,2015-08-26 02:59:32,54,7,en
It was car-thotic for Ramona to write her book.,2015-08-26 00:44:11,49,5,en
"Dorinda's ""you said it on the TV"" vs Jerri Blank's ""I stole the TV!"" Discuss &amp; show your work  #Rhony",2015-08-26 00:26:41,56,3,en
I love dorinda but she has never once made sense,2015-08-26 00:25:52,68,10,en
"Dying at @andy's ""I want to hear what Kristen has to say."" Can I see 4 more quick takes in a row? Maybe more convincing?",2015-08-26 00:21:08,28,4,en
"Carole CAN'T GET INTO A CAB without the driver turning around and saying ""LuAnn has a problem with you""? #RHONY",2015-08-26 00:15:02,46,5,en
"The new episode of #DifficultPeople premieres tomorrow (tonight at 12:01 AM)! In it, Billy and I… https://t.co/HZ43EHMDbf",2015-08-26 00:12:02,17,2,en
New episode of #DifficultPeople goes up on @Hulu at 12:01 tonight!!!,2015-08-25 22:45:20,45,7,en
SHANTÉ U STAY // RT @lindsschroeder: @julieklausner I think this says it all http://t.co/AfD2SU4Smq,2015-08-25 22:27:40,33,9,en
Werq http://t.co/rv0dgPXYSF,2015-08-25 22:18:53,40,6,en
Guys. http://t.co/kUaG5x5Fpo,2015-08-25 22:15:10,44,6,en
"Mr. Mistoffelees was BY FAR the gayest cat from CATS, Y/Y????",2015-08-25 22:12:11,91,13,en
http://t.co/LSI20DQvej,2015-08-25 12:28:02,60,7,und
"The photo they ran, tho // Josh Taekman  Apologizes ""Deeply"" for Ashley Madison Account http://t.co/iUjThmlwMX http://t.co/9F44znKRK7",2015-08-25 12:26:56,35,11,en
"Josh Taekman, human garbage",2015-08-25 11:46:16,78,9,in
"Spam email w/subject header ""handjob from a crazy girl."" Wish I had a time machine to go back and tell high school me that there's a market!",2015-08-25 02:05:14,116,7,en
The Tarantino interview is good but the new issue of @NYMag is fabulous for the article about the Slenderman girls. Heartbreaking &amp; bizarre.,2015-08-25 01:41:14,38,3,en
Living for @TVsAndyDaly &amp; @lennonparham in matching khakis on #review,2015-08-25 00:55:49,66,0,en
Cramming for my blood sugar test.,2015-08-25 00:30:26,71,10,en
Related: does anyone want to sell me a pint of their blood for my A1C tomorrow? #sugary,2015-08-24 20:43:42,11,2,en
Yesterday I ordered groceries and they included a bottle of Karo corn syrup I did not order. I can only take this as sarcasm.,2015-08-24 20:42:51,27,1,en
Preview of this week's brand new #DifficultPeople? Don't mind if you do. https://t.co/axFmrzq081,2015-08-24 20:04:32,71,14,en
"Wednesday's ep of #DifficultPeople features a STAR TURN by@littleesther! Plus @kathynajimy as her mom, a great SNL gag &amp; me drunk with dogs!",2015-08-24 17:18:02,64,9,en
Kevin Kline could never NOT get it. 💗👅👊💗,2015-08-23 23:23:59,106,10,en
"Never-late people: just be on time, ok? As an always-late'r I beg of you: please just DON'T BE EARLY!!! I don't have my face on. Thank u.",2015-08-23 17:23:38,56,12,en
Now I am going to subtweet somebody who is always early.,2015-08-23 17:22:40,27,0,en
Every time I wake up my cat by going about my business I see him consciously decide not  to give me shit about it bc I'm not very bright.,2015-08-23 16:05:19,43,3,en
😂😂😂😂 // RT @jdaake: @julieklausner @tedleo http://t.co/qNSeH1QhYD,2015-08-22 14:03:58,26,4,und
Please make this MEN REGRET LOST FATHERHOOD phone checking guy a meme. #MyDad #Iwish http://t.co/wRSdcnkxVn,2015-08-22 13:34:22,178,60,en
I've vowed to donate to #PP every time I see any yahoos protesting outside @PPact...today was a lucrative day for @PPNYCAction!,2015-08-22 13:33:26,118,16,en
Area around @PPact surrounded by assholes. Look at the guy checking his phone w/ MEN REGRET LOST FATHERHOOD sign. http://t.co/EZA0Dyxqcy,2015-08-22 13:30:20,101,33,en
"Sometimes high waisted shorts look good on me and sometimes it look like I'm the Guinness record holder for ""HUGEST GROIN""",2015-08-22 13:27:16,179,16,en
EVERYBODY WAKE UP I JUST REMEMBERED BON IVER,2015-08-22 02:31:28,161,23,en
"A prayer. God, give me the strength of a woman with good ideas and the confidence of a man with bad ones.",2015-08-21 23:58:28,881,419,en
Author Photo. #JimmyJazz https://t.co/SiBedkZawv,2015-08-21 23:47:43,21,1,en
"New @difficultppl trailer, FEATURING CRITICAL ACCLAIM:
https://t.co/f9lLug1mTi",2015-08-21 18:12:10,39,9,en
"I got one sentence in, then threw my phone in the ocean. http://t.co/MtAn5cLnIh - http://t.co/MtAn5cLnIh",2015-08-21 16:12:21,92,5,en
"👅💦 // RT @Gothamist: NYC's Black &amp; White Cookies, Ranked http://t.co/gLJG9bBr95 http://t.co/kv8Yl9iMh3",2015-08-21 16:07:48,54,12,en
"Ohai, new podcast featuring LIVE COMMENTARY ON EPISODES 3&amp;4 of @difficultppl with me &amp; showrunner @Scottykingking! http://t.co/EspzkrJJhU",2015-08-21 15:44:59,31,8,en
"Coming later today: a new #HWYW, where I am joined by #DifficultPeople EP &amp; showrunner @Scottykingking for live commentary on episodes 3&amp;4!",2015-08-21 13:36:33,31,0,en
"Now if @SEAMLESS is ever hacked and people see what I've ordered and how much and when, I will be #fucked",2015-08-21 13:09:41,162,41,en
The Catholic Church should elect a pint of Stephen Colbert's AMERICONE DREAM its next pope.,2015-08-21 03:32:01,105,8,en
If u really loved me you'd buy me the house from Silence of the Lambs,2015-08-21 03:31:09,102,20,en
Thank u @uproxx!,2015-08-21 02:13:18,7,0,en
https://t.co/VmSAUAOJCS,2015-08-20 12:54:53,61,11,und
🐶🙀 RT @lenadunham: Ugh fucking stalker https://t.co/fej7MNUVDB,2015-08-20 12:28:23,10,0,en
WHAT RT @brokenbottleboy: This delivers internationally. Oh god yes http://t.co/J65U6UN7ym http://t.co/Ap9akXWZQS,2015-08-20 12:27:42,23,0,en
Dorinda's hair. http://t.co/F7nnPUChuY,2015-08-20 02:19:53,113,10,en
LuAnn is upset at Carole because SHE JUST IS. Sometimes feelings don't make sense! That's ok!,2015-08-20 02:15:40,80,10,en
I am not ready to say goodbye to these glorious alcoholics,2015-08-20 01:48:56,71,4,en
Carole owns the intellectual property of the Kennedys,2015-08-20 01:48:11,71,2,en
"Kristen lost this season, and also life. Also her husband stinks. #popofcolor",2015-08-20 01:37:53,67,5,en
"2 open bathrobes, a sparkly shaper &amp; corporate casual. http://t.co/Ssz4SQWqvf",2015-08-20 01:36:25,155,20,en
"These girls all look like they raided their momma's ""fancy trunk"" for dress up costumes &amp; jewelry",2015-08-20 01:32:42,36,1,en
I will not tolerate any snark talk about Countess Luann's futuristic green dress. She is an emerald Queen &amp; we are lucky to breathe her air,2015-08-20 01:31:16,62,9,en
Dorinda's makeup on the RHONY reunion is identical to when I used to go to town on my Barbies's faces with magic markers,2015-08-20 01:29:28,55,7,en
"Bethenny won the season, with Dorinda on her tail.",2015-08-20 01:22:47,97,13,en
RHONY reunion pt 1 - THESE FUCKING CLOTHES,2015-08-20 01:22:12,68,11,en
Good note RT @ren_lessard: @julieklausner Needs more Trump,2015-08-19 14:08:22,5,1,en
Jared Fogle: Formerly Fat Jew. This tweet has no point I just wanted to ride those sweet sweet trending topics w/a vague comment on villians,2015-08-19 14:03:42,227,25,en
Rejoice! Episode 4 of #DifficultPeople is here! http://t.co/B1zTmWxnWS,2015-08-19 04:15:17,74,15,en
"New #DifficultPeople goes up in 40 min, after @bestshow4life!",2015-08-19 03:21:19,62,8,en
"Great job, Internet.",2015-08-18 21:01:34,29,4,en
What up what upppppp http://t.co/FwSQTQcjLu http://t.co/4MUGVBB8yD,2015-08-18 14:13:01,110,20,en
Shout out to the crunchy Puffins u pour into the cereal milk and then have to mingle with the soggy Puffins. You maintain #integrity,2015-08-18 13:13:14,40,4,en
Oh my GOD. // RT @G_Blott: @julieklausner http://t.co/d56v5yUvcg,2015-08-17 16:28:03,59,3,en
I think that despite whatever joke stealing or what have you we can all agree that The Fat Jew has a cool hairstyle that is extremely cool,2015-08-17 06:56:48,135,13,en
I will tell you non-movie buffs this about NIGHT OF THE HUNTER: there's an old woman in it who won't shut the fuck up about her fudge,2015-08-17 03:13:08,88,18,en
"Finally, who will Photoshop a hat &amp; string-tie onto #JimmyJazz so he can go as Rev Harry Powell for Halloween? https://t.co/dDhWMfgotK",2015-08-17 03:00:45,11,1,en
More on NOTH: 1) let's give it up for Shelley Winters's nightgown knockers 2) why did the mob attack Gish &amp; co. after the courtroom scene?,2015-08-17 02:59:09,22,0,en
By Flann o'Connor // RT @SweetieBirdR: @julieklausner That movie is a poem!,2015-08-17 02:49:06,4,0,en
I just saw NIGHT OF THE HUNTER &amp; 1) Robert Mitchum can get it 2) Lillian FISH! Serving face for days before Botox!,2015-08-17 02:47:53,92,6,en
Thanks! I love the D! 😉 // RT @freep: .@julieklausner is having a moment in 'Difficult People’ http://t.co/R4nyYnBhxy @hulu  @billyeichner,2015-08-17 01:04:33,27,1,en
The Fat Jew: bad for the Jews.,2015-08-17 00:25:10,208,21,en
"The irony of going out to find somebody you can stay in with is just ah fuck it, who wants ice cream",2015-08-16 21:23:22,192,48,en
"Last to the party on this one, but I just finished watching a perfect season of television: @UNREALlifetime. Run don't walk, quality lovers!",2015-08-16 15:29:49,117,10,en
I didn't say it at first bc I didn't want @hulu to crash but the amazing @rosannascotto is in NO LESS THAN 2 episodes of #DifficultPeople &lt;3,2015-08-16 13:50:28,45,3,en
I dig gummy. Bottom of the list is FOAMY. // RT @AndyHerren: @julieklausner Where does gummy fall?,2015-08-16 01:04:14,8,0,en
Disgusting. RT @ZetaHeiter: @julieklausner How about gelatinous. Ewwww.,2015-08-16 00:59:22,1,0,en
Mealy is at the bottom. AND AL DENTE IS BETTER THAN CRISPY!!!!! RT @valree: @julieklausner You forgot Mealy.,2015-08-16 00:49:47,6,0,en
"Food textures from great to no

Chewy
Mushy with buoyancy (Al dente) 
Crispy
Crunchy
Slimy",2015-08-16 00:32:23,56,11,en
"Gluten is behind ""chewy"" which is my #1 favorite food texture",2015-08-16 00:29:12,56,4,en
"Im just a woman who likes chewy food, boys with blonde hair, and when dogs shake hands",2015-08-16 00:28:42,130,11,en
"Dancing isn't ALL she wants to do, Don Henley. She also wants to vote.",2015-08-15 15:39:10,152,46,en
Ok fellow makeup junkie whores: what's a good substitute for Lime Crime's Velvetine liquid lipstick in RAVE that is FDA-compliant?,2015-08-14 14:25:49,8,1,en
".@WHITEREAPERUSA, who do the opening AND closing theme songs for #DifficultPeople have a new album, video &amp; shows- http://t.co/9mGKYpVAty",2015-08-13 16:01:10,25,14,en
http://t.co/EpqkScy3W3,2015-08-13 04:43:54,169,16,und
💖 RT @Chicago_Reader: Why you should watch @julieklausner &amp; @billyeichner DIFFICULT PEOPLE.  http://t.co/9ynzKLnvJo http://t.co/aX4PT8UR2q,2015-08-12 21:58:49,20,6,en
New episode!!! &gt;&gt;&gt;Difficult People: Pledge Week | Hulu Mobile Clips http://t.co/Kj0D1UDXrP,2015-08-12 16:19:20,15,2,en
New episode of #DifficultPeople is now streaming on @hulu!!! Get it get it!,2015-08-12 07:02:12,64,12,en
Congrats to @scharpling who won 600K tonight betting on red. @midnight,2015-08-12 07:01:20,26,1,en
"I am on the TV program @midnight later tonight, with @bcgoldthwait &amp; @jonahray. POINTS!!!!! http://t.co/hXXkfqS36L",2015-08-12 02:44:29,63,4,en
Here's a sneak peek of tomorrow's new episode of #DifficultPeople! It's gonna be a good one! x http://t.co/dkNgzE1cGU,2015-08-12 01:17:24,64,9,en
Go ahead and try to beat Amy Carter's Wikipedia photo game. http://t.co/nloDKLJVDp,2015-08-11 17:52:30,87,9,en
"hi @SHO_network I am available 2 play the following roles in your Patti Smith JUST KIDS miniseries: Poison Ivy from the Cramps, Amy Carter",2015-08-11 17:47:13,76,5,en
True or False mini bar caramel corn is an acceptable lunch,2015-08-10 20:02:44,42,2,en
"New episode of #DifficultPeople drops this Wed w/ guest stars Kate McKinnon, Marc Shaiman, John Benjamin Hickey, Andy Cohen &amp; MARTIN SHORT!",2015-08-10 18:38:48,109,13,en
If I am ever asked to do a @THR Roundtable with fellow creative ladies I am gonna wear this to the photo shoot http://t.co/er1LbrLnzb,2015-08-10 17:15:29,122,7,en
We're all gonna look PRETTY silly when we find out this was all publicity for when Megyn Kelly &amp; Melania Trump host the Golden Globes in '16,2015-08-10 17:07:14,86,16,en
Love to @KathieLGifford and your beautiful family. I'm so sorry for your loss and I hope you receive comfort &amp; healing from God. ❤️,2015-08-09 19:27:32,61,7,en
"Correction: David Rakoff's life was his masterpiece. Ours too. His final book, merely a perfect work of art. http://t.co/y23FIO0La5",2015-08-09 17:23:48,28,5,en
"3 years ago today we lost David Rakoff. All of his books are flawless stunners- his final one, not just a masterpiece, but his masterpiece",2015-08-09 17:22:40,167,49,en
Best review yet! http://t.co/TL54OxLXqv,2015-08-09 16:09:07,86,25,en
"In other words, to quote Saint Sinead: ""Fight the real enemy."" http://t.co/dHsNG91xU7",2015-08-09 05:03:20,143,25,en
"...just know that, to attack fellow feminists w/the same BIG goals is a privilege, and can be an implosion risk while Rome burns",2015-08-09 05:01:47,69,7,en
"...I know it's easy to attack people you see so much of yourself in, bc I've done the same many times &amp; I'm never proud of it after...",2015-08-09 05:00:54,55,4,en
...feminism can't divide &amp; eat itself. We can't have another failed ERA or economic boondoggle in pursuit of universal childcare/equal pay..,2015-08-09 04:59:13,69,6,en
....most importantly: remember when a rogue's gallery of mutants bragged thurs nite about defunding @PPFA...,2015-08-09 04:57:40,41,2,en
"...remember that this is not a black &amp; white issue, the world is treacherous and one treaty will not solve millennia of persecution, and...",2015-08-09 04:57:21,38,1,en
also-fellow 3rd/4th wavers- please treat sister @lenadunham with compassion and benefit of the doubt when she opines about about sex work...,2015-08-09 04:56:35,50,0,en
"The good news: there's a lot of ""heat"" on me currently as a creator, so I'm sure lots of movers/shakers wanna dive into my Larry Kramer chat",2015-08-09 04:49:33,39,1,en
I've been in LA for 10 seconds &amp; all I want to do is talk about the murderous negligence of Ed Koch &amp; the Reagan Administration in the 80s.,2015-08-09 04:48:25,90,6,en
"Also whenever a candidate evokes Reagan, I beg you to remember they are deifying a man who knowingly let millions of gay men suffer a plague",2015-08-09 04:41:46,475,260,en
"Young feminists and LGBT allies, please know who Phyllis Schlafly and Anita Bryant are so you know what evil in hairspray can do",2015-08-09 04:39:45,217,65,en
Sobbed thru THE NORMAL HEART on my flight (thanx 4 editing out the cuss words @Delta!) while my seatmate farted thru Avengers Age Of Ultron,2015-08-09 04:36:58,105,2,en
Best clip in the CNN 70s doc so far remains Anita Bryant praying with pie on her face,2015-08-09 04:27:27,70,11,en
Where is the think piece comparing Jewish shrink moms w/damaged daughters from @unreallifetime &amp; @difficultppl?,2015-08-08 16:27:36,45,4,en
Good thing we no longer need Gloria Steinem now that Megyn Kelly is around?,2015-08-08 15:28:37,206,66,en
Ugh I just wanna see a double feature of Shaun the Sheep and Ricki and the Flash while Michael Keaton gives me a head massage,2015-08-08 15:05:42,78,2,en
"I thought our target audience was ""Griffin Dunne from AFTER HOURS, Andrew McCarthy from PRETTY IN PINK &amp; James Spader from ANYTIME."" 😭",2015-08-08 02:50:06,67,3,en
Best thing about all the gorgeous fab young women who tweet me &amp; @billyeichner to say they love us is that neither of us want to fuck them,2015-08-08 02:48:26,153,4,en
"Surprise! A new podcast in which I give live commentary on the first 2 eps of #DifficultPeople! Plus, REBA'S BANGS http://t.co/WG8wgpj2Wr",2015-08-08 02:14:36,65,12,en
"I auditioned for the roles of ""Spooky Bellhop"" and ""Reasonably Upsetting Room Service Server"" for #AHSHotel &amp; I'm staying optimistic.",2015-08-07 23:04:17,86,10,en
I think it was cool of Megyn Kelly to pose for a photo with the Republican candidates after the debate last nite http://t.co/bChZ5TrDqY,2015-08-07 22:45:24,1161,531,en
FOUND: Adorable Tuxedo Kitten in Brooklyn! Give me a shout if you want your own lil' #JimmyJazz! http://t.co/PnRETLbeiM,2015-08-07 22:07:21,72,15,en
In the Team Katy Perry versus Team Taylor Swift war I proudly remain Team Carly Simon,2015-08-07 21:49:12,152,35,en
Still thinking about Trump from last night...some valid points and he looked great http://t.co/pDU5ff5ANU,2015-08-07 13:42:56,57,8,en
Trump/Flynt '16,2015-08-07 13:33:22,20,2,en
Fucked up world where Donald Trump is alive to run for president and Al Goldstein is not,2015-08-07 13:31:57,20,4,en
Girls with long hair- PLEASE tie that shit back before getting on the subway and brushing those Pantene curtains up against my bare arms 😁,2015-08-07 13:31:14,131,23,en
"Politically I'm more of a ""always mention how Reagan did nothing about AIDS"" liberal than a ""cried during the last DAILY SHOW"" liberal",2015-08-07 03:17:36,787,225,en
Fun fact is one time I went on a diet after a daily show callback to be a correspondent and then I found out they hired josh gad,2015-08-07 03:11:30,453,77,en
JOSH GAD,2015-08-07 03:10:40,52,4,lv
"Is ""and...God"" the new ""and...TWINS""???",2015-08-07 02:52:30,101,13,en
WHAT??? Did megyn kelly just TEASE GOD ??????,2015-08-07 02:46:58,184,40,en
I want Terri Schiavo's ghost to have a rebuttal to that atrocity,2015-08-07 02:24:57,96,24,en
It takes a real sick fuck to attack a woman when she's at the opening night performance of HAMILTON. Love and light to @rosie.,2015-08-07 02:14:21,484,71,en
"I can't believe they rename the lions outside the NYPL ""Grace and Frankie""",2015-08-06 23:58:35,35,0,en
Time to celebrate the #DifficultPeople writers. @Scottykingking @jakefogelnest @ealtman @jokeylemon @Blacktress @JackPMoore &amp; @alexscordelis,2015-08-06 19:56:56,73,4,en
I just donated 100 dollars per idiot protestor outside my Planned Parenthood @PPFA this morning. You can donate too: http://t.co/w9zQPsMtpM,2015-08-06 16:53:11,112,24,en
"People are expressing concern about us turning The Daily Show into a Sonny &amp; Cher-style variety hour, but it's what political satire needs.",2015-08-06 14:05:19,86,10,en
Thanx for all the overwhelming support for me &amp;@billyeichner. Taking over for Jon Stewart won't be easy but our DAILY SHOW will be fabulous!,2015-08-06 14:03:52,229,16,en
#IStandWithPP!!!!!!!!,2015-08-06 13:47:12,65,12,und
"There are 2 escorts for every protestor at the @plannedparenthood near me. Thank you, volunteers. Now donating $100 per protesting asshole.",2015-08-06 13:47:02,124,12,en
At #plannedparenthood in my neighborhood -handful of all male loonies protesting. One added a Cecil The Lion reference to his proselytizing,2015-08-06 13:45:35,42,5,en
"I'm beginning to get the sense that even if Eizabeth Warren DID get my invitation to @afropunk fest 2015, she's just not going to go with me",2015-08-06 02:02:05,48,3,en
The #bassethound painting in my apt on #difficultpeople is by my fab artist pal STEVEN HAMMEL http://t.co/IDeXU1nNCU http://t.co/6xJUVhnk4g,2015-08-05 20:53:01,26,3,en
I could really go for some #rigatone,2015-08-05 20:34:15,18,0,en
"Sorry for all the promotional tweeting and what have you. I'm off to the OBGYN for a routine pap now, so I'm switching over to periscope!",2015-08-05 15:28:29,110,2,en
Difficult People Doesn’t Give a Damn If You Like It http://t.co/Cfc1A7JvRw via @vulture,2015-08-05 15:19:07,33,5,en
I stand with fucking badass superbitch rockstar queen genius Elizabeth Warren http://t.co/1mfYp0whQE,2015-08-05 14:07:43,411,197,en
guys I have crushes on or am open to making love to - you can email me congrats about @difficultppl too!  😎,2015-08-05 13:58:17,62,1,en
Also each time you see @ColeEscola wearing a scarf u have to drink...piss (Should I delete this tweet? It's dirty &amp; stupid &amp; makes no sense),2015-08-05 05:09:45,17,0,en
"Signing off but overwhelmed with love for my ""craft."" (Macaroni and Cheese!) Just kidding, I'm an artist &amp; the luckiest girl in the world.",2015-08-05 05:08:20,85,1,en
Here is a video of the 2 basset hounds who play my dogs. They will have more Twitter followers than me by morning. https://t.co/IB0CceFit6,2015-08-05 05:06:17,29,4,en
"""Did you guys have a Devil's Threeway in here?"" is @ealtman, I believe. ""The alcoholic from the Eagles?"" has to be @jakefogelnest",2015-08-05 05:04:59,20,1,en
"Who has 2 Tonys, off the charts emotional intelligence, respect for process, &amp; a perfect pratfall? @iamandreamartin http://t.co/WZ6Uohn2t0",2015-08-05 05:01:39,44,2,en
"""Fuck David Byrne. I gotta act."" is a @billyeichner ad-lib that at least twelve of you should tattoo on one of your legs by tomorrow evening",2015-08-05 04:56:29,52,3,en
#DavidBurns,2015-08-05 04:55:01,11,2,und
"I truly believe @derrickbaskin and @GabbySidibe love each other on @difficultppl and that's bc they are both something called ""great actors""",2015-08-05 04:53:58,8,4,en
The marvelous animated facial expressions of an angry/shocked @JamesUrbaniak DOT COM http://t.co/HSXfZJaqlQ,2015-08-05 04:51:30,20,1,en
"I have seen @billyeichner's ad lib re: a loose wire ""This looks a little like Shirley MacLaine"" over 50 times &amp; I ALWAYS LAUGH @difficultppl",2015-08-05 04:48:53,14,0,en
"Try to find a finer ""talking while eating"" actor than @derrickbaskin and I'll hold up a mirror and show YOU a filthy liar. @difficultppl",2015-08-05 04:46:36,3,0,en
"Matthew's (@ColeEscola's) line ""Something with Angela Lansbury, or Miss Kate Capshaw. It's that kind of day"" was written by @Scottykingking",2015-08-05 04:45:37,18,3,en
That last tweet had nothing to do with @difficultppl but I couldn't burden that knowledge alone.,2015-08-05 04:44:49,8,0,en
"Mother of God, Micky Dolenz just retweeted Allison DuBois after she pointed out he was referenced in #GraceAndFrankie.",2015-08-05 04:44:18,27,1,en
Ahhhhhh @christinagausas is so good in @difficultppl also I can't believe I'm live tweeting a web show at quarter to one,2015-08-05 04:42:53,25,2,en
"The role of Brian Walsh in Ep2 of @difficultppl is expertly portrayed by @imnatecorddry. He does a lot of ""knowing nodding"" &amp; blank staring",2015-08-05 04:42:05,17,1,en
Fun fact: those are @iamandreamartin's real (FANTASTIC) breasts. #perkytits #ladyparts http://t.co/wmfiEtVDhn,2015-08-05 04:38:43,56,7,en
"""Andrea Mumford"" in Ep2 of @difficultppl is portrayed by the sickeningly hilarious @shannondevido",2015-08-05 04:36:26,11,2,en
Watching Difficult People: Devil's Three-way on @hulu  http://t.co/PkDnt2lwnL,2015-08-05 04:33:54,19,2,en
Watching Difficult People: Pilot on @hulu  http://t.co/Ke7TonMrmV,2015-08-05 04:06:24,45,13,en
If ur not sick of reading about me this is a good thing // RT @ezwrites: @julieklausner is making bitter beautiful http://t.co/WVUIf7Ncfi,2015-08-04 22:22:28,40,5,en
I LOVE MY 2 SISTERS SO MUCH https://t.co/4gb5croE4V,2015-08-04 14:44:19,25,4,en
Of course Kim Richards shoplifted from Target. It's the Saks of the Valley!!! #FreeKim,2015-08-04 13:42:12,66,17,en
BEYOND thrilled to be joining these two goddesses of broadcasting on klgandhoda today at 10AM!!! Tune… https://t.co/XVDxhNCPeU,2015-08-04 13:32:18,12,2,en
"I will be on @KLGandHoda today, which means I can die with all my goals accomplished except for f'ing James Spader from PRETTY IN PINK.",2015-08-04 12:08:05,115,5,en
I know john waters doesn't make movies right now but Kim Richards being arrested for shoplifting needs to cue dreamland closing credits.,2015-08-04 04:40:25,105,15,en
NOW! Turn to @bravoTV! Me! @billyeichner! @Andy! #WWHL!!!!,2015-08-04 02:31:09,77,10,en
15 min from now! RT @Andy: HILARITY WILL ENSUE! @julieklausner &amp; @billyeichner at 10:30 #WWHL http://t.co/1FfQ4fmuMG,2015-08-04 02:15:10,54,7,en
Yes!!! RT @aliciacamden: @UCBTheatreNY is there still a @difficultppl sneak peek/@julieklausner q &amp; a at Whiplash tonight?,2015-08-04 00:30:17,4,0,en
