text,created_at,favorite_count,retweet_count,lang
We added a show at @thebellhouseny 12/21! Tix: https://t.co/qMpJ2t8aXW! @tedleo @ColeEscola @bejohnce @TonyAtamanuik https://t.co/JiTm2XKuxP,2015-11-24 00:24:57,17,7,en
Meghan Trainor at the AMAs look like Adele pretending to be the Adele impersonator,2015-11-24 00:09:00,120,25,en
Show added! Bell House Monday 11/21 8PM! Tix https://t.co/qMpJ2sQA6o https://t.co/hef3xGQSwU,2015-11-23 17:21:29,31,3,en
"It starts with ""At Last"" by Etta James. As in ""At last, my basset hound has found another basset hound to marry.""",2015-11-23 14:44:51,48,2,en
This video about a basset hound wedding is all the proof you need that basset owners are hilarious and insane. https://t.co/wUhPZwdrq1,2015-11-23 14:44:10,44,7,en
"How you gonna cancel The Soup, tho???",2015-11-23 01:53:44,123,19,en
"They said they had to cut me from this piece for time, but I don't get how my photo ""didn't fit in with the others"" https://t.co/WpjZf28N0e",2015-11-22 17:29:42,113,5,en
"Remember when a podcast listener got mad when I called myself a ""Fag Hag"" bc I can't say ""Fag"" as I am not one? That was before Paris.",2015-11-22 17:21:51,67,3,en
Swan would be a better prez than Trump. At least he has good taste in #music and better skin https://t.co/9pkspBtn45,2015-11-22 17:20:38,197,70,en
"Mashup pitch: @IMPaulWilliams as Swan saying ""Get this F-- out of here"" in POTP with Trump's response to a #BLM protestor @jakefogelnest",2015-11-22 17:19:35,8,0,en
Maybe next time Maureen Dowd! Perhaps I will also mash up some PJ Harvey with my Summer! You don't know!!!!!,2015-11-22 16:17:55,18,0,en
If Maureen Dowd had interviewed me for her Women in Hollywood article I would have submitted lyrics as my statement https://t.co/kiKrRVzU6D,2015-11-22 16:17:25,47,5,en
"The most recent episode #BillyonTheStreet is the Adele of ep's. EMMY voters, wake up. @billyeichner quoting Eddie Murphy in white eyebrows?",2015-11-22 16:06:42,59,2,en
God willing last,2015-11-21 21:39:05,3,0,en
"Merrily blocking on all social: the last 
dude-xample to teach me that being a dick is not intriguing",2015-11-21 21:38:55,27,0,en
A little late to the party for this one but Jared Fogle: bad for jews,2015-11-21 18:24:23,91,9,en
This club has everything. Mia Farrow tweeting about Isis...,2015-11-21 17:46:39,153,16,en
7 train is down so I called an @Uber and he stopped for gas. I've been sitting at a Speedway station for 10 min.,2015-11-20 14:58:22,64,1,en
New Todd Haynes movie poster seems tonally off https://t.co/Bq6yB9E3SG,2015-11-20 02:15:04,307,66,en
Mike Milligan reciting Jabberwocky on FARGO is my bliss place.,2015-11-20 00:32:17,89,14,en
Is me RT @EW: See a first look at Melissa McCarthy's new movie #TheBoss: https://t.co/ZhQBcGFFgI https://t.co/7M5HtXUZSP,2015-11-19 22:29:16,52,0,en
"""More pizza, slave"" back in the sound collage. A good night. @bestshow4life",2015-11-18 04:11:27,65,10,en
We sold out @sidgoldsreqroom. Stand by for other show/ tix info if you didn't get yers. https://t.co/sXlM51KHsp,2015-11-18 01:50:22,41,2,en
The amazing @MerylRowin made this poster. Genuflect! https://t.co/JkdlxbL5r3,2015-11-17 23:28:11,56,4,en
Tix to my Depressing Christmas Party w/ @ColeEscola @bejohnce @tedleo @TonyAtamanuik &amp; directed by @jokeylemon - https://t.co/eqnkfChVoy,2015-11-17 23:25:31,21,6,en
"A Christmas Show for you, A Christmas Show for me. These Christmas Shows are given most generously! https://t.co/VAgWIEVc68",2015-11-17 23:10:19,48,6,en
Fuck R. Kelly forever,2015-11-16 21:17:34,159,24,en
"To celebrate today's 2nd #DifficultPeople table read, here is ANDREA  MARTIN doing her genius Bernadette Peters- https://t.co/kJfNFfUwUL",2015-11-16 16:38:27,76,17,en
"It only took three and a half years for the world to catch up with me, but now we all know that Pauley Perrette is out of her GD gourd.",2015-11-16 15:39:31,195,10,en
https://t.co/cfHblbBoGc,2015-11-16 15:02:22,77,4,und
TL; DR version? Eden is ok. https://t.co/PIkmGkRZZM,2015-11-15 16:12:21,31,1,tr
"Thank you God, for this new Pauley Perrette TextEdit poem and thank you @joemande for sending it.",2015-11-15 16:11:38,66,2,en
Hilarious RT @dankois: @julieklausner how is the foot thing,2015-11-15 04:18:36,13,1,en
TOTALLY WAS (earpiece visible) &amp; he still managed to screw em up RT @kevinmeyers: @julieklausner I heard he's being fed lines in an earpiece,2015-11-15 04:14:48,25,6,en
"In all seriousness, Bruce Willis is so bad in MISERY you wanna hobble his SAG card",2015-11-15 04:12:46,85,14,en
They should replace Bruce Willis with a pile of gently used seat cushions in MISERY &amp; that pile of cushions would probably make more choices,2015-11-15 04:11:35,96,16,en
"NCIS goth actress draws ""Fagin"" https://t.co/anxcy7FHYs",2015-11-13 16:50:08,72,14,en
Pauley Perrette once tried to get me kicked out of a dog awards show.,2015-11-13 16:48:22,198,36,en
"""My house, my beloved Hollywood""",2015-11-13 16:48:05,97,4,en
Outsider art museum to display dark drawings by procedural star Pauley Perrette,2015-11-13 16:47:31,108,7,en
https://t.co/2bHAliHxDD,2015-11-13 16:47:05,43,2,und
"""My church friend cop""",2015-11-13 16:46:57,100,3,en
"""My beloved homeless people that I spend my life protecting"" https://t.co/53MkuH0SsL",2015-11-13 16:46:35,134,12,en
Pauley Perrette needs to get a job as a birthday party caricaturist,2015-11-13 16:45:39,102,12,en
Pauley Perrette LOVES DRAWING,2015-11-13 16:45:23,93,7,en
"God bless @JoeMande, who sends me screenshots of all @PauleyP related craziness, as she has blocked me.",2015-11-13 16:44:56,113,7,en
"Ok, what the FUCK is going on with Pauley Perrette.",2015-11-13 16:39:35,190,30,en
"Fine, U got me. RT @BuzzFeed: These four dogs stole the show at their owners’ wedding https://t.co/DjsVqrOBOu https://t.co/jNeXzLudl6",2015-11-13 01:08:29,16,3,en
Do u like it when people refer to books as good reads or food as good eats? I don't. Hi. I'm Julie Klausner &amp; I'm trying to write a script.,2015-11-12 18:54:36,165,9,en
"Cable TV has now officially been renamed ""Let's Waste Mare Winningham""",2015-11-12 05:10:16,108,18,en
Standing still while an elderly person reads your T-Shirt out loud to you is a great way to slow down time,2015-11-11 15:22:17,254,44,en
"Google Image Search should be called ""as many different hairstyles and weight fluctuations you can fit onto a page of vague memories""",2015-11-11 15:21:46,39,2,en
"🙌 🚘🚨 RT @PunKandStuff: #TalkingHeads David Byrne, Slash Magazine, Nov 1979 https://t.co/NGODl4t9rv",2015-11-11 00:01:27,35,6,en
"Join us at @SymphonySpace tonight at 7:30 to celebrate THE UNCOLLECTED DAVID RAKOFF, and the man himself. &lt;3 https://t.co/8MdpAnOERP",2015-11-09 20:13:23,16,3,en
"""On Lana Del Rey's wedding day, all of her cool little sister's dreams come true.""  &lt;--- Summary of SIXTEEN CANDLES",2015-11-09 18:25:17,66,13,en
"Read about my son, John @Mulaney! https://t.co/QJ8atUVESd",2015-11-09 17:40:16,46,2,en
Well-wishers: I only joined vine so I could follow @VicBergerIV,2015-11-08 23:53:06,62,4,en
Me. #NathanForYou  https://t.co/aFJ5eAoZJ6,2015-11-08 20:48:48,32,4,und
Bro to do list: 1) make a girl crazy 2) reject her bc she's crazy,2015-11-08 05:49:21,258,58,en
Don't piss on my leg and tell me I asked you to piss on my leg,2015-11-08 05:22:21,103,10,en
Your grudges are precious calories you burn to run faster. Don't forget to replenish them!,2015-11-07 19:23:22,120,31,en
We need to discuss Trevor Noah's neckline in his standup special bc it goes beyond the Deep V https://t.co/pEoi5PUson,2015-11-07 16:23:17,123,8,en
"❤️ RT @BrianStack153: @billyeichner @julieklausner Our dog Darby saw this coming years ago. Congratulations, Julie! https://t.co/iqtkTM7sOp",2015-11-06 20:13:05,35,0,en
New Episode of #HowWasYourWeek - https://t.co/Y5HX8afFQO,2015-11-06 17:24:08,32,4,en
Hi pals- there's a new podcast coming down the pike. Watch out for it later today...,2015-11-06 16:26:00,57,1,en
This made me cry with joy. ❤️ Julie Klausner and Snoopy: A Cartoon Homage to My Two Favorites – Tablet Magazine - https://t.co/nI5Vt6qUTy,2015-11-05 21:09:52,64,11,en
In tears with gratitude (&amp; clinical depression) for this opportunity! I won't disappoint. Thank you Broad Green. xo https://t.co/AOB58iP8ur,2015-11-05 13:57:56,253,26,en
My beau Arthur! ❤️ // ‘Difficult People’ Ups James Urbaniak | Deadline - https://t.co/gjNQQ0JCPl,2015-11-05 04:07:27,35,2,en
"""My boyfriend is the writers' room"" from the top! Key of G! A 5, 6, 7, 8!",2015-11-05 01:50:26,35,0,en
"I don't know who Blake Shelton is, besides the person with the most goyishe name I've ever seen. Please do not tell me who he is thank you.",2015-11-05 01:29:04,159,17,en
"Anyway, good luck to Pauley Perrette! And to the child she once saw with the number of the beast on his forehead!",2015-11-04 16:49:02,127,9,en
of the dog awards show to kick me out from the red carpet press line. She was very flustered at my questions.,2015-11-04 16:47:57,42,3,en
"her dress, and then, when she didn't seem to get either question, I asked her if she was drunk. She got very upset and asked the organizer",2015-11-04 16:47:25,49,3,en
"I asked her whether Petfinder was like match dot com for dogs and their future owners, if she was going to smuggle any dogs home tonight in",2015-11-04 16:46:45,52,4,en
"Quick recap: Pauley Perrette, who blocked me, once tried to get me kicked out of a dog awards show I was covering for @vulture.",2015-11-04 16:46:02,86,8,en
https://t.co/t0QgwgBXs9,2015-11-04 16:42:47,44,7,und
https://t.co/1EciGpwZaC,2015-11-04 16:42:36,74,17,und
https://t.co/kJE3gM4be1,2015-11-04 16:42:19,36,4,und
"Apparently she has drawn a picture of a child she once saw with ""666"" tattooed on his head? And that's why she's afraid of that number?",2015-11-04 16:39:45,69,1,en
Pauley Perrette blocked me long ago. She is an insane person who once tried to get me kicked out of a dog awards show.,2015-11-04 16:38:38,137,15,en
Thanks to@JoeMande and others for alerting me to the shitshow that is Pauley Perrette's Twitter feed this morning.,2015-11-04 16:38:16,65,4,en
Rewatching this week's #NathanForYou bc #JungleChildren are worth our attention and care,2015-11-04 01:32:40,82,10,en
Jean Smart is MERYL'ing on this season's Fargo,2015-11-03 20:53:56,93,8,en
fargoFargoFargoFargooooo,2015-11-03 03:00:37,73,12,cy
❤️ RT @HistoryInPics: 18 year old John Candy at Niagara Falls. https://t.co/4HLaQLTBUL,2015-11-02 22:33:25,138,31,en
"Anybody else in their writers' room with ""It Depends on What You Pay"" from The Fantasticks in their head?",2015-11-02 21:47:51,24,1,en
LOL peeps tweeting about baseball while I reread FINISHING THE HAT,2015-11-02 04:11:24,103,8,en
The only way BOTCHED could possibly be better is if they featured the doctors who did the original surgeries,2015-11-02 02:12:48,154,18,en
Is Richard Ramirez considered a member of The Wolfpack?,2015-11-02 01:18:18,37,0,en
"Denis OHare used the expression ""dollars to donuts"" on this week's #AHSHotel &amp; Lily Rabe played Aileen Wuornos. I don't have a joke for this",2015-11-02 01:14:56,64,2,en
"And just like that, the Basic Olympics were won before they even began. (Via @jezebel) https://t.co/0pxtpBgtxs",2015-11-01 22:00:26,181,66,en
My idea of a marathon is a Twilight Zone marathon amirite fellas and gals oh I have pre-Diabeetus and my A1C is thru the roof,2015-11-01 16:40:14,72,2,en
"I like jokes you need to know 3-4 VERY specific things to get. That said, I saw a guy dressed up as Left Shark last night &amp; laughed out loud",2015-11-01 15:47:34,131,9,en
Kimmel commissions/videotapes a prank in which Higgins tells Fallon he drank all of his Halloween Jägermeister.,2015-11-01 15:46:01,49,5,en
"For example, behold these wonderful maniacs dressed as Billy Epstein and Julie Kessler. &lt;3 https://t.co/IKcZPTR93p",2015-10-31 18:26:14,33,4,en
"I know the odds are slim, but if you DO have a #DifficultPeople themed costume, please tweet it to me and it will make my day.",2015-10-31 18:22:31,43,5,en
"Serious reminder to keep your pets INSIDE today. Especially black cats. And while I'm at it? Don't put costumes on your cats, they hate it.",2015-10-31 13:48:53,111,24,en
"Do I have strong arms? I do. But when a guy won't kiss you on the mouth, you feel like Garry Marshall's idea of what hookers are",2015-10-30 23:45:36,93,2,en
Sometimes I wish my arms were made out of actual guns.,2015-10-30 23:42:09,64,6,en
"When a guy you date only wants to worship your delts &amp; traps and tell you how strong your arms are but won't kiss you, always a bridesmaid!",2015-10-30 23:41:48,73,5,en
Huge congrats to all parties involved.,2015-10-30 23:40:04,44,1,en
Just found out a guy I went on a date with who only wanted to kiss my biceps and tell me how strong my shoulders were got engaged to a woman,2015-10-30 23:39:49,126,7,en
"Lotta news stories are saying so and so ""won"" Halloween. Makes me lose faith in certainty.",2015-10-30 22:38:39,55,7,en
"Dude, join the club. https://t.co/Of7SjIiwpr",2015-10-30 16:19:09,63,6,en
Via @kentucker Via @nprmusic: Three Songs That Expose Frayed Nerves And Yearning  https://t.co/JHAz3BAnS5,2015-10-30 14:51:54,3,0,en
Hashtag LOST IN THE JAZZ https://t.co/zBfQeapNsY,2015-10-30 14:46:00,81,10,en
Nothing is more upsetting or a worse idea- historical atrocities included - than the Today show anchors dressed up like Peanuts characters.,2015-10-30 14:00:48,243,39,en
Everything is stupid and awful except for this soft fellow with pink jellybeans on the bottom of his… https://t.co/j7KgwP7ojy,2015-10-30 04:20:22,52,6,en
"Well, this is the best.  https://t.co/8ATNfrgHZf",2015-10-30 01:58:50,37,2,en
Sage Advice from Julie Klausner: ‘I Just Swallow All My Feelings’ | The Dinner Party Download - https://t.co/tV2LPvv3OS,2015-10-29 14:08:29,21,3,en
"The quaaludes from MODERN ROMANCE, @reneeelisegolds's singing voice, Ossie Clark dresses in my size &amp; a young Elvis Costello #DreamSwagBag",2015-10-28 17:52:33,18,0,en
Essential listening for future power showrunners https://t.co/wjNT2kIHax,2015-10-28 15:42:39,14,3,en
"""Jokes made by drama showrunners"" desperately needs a tumblr",2015-10-28 15:37:42,73,7,en
#KillingTheKardashians,2015-10-28 15:35:26,22,2,und
"Then I realize ""Chuck Lorre would be a better costume"" https://t.co/jQ4GryS1pa",2015-10-28 15:34:51,15,1,en
"Sometimes I think ""my Kurt Sutter costume will be on point""... https://t.co/wE29a09Tdq",2015-10-28 15:34:20,26,1,en
The only way to understand this important list is to listen to the Oct 20 #HollywoodHandbook podcast. https://t.co/lbSmg3Ku0p,2015-10-28 15:32:24,11,0,en
Can't decide if I'm going as a #NetworkAmbassador #RatingsMagnet #Heavyweight or #PopIcon,2015-10-28 15:31:13,14,2,en
Which of the @THR list of 2015 Power Showrunners are you dressing up as for Halloween?,2015-10-28 15:30:12,36,4,en
"Barbra Streisand's basement mall answers the long standing question, ""where the fuck was Ryan Murphy instead of the writers' room???""",2015-10-28 02:24:39,94,12,en
American Horror Story: Barbra Streisand's Basement Mall,2015-10-28 02:20:55,211,66,en
Remember a time before the internet discovered Jeopardy?,2015-10-27 20:48:38,51,5,en
Even worse than Ben Fields? Ben Fields Five.,2015-10-27 20:26:22,44,4,en
Ending my trip to LA with a visit to Larry King's legendary brooklynwaterbagel place. These are the… https://t.co/99nnAtB5mO,2015-10-27 18:27:52,8,0,en
"What's worse- the occasional diet coke, or admitting I love early Genesis (the prog-gy stuff)?",2015-10-26 21:17:08,72,4,en
"Intimacy dirty talk to employ whilst coital: ""fill me up with constant panic attacks related to abandonment""",2015-10-26 15:00:54,41,15,en
"Bacon causes cancer but bacon memes cause suicide, or should",2015-10-26 14:59:32,106,25,en
Skinny Leah Remini serving Alien Nation https://t.co/ODcl6jWtXn,2015-10-26 05:00:12,66,2,en
I've been in LA for less than 12 hours and I'm already tweeting compliments with no jokes in them.,2015-10-26 04:58:34,101,5,en
"And FWIW the double dutch and ""ID'ing a body"" metaphors from @amyschumer's new HBO special are worth your annual subscription fee",2015-10-26 04:57:57,42,3,en
"Ok, @anthonyjeselnik's Thoughts and Prayers on Netflix is brilliant.",2015-10-26 04:55:11,53,7,en
Finally saw LOVE &amp; MERCY and it was devastating. And I'm not just talking about Elizabeth Banks's dress size.,2015-10-25 21:45:21,51,2,en
"Pardon me for saying so, but I'm beginning to think Jimmy Fallon is a klutz!",2015-10-25 20:58:09,122,14,en
"Fyi she designed her own program. She eats 1000 calories a day, not including fruit.  😀🔫",2015-10-25 19:44:04,68,2,en
👎👎👎👎👎RT @shandzee: @julieklausner welcome to LA,2015-10-25 19:41:32,5,0,en
My cab driver is telling me how she lost 40 pounds - I did not ask - And I feel like I am being held hostage,2015-10-25 19:38:01,124,10,en
JOIN ME IN CELEBRATING #FilthDad AND BIRTHDAY BOY @TheSpoony!!!!!!,2015-10-24 17:03:04,19,0,en
"Nobody asked me whether I'd kill a baby I knew would grow up to be somebody who said ""spendy"" when she meant expensive. I would. #BabyHitler",2015-10-24 04:50:40,121,8,en
I liked doing this interview a lot. // Difficult People’s Julie Klausner - https://t.co/ebPWL2DUnB,2015-10-24 04:25:55,27,4,en
Truly serving electric youth tonite,2015-10-24 01:07:05,22,1,en
"Not saying I'm into pervy stuff or vanilla stuff, just putting it out there that if Evan Peters wanted to tickle me for sex, I'm down",2015-10-23 17:39:31,84,5,en
"If there was a poster demonstrating a Heimlich maneuver for those choking on loneliness, would Chris Ware HAVE to be the illustrator?",2015-10-23 13:12:22,77,14,en
Literally WEEPING at @SarahKSilverman on @nprfreshair. Must-listen interview. Two brilliant ladies talking about important stuff. x,2015-10-23 13:08:03,320,65,en
THERE'S A BERNIE MADOFF STORY ON #AHSHotel?????? #ICant,2015-10-23 00:18:02,59,2,en
"What if there's a parody of Zappa's Joe's Garage about Jay Leno's Garage and it's called Jay's Garage, she wondered, too afraid to google",2015-10-22 17:55:12,48,5,en
"I coulda done punch-up on #AHSHotel. Example: a plaque in Gaga's suite that sez ""You don't have to be bi to work here...but it helps!""",2015-10-22 15:34:43,75,8,en
#RedReddingtonRules,2015-10-21 02:48:16,27,5,und
Thank u @JenniKonner. https://t.co/3lke2H2Dhf,2015-10-20 19:45:32,65,0,en
"Hi @andy congrats on winning a ""bonus"" MacArthur genius grant after last nights OC reunion part one #SushiOnThePenis",2015-10-20 15:32:10,29,3,en
I just saw an ad for a Burger King siracha hamburgair and I would truly rather drink from the toilet like a dog that be in same room as one,2015-10-20 06:01:03,108,12,en
"EVERYBODY WAKE UP AND CELEBRATE JEAN SMART IN ""FARGO""",2015-10-20 05:52:09,139,19,en
"""I ran into Alice Cooper on his way to work. He was a very likable fellow, and completely free of snakes."" 👏 digging Elvis Costello's book",2015-10-19 20:06:14,52,6,en
The opposite of an anti-depressant is Donna Karan describing a body suit.,2015-10-19 18:36:23,63,4,en
Also Donna Karan does NOT seem like a gigglepuss,2015-10-19 18:24:37,11,0,en
"Just going about your business catching up on podcasts and next thing you know, you're listening to Donna Karan describe 9/11 to Terry Gross",2015-10-19 18:20:59,71,4,en
"If I'm over-tweeting/instagramming, I have writing to do. Do not enable me with favs!!!!!!",2015-10-18 16:25:25,108,6,en
"Would love to teach cat how to: 

1) get my hoodie from the next room 
2) write scripts / go to the gym for his momma
3) love me back",2015-10-18 16:23:56,156,21,en
Recommending the @GloriaSteinem profile from this week's @NewYorker on every social media platform I haz http://t.co/dgJj6DVhY0,2015-10-18 15:07:18,113,18,en
Imagine how baffled Hank Kingsley would be by TRANSPARENT.,2015-10-18 15:02:16,103,20,en
Trump vs. Bernie Debate! (James Adomian &amp; Anthony Atamanuik LIVE at Whiplash Comedy UCB-NY) - YouTube - https://t.co/95co1ky9wf,2015-10-18 10:39:01,47,10,en
Oh come on. Now do I have to put on hard pants and start texting people about getting into the SNL after party? #IntroduceJulieToLarry,2015-10-18 03:48:43,105,4,en
I'm the girl who grew up thinking she wanted a Jonathan Richman song as a boyfriend &amp; learns she actually wants to marry the movie Secretary,2015-10-18 01:44:11,124,12,en
It's a dime to Robin Wright's half dollar. Great question. // RT @katieisfunke: @julieklausner what's the m&amp;m capacity?,2015-10-18 01:40:09,10,2,en
Enjoy this normal tweet // RT @OfficialPiaZ: Flav stopped by last night to chill‼️😘👄🍸🍸🍸 https://t.co/dtscKvM9Vr,2015-10-18 01:37:44,28,4,en
No ***YOU*** stop obsessing over the topography of Julie Bowen's neck http://t.co/EEiK2Hm4ob,2015-10-18 01:36:41,134,9,en
"God, give me the strength of a woman with good ideas and the confidence of a man with bad ones.",2015-10-17 19:00:22,3741,1996,en
"I've said this before, but imma tweet it again.",2015-10-17 19:00:16,22,1,en
"New podcast for your ear, heart &amp; brain http://t.co/NaFHEHpAGh",2015-10-17 15:03:28,36,6,en
"AHHHH I JUST REMEMBERED THAT THE FIRST EP OF #AHSHotel ENDED WITH THE ORIGINAL EAGLES RECORDING OF ""HOTEL CALIFORNIA""",2015-10-17 14:26:13,52,6,en
"If you haven't yet seen this @ColeEscola video by now, you're a dead dummy from space. http://t.co/MiE2mrpoNu",2015-10-16 19:48:37,62,20,en
"I've always thought of the pear as an apple's older brother with a creepy mustache and a tan, scratchy sweater",2015-10-16 18:40:02,77,11,en
"This tweet was written by my Jewish cat 

RT if you like to be scratched on your #keppe. Fav if you like to be scratched above your #tucchus",2015-10-16 18:38:24,79,14,en
🙌🙌🙌🙌🙌 RT @spivey_e: in case you were wondering #overboard is on right now on Encore. http://t.co/k4WjCEKqgE,2015-10-16 16:57:43,44,2,en
"""Gay...gay...girl...girl....cat...gay"" &lt;-- me troll-perusing my instagram Likes, hoping to find a SUITAIRE",2015-10-16 15:23:00,112,6,en
"A Big Mouth Billy Bass that sings the Talking Heads version of ""Take Me To The River."" 

Called BIG SUIT Billy BYRNE Bass. 

Ok. Logging off",2015-10-16 15:21:26,63,6,en
New podcast coming later tonight or tomorrow.,2015-10-16 14:09:36,98,1,en
Mrs. Met is getting fuuuuuuuuucked tonite,2015-10-16 03:56:08,296,76,en
🙌 RT @pattymo: http://t.co/OyU48FsXqR,2015-10-16 03:04:47,29,3,und
Also @IssaRae has an HBO show now???!!?? TV WINS!!!!,2015-10-16 01:54:14,24,1,en
"Tonight we celebrate, because @nathanfielder is back and @billyeichner stars in a new episode of #billyonthestreet. I LOVE TELEVISION",2015-10-16 01:49:05,56,7,en
YAY ISSA!!!!!!!!! 🙌🙌HBO Gives Series Order to Comedy From YouTube Star Issa Rae - Hollywood Reporter - http://t.co/HYBq0j4tw7,2015-10-16 00:03:41,27,4,en
"Counting down to tonight's #NathanForYou premiere. How lucky we are to be alive during these times, but only in terms of television!",2015-10-15 20:16:03,122,12,en
"""COLOGNE!!!!!!!!!!!!!!!!!!"" - this guy",2015-10-15 14:01:15,50,4,en
Say what you like about Gwyneth Paltrow but you can't say she doesn't like music.,2015-10-15 13:59:03,41,6,en
"Next episode of #AHShotel: the Cortez gets bedbugs &amp; the series ends, then we all watch Death Becomes Her and the Express Yourself video.",2015-10-15 05:00:04,131,28,en
Yup. #ReplaceAHSHotelWithDeathBecomesHer RT @gilbertcruz: This show makes me hate sex.,2015-10-15 04:57:35,26,1,en
"Permission to show Death Becomes Her during AHS:Hotel's time slot each week instead, sergeant?",2015-10-15 04:43:45,138,11,en
Jack Black with 2 of my favorite (ginger!!!!) ladies this week http://t.co/3FMZG83BFI,2015-10-14 23:43:40,37,3,en
"""Splish Splash"" was released in '58 and ""Yickety Yak"" in 1959. And yet the Manson murders wouldn't take place for another 10 years",2015-10-14 23:31:36,206,48,en
"When you complain to a New Yorker about how we all act like NYC is the only city that matters, that small smile is us laughing at you",2015-10-14 21:39:28,120,27,en
Today: compare a female artist to a man. Just to see what it's like!,2015-10-14 17:57:53,50,11,en
Every day I pledge allegiance to this photograph of @NancySinatra and Morrissey and so should you 🇺🇸 http://t.co/2LVIvGcXBC,2015-10-14 17:27:43,120,23,en
"🙌 RT @NYMag: Every song that influenced Elvis Costello, according to his new memoir: http://t.co/fWZh5QEI6N http://t.co/lHjG4s9tLx",2015-10-14 14:29:50,15,3,en
Baby Jesus watching Tamara's baptism on tonight's OC like http://t.co/phgbqXBJ6U,2015-10-13 02:07:45,115,14,en
Is there a Shazaam for brunette boys I can use watching this season of AHS Hotel?,2015-10-13 00:05:18,131,25,en
#TinderHammock,2015-10-12 22:44:54,34,1,und
"""Just scrollin' through my FB photos, I'm really thinking 'You know which pic is most flattering of me? The one where I'm in that hammock'""",2015-10-12 22:44:40,43,1,en
"kevin, how did you meet your girlfriend? 
she saw a photo of me relaxing in a hammock",2015-10-12 22:43:14,65,5,en
"""Is there a pic where I'm recumbent that also says 'I love the outdoors'?"" -Person who uploaded a PHOTO OF THEMSELVES IN A HAMMOCK to Tinder",2015-10-12 22:42:10,63,6,en
"Dating App tips: make sure to upload a full body pic, a photo that shows your personality, and most importantly, a PHOTO OF YOU IN A HAMMOCK",2015-10-12 22:40:48,78,10,en
"Imagine being the person who thought to himself ""Yes. Good idea. I'll put this photo of me in a HAMMOCK on Tinder""",2015-10-12 22:39:31,62,7,en
"A fun, candid shot of me and @Scottykingking hard at work writing season 2 of @difficultppl http://t.co/1hMM2uvbXQ",2015-10-12 22:01:55,139,10,en
"All Female Fantasy Island Reboot, said the Internet. That'll do, pig, said Julie.",2015-10-12 16:47:04,34,2,en
