text,created_at,favorite_count,retweet_count,lang
I feel like people are wealth-shaming and misogyny-shaming and being a huge asshole-shaming Donald Trump :(,2016-03-26 17:07:10,86,18,en
#BernieBird sez #TheDress is white and gold,2016-03-25 23:45:07,46,5,en
#BernieLanders just won a golden globe,2016-03-25 23:32:49,23,1,en
#Berniebird just got an Amazon show,2016-03-25 23:32:17,49,2,en
"Can somebody sneak into @Tribeca and make it so that instead of the anti-vaccine doc, BAD GRANDPA starts playing?",2016-03-25 22:54:53,183,34,en
#Berniebird,2016-03-25 22:43:03,45,5,und
Larry Sanders is my favorite TV Show and I am so sad about Garry Shandling.,2016-03-24 21:19:02,245,27,en
"I didn't ""@"" any of those people's names bc I want them to work for their on-line compliments.",2016-03-24 16:27:40,37,1,en
"I know it's not a competition but please spin off The Characters into sketch shows starring John Early, Tim Robinson and Kate Berlant.",2016-03-24 16:27:04,84,6,en
HASHTAG PURIM,2016-03-24 02:35:43,51,11,hi
Quick reminder - a ghost's parents are murder.,2016-03-23 22:18:06,54,8,en
"🙀 Nathan Lane Fists a Toilet, and 9 More Things That’ll Happen in S. 2 of &lt;em&gt;Difficult People&lt;/em&gt; https://t.co/W1W244cSpE 🙀",2016-03-23 19:36:06,38,7,en
My king my queen my idol @RuPaul https://t.co/iUOVtNftdu,2016-03-23 16:04:51,96,27,en
"First thing tomorrow AM: check email to make sure I am not cast as The Tick somewhere. If am, go to set.",2016-03-23 04:46:42,89,0,en
Craig Kilborn can revamp MY mac and cheese 😉,2016-03-23 04:44:53,42,3,en
"RIP Rob Ford. You and Divine are finally in the same place at the same time, so no more guessing. 👼🏼",2016-03-22 23:53:42,236,50,en
Happy Purim. Vashti was reverse #slutshamed.,2016-03-22 14:51:03,53,11,en
Noooooooooooooooooo @RuPaul,2016-03-22 01:59:00,30,1,und
I absolutely loved the new @peeweeherman movie. Mazel Tov @paulrust @juddapatow et al. 😎😎😎,2016-03-22 01:08:24,72,4,en
And introducing Chris Christie as Andrew Jarecki,2016-03-22 00:46:26,35,4,en
"Hillary as Elaine Friedman
Bernie as Arnold Friedman
Trump as Silly Billy Friedman
Jeb as Jesse Friedman
Cruz as ""guy w/the Leapfrog story""",2016-03-22 00:46:07,60,12,en
I'm here. RT @HannahCruicksha: @julieklausner come back 😿,2016-03-19 04:45:38,20,1,en
Happiest of all possible birthdays to beautiful young @jakefogelnest 🎉🎉🎉🎉🚽🚽🚽,2016-03-14 13:54:09,62,1,en
Losing my goddamn mind. https://t.co/TtalGQ4Mi9,2016-03-14 00:05:31,149,14,en
"Time for ""The @scharpling episode of #TheSimpsons"" !!!",2016-03-14 00:02:46,91,15,en
Now I am going to get ready to watch #TheSimpsons. Peace and love. - Ringo.,2016-03-13 22:43:53,90,4,en
"...I won't apologize, non-apologize, delete tweets, backpedal or refuse to own my shit. BUT- I will be more thoughtful going forward. /end",2016-03-13 22:27:48,183,15,en
For those who have spoken to me respectfully about post-racialist bias....,2016-03-13 22:26:34,42,2,en
I wish Joan Rivers weren't dead.,2016-03-13 19:15:47,414,74,en
I'm thinkin' Arby's (this commercial has an ostrich in it) https://t.co/xBDE9rFTm4 https://t.co/StRZYEiF6o,2016-03-13 16:05:20,26,0,en
Let's not fight. Here is my olive branch to Zendaya fans- can we just all agree that 1) all women are beautiful and 2) Zendaya hates Jews?,2016-03-13 15:58:22,251,29,en
Sticking up 4 AIDS is rad. It gets such a bad rap! Love that Zendaya goes so far as 2 have Nancy Reagan's body type! https://t.co/2qMLZr0jzA,2016-03-13 15:47:37,110,1,en
I would like to use this opportunity to educate Zendaya fans that the Reagans ignored AIDS,2016-03-13 15:39:49,245,17,en
Zendaya's threat to write another paragraph is more dread inducing than Kim Jong Un's fronting about the bomb he has https://t.co/GK6Qc0ePPJ,2016-03-13 15:28:17,110,11,en
I'm concerned with the generation of girls who aspire to look like Zendaya.  I do not worry about Zendaya's health or care whether she eats.,2016-03-13 15:26:09,176,18,en
"And you know those public fat shamers who fake ""concern"" for Melissa McCarthy's health? Consider me your fire with fire.",2016-03-13 15:25:02,191,13,en
I will never stop criticizing celebs who perpetuate dangerous beauty standards for a generation of girls who grow up thinking they're fat.,2016-03-13 15:23:42,394,54,en
You don't have to have an eating disorder to attend the Kids' Choice Awards....but it helps!,2016-03-13 03:52:36,222,35,en
Zendaya's ultimate retort to Giuliana Rancic is starving herself down to the size of one of her elbowz,2016-03-13 03:51:01,199,39,en
"Nancy Reagan inspired AIDS activism, she did not participate in it. The blood of a generation of gay men is on her and Ron's hands.",2016-03-11 21:28:36,328,98,en
This is what I call my B.H. https://t.co/rf47gR59PX,2016-03-11 21:14:18,49,5,en
"We're gonna screen 15 min of new scenes &amp; clips from Season 2 of @difficultppl at Paley Fest next week, so buy tix! https://t.co/WuoH6ssQU8",2016-03-11 18:43:41,26,5,en
"Sarah Paulson told Terry Gross she would only watch herself on the OJ show once the ""hoopla doopla doo"" died down. Anyway have a great day.",2016-03-11 15:19:50,164,14,en
That's from the schmoo wiki. I didn't make this up.,2016-03-09 20:55:40,26,3,en
"Schmoos love being eaten. They will throw themselves into frying pans &amp; ""if a human looks at one hungrily, it will happily immolate itself.""",2016-03-09 20:55:25,45,4,en
Grimace was a Schmoo.,2016-03-09 20:53:28,31,8,en
Why isn't there more Schmoo roleplay/cosplay? Why isn't tumblr abuzz with young people pretending to be Schmoos?,2016-03-09 20:53:20,31,6,en
Do millennials know what a schmoo is?,2016-03-09 20:41:06,47,6,en
What if Lady Gaga play Hulk HOgan when Ryan Murphy turn his trial into American Crime Story,2016-03-09 17:14:59,96,18,en
Go ahead and run Trump so @HillaryClinton can hold up his scalp the way his sociopath piece of shit son held up his hunting trophies.,2016-03-09 16:05:07,173,18,en
Is me rn https://t.co/rQ4XMsGCjV,2016-03-09 01:48:57,12,0,en
#MTVMovieAwardsSoWhite,2016-03-08 15:35:55,62,6,und
Set RuPaul's Drag Race and Better Call Saul as priority recordings and now my DVR thinks I'm a straight couple :(,2016-03-08 12:52:39,184,13,en
#PattonPaleyPeople https://t.co/74KZeVP7qL,2016-03-07 20:53:27,3,0,und
OMG! @pattonoswalt will be moderating the @difficultppl panel at the Paley Festival in LA on 3/18! Tix: https://t.co/74KZeVP7qL,2016-03-07 20:51:45,19,3,en
by @jacquelinenovak!!! &gt;&gt; How to Flake Out on Plans If You're Depressed https://t.co/o5RoptB8jx,2016-03-07 19:04:04,41,7,en
Protein Bistro Box Slut,2016-03-07 16:43:28,45,8,de
What kind of psychopath sells me a laser pointer without batteries included?????? #sadcatstory,2016-03-07 00:49:53,100,4,en
"So grateful to breathe the same air as a living Larry Kramer on the day Nancy Reagan died. Ding the fuck Dong, Friends of Dorothy.",2016-03-06 18:00:07,330,60,en
"The foresight of the Reagans! Coining the term ""Welfare Queens"" knowing that racist, victim-blaming misogyny would define the GOP one day?",2016-03-06 17:58:54,285,71,en
"Losing some followers today, but the right followers.",2016-03-06 17:52:32,386,4,en
"I'm awful, right? It's almost as tho' I let a generation of gay men perish while my husband and I turned our heads! https://t.co/4vAG4f8ein",2016-03-06 17:50:01,365,61,en
"Lady Macbeth whispering ""don't fund AIDS research. Amp up the racist drug war. Deregulate Wall Street criminals"" to a Spitting Image puppet",2016-03-06 17:33:45,252,73,en
"Kinda fucked up The Blowjob Queen of Hollywood didn't lend a scaly hand to her fellow deep throating queens during the AIDS crisis, no?",2016-03-06 17:30:10,314,64,en
Now republicans gonna compete to see who loved Nancy more. Throwing themselves at a skinny bitch like some f'ed up SABRINA,2016-03-06 17:24:02,136,18,en
Billy Wilder's suicide jokes were the opposite of sweaty bc he knew the struggle of living was as ridiculous as arrogant escape misfires,2016-03-06 03:21:44,47,3,en
I have a very complex mental relationship with Stacy London.,2016-03-06 02:29:26,180,13,en
"Rest in peace, wonderful @QuiltingMuriel. My heart breaks. xxxx",2016-03-05 20:35:09,46,6,en
Click here to witness the chemistry between Gwyneth Paltrow and Jimmy Fallon AKA the comedy version of ammonia and bleach!,2016-03-05 16:23:45,131,13,en
My queendom for a pretzel croissant.,2016-03-05 16:22:41,76,4,en
I'm not picking on Bernadette Peters. I've ALWAYS #FeltTheBern. Lookit my BG! I just think she should let herself eat a non-dog potato!,2016-03-04 21:25:58,119,8,en
"Fav if you think Bernadette's ""Dove Bar Friend"" is Donna Murphy. RT if you think it's Elaine Paige. https://t.co/bqUFVh2Afz",2016-03-04 18:28:58,85,9,en
"ICYMI: Bernadette Peters blames Sunday in the Park with George for her exercise bulimia, doesn't need a cheat day. https://t.co/bqUFVh2Afz",2016-03-04 18:18:27,101,15,en
Was enjoying my croissant until I remembered that Bernadette Peters was horrified at a family dinner when her dad brought out a watermelon.,2016-03-04 17:26:04,165,13,en
"That's a picture wrap on Julie Klausner and a wrap on #DifficultPeopleSeason2, coming to a @hulu near you this summer. ❤️",2016-03-04 02:09:02,164,3,en
Bernadette Peters doesn't keep crackers in her house.,2016-03-03 23:48:34,100,14,en
Last day of PRINCIPLE PHOTGRAPHY on #DifficultPeopleSeason2 and I'm already verklempt… https://t.co/qhGvzl7mf0,2016-03-03 16:09:02,21,2,en
Terry Baskmas!!!! Louie Anderson on Fresh Air???! 🙌🏼🙌🏼🙌🏼,2016-03-03 01:44:31,25,1,en
Me and samstunts doing some crazy physical comedy for #DifficultPeopleSeason2! 🏅🏅🏅 https://t.co/Rrfg5yRenV,2016-03-02 18:24:06,23,2,en
Trump/ Christie: Bully Nation.,2016-03-02 02:41:56,132,32,en
"The Nina Simone doc is so much better than AMY, FYI. Must watch if you haven't already. NOT TO WOMANSPLAIN",2016-02-29 17:30:26,133,7,en
"When @MichaelKeaton came onstage at the end of the ceremony and he was chewing gum, it made me #horny. Good night.",2016-02-29 05:34:57,299,33,en
Neil Patrick Harris Oscars 2015 Opening ceremony Moving pictures Opening Musical Oscars 2015 - YouTube https://t.co/04MMH7eO14,2016-02-29 05:18:48,17,0,en
"That was awful. You are all insane. Signed, your cranky mom.",2016-02-29 04:19:42,196,23,en
👀,2016-02-29 04:17:56,34,0,und
Has anybody seen my puka shell necklace with the skull and crossbones on it?,2016-02-29 02:50:44,203,32,en
I have logged on to express my extreme rage twd Rachel McAdams's dress. It look like a robe and the 90s neckline &amp; everything else I hate it,2016-02-29 02:38:20,82,6,en
Pity that the Rooney sisters died of consumption 200 years ago in that dusty mansion. They would've loved watching their ghost selves thrive,2016-02-29 00:25:20,452,134,en
Rooney Mara is clearly a ghost no longer interested in concealing the fact that she is a ghost.,2016-02-29 00:21:41,426,165,en
Let's see some fucking dresses.,2016-02-29 00:09:35,147,55,en
Peeps bullying me about my having never seen Breakfast at Tiffany's til now- I was too busy watching The Beaver Trilogy &amp; Nick Zedd's oeuvre,2016-02-28 19:23:17,42,2,en
BITCH STOLE MY LOOK #Scamilton https://t.co/Gdjo2Kpjqp,2016-02-28 19:10:46,50,3,en
WHY DID NONE OF YOU TELL ME ABOUT THE CAT STUFF AT THE END OF BREAKFAST AT TIFFANY'S? Now I'm in tears like some basic white bitch,2016-02-28 18:46:59,148,13,en
"Also, Mickey Rooney was offensive in EVERY ROLE. He stunk.",2016-02-28 17:59:03,71,4,en
"Breakfast at Tiffany's is to me what Rushmore is to @scharpling-spawned so much crap &amp; so many basic bitches, I can't judge on its own merit",2016-02-28 17:58:45,71,5,en
Baby's first transphobic Instagram comment!!!!!!,2016-02-28 17:56:20,95,10,en
So Bernie Sanders gets a visit from Pussy Riot. I bet Hillary can get all 3 of these OG's on the phone in minutes. https://t.co/mVuU6oK6yj,2016-02-27 20:28:02,168,25,en
"#NotAllWhiteFeministsOfAllHairColors""",2016-02-27 17:19:22,30,2,und
Genuinely sad that tomorrow is the last day @_juliannemoore will be reigning Best Actress. I feel like I will on Obama's last day in office.,2016-02-27 17:01:42,184,40,en
Ooooooh I hope I get to see @_juliannemoore wearing the red carpet dress tomorrow I think she is gonna wear!!!!!!!!,2016-02-27 17:00:46,23,1,en
Nobody wants to talk about how there was a Jonathan Franzen quote on my takeout bag from Chipotle yesterday.,2016-02-26 21:11:25,143,12,en
I blame @scharpling @APMike @sonicdork @kristencheeks @1800PATBYRNE for my being at Chipotle right now,2016-02-25 18:10:22,64,6,en
Here is a context-free photograph of me and @billyeichner shooting a scene from… https://t.co/e5nmDLY7x7,2016-02-25 16:07:36,31,5,en
When it's easy to choose https://t.co/mGsgJfRLeb,2016-02-25 03:41:33,170,12,en
https://t.co/0fzPxnhurn,2016-02-23 22:56:02,44,2,und
"I was listening to a podcast and one of its 2 male hosts said ""you know, my whole thing lately is being grateful.""",2016-02-22 12:47:02,150,6,en
No shade like the shade of Terry Gross not laughing at a joke her guest has just made,2016-02-21 16:13:03,553,124,en
Usually I think of myself as a crusty cynic who can only feel envy but then I think about the lyrics to Sunrise Sunset &amp; realize I am crying,2016-02-20 17:51:48,97,19,en
I'm excited to watch #DarbyForever because I am a #fan of @aidybryant and I think she is #cool and #funny.,2016-02-20 17:40:34,94,4,en
"You know what? I'm retracting my apology. I wrote a Queen song parody about eating pie and being called ""Mrs. Cellulite"" &amp; I'm awesome.",2016-02-20 17:32:32,88,4,en
"I'd like to publicly apologize for my ""Don't Stop Me Now"" parody about pie and eating pie. Not all of my tweets can be winners. Thank you.",2016-02-20 17:30:21,50,3,en
"I'm burnin' through this pie yeah
It's all crust and cream
That's why they call me Missus Cellulite",2016-02-20 17:08:55,73,7,en
"There are two kinds of people- people who look good when they're at the beach, and me.",2016-02-18 15:16:07,98,16,en
I love how @broadcity is Amy's summer show &amp; @difficultppl is her winter show. WAIT- do people not want to see me &amp; Billy in tanks &amp; shorts?,2016-02-18 15:02:42,183,15,en
"I rebuke you, Jesus Christ, in the name of Satan. It's Alice Cooper 'o clock.",2016-02-16 04:12:22,156,18,en
"If Alice Cooper ever G-d forbid passes away, I pray I'll have the opportunity to pay tribute to him, even if it's at the Kids Choice Awards.",2016-02-16 04:02:10,180,11,en
Gaga is ripping off my whole shtick right now.,2016-02-16 03:30:57,177,22,en
"Fun fact about Nancy O'Dell: since her lobotomy, she can only wear her hair to one side of her poor head.",2016-02-16 00:38:17,70,9,en
"Has anyone tweeted about Zendaya serving Ellen Degeneres's ""One Night Stand"" HBO special on the red carpet tonight?",2016-02-16 00:33:42,61,4,en
"Just thinking about JK Simmons using his Oscar speech to say, ""call your mom and dad. Don't text."" What a square. Let's beat him up.",2016-02-14 21:16:51,139,12,en
Where were YOU on Kat Von D and Steve-O's first Valentine's Day together?????,2016-02-14 21:10:12,106,9,en
This PBS Bowie doc is killing me.,2016-02-14 02:37:52,38,0,en
Why are only @natashaleggero and I tweeting about Louie Anderson in @basketsFX???? What the hell is wrong with everybody else????,2016-02-13 22:28:51,88,9,en
I think we can stop asking Charlotte Rampling her opinions about stuff now? https://t.co/ZBxvE8ePxc,2016-02-13 20:23:23,216,27,en
"What if I tweeted ""Gucci is killing it""? That would be off brand right??????",2016-02-13 19:07:22,68,2,en
#nyfw https://t.co/PFAlcNlWxc,2016-02-13 03:26:08,275,31,und
Monday he was almost killed by a Boar's Head truck and today???? What a difference a week makes @billyeichner !!! https://t.co/7t4i39q2i8,2016-02-13 01:59:20,719,55,en
.@billyeichner is getting me a membership to Getty Images for #GalentinesDay,2016-02-12 18:52:10,217,10,en
My apartment is #cold and I want a slice of #pizza. #nyfw,2016-02-12 01:30:16,70,4,en
I rebuke you Satan in the name of Jesus Christ. It's 12:59 PM EST.,2016-02-11 17:59:14,156,15,en
"""we're all Out of African's, really"" https://t.co/WCrb7F8e34",2016-02-11 15:50:48,60,9,en
I rebuke you Satan in the name of Jesus Christ. It's 12:49 AM EST,2016-02-11 05:49:22,144,15,en
Idea: Pauley Perrette cuckoo clock,2016-02-11 05:49:09,162,15,en
I rebuke you Satan in the name of Jesus Christ. It's 12:13 AM EST,2016-02-11 05:13:47,154,14,en
I rebuke you Satan in the name of Jesus Christ. It's 9:59 PM EST,2016-02-11 02:59:58,154,15,en
I rebuke you Satan in the name of Jesus Christ. It's 8:47 PM EST,2016-02-11 01:47:31,135,13,en
I rebuke you Satan in the name of Jesus Christ. It's 7:38 EST,2016-02-11 00:38:23,149,20,en
I rebuke you Satan in the name of Jesus Christ. It's 5:37.,2016-02-10 23:24:02,141,19,en
"And for those of you who don't know why I don't care for Pauley Perrette, she, at one point, tried to get me kicked out of a dog award show.",2016-02-10 21:57:37,230,12,en
I'm so blessed to have followers Pauley Perrette hasn't blocked. You all keep me in the know.,2016-02-10 21:56:37,136,4,en
"""I rebuke you Satan, in the name of Jesus Christ. And yes, I know guacamole is extra.""",2016-02-10 21:54:54,148,31,en
"Just say ""its 5:37.""",2016-02-10 21:53:59,69,6,en
"If ANYONE asks you the time, I don't care if he has his hand on you or not, do NOT answer ""I rebuke you, Satan in the name of Jesus Christ.""",2016-02-10 21:53:46,193,30,en
I'm sorry- my phone is blowing up- did pauley p seriously get attacked by another homeless man????,2016-02-10 21:46:33,150,21,en
#ImWithHer,2016-02-10 02:15:43,170,20,und
"Hello, I watched CARNAL KNOWLEDGE and CRUISING during the super bowl. 

Good night, I'm Julie Klausner.",2016-02-08 03:49:58,239,13,en
I have watched Gloria on bill maher. She said something silly bc she is imperfect. But she is a queen and I love her.,2016-02-07 19:45:24,104,13,en
Google Gloria Steinem before you start talking shit.,2016-02-07 16:53:54,228,47,en
"That buscemi cat is not real, right",2016-02-07 16:13:35,21,0,en
"*walks into a tattoo parlor, hands the artist an adult coloring book* 

""Go to town, maestro. Surprise me.""",2016-02-07 07:02:23,126,15,en
Ass play &gt; Coldplay,2016-02-06 20:19:23,1173,432,en
"Just found out that Terry Gross has an aversion to /fear of oranges, and I'm no longer sure about what is real, true or even happening",2016-02-05 11:07:26,288,34,en
I have no idea why any of us are talking about anything besides Louie Anderson in drag on @BasketsFX,2016-02-05 03:10:14,184,29,en
Happy birthday @RealAliceCooper!!!!!!!!!! I met you once and it was amazing and I love you Amen. https://t.co/gcBybZRK7O,2016-02-04 22:54:37,107,5,en
Can I lose weight if I get the Zika virus?,2016-02-04 02:21:51,135,23,en
"When you bathe a dog and all its smells are gone, they're sad bc you essentially deleted all of their photos and mementos in front of them",2016-02-03 21:26:01,252,64,en
"Rest in Peace, Bob Elliott.",2016-02-03 20:50:39,33,10,en
I wish there was an Olympics for going to the same person over and over again for comfort when they've never once given you that. #GoldMedal,2016-02-02 17:18:50,174,20,en
Who is O'Malley? https://t.co/isRAEraERB,2016-02-02 03:01:21,142,23,en
"Enjoy #GreaseLive but please remember: Olivia Newton-John's husband faked his own death &amp; John Travolta has been sued by over 5,000 masseurs",2016-02-01 00:31:56,531,146,en
Fuck #GreaseLive. I will pay cash money to instead watch Stockard Channing take off her makeup while she drives a car,2016-02-01 00:17:19,333,77,en
"Dear God, in my next life please make me Debbie Harry. https://t.co/pUd7oa7OkT",2016-01-31 21:52:39,84,16,en
"I'm not a bad person, but I sincerely hope tonight's production of GREASE LIVE is interrupted by an earthquake.",2016-01-31 21:35:55,285,43,en
"I sing ""Lemme take a Zantac"" like ""Lemme take a selfie""",2016-01-31 17:45:58,70,12,en
"""Any social interactions we can include for the column?"" ""Sorry, did you not get the part about how I talk to the cat?",2016-01-31 14:49:01,69,8,en
"My Sunday Routine column: I sleep until it's time to eat, then I eat until it's time to sleep. When mouth isn't full of food, I talk to cat.",2016-01-31 14:47:50,232,55,en
"I have a theory that SUNDAY ROUTINE editors send the column back and forth until the subject is like FINE, SOMETIMES I GO TO THE GYM OR WALK",2016-01-31 14:46:55,55,2,en
"I'm convinced the @nytimes ""Sunday Routine"" column exists only to make me feel bad about how lazy I am.",2016-01-31 14:45:20,92,5,en
Is it safe for me to now admit that ROOM made me hungry for #cornflakes?,2016-01-31 02:46:51,74,8,en
Carol Burnett OG power Red. Hendricks in @CSiriano rocking bombshell 60s gold glam.,2016-01-31 02:36:31,34,1,en
"Susan Sarandon, Amy Poehler, Julianne Moore representing The Power of Red tonight.",2016-01-31 02:35:24,98,9,en
Bull terriers have big faces I want to pet.,2016-01-30 16:25:04,53,1,en
Robyn Hitchcock is still a panty dampener!!!,2016-01-30 04:38:54,46,2,en
"Before celebs could tweet that they thought butt stuff was gross, they spoke to playboy https://t.co/sBNDFZBX1E",2016-01-29 18:58:57,87,19,en
"Imagine being so freaked out by your own butt you have to take to Twitter to ""set things straight"" 👀",2016-01-29 18:53:36,234,42,en
"Historians will trace the decline of my sanity around the day I, when speaking to my cat, began to call myself ""Mama Cat"" in the 3rd person.",2016-01-29 05:01:23,255,29,en
I hate that Weird Al always poses for pictures with that particular facial expression,2016-01-29 04:56:52,100,5,en
"Joke's on you, Twitter!!! While you were live tweeting the debate, apparently, I was eating a baked potato with my bare hands!!!!!",2016-01-29 04:55:54,167,14,en
Very proud to brag that BOTH queens of the Redhead Hall of Fame are appearing in Season 2 of @difficultppl 🙌🏼,2016-01-28 17:01:19,94,3,en
Now is as good of a time as any to remind everyone that we all have butts and we all like or do butt stuff and it's great!,2016-01-28 00:22:48,209,35,en
Thank you @AndieMacDowell3 for your timeline today.  🙌🏻,2016-01-27 03:08:00,43,1,en
Malin Ackerman as Debbie Harry plus Zosia Mamet as Patti Smith equals ISIS?????,2016-01-26 16:42:35,68,3,en
"Fuck y'all I'm voting for Larry Sanders. Hank VP, Artie SoS",2016-01-26 13:53:26,84,17,en
Made it to the part of THE MARTIAN where Matt Damon grows his own potatoes and then I decided to lie in bed until I got tired instead,2016-01-26 11:41:23,192,15,en
Tian Tian needs a Bath Bath,2016-01-26 01:59:32,54,3,en
I trust neither Todd Solondz nor the Bros. Duplass with the subject matter of ANIMULES.,2016-01-25 23:21:48,41,1,en
"Miley is dodging texts from Wayne Coyne today like ""I thought I was ur only dirty old man, why you gonna go and Woody Allen me?""",2016-01-25 23:20:15,142,46,en
Yes mine too RT @MarthaStewart: My peafowl have a new and expanded pen.,2016-01-25 14:28:01,95,19,en
David Bowie: On Writing Flight of the Conchords’ ‘Bowie’s in Space’ | The Spinoff - https://t.co/IBMthZXVnm,2016-01-25 14:25:41,48,25,en
Amazing woman weighs in on my TV show West Side Rag » ARE THEY REALLY GOING TO MAKE PEOPLE MOVE THEIR CARS - https://t.co/FkRhRyC8De,2016-01-25 02:05:53,20,0,en
Need a Germanic term for the specific wave of self hatred/ shame u experience when you bite your inner lower lip AGAIN while you're eating,2016-01-24 21:19:51,98,12,en
Help? https://t.co/Kk5AzFPFXv,2016-01-24 02:21:56,63,2,en
"Tips for others saving for an extension- instead of buying the kitties new goodies, change their names! #NekoAtsume https://t.co/GP250715pU",2016-01-24 02:18:47,45,5,en
"Hearing Toni Morrison saying the word ""fecund"" on Fresh Air is the closest I've ever felt to experiencing comfort and joy",2016-01-23 20:15:29,107,11,en
Dirty Panda &gt; Dirty Grandpa,2016-01-23 19:35:04,67,7,en
Praying for more @ColeEscola cake pan grocery tweets,2016-01-23 19:16:41,24,0,en
Thanks u @idiotsitter &amp; @basketsFX for replenishing the metaphorical goodies in my DVR's yard. #NekoAtsume,2016-01-23 16:27:08,41,1,en
"Oh my god, @basketsFX yes.",2016-01-23 05:01:28,60,2,en
"I am tweeting now to recommend you watch IDIOTSITTER with the divine @jilliandeltoro, bc I watched it &amp; LOL'ed like I could still feel joy!",2016-01-22 18:50:42,82,9,en
American Horror Story: Sarah Palin's Leather Jacket,2016-01-21 21:16:28,224,65,en
OMG @bejohnce was born today??? this is huge. @ColeEscola any comment?,2016-01-21 15:33:25,23,1,en
https://t.co/jY9gG93hhD,2016-01-21 15:15:34,111,3,und
Crying https://t.co/7jpmsaaTKF,2016-01-21 15:13:07,22,4,en
https://t.co/cLSbOj9TsA,2016-01-21 15:11:27,93,3,und
"Thanks to all who have sent letters, flowers and food baskets in regards to the CATS revival news. I am over the moon and so is my family.",2016-01-21 15:00:48,90,11,en
"The only thing @amyschumer has stolen is AMERICA'S GODDAMN HEART. Go back to popping boners over cat torturer Steven Avery, garbage web.",2016-01-21 01:19:26,248,40,en
Is me https://t.co/ZoY0fLaqVl,2016-01-20 20:03:23,119,6,en
"Anyway, I don't sleep much anymore.",2016-01-20 11:56:31,32,2,en
"Altho maybe now that I think about it, he only THOUGHT. A monkey stole his glasses bc he was drunk? No. That's not how vodka works.",2016-01-20 11:56:15,35,1,en
Nobody is talking about how Michael Caine used to drink a bottle of vodka a day and how one time in India a monkey stole his glasses,2016-01-20 11:55:44,104,17,en
"Well I wasn't sure about watching VINYL but now that I know Ray Romano is n00d in it, my DVR's body is ready #itsNotTV",2016-01-20 11:54:47,59,0,en
What the fuck https://t.co/1QoFbIu5fE,2016-01-19 23:18:54,98,6,en
"Honestly, if that monkey was the subject of Mozart in the Jungle, I'd raise a glass of banana juice to the Hollywood Foreign Press.",2016-01-19 17:14:23,34,3,en
