text,created_at,favorite_count,retweet_count,lang
If HGH would allow me to play professional sports you could stick a needle in every square inch of my body including the tip of my dick,2015-12-28 23:44:00,15,3,en
https://t.co/rrn7alWKNA,2015-12-28 02:26:28,64,8,und
Why do my in-laws look like they're about to get caught up moving coke in a Scorcese movie https://t.co/c7KjCTAES0,2015-12-28 01:54:37,83,11,en
My in-laws take turns opening gifts one at a time and say thank you like some super polite Von Trapp nightmare and I'm about to lose my shit,2015-12-27 21:00:17,70,9,en
My mother-in-law's text alert is an entire song. Starting to think my father-in-law's rage isn't really from Vietnam.,2015-12-27 15:39:28,417,111,en
"Anyone wanna get drunk in the Atlanta airport? Wife said ""wow you'll get drunk w anyone"" and my NY's resolution is to accept encouragement",2015-12-27 03:24:07,41,1,en
Why even write a review of Point Break? Who's it for? High art connoisseurs who were on the fence? Shit blows up. We're on board.,2015-12-27 01:11:59,26,3,en
"Jeb Bush, shitty presidential candidate, mildly fun dad https://t.co/EttZzpTkB9",2015-12-27 01:01:12,35,3,en
On my way to Florida for New Year's. Gonna cut my jeans into jorts in the plane bathroom.,2015-12-26 22:59:48,33,4,en
Hoverboards should come with a helmet that somehow compounds head injuries.,2015-12-26 22:07:51,32,12,en
Just learned that dogs can be Russian too https://t.co/drynevwxPv,2015-12-26 19:29:16,28,2,en
When you see a beautiful girl across the room who's factually wrong about something https://t.co/MEN9LlFOET,2015-12-26 17:12:36,92,19,en
Before twitter you would write your political jokes on onions and throw them at politicians as their carriages passed.,2015-12-26 16:13:37,53,7,en
"New porn movie idea ""Really Good Fellas"" starring Gay Liotta. Save to Notes. Siri why is Twitter open",2015-12-26 01:24:41,39,6,en
George Will is a shiity person but a good writer and this is the best summary I've seen of Trump https://t.co/jhkFy5nWCw,2015-12-26 01:18:18,62,25,en
"Mom got my sister's kid an electric guitar and a harmonica. That's mom for ""fuck you, you were an awful child.""",2015-12-25 20:16:28,37,2,en
The main thing you need to be a good uncle is the ability to take a Nerf bullet to the dick.,2015-12-25 18:54:29,189,43,en
Condolences to everyone this week who slept with a high school acquaintance who they'd spent their whole life avoiding sleeping with.,2015-12-25 18:14:51,84,11,en
What are thoooooose https://t.co/422bqCqXMm,2015-12-25 14:23:36,23,2,en
"Did you know there is a Kidz Bop version of ""Watch Me Whip/Nae Nae?"" There is, because life is unrelenting torment.",2015-12-25 14:18:22,263,88,en
Santa you son of a bitch https://t.co/pZMpKmhw8e,2015-12-25 13:09:43,29,5,en
Santa basically had all those reindeer harnessed into a Reindeer Centipede. Happy holidays.,2015-12-25 02:59:30,21,3,en
My niece has discovered humor. She's the leading comic of her generation. https://t.co/rlcYH6zIV8,2015-12-25 02:08:24,20,2,en
When Christmas dinner with the fam is going good but then everybody's liquor kicks in https://t.co/2ghNRUGGmK,2015-12-25 00:30:55,34,13,en
Told the nephew if he behaved in church we'd do one thing he wanted. Now he wants to set the couch on fire. Fucker found a loophole.,2015-12-25 00:09:02,63,16,en
Imagine how much more fun society would be if the 2nd Amendment said instead of using guns we had to HOME ALONE the hell out of burglars,2015-12-24 20:18:57,27,2,en
"""These ho ho hoes ain't loyal.""- Kris Brown Kringle

Do they hang tweets in the Guggenheim?",2015-12-24 18:24:44,20,5,en
Showed my nephews all of the Star Wars movies and the consensus was that Phantom Menace was the best. ISIS come quick please,2015-12-23 22:47:38,42,7,en
That's the actual Bublé that's been singing live into your mall intercom for the last month. He desperately needs sleep.,2015-12-23 20:13:57,13,5,en
Aaron Hernandez joined the Bloods because he wanted to be a part of an organization less corrupt than the Patriots. (Put me on FIRST TAKE),2015-12-23 18:09:24,109,75,en
"""The 12 Days of Christmas"" is the story of a woman being harassed by a guy who's way too into birds",2015-12-23 16:36:35,26,4,en
Movies have taught me that yoga classes are mostly women talking about boys and boy problems and being shushed by the teacher.,2015-12-23 16:12:23,35,5,en
"The most likely explanation is that Trump walked in on his employees calling him ""schlong"" and they concocted an elaborate definition",2015-12-23 15:43:24,29,3,en
"Dude at the bar, earnestly: ""Worst part of the whole Steve Harvey thing is that it really affects his credibility on the Family Feud.""",2015-12-22 23:21:30,43,6,en
I feel like every New York City ghostwriter is booked right now by prostitutes racing to get books out about Trump.,2015-12-22 17:21:31,24,6,en
Check out the mustache Trump's dad was sporting in the 1940s https://t.co/4vtPSZBrf4,2015-12-22 14:40:00,18,4,en
Trump's dad looks like the villain in a Three Stooges movie https://t.co/1AC21orTCP,2015-12-22 14:28:28,41,5,en
"Neil deGrasse Tyson disproving the physics of ""The Santa Clause"" with a 1,000-tweet rant about Newton's third law of thermodynamics",2015-12-21 23:28:10,30,1,en
The good news is that Steve Harvey wears a peel-off mustache that covers 80% of his face for just such a situation,2015-12-21 23:06:53,16,4,en
"Neil deGrasse Tyson at your funeral telling your kids ""actually, there's no heaven.""",2015-12-21 21:45:21,273,91,en
I know your baby just got here but we already hate them https://t.co/tW1u0mC6ln,2015-12-21 18:34:13,41,10,en
Another way to make beauty pageants more fair would be to just not hand out a bunch of money to people who arbitrarily have facial symmetry,2015-12-21 17:39:04,52,19,en
The only reason I assumed Hermione is white is because she's lame as fuck,2015-12-21 16:20:30,10,3,en
Today my MRA group is open-carrying down to orphanage and handing out toys to just the boy orphans.,2015-12-21 15:55:02,19,3,en
Steve Harvey just wished everyone a Merry Christmas today.,2015-12-21 15:50:39,17,2,en
This ISIS commander talks like Trump https://t.co/2XRmeP2Dqg,2015-12-21 14:32:00,17,1,en
Fuck it let's let Steve Harvey swear in the next president.,2015-12-21 03:58:21,59,14,en
When someone accidentally faves your tweet then unfaves it https://t.co/m1gGaCRSEe,2015-12-21 03:44:46,56,20,en
https://t.co/WQANyQrrQS,2015-12-20 18:06:19,38,8,und
My sister just told me she recently got kicked out of a Lane Bryant because her kid wouldn't stop rubbing the tits on the mannequins.,2015-12-20 17:36:08,106,10,en
The worst part about having sex with Johnny Depp is he spends the first two hours just taking off bracelets.,2015-12-20 16:32:29,159,39,en
I asked my mom if there was a green vegetable in the house and she looked at me like I was trying to explain the joys of Scientology.,2015-12-20 15:58:21,33,4,en
I've already seen Episode VIII. I'm about to spoil shit y'all haven't even heard of yet.,2015-12-20 15:31:30,13,1,en
My nephew just made a very unconvincing case for why I should smell his earbud,2015-12-20 14:39:49,21,0,en
"""I know this is hard, but I need one of my employees to-""
*40 hands go up* https://t.co/TOV9Gduqj2",2015-12-20 14:35:00,25,7,en
If your family doesn't store most of their possessions in old Crown Royal bags we probably won't understand each other.,2015-12-20 14:20:30,43,8,en
I'm not watching the debate does Bernie sound like he ran out of his lab and is warning everyone he lost control of his doomsday device,2015-12-20 02:22:37,42,3,en
"STYLIST: how can I help you
TED CRUZ: yes I think the look I'm going for is called the ""step dad named Gary"" https://t.co/Eal4GXB60T",2015-12-19 21:14:05,63,18,en
Nephew proving swag is genetic https://t.co/tPdlOzZ5Dk,2015-12-19 20:42:32,12,2,en
Bernie Sanders warming up for the debate by saying different percentages in random order,2015-12-19 18:44:35,15,2,en
"""Jerk store called,"" Mr. Bush said. ""Mr Trump said 'we're all out of jerks' no wait that's now how it goes, oh gosh"" https://t.co/GhsZSS68u8",2015-12-19 18:15:28,29,8,en
"Guns are like dental dams. Yeah they make you feel safe, but if you feel you need one you probably shouldn't be in the situation you're in.",2015-12-19 17:41:04,104,35,en
The weird thing is that SHKRELI would've been a pretty dope Wu-Tang name,2015-12-19 17:37:58,32,8,en
Almost got in a fight at the airport because my wife called a guy out for cutting in the TSA line. Happy holidays.,2015-12-19 13:12:12,38,2,en
This dude taping shit back together is not the best ad for WestJet https://t.co/c7JbwQUkab,2015-12-19 12:18:34,24,0,en
DECLARATION OF WAR: I'm starting a 99₵ Shave Club,2015-12-18 21:50:19,21,3,en
You ever been so tired of shopping you don't care where you lean? https://t.co/Uu3dQSzDu3,2015-12-18 20:13:25,33,6,en
"My favorite holiday is ""@Mobute in @RollingStone Day"" https://t.co/8j50nH5pgw https://t.co/Sv9rRdi7gN",2015-12-18 17:15:25,6,0,en
How does Trump get off presenting himself as a tough guy? He went to prep school and I bet if you punch him he'd pop like a zit.,2015-12-18 17:06:10,32,2,en
Airbnb is just a ruse for property owners to covertly record video of people masturbating,2015-12-18 16:16:13,10,1,en
"At this point would Huey Lewis' kidnapping even be of any interest to The News?

Put this tweet straight into the Louvre",2015-12-18 15:40:16,17,4,en
NYC is the world capital of men carrying dogs like babies,2015-12-17 23:44:47,14,1,en
Please stop putting that Shkreli perpwalk pic in my timeline it's hard to walk around with this boner,2015-12-17 19:11:36,33,5,en
They should auction off the right to be on Shkreli's jury so RZA can pay $2 million for it,2015-12-17 18:58:09,92,24,en
".@neiltyson at your planetarium no mention of how Jesus rode dinosaurs, zero stars",2015-12-17 18:02:31,13,2,en
When you realize they were totally fine with you being above the law until you talked too much shit https://t.co/sOJEDC8dQF,2015-12-17 16:57:23,34,8,en
"Trying to fit in in NY just yelling ""GABAGOOL"" every third word. So far none's the wiser",2015-12-16 19:59:25,20,0,en
Wife made color-coded folders of plans of vacation activities. Someone remember this for our divorce proceedings https://t.co/RUUjJqxSDT,2015-12-16 17:31:20,32,4,en
"Future historians are going to look back and wonder how ""liking Star Wars"" became a whole genre of person.",2015-12-16 16:12:33,80,18,en
"""Best thing about Star Wars? That Ewoks Saturday cartoon,"" he said as millions of nerd voices cried out in terror and were suddenly silenced",2015-12-16 16:09:19,18,1,en
"Keep thinking talent's a thing, but George Lucas only begrudgingly wrote STAR WARS bc he couldn't get the rights to remake FLASH GORDON",2015-12-16 15:36:14,19,1,en
"Yo I'm in NY for a couple days, is there anything to do in this hick ass yokel burg",2015-12-15 22:31:37,26,0,en
Of you course tell your kids there's a Santa. Children should learn young that even the people who love you will lie in order to manage you.,2015-12-15 21:15:44,63,22,en
We make fun of Millenials for making up words as if it wasn't some corny ass old person who made up the word Millenial.,2015-12-15 02:30:43,49,10,en
A fun thing would be for Trump to choke to death on a pork chop the day his doctor announced his perfect health.,2015-12-15 00:48:40,34,4,en
Tomorrow I'm leaving town for three weeks and I'm very excited because that means today I have to eat all the food in the refrigerator.,2015-12-14 19:10:27,64,12,en
https://t.co/gEtUsQxujB,2015-12-14 05:12:20,30,11,und
Hate so strong https://t.co/szOrsA3fGA,2015-12-14 05:05:38,23,5,en
Over-policing in communities of color has become a serious problem that needs to be addressed https://t.co/OplEhAzkT3,2015-12-14 04:41:51,28,8,en
Cops arresting rappers on weed charges seems like too much of a layup. Just way too easy. It's like comics giving it up for the troops.,2015-12-14 04:37:47,29,5,en
"Sorry TV news you need to recast the parents of the mosque arsonist, too on-the-nose https://t.co/nDXiZBK3YI https://t.co/B3YVfItvdp",2015-12-13 18:57:08,23,8,en
This my favorite headline because I'm imaging Ted Cruz went back in time to blow Trump https://t.co/7ekz2dUQxU,2015-12-13 18:23:25,59,9,en
"I'm only medium into Star Wars, so this week is a win/win. Either the movie is good, or a bunch of nerds will cry, which is also good.",2015-12-13 04:40:06,79,28,en
"I've been watching Youtube videos of people doing magic tricks for chimps for seven hours, what did I miss",2015-12-13 04:36:07,28,2,en
The neighborhood's not sure what to make of my nativity scene of RealDolls,2015-12-12 23:57:04,26,4,en
A town that is not cartoon Springfield rejected solar farms for the following reasons https://t.co/JcP09uuMOQ https://t.co/yKQvHOATbK,2015-12-12 19:14:24,2334,3609,en
"Don't know why but I google image searched ""karate Santa"" and man there's a stock photo for everything https://t.co/fMGc83rYqv",2015-12-12 17:01:59,38,7,en
"Benedict Cumberbatch looks like a police sketch of an emo Easter Island head, but sexy",2015-12-12 05:14:52,109,17,en
The Warriors are 24-0. Imagine having 24 effective days at work in a row. I've never strung 3 together.,2015-12-12 03:53:34,29,17,en
"Everything I know about Judaism I learned from ""Seinfeld,"" Sandler's Hanukkah Song and that House of Pain joint where they light a menorah",2015-12-11 21:52:36,21,5,en
"An ""It's a Wonder Life"" remake were Trump is showed an alternate reality where he loves and is loved by others but doesn't see the appeal.",2015-12-11 21:31:32,19,5,en
"If you trip a little, don't play it off. Fall all the way down. It will bring everyone who sees it so much joy. Think of others.",2015-12-11 21:07:27,106,90,en
"Going to go out on a limb here. Some problems are yours, and the world shouldn't fix them. https://t.co/vGjz5yY61d",2015-12-11 06:30:49,40,14,en
It's weird you legally can't be president if you were born overseas but you can if you've participated in this https://t.co/aMbWsFJDJI,2015-12-11 04:36:58,163,94,en
"It is clear that this lady, donning a fake mustache, has replaced El Chapo https://t.co/loE1Anl3RT",2015-12-11 03:09:09,20,1,en
"Money can't buy you happiness. No wait, that's wrong. Money can't *necessarily* buy you happiness. It's possible you're a really bad shopper",2015-12-11 03:00:30,17,4,en
The guy behind me in traffic is literally just honking at the concept of waiting,2015-12-11 01:58:34,88,17,en
You ever feel like you're the Heathcliff to everyone else's Garfield,2015-12-11 01:22:20,15,1,en
"Yes I went through your medicine cabinet, but I was just looking for shit to steal. I'm not judgy.",2015-12-10 22:57:08,23,0,en
"DAY 3 - TRUMP PRESIDENCY
REPORTER: Mr President, you have been owned on Twitter. What's your response?
TRUMP: https://t.co/iEejgD4ZMd",2015-12-10 22:01:03,17,3,en
When you realize somebody's blocked you even though you never attacked them... that's how Iraq felt about Bush right?,2015-12-10 07:18:24,25,4,en
"It's easy to shit on Trump supporters, but good-ol'-days syndrome comes for us all. Be vigilant. (Ignore my tweets shitting on hoverboards.)",2015-12-10 06:33:04,14,1,en
"Curb the use of those hoverboard things by calling them ""Stand-Up Rascal Scooters."" Join the movement.",2015-12-10 06:23:28,27,2,en
How's Trump gonna be president when he can't even figure out how to tan without leaving the goggle lines,2015-12-10 04:35:24,49,11,en
All the candidates ducking and hoping someone else make Trump go away are showing real leadership.,2015-12-10 02:27:01,38,13,en
"Old dude at the coffee shop asked another guy if he had ""permission to compliment the lady"" (she ain't w him) and all hell is breaking loose",2015-12-10 00:29:39,40,5,en
All I want in life right now is to be a part of a mob that's chasing Martin Shkreli with pitchforks,2015-12-09 23:46:26,24,3,en
"SCIENTIST SCHOOL - DAY 1
""OK so that's how you pretend there's climate change. The next 7 years until graduation we just kinda hang out.""",2015-12-09 23:35:18,32,4,en
The only way to explain why all these people are still running for president is if you die in the Republican primary you die in real life.,2015-12-09 23:07:37,26,6,en
"*Martin Skreli awkward rapping in his underwear
♬""Cash Rules Everything Around Martin, C.R.E.A.M! Get the money! CANCER CANCER DRUGS Y'ALL""♬",2015-12-09 17:16:07,11,1,en
The logical end to this year is RZA beating up Martin Shkreli,2015-12-09 16:16:47,16,4,en
"Ok a story. I'm from a small town and was prob a lil Islamophobic. My freshman roommate was Pakistani, devout, prayed 5 times a day, etc...",2015-12-09 15:50:08,30,7,en
W. seriously lowered the bar for what presidents should sound like https://t.co/07XcPEY8gq,2015-12-09 02:51:36,27,2,en
"Serious question: do you guys think that me, Steph and the first 3 people to fave this tweet could hold this lead? https://t.co/I11fCfRzTA",2015-12-09 01:49:12,19,3,en
The Warriors are a fire emoji on meth and six Viagra.,2015-12-09 00:38:36,10,1,en
"I didn't see the merits of this person's political argument until they yelled ""WAKE UP!"" at the end of it, now I'm on board",2015-12-08 23:26:03,80,34,en
Remember when Americans had jobs making cars and shit https://t.co/CFFOIPoqbz,2015-12-08 23:16:01,97,28,en
"TRUMP: Muslim kids must bring lunch from home on pizza day
OLD DUDES IN CROWD: WOO (*while taking their shirts off and spinning them around)",2015-12-08 22:42:08,53,18,en
Milligan pulls up at a shootout and waits for his driver to open the door for him. FARGO is the goddam best.,2015-12-08 21:10:37,12,0,en
This dude @Mobute is very adept at taking words and putting them in an order that is good https://t.co/QhczTcATFh,2015-12-08 20:40:34,8,0,en
I think we're out of movie villains to compare Trump to. We're down to the Monstars and dude can't even hoop.,2015-12-08 17:01:29,20,7,en
"Can Saudi Princes still come to traffic women w the lure of a modeling contract?
TRUMP: Of course I love sex trafficking
*crowd goes apeshit",2015-12-08 16:20:45,19,5,en
"First they came for the Muslims. And I was like ""Ha ha, Donald Trump is hilarious, ironically.""",2015-12-08 08:00:43,61,21,en
We'll tell our grandkids about the night Kirk Cousins and Matt Cassell faced off at the top of their primes.,2015-12-08 04:39:57,16,3,en
Imagine Trump's orgasm face. I feel like it's like 'Alien' where he opens his mouth and a smaller Trump head comes out and opens its mouth.,2015-12-08 04:03:06,59,9,en
If Cowboys-Redskins goes to OT both teams should be forced to play in some fourth-tier college bowl game.,2015-12-08 03:53:48,19,8,en
Perhaps the best evidence for America's greatness is that Melania is willing to have sex with Trump to stay here.,2015-12-08 03:35:40,35,7,en
When this is all over we'll find out it was all because Trump made a $1 bet with another rich dude that he could ruin Jeb's life.,2015-12-08 02:09:11,177,74,en
My sister put my 8-year-old nephew on the phone to say he wants to be a writer like me and I told her to put him in military school.,2015-12-07 23:44:36,30,4,en
I'm having fun imagining the series of events that led a person to abandon this lone Croc at the gym https://t.co/7wAdQV5AuC,2015-12-07 22:38:44,39,2,en
"""My Bartender Hates Me"": a Lifetime movie of my life story.",2015-12-07 04:18:58,14,1,en
I hope Obama uses his Oval Office speech tonight to address what is or is not an NFL catch.,2015-12-06 23:26:55,225,125,en
"NEIL deGRASSE TYSON: Actually the plural of Wookie is ""Wookie."" It's like moose.

DOCTOR: ... I just told you that you have a month to live.",2015-12-06 23:16:15,37,14,en
Why does Ted Cruz always look like a plastic Ted Cruz somebody put in the microwave,2015-12-06 19:05:26,165,40,en
I have found the oldest person in the world https://t.co/AtIYEGiyNb https://t.co/XysYn0IyO3,2015-12-06 18:34:35,38,10,en
Kardashian baby's 14 hours old and already has a table at 1Oak,2015-12-06 03:32:21,15,1,en
White privilege is having the free time to invent so many kinds of new beards.,2015-12-05 21:09:11,29,7,en
That face at the end. My old dog Butterscotch would make that face when she accidentally sat in her water bowl. https://t.co/auxZPFYbIX,2015-12-05 18:17:30,24,10,en
I actually admire bitterness as a personality trait. Cruz's college roommate constantly yelling this shit is my hero https://t.co/1PQVdRfrN1,2015-12-05 08:35:28,160,58,en
After midnight PST. Late night confession time. I'll go first. I started ISIS as a frat at my college.,2015-12-05 08:24:12,16,0,en
I will do the Bartman on your grave,2015-12-05 06:49:27,23,6,en
*reads 20 words of Hunter S. Thompson once* https://t.co/8LZe1yy7C5,2015-12-05 06:35:22,269,94,en
LOVE ACTUALLY is the most heartwarming holiday movie about trying to fuck your buddy's wife.,2015-12-05 05:33:41,35,8,en
"My bad guys, there is no 'Donald Trump.' It's just a pile of used bubble gum I stuck dentures in. It was fun but it's gone too far.",2015-12-05 05:24:34,39,8,en
The NBA has real life Yakov Smirnoffs https://t.co/OCHWRBfCDI,2015-12-05 03:28:52,15,7,en
"Tix on sale for @RiotLA! CAN I KICK IT is Sat., Jan 30. Not as my last tweet said, Jan 39, unless you're on Earth 2 https://t.co/uaj0RmDYr1",2015-12-04 21:44:43,11,3,en
https://t.co/7sRx6udlEZ,2015-12-04 20:39:50,59,7,und
"*MSNBC kidnaps the suspects' baby*
""Look, a baby.""",2015-12-04 19:12:15,39,12,en
"TV news basically just accidentally did an episode of ""ISIS: They're Just Like Us!""",2015-12-04 18:38:03,26,13,en
On of these cameras is gonna pan over and a print reporter is gonna be helping himself to a sandwich.,2015-12-04 18:20:14,15,2,en
I remember in journalism school we spent an entire year on lock-picking and skulking. I got an A in skulking.,2015-12-04 18:10:06,17,4,en
"Edward R. Murrow digging through Sirhan Sirhan's underwear drawer. ""Ah, a tightie whitey man.""",2015-12-04 18:08:27,21,7,en
"*MSNBC rifling through medicine cabinet*
""It appears these ISIS sleepers recently had diarrhea. How illuminating.""",2015-12-04 18:04:22,25,7,en
If I'm ever involved in some giant news story just please don't let the news in my sock drawer. (I have a Wolf Blitzer mouth Fleshlight.),2015-12-04 17:59:00,31,5,en
"""Dream"" is a weird word because it could involve having sex with a giant bird or the vague notion of being successful at something you like.",2015-12-04 17:05:11,23,6,en
This was a weird day but the weirdest thing was RIP titties you had a good run https://t.co/RBdBnpe26t,2015-12-04 07:12:00,19,3,en
This is my brain after I talk https://t.co/4ixUHJQ44g,2015-12-04 06:51:29,22,4,en
"RIP Scott Weiland. This reminds me of what my favorite aunt told me one time. ""Never do cocaine. It's really good.""",2015-12-04 06:09:56,64,20,en
my shift key stopped working. not a problem for a writer. i'm just e.e. cummings now,2015-12-04 02:46:01,24,4,en
If you're watching The Wiz your irony has gone too far.,2015-12-04 02:18:18,19,1,en
Hey it turns out don't date George Zimmerman,2015-12-04 01:49:03,38,5,en
The fuck is he doing https://t.co/R6XGmhH7bS,2015-12-03 19:25:09,19,1,en
"Instead of that tax shelter Zuckerburg could give every man, woman and child in the bottom 50% of America $350 for Christmas",2015-12-03 19:20:12,14,4,en
FYI it's extraordinarily hard to get 911 to respond when your grandma actually gets run over by a reindeer,2015-12-03 18:58:42,47,18,en
I just got escorted out of the DMV I guess they don't like valid points,2015-12-03 17:27:31,20,3,en
"THIS ISNT PRESIDENTIAL, CLINTON/JFK/FDR WOULDA HAD HER WAIT IN THE LIMO https://t.co/tQcQIiqXG0",2015-12-03 15:24:07,39,5,en
BTW we do have knife control dummies you can't walk around with a katana,2015-12-02 23:11:09,61,17,en
My thoughts and prayers go out to the poor intern who has to read the NRA's mentions,2015-12-02 22:40:08,40,3,en
Wish Trump was on the air with Alex Jones rn so he could proclaim the shooting a false flag op pulled off by the gov't he wants to run.,2015-12-02 21:41:36,12,1,en
At this point you can basically preschedule daily mass shooting tweets.,2015-12-02 19:54:03,31,10,en
I just had a really sad thought that also made me laugh: Do you think Donald Trump has a friend?,2015-12-02 17:59:18,90,21,en
Pretty romantic that after six months of marriage my wife and I are still Tinder matches,2015-12-02 06:31:47,32,4,en
Tonight's episode of Fresh Off The Boat had DMX guest-starring and @ChelseyCrisp in the A-plot. That's must see TV.,2015-12-02 04:57:57,7,0,en
The proof that cartoons control our culture is that honey comes in containers shaped like bears.,2015-12-02 04:45:02,18,1,en
"LAKERS: 91
SIXERS: 103
ME: lOl 
(that's an L an O and an L)",2015-12-02 03:32:00,14,0,en
Heeey CAN I KICK IT is gonna be at the @RiotLA next month. Passes/tickets went on sale today. https://t.co/EbUtYcZZ2U,2015-12-02 00:04:35,6,0,en
PRO TIP: Girls like it when before sex you do the haka.,2015-12-01 23:18:24,23,12,en
I support Bernie because it's about time America had its first Costanza president.,2015-12-01 22:51:50,26,2,en
I like to answer when bill collectors call just to catfish them.,2015-12-01 21:29:15,9,0,en
Are politicians in other countries asked about rappers and if women should be allowed to have medicine,2015-12-01 21:28:30,31,12,en
"""DIBS ON BIRD HEAD""
""But that just leaves 'in the middle holding thighs'. I always sit in the middle holding thighs"" https://t.co/nFxElnnTp9",2015-12-01 17:04:55,12,1,en
If this is how we define criticism Yelp's about to get scary as fuck https://t.co/56auMnlezB,2015-12-01 03:30:43,22,11,en
He went to Jared https://t.co/tsRif8h1EM,2015-12-01 03:05:03,28,3,en
If Shawn Bradley and his wife can make it work what's your problem https://t.co/z2IqYjfhD3,2015-12-01 02:04:45,25,8,en
