text,created_at,favorite_count,retweet_count,lang
What a striking contrast in styles the Superbowl will be. If Peyton Manning tried to dab his head would fall off.,2016-01-25 02:48:34,24,14,en
Hey if the Cardinals don't win @RhettReese says he's gonna delete the Deadpool movie so you nerds think about your allegiances,2016-01-25 01:46:31,4,0,en
[Gronk twerks sadly off into the darkness],2016-01-24 23:35:50,26,8,en
"JIM NANTZ: How stupendous and splendorous, what a play, it makes me feel loquacious.
PHIL SIMMS: I eat sticks of butter.",2016-01-24 23:29:27,35,15,en
"How do you give Gronk a concussion test? If you ask him ""Who's the current president?"" he probably tries to remember Olympus is Fallen.",2016-01-24 23:24:07,23,4,en
Really warms my heart to see owners in the luxury box of football games celebrating how all those years of other people's work have paid off,2016-01-24 23:04:30,43,6,en
Nothing sums up America more than the fact we have gummy vitamins for adults,2016-01-24 22:42:22,163,68,en
These two dummies are driving ATVs around Brooklyn and neither one of them know how and they both got stuck https://t.co/OzRghJ5gFK,2016-01-24 20:59:40,10,1,en
I hope Cam scores a TD today and stops the game for 14 minutes while he reenacts the entire video for Thriller,2016-01-24 19:14:51,160,55,en
"About to leave my place. If I die trying to get to this liquor store through the blizzard here are believable lies:
1) I got nothing",2016-01-24 01:07:17,32,2,en
Snow is a dickhead,2016-01-24 00:43:10,10,0,en
Sarah Palin looks like an evil stepmom who got wine drunk and bought a Bumpit https://t.co/d0x0FMf3Nf,2016-01-23 22:49:17,48,11,en
"Welp I just considered reading a book to pass the blizzard time, that's a sign it's a good time to start drinking",2016-01-23 20:00:35,24,5,en
Hey dipshits global warming means more snow bc there's more evaporation from warmer oceans as long as it still gets below 32 occasionally,2016-01-23 19:20:13,73,43,en
I only have enough food until in the morning but that's fine. If Wi-Fi goes out I will walk into the blizzard.,2016-01-23 19:16:49,20,0,en
This is fine. This is a place it makes sense for people to live. https://t.co/sv7Ed1IhLJ,2016-01-23 18:13:11,22,1,en
This man's optimism and believe in himself distresses me https://t.co/x5FdVJoKiw,2016-01-23 17:38:52,19,3,en
Does Uber have Tauntauns https://t.co/NrAPLCNW3D,2016-01-23 14:40:31,50,8,en
"MICHAEL BAY BENGHAZI MOVIE
BRO: We gotta get em
BRO 2: Suck America's dick
BRO: Hell yeah, let's high five with our guns",2016-01-23 05:17:44,34,11,en
"I feel like all movie trailers have a person screaming ""IT'S A SUICIDE MISSION."" This isn't a criticism, it's a screenwriting tip.",2016-01-23 05:08:16,10,1,en
This is the logical conclusion of everything https://t.co/HBwzm9rvsE,2016-01-23 04:56:39,91,37,en
100 percent chance Trump has watched one of his employees beat someone to death with his legs crossed holding a brandy snifter,2016-01-23 04:06:00,32,8,en
If I had a nickel for every time I accidentally walked into a women's bathroom I'd be the richest undeserving sex offender on the planet.,2016-01-23 01:55:25,17,2,en
Ok if Nelly agrees I might be swayed to vote Trump  https://t.co/eUZedKMRYc,2016-01-22 22:56:35,11,0,en
DEAR DIARY: Hour -9 of the pre-blizzard. I have already eaten all my food.,2016-01-22 19:30:29,101,24,en
Please RSVP to my Donner Party I mean blizzard party shit goddam ignore that first part,2016-01-22 17:38:27,26,1,en
Guys I'm the coolest me and Mike are best friends https://t.co/cOT2kABMAw,2016-01-22 03:21:45,37,2,en
Somebody please photoshop Sarah's doing the Run the Jewels pose with Bernie and @KillerMike https://t.co/1cYplWaWFx,2016-01-22 03:07:35,8,0,en
Bar dude's complaining his girl told him to get out bc her husband's gonna be home. He didn't know she's married. He waited out front 2 hrs,2016-01-22 02:55:02,25,3,en
That thing in Erin Brockovich where she gives the power co people poisoned water to drink but it's the Gov of MI being waterboarded with it,2016-01-21 13:43:37,16,2,en
Subways are like an uneventful rollercoaster to Sad Town,2016-01-21 04:02:29,46,3,en
Amy Schumer stole thing where I talk about sex and relationships.,2016-01-21 03:12:42,48,5,en
This is the dunking-from-the-foul-line of bullshit https://t.co/BHTLf8pmv1,2016-01-21 00:12:40,40,14,en
I stared into the abyss and the abyss stared back at me so I stuck my dick in it fuck you abyss,2016-01-21 00:07:04,26,2,en
"Settle a work debate for us. Have you guys ever heard a vagina referred to as a ""coin purse?"" This is very important",2016-01-20 15:31:43,5,0,en
"If Jamie Foxx tried to pull me from a burning car I'd be like ""I'M NOT COMING OUT UNLESS YOU DO WANDA"" https://t.co/YLO1OiJb0Y",2016-01-20 13:07:56,36,3,en
Palin family values https://t.co/NkVQKPRbP4 https://t.co/ZDxy8u0p1b,2016-01-20 12:29:24,21,15,en
.@BarackObama a dude that looks like Riff Raff w/out a grill just told me he's a hype man for DJs pls send SEAL Team 6 to Brooklyn to get me,2016-01-20 12:21:33,23,0,en
John McCain is a great American war hero who is going to die ashamed because he tried to make VP a woman who names her kids onomatopoeias,2016-01-20 01:06:42,60,15,en
Even tho I think it's a tad naive to vote Bernie it still bugs me to hear others say it. Voting is supposed to be an expression of optimism,2016-01-20 00:38:34,31,5,en
Jeb Bush feels like the kind of guy that still slips up and calls teachers mommy,2016-01-20 00:19:07,29,7,en
"I've built an Animatronic Reagan with a gun for a dick, how do I sign him up for president",2016-01-20 00:15:49,24,7,en
"He did, tho. Reagan was a Dem until the 60s. It's irrelevant, but it's a fact. This is shit you can google, Ted. https://t.co/qwVideCBSd",2016-01-19 16:10:22,30,6,en
"""It's important on 9/11 to remember first responders who protect us. When I do, I like to take my shirt off."" -Zac https://t.co/ZzvqFFiqQd",2016-01-19 15:45:10,19,1,en
"""On Memorial Day I'm so grateful for soldiers who made the ultimate sacrifice and also for my sweet hair"" -Zac Efron https://t.co/r95QWMajph",2016-01-19 15:36:11,30,4,en
"The important thing about MLK is that he would have agreed with you on everything, because he was good, and of course you are good",2016-01-19 03:41:15,38,5,en
Warriors are beating the Cavs by so much Lebron already moved back to Miami,2016-01-19 03:16:58,32,5,en
"Ok, here's a story from an adventure Sat night. Pretty weird. Heading in the subway from drinks with friends. OMW down, it's empty, 1:30...",2016-01-19 02:36:43,21,3,en
In 8th grade I took a yearbook pic so bad I was clowned by ppl in line while I was taking it. I want to hug this kid https://t.co/bhsxlYPvOZ,2016-01-19 01:37:31,62,11,en
"All the reasons MLK would have actually agreed with me, a white person: my 8,000-word column",2016-01-19 01:01:33,28,6,en
"[Sean Penn interviewing Hitler]
""Which is your favorite of my movies?""",2016-01-19 00:35:38,188,69,en
.@realDonaldTrump If you can beat me in a game of Bible Trivia I will suck your dick live on Periscope in a 'Make America Great Again' hat,2016-01-18 16:49:37,103,21,en
Dude rollerbladed to the subway on ice and is standing on the platform barefoot. I have found the bravest man alive. https://t.co/WSnOeOFqvb,2016-01-18 15:00:48,35,3,en
"Welp done with the debate so I'm watching something less depressing, BONE TOMAHAWK",2016-01-18 04:26:35,13,0,en
.@BauerOutage With a 4.5 ERA and a losing record you aren't the best argument for a pure meritocracy bud https://t.co/oZ2Jm1Y4Em,2016-01-18 03:35:34,46,11,en
"""Banks are inherently good,"" Hillary says. ""Some of my best friends are banks. A bank is my church. My daughter Chelsea married a bank.""",2016-01-18 03:30:15,44,13,en
Dems are really gonna nominate someone who was a guest at Trump's wedding? Look the only person forced at gunpoint to be there was Melania,2016-01-18 03:19:51,26,5,en
*Martin O'Malley playing his Gameboy,2016-01-18 03:14:12,12,4,en
I don't know how to phrase it but Bernie is to Banksy what Hillary is to banks. There I think that's a tweet.,2016-01-18 03:03:01,21,3,en
Honestly vote O'Malley just bc he's our only shot at having our third consecutive president who looks ok for an old dude with his shirt off,2016-01-18 02:58:06,17,5,en
Bernie should be able to let Killer Mike do the debate for him.,2016-01-18 01:56:12,18,1,en
"New level of anger I discovered tonight is ""waiting 45 mins for a seat at this restaurant's bar of while watching two ppl split a Guinness""",2016-01-18 01:34:47,22,5,en
My problem with Peyton is that he's not taking *enough* HGH,2016-01-18 00:23:34,15,3,en
Are the Broncos really gonna go out with 63-year-old Peyton Manning throwing 17mph knuckle balls into double-coverage on 6-yard routes?,2016-01-17 22:47:24,14,2,en
Really loving Jesse Eisenberg's Rick Moranis-esque take on Lex Luthor in these commercials,2016-01-17 21:02:20,16,0,en
"Please don't let Russell beat Cam, I'll die from the hot takes. ""More praying less dancing,"" they'll say. Like FOOTLOOSE if the bad guys won",2016-01-17 20:08:40,35,10,en
This game is Jesus telling Russell Wilson he should've fucked Ciara,2016-01-17 18:46:12,66,18,en
"""Go fuck yourself,"" economists say https://t.co/kS7IJHvzRl",2016-01-17 18:09:40,23,5,en
"""Moooooom, ISIS is in the yard again.""
""Goddam ISIS they're worse than the Jehovah's Witnesses"" https://t.co/WuoWeqj4Yc",2016-01-17 17:07:08,124,67,en
Jesus Christ Aaron Rogers can't be killed,2016-01-17 04:28:18,35,1,en
Uber driver's honking at a line of an indeterminate amount of cars in front of him. Just a plaintive cry to the traffic gods.,2016-01-17 03:18:02,12,0,en
My level of science knowledge is I don't understand why water gets runny when it gets warm but eggs don't get runny again when they get cold,2016-01-16 21:13:06,7,1,en
Dude is *only* charging $1300 a month for a twin bed in a room you share with him. Talk about your New York values! https://t.co/NsuX4YdWiX,2016-01-16 14:55:50,27,2,en
Honestly the fact Trump graduated Penn should be reason for the whole faculty to walk into the ocean.,2016-01-16 04:41:34,23,3,en
"Interested to hear the other reasons, as I am unconvinced by the first. https://t.co/AWOlMtSrzP",2016-01-16 04:34:52,21,4,en
Went for coffee today and some fan tweeted a pic @momandel to say some guy in a NY coffee shop looked like him but dumb. Best thing all week,2016-01-16 03:03:55,10,0,en
"Just want to be famous enough to get asked to prom on social media, so this time I can be the one to tell some nerd to get bent",2016-01-16 01:23:38,28,2,en
Ah 5 o'clock Friday time to do the Fred Flintstone-slide down a brontosaurus neck into a giant whiskey,2016-01-15 22:06:30,43,7,en
"MOB GUY: ... Anundercovercopsayswhat
UNDERCOVER COP: What?
MOB GUY: Gotcha!
UNDERCOVER COP: Oh man, we spent a year on this at the academy",2016-01-15 17:56:14,41,7,en
THIS WOMAN FOR SECRETARY OF THE TREASURY https://t.co/H7vgxMUJJh,2016-01-15 17:24:21,17,6,en
This guy didn't touch a boob until he was 36 https://t.co/O5smyAMPhS,2016-01-15 16:27:29,13,2,en
"Teen-age Ted Cruz changed his nickname and decided to go with ""Ted"". As an 8th grader. This is the worse guy alive. https://t.co/t6L9ROcu65",2016-01-15 16:25:39,53,21,en
https://t.co/Vwehi58RFm,2016-01-15 12:52:14,29,8,und
For a bunch of people who use lots of violent rhetoric there isn't a single GOP candidate could defend themselves from even a mild wedgy,2016-01-15 05:44:55,126,49,en
"""Is the mask too much?""
""Nah bro it really pulls the whole thing together."" https://t.co/zmFqpW5DXc",2016-01-15 00:18:31,23,7,en
This is some fascist bullshit. Kids shouldn't be singing about crushing enemies unless it's in rap. https://t.co/sYiypfo2D1,2016-01-14 22:16:48,10,0,en
If you tell me you didn't vaccinate your kid I'm going to cough directly into their mouth,2016-01-14 20:52:10,94,32,en
Jeb Bush warming up for the debate by looking scared into a mirror.,2016-01-14 20:18:01,22,1,en
"The only question I want answered at the debate tonight is ""Mr Trump, what's it like to know your wife and kids will be happy when you die?""",2016-01-14 15:27:40,38,7,en
Just going to continue this holiday weight gain all the way through til the next Ford Truck Month,2016-01-14 14:22:32,20,2,en
"At this moment, 5:40 AM PST, someone with a loaded AR-15, who no one is coming for, is paroling the defensive perimeter of a bird sanctuary",2016-01-14 13:39:29,42,14,en
Our workplace Powerball pool got so few numbers I'm pretty sure the secretary who organized it is fired. This is the American economy.,2016-01-14 04:15:34,25,8,en
WHAT ARE THE POWERBALL NUMBERS I'M ALREADY BUCK NAKED AT A FERRARI DEALERSHIP,2016-01-14 04:06:14,114,45,en
Some days I'm unsure if America will be OK. Other days lot of ppl send a failing militia protest care packages of dildos. We're gonna be OK.,2016-01-14 01:56:03,487,193,en
Trump would eat this woman if he were mildly hungry https://t.co/3ScPbeVp8z,2016-01-14 01:23:28,24,6,en
One day historians are going to marvel at the fact we trusted the entire world economy to a company that named itself Gold Man Sacks,2016-01-13 22:25:46,24,2,en
Just a little tip from a professional crowd pleaser @BarackObama that speech last night woulda killed if you just had a T-shirt cannon,2016-01-13 22:05:27,18,5,en
"PITCH: a Court Reporter for life. You can say something dumb and then just be like ""strike that from the record""",2016-01-13 15:58:30,12,0,en
"The Rams are just what L.A. needs, more traffic and failed midwest transplants.",2016-01-13 15:27:12,37,5,en
Just wish I could ever feel as proud of my toughness as a white dude choosing to not wear a coat.,2016-01-13 15:01:19,16,3,en
Rams to L.A. is a brilliant move to force the 12 mil residents of L.A. to all buy Sunday Ticket so they don't have to watch the fucking Rams,2016-01-13 14:07:25,50,23,en
The Rams moving back from the Midwest to Los Angeles in defeat are doing it backwards,2016-01-13 13:58:37,22,5,en
Animatronic Nikki Haley was a poor choice.,2016-01-13 03:29:34,26,8,en
Bars in NY are weird https://t.co/nKQoO24eBU,2016-01-13 03:16:59,17,0,en
Obama entering the State of the Union like https://t.co/Ghh9ywUkyo,2016-01-13 02:09:22,46,22,en
My friend's fantasizing about winning Powerball and picking the neighborhood she'd buy a house in by the subway stops. Poor ppl are idiots.,2016-01-13 01:42:12,45,3,en
Jan 30 CAN I KICK IT is at the Downtown Independent for @RiotLA! Come to there https://t.co/EbUtYdhAru https://t.co/BQFY4MUut6,2016-01-12 22:18:04,6,2,en
"STATE OF THE UNION DRINKING GAME: Instead of watching the State of the Union, drink.",2016-01-12 19:52:05,67,22,en
You can get anything you want in life if you are willing to let people think things are their idea. But literally none of us are.,2016-01-12 04:00:04,24,2,en
Staying in a heavily Haitian neighborhood of Bed-Stuy and I'm the only white dude in this bar and everyone's arguing Bowie tracks. RIP.,2016-01-12 02:27:55,35,6,en
"1) kid from the burbs
2) listens to Run the Jewels once https://t.co/fqOD7NlRHX",2016-01-12 02:01:29,230,86,en
"""Hello from University of Phoenix Stadium. We're playing a college championship here because we have no sense of decency or irony.""",2016-01-12 01:47:30,37,15,en
If education is great payment why aren't college coaches paid in education? Some could use a master's and most sound like they need English.,2016-01-12 01:38:52,25,1,en
"Oh nothin just chilling in the Apple Store before my avante guard one-woman show ""Spacewoman Chills in Apple Store"" https://t.co/wp9Y1MDPxV",2016-01-12 00:44:20,115,46,en
The only way this mirror has a purpose is if it's two-way and the janitor is behind it https://t.co/NUHHEcuHAW,2016-01-11 22:17:50,26,2,en
CAN I KICK IT Jan 30 @RiotLA! @aljackson @joederosacomedy @toneBell w/ @moshekasher TICKETS: https://t.co/EbUtYdhAru https://t.co/DJQa0TOb2t,2016-01-11 20:10:23,9,3,en
"I didn't understand all the David Bowie grief but then someone explained ""It's like if Fetty Wap died"" and now I feel you",2016-01-11 19:10:06,38,4,en
"What if 40-year teachers like my mom got TV awards? JK her only designers are dumb kids who handpaint her sweaters, that'd be fucking awful",2016-01-11 03:26:45,19,1,en
Local beers are a great populist excuse to be an alcoholic.,2016-01-11 02:39:01,24,3,en
Actors getting awards is like getting a trophy for receiving a blowjob.,2016-01-11 02:13:28,93,23,en
When you're talking to a girl and didn't notice your wife show up https://t.co/DnUqamPnwM,2016-01-11 01:43:54,23,8,en
Yo Jan 30 CAN I KICK IT is at Downtown Independent @RiotLA! @aljackson @joederosacomedy @toneBell and @moshekasher https://t.co/EbUtYdhAru,2016-01-10 22:26:50,2,1,en
Nothing is more boring than a low-scoring football game. Defenses should have to play with 8 guys.,2016-01-10 19:58:35,8,0,en
This is easy. I'd fuck AND marry El Chapo https://t.co/4mHKjSmmvS,2016-01-10 17:51:05,18,2,en
My buddy has a story about doing cocaine with Sean Penn that is boring. That's how I'd sum Sean Penn up. Even drugs with him are boring.,2016-01-10 17:24:59,65,10,en
"At least there are tons of late night spots to blow off steam in Cinci. JK, but head to @gobananascomedy. @geofftate96 is there this weekend",2016-01-10 05:09:47,9,0,en
That's a gross fucking hit on Brown. That dude should be in jail. Jesus Christ.,2016-01-10 04:51:25,26,4,en
Not sure how you make a list of the most influential TV shows off all time without noting that every girl of my generation turned into Daria,2016-01-10 02:43:37,33,3,en
"The only white person in this soul food place in Bed-Stuy, feeling like part of the solution while absolutely being part of the problem.",2016-01-10 02:37:57,34,1,en
In retrospect 1977 was my year. (I wasn't born yet),2016-01-10 01:58:22,14,6,en
If I win the Powerball I will have a monkey butler if it takes all $900 million and me and Bubbles McMonkeysworth have to move in with mom,2016-01-10 01:10:18,36,3,en
"I'm very confused this bartender said ""The DJ starts at 9!"" but her tone of voice didn't sound like a warning.",2016-01-10 00:42:56,26,3,en
"If I win Powerball, I'm having at least six of you killed. Four of you know who you are. I think the other two will be very surprised.",2016-01-09 21:15:06,875,341,en
I feel like Obama could get a third term if he pardoned Steve Avery and deported Ken Kratz.,2016-01-09 19:33:26,36,8,en
I present to you the most difficult-to-impress child in the world https://t.co/MWmgLM1kHi,2016-01-09 16:47:51,268,170,en
"So @CaliseHawkins described 30 mins to me as ""it's just 5 or 6 songs"" and now there is nothing I can't endure. #ff",2016-01-09 03:28:53,10,2,en
"Why are there handjob places but no bean flicking places, for ladies? This offends me as a male feminist.",2016-01-08 23:35:20,34,2,en
Without knowing details I am going to assume this information was presented as evidence of justifiable homicide https://t.co/TVSMzHfBnM,2016-01-08 21:11:12,24,9,en
Jan 30 @CIKIcomedy is at @RiotLA!Gonna be fun. Al will probably wear a dumb shirt. https://t.co/EbUtYdhAru https://t.co/ECgExJ2Jbj,2016-01-08 19:34:47,13,4,en
Why's it so funny to me that Inspectah Deck has a song named after Bar Refaeli https://t.co/PNi0hTHs6s,2016-01-08 15:04:24,7,1,en
"""if elected president, I promise to more effectively bully our dumbest children."" https://t.co/KoiIZ0i6lJ",2016-01-08 13:22:46,34,14,en
I'm drinking with some Australians. This is goodbye.,2016-01-08 02:34:48,36,2,en
People are fact checking a joke I wrote in March of 2011 about bee jizz https://t.co/9G1ggciJrO,2016-01-08 01:59:23,41,4,en
I just saw a $600 Buddha statue and I'm guessing whoever buys it might be missing the point.,2016-01-07 17:16:37,37,10,en
Reminder of that time Kim Jong-Un visited a lube factory and had the time of his life. Good morning. https://t.co/ZYhAZYKzhL,2016-01-07 15:41:20,41,17,en
"Just to keep a record, the most Brooklyn thing I've observed so far is a guy on the train talking about 3-D printing a bass fiddle",2016-01-07 03:09:58,26,3,en
"Just saw I was this mag's #24 best account of 2015, which is dumb/ meaningless, except I'm pissed @weismanjake is #9 https://t.co/38TM4VofXj",2016-01-07 02:56:04,17,2,en
All I want to do is be best friends with Killer Mike and Charles Barkley and hang out in The Gold Club. Somewhere I made a horrible turn.,2016-01-07 02:36:31,19,3,en
"Most Jewish thing I ever heard was just now when @MoMandel asked me ""What do they call it in church when they pass around the tip jar?""",2016-01-06 17:22:48,45,6,en
I wish BeastMaster really existed so we could send him to that Oregon bird sanctuary to make the birds shit all over those dudes repeatedly,2016-01-06 15:18:54,17,6,en
ISIS gettin pretty ballsy https://t.co/DNErBGSeHq,2016-01-06 15:12:15,30,4,en
"FYI it turns out a a fun thing to text your wife when you're on opposite coasts for six weeks is not ""do u know how to set up Tinder""",2016-01-06 15:09:32,45,6,en
Why do I feel like North Korea's H-bomb was set off by an old school alarm clock,2016-01-06 13:55:17,28,4,en
Yoooo @mrdavehill leaving straight from work for Oregon https://t.co/VzT25sAeTQ,2016-01-05 15:17:23,12,0,en
"Please to not blast E-40's ""Sprinkle Me"" on the subway https://t.co/ZB5weBzvli",2016-01-05 02:27:12,19,5,en
"Gonna put up posters around my neighborhood that say ""FOUND CAT: GOOD AT FUCKING"" with my buddy Steve's phone number",2016-01-04 20:26:34,34,2,en
"If you'd told me before this happened, I'd have wish for all those dudes to go live on some bird sanctuary anyway so fuck it.",2016-01-04 19:22:47,13,4,en
Just accidentally texted an audio message intended for my wife to one of my asshole friends so I'm going to go live in the woods now,2016-01-04 12:01:32,45,5,en
And now we summon the oracle of what-is-possessing-a-football,2016-01-04 02:44:27,13,2,en
"When airlines refer to ""leg room"" they mean room for literally one leg.

One day I will write for Family Circus",2016-01-03 13:22:43,133,13,en
These dudes are feuding with park rangers. Their political philosophy is the same as a cartoon bear's.,2016-01-03 10:16:12,262,126,en
If you're white you can apparently just keep playing army your whole life,2016-01-03 10:15:13,79,13,en
Watching Wedding Crashers and wife makes a good point movies need consultants to prevent characters choosing Owen Wilson over Bradley Cooper,2016-01-03 02:30:33,18,1,en
"George R.R. Martin is just the latest example of my age old axiom ""Never depend on a man in a steampunk hat.""",2016-01-02 21:02:24,26,1,en
The main thing I've learned from Making a Murderer is that it will be very simple and easy when I eventually frame one of you for my death,2016-01-02 15:13:40,80,26,en
Being fat shamed by my pants,2016-01-02 01:07:00,55,10,en
"Brother-in-law combined ""sweetness"" and ""sweet pea"" and accidentally called his baby daughter ""sweet penis"" and I'm the only one who laughed",2016-01-02 00:26:26,109,14,en
"Just saw a cop pull over a golf cart on the interstate, presumably to high-five",2016-01-01 20:16:12,37,5,en
"My favorite thing about Making a Murderer is how whenever people answer a phone both parties say ""yeah"" at least twice each before talking",2016-01-01 20:02:47,76,9,en
Every vegetable I've had in the past two weeks has been in a Bloody Mary.,2016-01-01 17:14:01,46,3,en
Dude in the red hat fucked everything up https://t.co/k26ieeoomL,2016-01-01 16:37:23,36,8,en
Shoutout to Macklemore for doing a mom's idea of what rap is,2016-01-01 03:04:29,103,27,en
While Jenny McCarthy is out tonight somebody go vaccinate her kids https://t.co/PlG4f4QdHE,2016-01-01 02:02:33,569,326,en
I feel like Jeb Bush still struggles to unhook a bra.,2015-12-31 17:02:31,53,21,en
"When you watch MAKING A MURDERER, remember the sheriff dept's vandetta against Avery began with him waving his dick at one of their girls.",2015-12-31 15:32:06,17,3,en
The tree of liberty must occasionally be refreshed with the butt hurt of tyrants https://t.co/fMdAAKaViz,2015-12-31 15:04:16,43,22,en
"Wife's pregnant friend just said she needs a series of mirrors to masturbate and described her husband going down as ""looks like a sunset.""",2015-12-31 03:03:42,36,4,en
This is like bullet point 47 but eventually we gotta talk about how Cosby got his head and face to match his sweater https://t.co/3RXJqlsVXD,2015-12-31 00:57:37,433,196,en
"Lucas thinks people like Star Wars as a space car show and travel doc, maybe that's the problem https://t.co/2A2RpF4wBj",2015-12-31 00:47:37,12,9,en
"One day someone will explain to me how Republicans can hate liberals for being ""communist"" but love Putin, who literally ran the KGB.",2015-12-31 00:09:01,36,9,en
"Dogs are hella racist and pretty bad spellers, pretty sure most internet commenters are dogs",2015-12-30 23:43:22,23,3,en
https://t.co/YeSdFfiusQ,2015-12-30 22:20:11,12,1,und
If Baby Jessica happened nowadays half of America would have said it was her fault and voted to seal up the well.,2015-12-30 22:09:04,34,7,en
What Trump spokeswoman doesn't know is her bullet necklace is useless w/out my very heavy necklace of a dozen guns https://t.co/gUKfgCt2kI,2015-12-30 22:04:04,28,5,en
"Did everyone achieve their 2015 resol- haha I can't even finish it, just wanted to remind you that you're a piece of shit",2015-12-30 18:21:17,22,6,en
I like how the post office has a sign that says United States Post Office to make sure you don't accidentally go to Guatemala's post office,2015-12-30 18:02:43,27,4,en
A Shawshank remake with Martin Shkreli and Ethan Crouch where the river of shit is 30 miles long and leads into an open volcano,2015-12-30 15:53:35,57,7,en
"On board with this neighborhood's ""No Bieber"" policy folks. https://t.co/iUnNaw7J82",2015-12-30 15:49:49,24,4,en
Children are just tiny terrorists you can't report to anybody,2015-12-29 01:16:47,78,26,en
