text,created_at,favorite_count,retweet_count,lang
Hey Saturday nite drunk drivers! Who cares? Everyone dies. Drive through someone. Drive through arbys. You'll die too. No guilt in the void.,2015-07-19 02:41:41,50,41,en
Come for the guy out by the drive thru sign who's got fairly okay cocaine. Stay for our Montreal angus portobella sandwich. Arby's: Whatever,2015-02-10 19:22:00,54,39,en
"Q: How many jr bacon cheddar melts can you eat in one sitting? 

A: it doesn't matter and no one cares.

Arby's: no one is paying attention.",2015-02-09 21:57:15,37,23,en
In case there was any doubt... http://t.co/AFxri8qHJE,2015-02-08 21:11:24,25,12,en
"Arby's: we play john mellencamp in our dining rooms, because fuck it.",2015-02-08 20:45:04,42,25,en
"Did I die? Eh, it was about the same. Please continue to eat at arbys.",2015-02-08 20:27:36,27,13,en
