text,created_at,favorite_count,retweet_count,lang
the world is terrifying garbage,2015-08-26 18:17:11,1920,2149,en
"burned all professional bridges with sharp and illogical emails, many of them referring to Eminem",2015-08-26 13:19:04,695,325,en
"Sex, please",2015-08-26 00:06:13,713,273,en
all Internet traffic is cat-related,2015-08-25 18:17:08,445,350,en
somehow both disgusting and alluring,2015-08-25 13:19:03,616,520,en
there are so many odd and troubling noises in the city,2015-08-25 00:06:08,393,220,en
basically me standing around talking to myself,2015-08-24 18:17:02,614,657,en
she's a Neo-Platonist; a Neo-Platonist with a thing for cute figurines,2015-08-24 13:19:08,194,97,en
"In an ideal world, we would all sit at home reading “Infinite Jest” and then go out to eat hamburgers",2015-08-24 00:06:04,640,410,en
just let everything go,2015-08-23 18:17:05,514,437,en
What if Christ had been electrocuted,2015-08-23 13:19:04,447,216,en
regular users of social media tend to score lower on measures of belonging and meaningful existence,2015-08-23 00:06:00,912,609,en
hanging with Ben and Jerry. No big deal,2015-08-22 18:17:05,355,167,en
"sometimes baby-talking, sometimes foul-mouthed",2015-08-22 13:19:05,343,261,en
personal choices — too much alcohol,2015-08-22 04:49:23,743,397,en
Here are some newer gay rooftop soirees,2015-08-22 00:06:10,406,219,en
impatient with the world and suspicious of the motives of a lot of people in it,2015-08-21 18:17:09,937,882,en
all about self-loathing,2015-08-21 13:19:01,492,423,en
eat pizza every day,2015-08-21 00:06:08,751,741,en
parting gift — an adult-size bloodied infant emerging imperiously from an egg,2015-08-20 18:17:03,276,125,en
everyone who takes a selfie is a psychopath,2015-08-20 13:19:04,887,617,en
"if you’re going to have something to eat, you might as well as have something amazing",2015-08-20 00:06:10,520,388,en
"mood-altering drugs, terror, compassion, insects",2015-08-19 18:17:19,409,249,en
When was the last time you had sex and how was it,2015-08-19 13:19:21,318,120,en
You can always go home again — if you’re prepared to have your beating heart ripped from your chest and stomped on,2015-08-19 00:06:06,710,389,en
in the sixth year of writing a bad novel,2015-08-18 18:17:09,546,331,en
Je m’appelle everything is just fine,2015-08-18 13:19:11,815,764,en
guess what? No one calls,2015-08-18 00:06:13,441,222,en
there are many wonderful ice creams out there in the world,2015-08-17 18:17:05,662,647,en
connect to the Internet and get sucked into the black hole of wasting time,2015-08-17 13:19:07,1061,1002,en
"months, seasons, entire school years friendless",2015-08-17 00:06:23,634,342,en
"Canadians, all of them art-goth chic",2015-08-16 18:17:05,648,460,en
"passive-aggressive, perpetually stoned",2015-08-16 13:19:07,893,469,en
"wandering around, alone, wearing absurd shoes",2015-08-16 00:06:04,712,534,en
ducks make for the funniest animal jokes,2015-08-15 18:17:06,213,101,en
lightly but thoroughly scarred psyche,2015-08-15 13:19:15,455,306,en
now I am going to die a little bit,2015-08-15 05:34:34,750,714,en
"an alcohol-free nightclub for cheerful, athletic nerds",2015-08-15 00:06:15,710,300,en
rooms are stupid,2015-08-14 18:17:02,289,174,en
"if you are difficult, so what? Be difficult",2015-08-14 13:19:01,1009,867,en
Everyone’s bad,2015-08-14 00:06:10,554,537,en
Where’s that thing for the thing,2015-08-13 18:17:03,456,366,en
capable of perceiving anxiety and menace in even the most routine phenomena,2015-08-13 13:19:02,498,396,en
take a lot of time and fail at important things,2015-08-13 00:06:03,764,712,en
tortured death sex meow,2015-08-12 18:17:00,419,227,en
"a lot of things make me sad and frightened, especially when it comes to the Internet",2015-08-12 13:19:00,589,446,en
"no real reason or complaint or plans, just a single piece of beef jerky",2015-08-12 00:06:19,395,267,en
"unbearable shame, bitter sadness",2015-08-11 18:17:02,429,289,en
"it started out as just an ordinary day, until an envious neighbor evil-eyed you",2015-08-11 13:19:21,259,104,en
"Coherence, I don’t want it anymore",2015-08-11 00:06:05,502,465,en
http://t.co/pBgFJDcUgn,2015-08-10 18:17:12,394,263,und
My toes: too short. My entire body: too fat,2015-08-10 13:19:09,387,138,en
a less-than-successful evening of erotic adventuring,2015-08-10 00:06:05,430,177,en
messy and lazy and pretty incoherent,2015-08-09 18:17:02,654,793,en
Let’s be honest here: The vagina is an odd-looking thing,2015-08-09 13:19:19,525,160,en
forget the k-i-s-s-i-n-g,2015-08-09 00:06:14,292,151,en
"recently, I tried playing egg shaker to the latest Taylor Swift album. It was very unsatisfying",2015-08-08 18:17:11,394,188,en
Do you have any idea what happened to my jeans,2015-08-08 13:19:05,319,162,en
just a couple of gals not wanting to die,2015-08-08 00:06:00,1006,734,en
the best part was the peeing,2015-08-07 18:17:01,329,158,en
"no, it was just dumb",2015-08-07 13:19:01,432,357,en
A glass of wine is better than a glass of water,2015-08-07 00:06:01,648,524,en
Who has the energy to smile,2015-08-06 18:17:00,595,528,en
What’s so great is that everything has already gone through Bob,2015-08-06 13:19:04,149,45,en
a steady diet of waffles,2015-08-06 00:06:12,715,630,en
Do the rats know that they’re rats,2015-08-05 18:17:01,509,364,en
"Facebook: ah, Facebook. Social media",2015-08-05 13:19:08,346,172,en
this is impressive; these are very tight pants,2015-08-05 00:06:06,540,280,en
Don’t masturbate to Radiohead,2015-08-04 18:17:02,924,531,et
"She’s a pervert, and she makes bizarre aesthetic choices with regard to her personal appearance",2015-08-04 13:19:01,863,504,en
"needs more “cat,” or something",2015-08-04 00:06:09,552,563,en
I’m no baby; I’m a man,2015-08-03 18:17:06,322,192,en
make it through a day without hiding in the bathroom,2015-08-03 13:19:04,924,589,en
Find the value of n such that n plus everything else in your life makes you feel all right,2015-08-03 00:06:02,569,462,en
It turns out that walking is a popular mode of transport,2015-08-02 18:17:00,561,319,en
ALL selfies are photos. Not all photos are selfies,2015-08-02 13:19:06,563,281,en
"Oh God, this is going to be horrible",2015-08-02 00:06:11,699,623,en
acknowledge that children actually exist,2015-08-01 18:17:01,387,159,en
doughnuts are fun to work with,2015-08-01 13:19:03,294,152,en
chest bare and nipples aglitter,2015-08-01 04:24:25,886,505,en
a state of barely controlled panic,2015-08-01 00:06:06,690,655,en
"just creep on me silently, like a normal person",2015-07-31 18:17:08,592,333,en
"get on Facebook, you can look at puppies",2015-07-31 13:19:06,355,196,en
The egg is supervisible just as there are supersonic sounds. No one can see the egg. Does the dog see the egg? Only machines see the egg,2015-07-31 00:06:00,431,322,en
four little words: You all will die,2015-07-30 18:17:10,845,579,en
THIS PLACE IS TERRIBLE,2015-07-30 13:19:00,478,387,en
being alone is not the same as feeling alone,2015-07-30 00:06:00,870,505,en
People love watching jackasses doing stupid things,2015-07-29 18:17:03,265,134,en
"guns, dildos, animal heads, potato chips, milk, purses",2015-07-29 13:19:10,405,198,en
brief existential panic is an everyday thing,2015-07-29 00:06:33,2124,2363,en
"goal: having the Catholics in my control, and figuring out if women have souls",2015-07-28 18:17:02,516,257,en
See that guy sitting next to you on the bus? He’s your cousin,2015-07-28 13:19:06,284,116,en
"dogs, he reasoned, are indeed happy",2015-07-28 00:06:01,555,373,en
back among the ugly people,2015-07-27 18:17:11,447,240,en
Shade may be most delightfully expressed through emoji,2015-07-27 13:19:11,596,397,en
"a place where you might, on occasion, get punched in the face for no reason at all",2015-07-27 00:06:09,501,317,en
you will never be entirely sober again,2015-07-26 18:17:19,825,498,en
a blanket of oat flour over my tongue and a lasting taste of the worst glass of milk ever beneath it,2015-07-26 13:19:12,167,51,en
"pseudo-adult, crazed, clad in a tutu",2015-07-26 00:06:00,504,357,en
"ladies, you have hair on your face",2015-07-25 18:17:02,211,70,en
avoid adulthood,2015-07-25 13:19:10,1371,1724,en
"if you don’t think I look amazing, that’s 100 percent your problem",2015-07-25 00:06:09,1501,1437,en
"like taking two knives and cutting each other up, but through a dance form",2015-07-24 18:17:07,230,120,en
Did you remember to send in the touching images of your child,2015-07-24 13:19:18,158,36,en
Hitler never apologizes,2015-07-24 00:06:01,317,152,en
a musical approximation of self-hatred,2015-07-23 18:17:04,413,291,en
pop music is too fast,2015-07-23 13:19:13,301,152,en
"a freelance taxi driver, whose true calling is to seek out lonely women who need his special kind of loving",2015-07-23 00:06:00,270,94,en
romance between a girl and her television,2015-07-22 18:17:02,764,652,en
"Dinner is a damned nice thing
as are breakfast and lunch",2015-07-22 00:06:12,615,469,en
hot ticket? Dad Braiding,2015-07-21 18:17:15,137,55,en
chased from the community for being “a weirdo”,2015-07-21 01:06:14,535,340,en
got felt up by an old lady,2015-07-20 19:59:09,213,74,en
hellpit of cat hair,2015-07-19 19:59:00,299,226,en
avant-garde ballad of teenage angst yodeled in phonetic English,2015-07-18 19:59:01,934,750,en
just the right touch of desperation and awkward vulnerability,2015-07-17 19:59:06,768,533,en
Human love can be very frightening,2015-07-16 19:59:04,1107,755,en
pretend to be cheerful,2015-07-15 19:59:07,463,311,en
Should we all take a bit of lithium,2015-07-14 19:59:08,365,190,en
That’s a lot of pot,2015-07-13 19:59:02,426,199,en
the latest research and media articles relating to bees,2015-07-13 13:19:01,202,88,en
nothing was as good as beer,2015-07-13 01:58:10,460,329,en
writhing atop a gargantuan Toblerone,2015-07-12 18:37:11,419,267,en
"people with deep, dark secrets shouldn’t really meddle in other people’s mysteries",2015-07-12 13:19:07,524,244,en
"body glitter, head to toe",2015-07-12 01:58:00,520,475,en
Ice Cream. Ice cream,2015-07-11 18:37:04,398,326,en
the problem might be me,2015-07-11 13:19:02,718,634,en
it’s fun when things look kind of silly,2015-07-11 01:58:04,313,197,en
a good tweet among a mudslide of drivel,2015-07-10 18:37:11,324,313,en
"perhaps a beach in the sunshine, or a cool photo of Dwayne ‘The Rock’ Johnson",2015-07-10 13:19:06,437,317,en
kinky couples have the best sex,2015-07-10 01:58:07,316,89,en
there’s a secret commission of readers and editors dedicated to the mission of keeping women writers down,2015-07-09 18:37:09,218,102,en
why is my poop green,2015-07-09 13:19:14,196,83,en
"a slapping game, whose object was to slap one another in the face very hard",2015-07-09 01:58:08,342,160,en
a mushroom beverage company out “to make ’shrooms the new kale”,2015-07-08 18:37:22,231,100,en
election on a platform of: Eh,2015-07-08 13:19:05,349,183,en
"Smarter, really, not to try",2015-07-08 01:58:05,360,222,en
"this one’s about eating people, so, that’s cool",2015-07-07 18:37:01,437,291,en
"gossiping, complaining, freaking out",2015-07-07 13:19:03,487,406,en
trying and failing and trying and failing,2015-07-07 01:58:05,668,676,en
"a hitchhiking, heroin-addicted dwarf named Christian",2015-07-06 18:37:02,431,200,en
I’m not on Facebook because I hate Facebook,2015-07-06 13:19:07,430,180,en
whatever happened to old-fashioned foreplay,2015-07-06 01:58:03,518,233,en
come under fire in the past year for sucking,2015-07-05 18:37:07,274,164,en
babies are all right,2015-07-05 13:19:17,319,167,en
combination of ketchup and meat juice,2015-07-05 01:58:01,150,64,en
throwing firecrackers at tourists,2015-07-04 18:37:01,502,466,en
my crotch: now bleeding,2015-07-04 13:19:07,500,128,en
You should totally go for it,2015-07-04 01:58:01,498,520,en
"fear of being called a filthy, creepy ratgirl",2015-07-03 18:37:09,618,436,en
"a twinkle, and this — the twinkle — was all about poetry",2015-07-03 13:19:05,195,89,en
men are naked,2015-07-03 01:58:28,364,160,en
"Yum, yum, yum. Boy, that tastes good",2015-07-02 18:37:09,255,102,en
talk back to children,2015-07-02 13:19:14,330,191,en
Why is there a corn dog in my bed,2015-07-02 01:58:03,628,475,en
single people are pathetic,2015-07-01 18:37:05,304,139,en
it’s very easy to be flaky,2015-07-01 13:19:13,286,148,en
very few foods won’t be improved by wine,2015-07-01 01:58:02,472,363,en
"nice, useless",2015-06-30 18:37:10,585,607,en
Googling the relationship between strong headaches and brain tumors,2015-06-30 13:19:16,292,142,en
a complicated relationship with depression,2015-06-30 04:52:05,1018,410,en
"ice cream, astonishing",2015-06-30 01:58:02,555,467,en
living with a feral rat is sustainable,2015-06-29 18:37:17,296,163,en
it’s better to get some professional help than try to handle it on your own,2015-06-29 13:19:03,249,111,en
"yes, I am a loser",2015-06-29 01:58:03,677,753,en
nude Hitler,2015-06-28 18:37:03,370,203,tr
there’s a feminist case to be made for unlikable women,2015-06-28 13:19:03,335,113,en
the only moral to be drawn: Never invite a wine snob to your sex party,2015-06-28 01:58:15,604,281,en
Nobody wants to be an adult,2015-06-27 18:37:04,914,1006,en
"be happy, for God’s sake",2015-06-27 13:19:03,469,397,en
"date night, here we come",2015-06-27 01:58:01,180,57,en
can barely speak to strangers or even friends,2015-06-26 18:37:15,523,379,en
bring out your dance moves,2015-06-26 15:29:10,273,291,en
There’s nothing creepier than creepy children,2015-06-26 13:19:19,410,238,en
I don’t need this kind of negativity in my life,2015-06-26 01:58:09,511,379,en
you’re always being judged a little,2015-06-25 18:37:00,433,347,en
"Ghosts, it seems, have invaded our parties",2015-06-25 13:19:10,501,381,en
disavowal of maturity,2015-06-25 01:58:11,152,109,en
"Penis, penis, penis",2015-06-24 18:37:06,448,263,in
the usual suspects: millennials,2015-06-24 13:19:01,1268,953,en
remember that time we got drunk,2015-06-24 01:58:02,621,333,en
buying books is the same as reading,2015-06-23 18:37:07,567,347,en
"a cheerful, boorish idiot with only one friend",2015-06-23 13:19:01,311,208,en
the absurd futility of life,2015-06-23 01:58:02,472,398,en
"follow everything Danish, actually. Danes are extremely good",2015-06-22 18:37:00,245,110,en
"Oh, no, we’ve got a gay community beginning here",2015-06-22 13:19:14,546,310,en
there were 112 million dad-related tweets in 2014,2015-06-22 01:58:15,492,227,en
I generally get angry at handsome men,2015-06-21 18:37:13,1000,712,en
"wake up, eat breakfast, talk about your feelings and decorate",2015-06-21 13:19:13,791,496,en
I hope you never drown,2015-06-21 01:58:04,481,321,en
the rabbit needs to learn its job,2015-06-20 18:37:03,252,152,en
everything has become meaningless,2015-06-20 13:19:01,662,497,en
Dudes don’t know anything,2015-06-20 01:58:12,763,670,en
"In other words, get a life",2015-06-19 18:37:07,430,319,en
fact: Salt and vinegar chips taste 46% better when you’re on your period,2015-06-19 13:19:03,497,154,en
spaghetti is long,2015-06-19 01:58:00,514,396,nl
I’ve got the sadness too,2015-06-18 18:37:05,525,293,en
"dazed, bogged in a swamp of despair, hating myself and blaming myself for this demented pride",2015-06-18 13:19:19,352,174,en
A drink or two could be good,2015-06-18 01:58:00,467,358,en
"if you spend your time in cyberspace watching something besides porn and Korean rap videos, you can gain a great deal",2015-06-17 18:37:06,439,298,en
Does America’s “fear of sex” have anything to do with our foreign policy,2015-06-17 13:19:08,450,241,en
she had concluded that she just wasn’t meant to have romance. She had resigned herself to solitude,2015-06-17 01:58:04,721,343,en
Watch how awesome I am,2015-06-16 18:37:10,321,284,en
"always taught that sexuality was, you know, good",2015-06-16 13:19:17,337,102,en
trying to understand why I am always crying,2015-06-16 01:58:02,908,666,en
a ghost story with a twist of feminism,2015-06-15 18:37:08,820,588,en
why would anyone care,2015-06-15 13:19:21,426,314,en
not so much a creature of routine as a psychopathic raging monster of it,2015-06-15 01:58:00,519,332,en
eat pizza and snacks and just relax,2015-06-14 18:37:03,593,596,en
Imagine a meal made of the milk left in the bottom of a bowl of cut-rate cereal,2015-06-14 13:19:03,193,93,en
dead and exhausted and going to bed,2015-06-14 05:58:07,742,664,en
flip-flopping between sympathy and revulsion,2015-06-14 01:58:01,416,284,en
"very, very low maintenance, bordering on extreme laziness",2015-06-13 18:37:00,695,571,en
say you want to go to Brazil. Now is a good time,2015-06-13 13:19:13,188,56,en
come to this party to make out,2015-06-13 01:58:00,553,246,en
"dad, who refuses to put on a pair of pants",2015-06-12 18:37:00,379,220,en
we are all in trouble,2015-06-12 13:19:18,397,383,en
be tall if you can,2015-06-12 01:58:02,636,473,en
Do you have the baked goods,2015-06-11 18:37:09,430,315,en
constantly thinking about how other people think,2015-06-11 13:19:08,657,446,en
your body is a mess,2015-06-11 01:58:06,378,233,en
"mmm, mmm, this is swell",2015-06-10 18:37:02,316,300,en
overwhelmed and exhausted by simple tasks,2015-06-10 13:19:04,860,906,en
"several million rats, which it is better not to think about",2015-06-10 01:58:11,310,182,en
A picture of The Rock might nudge those young people who do have disposable income to bank a bit more of it,2015-06-09 18:37:09,187,104,en
why do only women have the privilege of using heels,2015-06-09 13:19:04,205,91,en
moderate aloneness,2015-06-09 01:58:08,813,628,de
a gang leader’s contracted murder of a young nerd,2015-06-08 18:37:08,207,101,en
"when success is near, you get in your own way and screw it up",2015-06-08 13:19:25,445,292,en
my old friend I Am Ass,2015-06-08 01:58:03,451,291,en
turns out it’s not so easy to cook,2015-06-07 18:37:09,364,199,en
"get off my back, I’m God",2015-06-07 13:19:13,585,417,en
she could smell your stupidity,2015-06-07 04:51:22,518,418,en
trembling cluelessly on the edge of adulthood,2015-06-07 01:58:01,1447,1753,en
trying to figure out how stories work,2015-06-06 18:37:01,263,178,en
too much weed and too little sleep,2015-06-06 13:19:05,557,210,en
American society: gay,2015-06-06 01:58:03,821,546,en
entertainment is fun and hip,2015-06-05 18:37:06,281,154,en
sweating. I guarantee you,2015-06-05 13:19:04,384,250,en
"the weenie, the weasel, the jerk, the jackass, the pedant, the moral coward",2015-06-05 01:58:03,271,154,en
"thank-you gifts, including a tube of mice that poop out a message",2015-06-04 18:37:11,241,103,en
"not good, of course",2015-06-04 13:19:08,236,175,en
the troubles of white people,2015-06-04 01:58:11,541,303,en
"children are out to get you, possibly with the help of aliens",2015-06-03 18:37:06,839,821,en
a radioactive cloud of self-loathing,2015-06-03 13:19:00,594,452,en
The Nation Is Stumped: Is This Humor?,2015-06-03 01:58:04,319,200,en
nice sternum,2015-06-02 18:37:19,380,238,en
a slide show in which a middle-aged white man transformed into a young brown woman. The executives present were dazzled,2015-06-02 13:19:09,337,112,en
life be enemy,2015-06-02 01:58:06,245,194,en
surely haters are the least of our worries,2015-06-01 18:37:11,772,622,en
wearing a mask like a gazelle’s skull and murmuring ominously,2015-06-01 13:19:01,315,211,en
there’s definitely something wrong with me,2015-06-01 01:58:04,606,536,en
There’s no good parenting,2015-05-31 18:37:05,285,138,en
sex and love and perversion,2015-05-31 13:19:02,266,103,en
this is poppycock,2015-05-31 05:30:29,302,263,en
a road that smells like pee,2015-05-30 18:37:15,148,67,en
"Instead of being afraid to fly, I’m mortally afraid of landing and being judged by the officer at the airport",2015-05-30 13:19:02,384,151,en
you have like five minutes,2015-05-30 01:58:05,403,256,en
why: Why live like this,2015-05-29 18:37:05,576,475,en
society may not be ready for children,2015-05-29 13:19:01,449,291,en
"wiener, preferably",2015-05-29 01:58:15,355,215,en
start lying about yourself,2015-05-28 18:37:30,364,251,en
fantasize about being described as a “tall drink of water”,2015-05-28 13:19:04,557,294,en
"faint, cry, vomit",2015-05-28 01:58:08,459,380,en
constant anxiety will be your savior,2015-05-27 18:37:12,544,432,en
advice: Do less,2015-05-27 13:19:00,875,847,en
the guy who wrote “Me and Bobby McGee” is now president,2015-05-27 01:58:06,144,40,en
Food tastes good,2015-05-26 18:37:03,379,318,en
I spent the first two years as an undergraduate crying,2015-05-26 13:19:13,1442,1064,en
could these girls stop obsessing about their “bust” size already,2015-05-26 01:58:01,157,46,en
a spiritual communion through sex and agricultural practice,2015-05-25 18:37:08,380,183,en
"I’m here, I’m in the computer",2015-05-25 13:19:00,579,412,en
"death, a friend",2015-05-25 01:58:00,447,284,en
the prospect of marrying makes no sense,2015-05-24 18:37:11,530,281,en
here are a few good jokes,2015-05-24 13:58:08,217,145,en
I’ve been aware of God for some time,2015-05-24 13:19:01,293,105,en
If a succubus appeared I wouldn’t turn her down,2015-05-24 02:51:16,464,290,en
everyone is gay,2015-05-23 20:35:11,1038,899,en
British monarchs do love their syphilis,2015-05-23 13:56:54,396,212,en
What would cause anyone to resist the notion of drinking wine,2015-05-23 01:54:04,628,496,en
why would any self-respecting ghost want to hang around a barn,2015-05-22 18:21:25,678,446,en
Pinocchio is more than a wooden boy who longs to be human; he’s also a Mexican,2015-05-22 13:31:32,548,236,en
"ever-­evolving, ever more complicated narcissism",2015-05-22 02:29:23,473,393,en
"‘fat yoga here.’ If you’re fat and want to do yoga, go here",2015-05-21 20:06:00,320,88,en
It’s a great time to think about mangos,2015-05-21 14:29:28,788,715,en
"fortunately, there’s nothing",2015-05-21 01:43:45,545,472,en
your you is not so good,2015-05-20 20:38:44,441,283,en
lunch hours are not to be trifled with,2015-05-20 16:36:54,359,240,en
both unstable and self-absorbed,2015-05-20 01:58:38,808,763,en
an AppleCare employee manual and occasional gouts of blood,2015-05-19 20:30:26,165,70,en
"the orgy, which he describes as the “quiet and industrious” kind",2015-05-19 16:57:35,422,186,en
we can’t wiggle our butts in a sequence so precise that it communicates the location of a nectar source three miles away. Bees can,2015-05-19 13:11:36,1282,908,en
it’s hard to know what happened here or why,2015-05-19 01:50:35,465,374,en
Maybe you’ll get it right this time,2015-05-18 19:01:34,398,318,en
I love commuting. I love office clothes,2015-05-18 13:24:19,331,143,en
Be a normal person for just a moment,2015-05-17 16:22:39,677,476,en
it’s going to be awful,2015-05-17 02:16:34,582,549,en
Google is building a fleet of robots that may accidentally destroy mankind,2015-05-16 13:22:27,498,329,en
home entertaining: Simply put out a big plate of cheese shavings,2015-05-16 01:31:28,383,245,en
haters have other qualities apart from their hatred,2015-05-15 19:34:02,498,278,en
should I cut back maybe on the pillaging today,2015-05-15 14:14:11,366,301,en
The motives for ever leaving a house and entering society are often flawed,2015-05-15 01:26:01,817,749,en
http://t.co/0MrVwPtRcg http://t.co/9QD1GibKAA,2015-05-14 18:42:16,125,51,und
it’s all about the sparkle,2015-05-14 13:27:28,298,291,en
something or someone will get poked,2015-05-13 19:35:20,199,111,en
ill prepared for the realities of grown-up life,2015-05-13 14:26:33,788,978,en
Grandma’s 93 she can’t be suicidal,2015-05-13 02:32:18,432,134,en
Look at me transgressing the taboos that are meant to hold us down,2015-05-12 19:03:47,396,275,en
we certainly don’t need more stuff,2015-05-12 13:36:22,302,171,en
Mom and Dad are broke and so are you,2015-05-12 01:46:29,434,231,en
"self-destructive, jealous, spiteful, sexual, snobbish, druggie, fiendish and breathtakingly awful",2015-05-11 18:35:38,876,564,en
"the neutering of dogs, re-enacted episodes of childhood humiliation",2015-05-11 13:16:06,96,25,en
"We’re not laughing about Hitler, we’re laughing with him",2015-05-11 02:45:53,398,131,en
most novels are boring,2015-05-10 17:44:06,262,117,en
"the more I keep drinking, the more I enjoy it",2015-05-10 01:38:13,580,282,en
a cross between Rihanna and a tennis ball,2015-05-09 14:39:20,459,296,en
love is just foolish,2015-05-09 03:00:03,417,262,en
“normal people” don’t share their beds with dogs,2015-05-08 13:34:59,229,109,en
maybe the real problem isn’t men,2015-05-08 02:02:49,235,99,en
I don’t know what I did. I’ve broken the Internet,2015-05-07 18:52:21,421,198,en
What exactly constitutes the “real world”,2015-05-07 13:37:19,541,565,en
"wine, who could disagree",2015-05-07 01:04:23,785,815,en
sensitive fellows who own more than one sweater and who have internalized feelings about the Muppets,2015-05-06 19:17:08,525,360,en
it reeks in here,2015-05-06 13:28:33,107,65,en
Is she a sad oddball or a kind of genius,2015-05-06 00:44:38,747,607,en
nothing rivals the irritation of being over 40 and trying to fit into pants,2015-05-05 18:52:47,185,64,en
"oh, God, don’t even talk to me, go away",2015-05-05 13:28:46,683,654,en
have you considered growing your hair out and taking on a facial expression of constant pain,2015-05-05 00:55:20,510,392,en
being called fat is a good thing,2015-05-04 19:21:56,209,99,en
think about using your whole foot,2015-05-04 14:36:00,247,127,en
many men find themselves grasping for emoji,2015-05-04 00:58:13,460,334,en
texting is kind of stupid,2015-05-03 19:08:22,441,251,en
