text,created_at,favorite_count,retweet_count,lang
buried in an avalanche of popcorn,2014-09-30 02:12:06,244,160,en
"Only hugs, smiles and warm feelings are allowed",2014-09-29 23:31:00,399,419,en
Determinedly anti-classy,2014-09-29 20:27:01,241,164,en
the lady with crazy eyes might want to wipe the trickle of blood oozing from her mouth,2014-09-29 17:11:34,177,80,en
never stop procrastinating,2014-09-29 15:36:02,359,436,en
prize: free coffee,2014-09-29 13:53:03,261,185,en
I’m the most difficult person I have to live with,2014-09-29 12:04:05,619,529,en
"pajamas, spiritually speaking",2014-09-29 04:40:01,373,318,en
a new form of self-mutilation,2014-09-29 02:12:06,122,63,en
soup: children,2014-09-28 23:31:00,288,217,en
family tries to appear normal,2014-09-28 20:27:01,272,156,en
"pale pink mouse costume, upside down on a couch, sneakered feet in the air, smartphone in hand, doing an electronic crossword puzzle",2014-09-28 18:39:10,203,88,en
"games, both sporting and erotic",2014-09-28 17:11:05,175,89,en
dogs who eat screws and batteries,2014-09-28 15:29:22,103,45,en
BUTT NAKED,2014-09-28 13:53:15,217,185,en
"life, love, suffering",2014-09-28 04:40:08,317,199,en
cheerfully experimental sex life,2014-09-28 02:12:01,377,162,en
an excruciating case of the munchies,2014-09-27 23:31:10,226,137,en
stupid relationship with some stupid girl,2014-09-27 20:27:07,408,125,en
you are so not fat,2014-09-27 17:11:10,201,99,en
that’s a fun and fancy thing to say,2014-09-27 13:53:01,272,150,en
wake up to see someone playing a Tibetan prayer bowl over your heart,2014-09-27 11:41:30,176,79,en
"I’m not a drinker, I’m more of a stoner",2014-09-27 07:05:54,250,64,en
"requiring the presence of a functioning, sensitive body",2014-09-27 04:40:01,202,95,en
dedicated to beer,2014-09-27 02:12:05,252,202,en
bad judgment is a release or fun or both,2014-09-27 00:37:00,191,122,en
preoccupied with wedgies,2014-09-26 23:31:01,131,76,en
"journalists are parasites, etc",2014-09-26 20:27:09,250,134,fr
people who eat too much salt should eat less of it,2014-09-26 17:11:07,308,135,en
we’re all nerds now,2014-09-26 15:38:04,294,350,en
cute green Gummi Bears who seem to be gearing up for hand-to-hand combat,2014-09-26 13:53:22,203,140,en
is it even possible to be real,2014-09-26 06:48:01,539,468,en
God knows it is — booze,2014-09-26 04:40:03,217,115,en
stop doing that,2014-09-26 02:12:00,299,336,en
ingenious laziness,2014-09-25 23:31:03,175,156,en
"cats, licking themselves",2014-09-25 20:27:04,165,119,en
I can barely put sentences together,2014-09-25 18:50:04,290,310,en
Thank goodness for the sweet little boys,2014-09-25 17:11:09,101,34,en
booty at the bus stop,2014-09-25 13:53:01,303,203,en
"You’re very sick, and you’re very psychotic",2014-09-25 04:40:03,286,123,en
a friendly reminder to any teenage girl offered an exciting opportunity to sell her soul: It’s a bad idea,2014-09-25 02:12:00,662,618,en
Promiscuity is better than nothing,2014-09-24 23:31:04,396,187,en
vulgar and shameless and desperate for attention,2014-09-24 20:27:13,306,267,en
Here are six ways to kill an employee,2014-09-24 17:11:05,278,156,en
one way to get started: Imagine a chicken,2014-09-24 13:53:15,280,210,en
Most people are not good,2014-09-24 04:40:19,463,325,en
New York is so over,2014-09-24 02:12:02,281,120,en
you can wrap a warm tortilla around just about anything and call it a taco,2014-09-23 23:31:14,450,377,en
there must be something better than what we have here,2014-09-23 22:08:32,307,222,en
a perverse drive to play with fire,2014-09-23 20:27:04,108,58,en
name that one has chosen to give her new daughter: Genitalia,2014-09-23 18:44:41,177,66,en
fabulously infantile,2014-09-23 17:11:13,104,69,en
"Eventually, you’ll destroy yourself",2014-09-23 13:53:03,451,339,en
don’t ever do evil,2014-09-23 04:40:26,285,195,en
"lazy, phobic, neurotic, all-around lame",2014-09-23 02:12:02,326,288,en
watching Tibetans dig for caterpillar fungus,2014-09-23 00:53:03,81,32,en
Good luck trying to criticize Derek,2014-09-22 23:31:01,171,90,en
"most alarmingly, groins",2014-09-22 20:27:01,245,178,en
I will eat pretty much anything,2014-09-22 17:11:09,294,229,en
news headline: ANOTHER WRITER FAILED TODAY,2014-09-22 15:21:32,329,211,en
"smoke cigarettes, drink coffee and paint",2014-09-22 13:53:20,475,253,en
"inner disengagement with the world, or maybe just disgust with it",2014-09-22 04:40:17,308,195,en
being human may involve being a little bit psychopathic,2014-09-22 02:12:02,481,368,en
The three dots shown while someone is drafting a message in iMessage is quite possibly the most important source of eternal hope,2014-09-21 23:31:01,785,585,en
stop doing homework,2014-09-21 20:27:00,418,428,en
"one part pubescent self-pity, one part junk",2014-09-21 17:11:02,234,176,en
"Big Bird might make a provocative, highly nontraditional Hamlet",2014-09-21 15:29:05,439,320,en
Libby can be kind of a jerk,2014-09-21 13:53:13,107,31,en
think masturbation,2014-09-21 07:06:06,209,109,en
"the whole sad, beautiful pageant of human experience",2014-09-21 04:40:02,475,295,en
I am courting him with my misfortunes,2014-09-21 02:12:00,462,297,en
What matters a few broken bones to the glories of intercollegiate sport?,2014-09-20 23:53:01,142,57,en
time to start having more fun,2014-09-20 23:31:07,309,241,en
enthusiastic vulgarity and truly terrible punk rock,2014-09-20 20:27:01,301,301,en
the Kate Middleton of animals,2014-09-20 17:11:02,224,91,en
have Popsicles for breakfast,2014-09-20 13:53:09,170,132,en
"Anytime you would like to make out, I want you to know I’m available",2014-09-20 04:40:01,868,534,en
a tearful fit over not being able to find a particular pair of socks,2014-09-20 02:12:07,283,187,en
all of that namaste [expletive],2014-09-20 00:39:22,277,168,en
"because mmm, ENCHILADA",2014-09-19 23:31:04,228,164,en
"witless, lazy, lustful, duplicitous and cowardly",2014-09-19 20:27:08,163,78,en
never speak to anyone,2014-09-19 17:11:10,371,336,en
butts have become a thing,2014-09-19 15:20:27,584,532,en
"Demons, demons, demons",2014-09-19 13:53:01,222,195,und
"seeking romance, or at least physical companionship",2014-09-19 04:40:13,267,129,en
passing the time with a bottle of wine,2014-09-19 02:12:01,311,183,en
wearing Elmo and Easter bunny costumes at children’s birthday parties and drifting uneasily into striptease,2014-09-18 23:31:02,299,177,en
"a mother or a father, a girlfriend, a dog or something",2014-09-18 20:27:02,171,77,en
consistently excited and surprised that I am in any way functional,2014-09-18 17:11:18,661,818,en
"Off the cocaine, onto the cupcakes",2014-09-18 15:23:40,450,293,en
"thank God, somebody here is as smart as I am",2014-09-18 13:53:05,306,159,en
never been wild about getting pulled out of bed,2014-09-18 12:11:09,282,210,en
I just want to give up,2014-09-18 04:40:17,287,170,en
Can chimpanzees send penis pictures over the Internet,2014-09-18 02:12:03,208,138,en
stop hitting people,2014-09-18 00:57:26,242,209,en
let’s not get ourselves too down,2014-09-17 23:31:24,172,138,en
men are obsolete,2014-09-17 20:27:16,600,533,en
go back to smoking opium,2014-09-17 18:42:02,192,114,en
"not, by nature, easygoing about the prospect of my son eating rodent genitals",2014-09-17 17:11:06,173,73,en
Who in their right mind would agree to walk around,2014-09-17 13:53:32,229,167,en
too afraid of daylight,2014-09-17 11:52:15,163,141,en
I am an old man. I am erotic.,2014-09-17 04:40:08,305,171,en
stop having all these constant dramas,2014-09-17 02:12:05,218,145,en
"I’M DEAD, I’M DONE, EAT ME",2014-09-17 00:51:56,458,401,en
specifically asking not to be mocked,2014-09-16 23:31:03,189,140,en
Everything is a cry for help,2014-09-16 20:27:00,325,256,en
what do you have left? Not much. Not much at all,2014-09-16 17:11:10,216,164,en
find the birding and conservation biology world to be startlingly white,2014-09-16 15:35:57,103,51,en
idiotic smugness and an extremely large mouth,2014-09-16 13:53:07,166,107,en
can’t . . . do this . . . anymore,2014-09-16 04:40:05,326,218,en
"swearing, crying, sex",2014-09-16 02:12:09,508,260,en
defecation masquerading as nihilism,2014-09-16 00:53:37,221,125,en
artichokes that are not actually artichokes,2014-09-15 23:31:02,198,115,en
"inventive, resourceful vulgarity",2014-09-15 20:27:06,153,138,en
War is gross. But this isn’t war. It’s fun,2014-09-15 18:26:51,222,114,en
whole wheat salad pizza,2014-09-15 17:11:12,159,89,en
there’s a correlation between tending a garden and not being a serial killer,2014-09-15 15:28:53,438,280,en
"awkward, lovably unlovable creature",2014-09-15 13:53:04,330,255,en
no idea how high I am,2014-09-15 04:40:14,339,125,en
Why does she spend so much time in her underwear,2014-09-15 02:12:02,356,217,en
"strewn across the floor of the kitchen, screaming “but it’s too hard”",2014-09-14 23:31:01,367,317,en
Jesus has been Jesus for only 15 years,2014-09-14 20:27:00,227,110,en
You’ve now been porked,2014-09-14 17:11:00,146,82,en
This article contains no useful information,2014-09-14 13:53:12,335,184,en
copulate and listen to smooth jazz,2014-09-14 07:07:02,345,219,en
no one will love you,2014-09-14 04:40:08,446,348,en
there’s a very good argument to be made that there are too many people,2014-09-14 02:12:05,310,227,en
how many shy people does it take to thwart an interactive performance,2014-09-14 00:57:15,446,254,en
it must be conceded that the website of a liquor company is not the gold standard of historical reliability,2014-09-13 23:31:00,202,101,en
float in a bubble of alienated solitude,2014-09-13 20:27:04,290,229,en
"wow, this is very different and exciting",2014-09-13 17:11:04,221,164,en
a real Cookie Monster,2014-09-13 15:32:58,112,61,en
http://t.co/pNnmKMTPp1,2014-09-13 13:53:06,147,44,und
the joy of no longer being alone,2014-09-13 07:11:01,246,94,en
surely a cocktail is the best hope,2014-09-13 04:40:12,251,232,en
What if we could change dating,2014-09-13 02:12:00,195,88,en
"a whole system of life, of erotic life",2014-09-12 23:31:03,135,75,en
narcissist with impenetrable emotional armor,2014-09-12 20:27:00,345,291,en
invite you to a cat birthday party,2014-09-12 18:53:54,312,229,en
a pie in the face never goes wrong,2014-09-12 17:11:16,132,84,en
repelling the advances of a somewhat scruffy ghost,2014-09-12 15:16:10,172,109,en
"brush your teeth, experts do not agree",2014-09-12 13:53:02,118,51,en
switch from liquor to coffee,2014-09-12 10:11:01,186,105,en
it sometimes seems that almost everyone is thinking,2014-09-12 04:40:11,216,125,en
the act of lovemaking is hilarious,2014-09-12 02:12:02,393,188,en
food is something people think they love,2014-09-11 23:31:06,224,153,en
rats competing in a wet zoot suit competition,2014-09-11 20:27:04,142,73,en
happiness and satisfaction can happen,2014-09-11 18:32:28,181,138,en
confused about combining art and life and creating a new kind of communelike open family,2014-09-11 17:11:00,122,67,en
I think I’m going to try to do as little as possible with my life,2014-09-11 13:53:01,373,316,en
"neurotic meltdowns, toxic relationships and questionable personal choices",2014-09-11 07:11:10,506,400,en
demonologists who want to collect his semen,2014-09-11 04:40:05,204,87,en
who we’ve become as a society: people,2014-09-11 02:12:01,276,133,en
cheeses are much too good,2014-09-10 23:31:04,276,252,en
"He may not be as dumb as he at first appears, but at the same time, it’s hard to tell",2014-09-10 21:44:37,330,182,en
impossible to like,2014-09-10 20:27:00,147,115,en
"whatever, making the words clear is not the point",2014-09-10 17:11:03,210,141,en
Sausage is a great deal like life,2014-09-10 13:53:03,161,104,en
And weirdos. So many weirdos,2014-09-10 07:02:02,232,211,en
men persist in their delusions,2014-09-10 04:40:00,417,278,en
stupid/idiot/moron,2014-09-10 02:12:13,210,139,en
not Catholics or blacks but Muggles,2014-09-09 23:31:00,352,165,en
never go outside,2014-09-09 20:27:32,318,316,en
"Hey, that’s not nice",2014-09-09 17:11:05,174,137,en
"one of those headaches, you know the ones, right above the eye bone there",2014-09-09 13:53:08,224,105,en
narcissism masked as altruism,2014-09-09 04:40:04,342,185,en
not a huge fan of social interaction,2014-09-09 02:12:02,580,521,en
there’s nothing but brussels sprouts,2014-09-08 23:31:00,191,115,en
Life is stupid,2014-09-08 20:27:00,306,256,en
concluded that you do not want to know,2014-09-08 18:45:11,125,84,en
enough ice cream,2014-09-08 17:11:02,112,36,en
a walking middle finger to cultural norms of femininity,2014-09-08 13:53:07,661,550,en
"obsessive by nature, most of the time",2014-09-08 04:40:17,220,153,en
magic homework-disappearing trick,2014-09-08 02:12:02,180,181,en
cannabis and chicken decapitation,2014-09-07 23:31:05,253,127,en
avoid participation,2014-09-07 21:31:51,367,334,fr
student of vaginal flora and bodily fluids,2014-09-07 20:27:02,157,63,en
I like Sundays,2014-09-07 17:11:00,139,103,en
have waffles for breakfast,2014-09-07 13:53:14,249,160,en
drink straight booze,2014-09-07 06:27:00,246,158,en
passionate but fragile,2014-09-07 04:40:02,398,383,en
I'm not a sex maniac,2014-09-07 02:12:03,189,100,en
why do I insist on going through with this whole thing when deep down I know it can only end in tragedy,2014-09-06 23:31:01,477,261,en
"Ah, the blood of virgins",2014-09-06 20:27:01,376,249,en
single and not ready to mingle,2014-09-06 17:11:03,430,253,en
alcohol can bring both joy and pain,2014-09-06 13:53:01,389,215,en
no idea what the hell just happened,2014-09-06 07:31:00,264,219,en
living has become popular,2014-09-06 04:40:09,463,351,en
Let’s pretend that we’re human beings,2014-09-06 02:12:07,436,406,en
Pasta is the whole point,2014-09-05 23:31:07,612,700,en
rebellious attitude toward personal hygiene,2014-09-05 20:27:00,186,106,en
"always so, so sad",2014-09-05 18:58:12,263,164,en
I think Lassie is annoyed,2014-09-05 17:11:02,66,33,en
bad hair life,2014-09-05 15:20:41,243,288,en
you’re the good kind of fat,2014-09-05 13:53:08,260,107,en
determined to avoid the world,2014-09-05 04:40:05,328,284,en
Many people are able to remember details,2014-09-05 02:12:06,122,55,en
don’t give a rat’s ass about football,2014-09-05 00:28:09,258,205,en
"fried chicken, cleverly paired with Champagne",2014-09-04 23:31:04,248,131,en
do you have some hot gossip you want to share,2014-09-04 20:27:11,126,68,en
the ultimate privilege: pressing a button,2014-09-04 18:56:27,177,94,en
"like, ‘Heck yeah.’",2014-09-04 17:11:21,225,223,en
sixth grade: What sort of crazy swinger town is this,2014-09-04 13:53:04,300,146,en
turkey excrement removal,2014-09-04 08:31:19,65,34,en
obsessive fixation on getting sleep,2014-09-04 04:40:00,261,242,en
I’ll be under the bed in a fetal position,2014-09-04 02:12:04,362,351,en
chicken cutlets it is! For everyone. Forevermore,2014-09-03 23:31:03,293,227,en
foul language and bitching at length,2014-09-03 20:27:22,257,254,en
you are dead. No fun,2014-09-03 17:11:08,317,200,en
occasionally tolerable but mostly just talky,2014-09-03 13:53:17,228,221,en
"whispered aloud, “This.”",2014-09-03 07:11:07,203,94,en
weed helps a lot,2014-09-03 04:40:19,479,226,en
terrified of the future,2014-09-03 02:12:02,360,360,en
pretty porn-savvy,2014-09-02 23:31:01,156,78,en
Nobody really cares,2014-09-02 20:27:03,302,299,en
wounded when the cat declined to sleep with me,2014-09-02 17:11:01,256,185,en
"In the beginning, everyone made fun of me",2014-09-02 13:53:11,188,118,en
"Tomorrow is a drag, man",2014-09-02 04:40:06,261,265,en
who speaks for the wine,2014-09-02 02:12:01,225,173,en
fantasized about the big bowl of ramen I would make myself,2014-09-01 23:31:06,283,181,en
completely flummoxed by how to take care of things,2014-09-01 20:27:00,212,173,en
Excuse me. Would you mind,2014-09-01 17:11:04,226,141,en
What about bunions,2014-09-01 15:55:30,79,43,en
these plush digs only feature a single bathroom — for conceptual-art reasons,2014-09-01 13:53:18,75,44,en
Get that old guy off,2014-09-01 07:31:11,95,49,en
"She’s a mean, sloppy drunk, too",2014-09-01 04:40:00,184,96,en
radically immature,2014-09-01 02:12:11,206,249,en
The meat thermometer is the worst thing that ever happened,2014-08-31 23:31:00,117,69,en
do something else,2014-08-31 21:35:03,176,170,en
"hope (an old man, who may be the last on Earth) and grace (a gramophone that plays only “Beer Barrel Polka”)",2014-08-31 20:27:08,125,54,en
dogs are not people. They have more fur,2014-08-31 18:50:15,388,260,en
"peanut butter and jelly, which are sadly forbidden",2014-08-31 17:11:08,190,83,en
"There, like, just isn’t enough time",2014-08-31 15:45:58,381,329,en
multiple advanced degrees prove no help in selecting a sweater that covers both shoulders simultaneously,2014-08-31 13:53:03,345,185,en
I’m really worried about you,2014-08-31 07:01:01,234,106,en
Who ate the other squirrel testicle,2014-08-31 04:40:02,269,162,en
sit uncomfortably at a cocktail gathering,2014-08-31 02:12:17,180,98,en
a traffic cone is unlikely to make a comfortable seat,2014-08-30 23:31:00,227,169,en
"make really, really bad choices",2014-08-30 20:27:05,394,438,en
pie is home,2014-08-30 19:01:42,229,167,en
mom tried to hide behind some grocery shelves,2014-08-30 17:11:00,120,45,en
wear sweatpants and eat a lot,2014-08-30 13:53:00,534,442,en
so much going on in my head all the time,2014-08-30 07:01:00,260,226,en
party entertainment in the form of a harrowing Shakespearean tragedy,2014-08-30 04:40:16,221,205,en
"a drinking habit, a mood disorder, a sex life",2014-08-30 02:12:02,430,278,en
condescending jazz nerd,2014-08-29 23:31:01,385,289,en
EXCUSE ME,2014-08-29 20:27:05,182,167,en
don't eat children,2014-08-29 19:11:00,260,263,en
wolves should be allowed to mate with coyotes,2014-08-29 17:11:03,108,57,en
anything that tastes good on its own will probably taste even better baked inside a buttery pastry,2014-08-29 15:23:29,322,242,en
is this a completely stupid idea,2014-08-29 13:53:17,192,131,en
I love the liquor,2014-08-29 04:40:03,220,146,en
sitting around the house watching TV just horny,2014-08-29 02:12:00,218,98,en
have macaroni and cheese for dinner,2014-08-28 23:31:02,224,164,en
it’s kind of heartbreaking to know there are people,2014-08-28 20:27:00,489,444,en
an intellectual or whatever,2014-08-28 18:43:15,334,270,en
kill whitey,2014-08-28 17:11:02,166,134,en
passion can be far more dangerous than many realize,2014-08-28 15:19:04,221,144,en
there are some real basket cases out there,2014-08-28 13:53:03,124,74,en
Oscar-worthy erection,2014-08-28 10:54:17,277,131,en
asleep. Or dead,2014-08-28 04:40:12,272,245,en
dessert: something to consume after internalizing the fundamentals of Judaism,2014-08-28 02:12:03,247,128,en
please don’t say really mean stuff,2014-08-27 23:31:03,463,474,en
dramatically walking off now,2014-08-27 20:27:14,198,182,en
How many cookies will you need,2014-08-27 17:11:00,184,111,en
writing is not a way to support oneself,2014-08-27 13:53:04,256,170,en
http://t.co/mEYxnXPaNz,2014-08-27 12:01:04,129,52,und
peeing and pooping at the same time,2014-08-27 04:40:05,181,82,en
people are infuriating mysteries,2014-08-27 02:12:01,401,365,en
"put something edible on a stick, add something to improve the flavor and hold it over a fire. That's cooking",2014-08-26 23:31:00,331,190,en
a Ken doll who “wakes up in the Mattel factory to discover he’s gay.”,2014-08-26 20:27:05,258,111,en
be smarter,2014-08-26 17:11:02,202,178,en
"realized, then, that the birds had become our teachers",2014-08-26 13:53:10,239,149,en
"down a rainbow-colored path, with psychedelic sea creatures and anthropomorphized ships guiding the way",2014-08-26 04:40:01,225,140,en
Privacy is avant-garde now,2014-08-26 02:12:05,281,198,en
chicken is often cooked,2014-08-25 23:31:00,118,91,en
let’s talk about dildos,2014-08-25 20:27:06,240,189,en
taco week,2014-08-25 17:11:11,158,128,pl
we are idiots,2014-08-25 15:11:02,339,362,en
remember to be friendly and speak to people,2014-08-25 13:53:05,327,260,en
a long night of being deeply creepy,2014-08-25 06:47:01,264,187,en
take these bathrooms and blow ‘em out,2014-08-25 04:40:05,53,19,en
"rude, cruel, bratty, painful to watch, funny to watch and, sometimes, reckless",2014-08-25 02:12:01,170,118,en
His main flaw is he’s eating my food,2014-08-24 23:31:01,418,295,en
"On the Internet, no one knows you’re a psychopath",2014-08-24 20:27:09,385,295,en
a discussion of whether or not trees are moral,2014-08-24 17:11:14,225,127,en
"not enough money, my family is a nightmare, my love life is a disaster",2014-08-24 15:51:44,379,208,en
"unshaven, downtrodden man in pajamas",2014-08-24 13:53:06,168,86,en
mix in a little more of the cock,2014-08-24 07:02:04,206,98,en
you’re not likable,2014-08-24 04:40:02,253,178,en
the only thing that’s been in my body today is vodka,2014-08-24 02:12:03,366,136,en
Dating is often terrible,2014-08-23 23:31:09,612,393,en
kids wants good brains,2014-08-23 21:59:23,105,63,en
"Carburetors, man, that’s what’s life is all about",2014-08-23 20:27:02,107,57,en
willing to pay to be lazy,2014-08-23 17:11:02,186,143,en
"Who knows, Miss Cat, what fantastical adventures the two of us will have today",2014-08-23 13:53:08,218,142,en
What the hell did you do,2014-08-23 07:02:03,245,186,en
have always been and will always remain totally uncool,2014-08-23 04:40:02,442,397,en
eaten alive by anxiety,2014-08-23 02:12:03,488,430,en
failure in writing is more of an intimately crushing day-to-day thing,2014-08-22 23:31:00,314,219,en
gosh darn it,2014-08-22 20:27:00,167,139,en
pizza vending machine,2014-08-22 17:11:13,248,217,en
Hello! I am very excited,2014-08-22 13:53:08,206,171,en
demonstrate the safest way to step on a penis,2014-08-22 04:40:00,388,221,en
horrible at being a person,2014-08-22 02:12:09,549,600,en
that guy with the spleen. Yikes,2014-08-21 23:31:03,195,112,en
may or may not be in league with Satan,2014-08-21 20:27:05,370,313,en
an emotional lunatic from start to finish,2014-08-21 17:11:00,300,251,en
"(Ice Cream Life), marijuana",2014-08-21 15:41:04,240,111,en
singing a cappella music in the barbershop style is cool,2014-08-21 13:53:09,95,52,en
drunkenly eating Cheetos,2014-08-21 04:40:13,257,133,en
"I am going to lie here in despair, just step over me it’s fine",2014-08-21 02:12:07,666,641,en
"Tweet, tweet",2014-08-21 00:53:01,135,75,fr
a man who wants simply to be left in peace,2014-08-20 23:31:03,114,68,en
she’s a loner resigned to her ill fate: She can’t use a microwave,2014-08-20 20:27:00,230,118,en
mostly dislikable,2014-08-20 18:53:43,147,151,en
"ribs, bone-in pork chops, whole chicken or bone-in parts, leg of lamb, rack of lamb, beef brisket, pork loin or butt",2014-08-20 17:11:02,56,29,en
nothing you do shows any sign of promise,2014-08-20 13:53:02,258,174,en
just want to cuddle,2014-08-20 07:14:49,256,200,en
laziness isn’t necessarily a bad thing,2014-08-20 04:40:01,208,157,en
there is only wine,2014-08-20 02:12:07,377,278,en
barbecue is magic,2014-08-19 23:31:03,151,132,en
"You know, you’re absolutely full of it",2014-08-19 20:27:10,150,104,en
"two very strong passions, and one of them is his robots",2014-08-19 17:11:05,119,66,en
way beyond butt glue,2014-08-19 15:35:58,146,119,en
this tack isn’t working out so well,2014-08-19 13:53:03,39,16,en
I can’t believe I ate that brownie. I am so fat,2014-08-19 04:40:04,244,92,en
men are naked,2014-08-19 02:12:07,168,93,en
Here are four ways to destroy your marriage,2014-08-18 23:31:09,130,65,en
"a dog, even a showbiz one, was just not meant to be a meteorologist",2014-08-18 21:55:01,304,229,en
literally the smell of animal feces,2014-08-18 20:27:06,95,46,en
needed to tell that chicken wing how I felt: “I’m in love with you.”,2014-08-18 17:11:05,328,274,en
going outside to clean up vomit and feed a rat,2014-08-18 13:53:06,131,57,en
What if we welcomed students to school,2014-08-18 12:31:07,174,79,en
I worry that people are going to be afraid,2014-08-18 04:40:05,171,68,en
known as the Bastard,2014-08-18 02:12:14,107,73,en
diagnosis: porcelain cat figurines,2014-08-17 23:31:02,246,214,fr
stuff is everywhere,2014-08-17 20:27:01,213,187,en
how soon is too soon for red wine,2014-08-17 17:11:00,391,307,en
"the beginning was the Word; later, came all the human psychodrama",2014-08-17 15:28:17,179,121,en
Waking up is challenging,2014-08-17 13:53:00,379,380,en
there is so much to worry about,2014-08-17 04:40:06,357,364,en
second date. It isn’t going well,2014-08-17 02:12:02,242,62,en
make people feel better,2014-08-16 23:31:00,203,170,en
it’s possible that you’re an overly competitive maniac,2014-08-16 20:27:07,236,149,en
Shakespeare sucks,2014-08-16 17:11:13,143,77,en
"Al Gore is a cardboard cutout, literally",2014-08-16 13:53:04,273,118,en
you pay too much attention to what other people think. You worry too much that you are a failure,2014-08-16 06:53:01,446,227,en
Some real classy dames are tearing up the joint,2014-08-16 04:40:07,238,174,en
aspirations: marijuana and vaginas,2014-08-16 02:12:05,429,206,tl
watching a fish play Pokémon,2014-08-16 00:45:07,147,89,cy
"steak takes the crown, no contest",2014-08-15 23:31:02,97,55,en
having fun is more important than having everything be perfect,2014-08-15 20:27:02,314,269,en
bordello run by a religious cat lady,2014-08-15 17:11:10,109,69,en
I am obviously not smart,2014-08-15 15:21:52,227,183,en
interspecies cross-dressing,2014-08-15 13:53:04,132,61,en
it’s my churning mind that keeps me up at night,2014-08-15 08:09:11,188,116,en
BE NICE,2014-08-15 04:40:09,296,323,en
