text,created_at,favorite_count,retweet_count,lang
"Imagine how many people are having sex right now. They could fill a lake. And if you fine folks at Shark Tank give me $90,000, I intend to",2015-05-26 19:05:04,680,165,en
babe please come over and lets do the thing adults do in bed (i fall asleep during Beetlejuice but wake up mad if you try to turn it off),2015-05-25 07:58:32,915,265,en
Shrimp are always curled up like they died trying to s their own dick,2015-05-21 18:12:54,988,379,en
"I handwrite and fold a message then slide it across the table. My banker opens it, CAN I HAVE ANOTHER CREDIT CARD IT WON'T BE LIKE LAST TIME",2015-05-19 22:44:53,928,241,en
They had some really dope samples at the grocery store today.  I finally got to try cheddar cheese.,2015-05-19 04:34:59,605,135,en
"Sometimes when I gaze upon a giant mountain I feel insignificant. But then I snap out of it and think, ""No. I'm better then this mountain""",2015-05-18 19:10:03,506,184,en
I'm in one of those moods where if I was a girl I would change up my hair,2015-05-17 01:52:45,706,168,en
"Fuck the name 'Geoff'.  If youre named Geoff go to the courthouse right now and change it to Jeff. Take accountability, make this right",2015-05-17 01:36:09,1728,631,en
"I am a great multitasker because i'm always doing two things at once:
1) Doing a thing
2) Being a diva about it",2015-05-16 19:55:30,1026,498,en
just gonna throw it out there that i think aristotle would wear a fedora if he were alive today and thats why i refuse to learn about him,2015-05-16 07:06:12,966,316,en
Facebook should change its name to Acquaintance Birthday Reminder,2015-05-14 15:44:47,1668,721,en
Someone should put a GoPro on a mole. Who really knows what's going on down there,2015-05-14 04:43:31,699,210,en
"Has anyone tried giving bees heroin? I feel like bees on heroin would produce better honey. It's probably not true, but it's just how I feel",2015-05-12 16:59:22,860,271,en
Every 4 years pizza hut comes out with a rectangle pizza and tries to act like it's a brand new idea.,2015-05-12 13:12:35,3041,1011,en
Think it's not ok to make fun of George Zimmerman getting shot in the face? Please consider: its actually extremely cool.,2015-05-11 23:21:50,682,215,en
"when someone gives you 2 options, there is usually a secret 3rd option of going to out for milkshakes if you ask and then add,""I'm buyin'""",2015-05-11 23:00:36,469,158,en
very sad to hear the news that George Zimmerman was shot in the face and survived,2015-05-11 19:43:01,1198,780,en
i have been sitting in a pitch black room for hours staring only at my computer screen. i am essentially dead &amp; in perfect health,2015-05-11 04:07:53,433,124,en
dad people at the party are drinking can u come pick me up?? http://t.co/dWEwt0ZGaB,2015-05-10 23:54:13,479,143,en
the boys are coming over tonight with a couple cases of beer and we're going to watch the dog eat a bowl of spaghetti,2015-05-10 20:47:35,669,209,en
"I look like Harry Potter if instead of going to wizard school, he just kept living under the stairs",2015-05-09 23:20:02,1403,610,en
"Her: music tastes? i like anything besides rap &amp; country
Kid Rock: Dang",2015-05-09 22:53:23,991,311,en
if you're wearing a blue tooth headset I will assume Will Smith is hiding in the bushes feeding you smooth lines to say to girls,2015-05-09 20:00:41,665,222,en
"""Your Kickstarter concept 'Send Mike to the office's of Men's Humor to secretly hide several angry beehives' was met in 48 seconds.""",2015-05-09 17:48:43,521,106,en
"Bill Gates: hey Mike fantastic to meet you
Me: I filed a report when my Windows 2000 crashed and no one ever followed up. We ain't cool Bill",2015-05-09 17:41:29,815,213,en
"I like to refer to ducks as mallards and as people are processing that, I bodyslam them by calling geese ""canadian honkers""",2015-05-07 03:32:04,404,98,en
How I significantly improved my Netflix http://t.co/8EMjBI3PM1,2015-05-06 23:37:53,26266,12323,en
"17 Ways To Be &amp; Act, By Person Who Writes Online Lists For A Living",2015-05-06 04:39:41,804,292,en
"i think i'm finally in good enough shape, and he's deteriorated to the point, where i could finally beat up Clint Eastwood",2015-05-06 02:29:59,476,108,en
Sun Tzu's Art of War is very applicable in the business world. Just today I made a client face the window and get the sun in his eyes,2015-05-06 00:18:55,316,71,en
"Ghost of Caesar: and what of my legacy? what now bares my name? Buildings? Mountains?
Me:uhh remember how you used to love romaine lettuce?",2015-05-05 23:22:19,1279,560,en
"Girl with eagle feather in her hair: hmmmm
[licks finger and holds it in the wind] 
Girl: yes, the crops are going to be on fleek this year",2015-05-05 19:32:41,605,197,en
Comedian: Folks back in my day a Blackberry was something you ate in a pie [drops notecards] folks... I live in my car. please help me folks,2015-05-05 02:37:25,628,131,en
"sorry, but if you are ever upside down for any reason i'm going to try to kiss you because Spider-Man",2015-05-03 19:02:26,675,274,en
If you're under the age of 22 and wearing a suit I will assume you're the shift manager of a movie theater,2015-05-03 01:17:01,436,76,en
i wish for just a day geese and cars would switch honks,2015-05-01 23:57:00,704,311,en
"I hate that the word 'tased' isn't spelled 'tazed.' It's a futuristic electricity gun, you could have totally pulled of a 'z' in there.",2015-05-01 03:26:07,711,192,en
Facebook Reminder: You Have Two Events You Need To Get Out Of Attending Tomorrow,2015-04-30 15:52:28,547,183,en
"my favorite animals at the zoo are just the random birds walking around like they belong. Go home pigeon, this is fancy bird town",2015-04-30 04:10:06,24494,13279,en
"Gym Trainer: Well, lets start simple. What are your fitness goals?
Me: I want to be able to lift my cast iron pan with one hand.",2015-04-30 01:22:19,747,295,en
"As a child, 'The Jetsons' gave me unrealistic expectations for the future: like having a wife who loves me &amp; owning a dog.",2015-04-29 23:52:29,3008,1344,en
do fish know they're fish or are they just like AAAAAAAAAAHHHHH all the time?,2015-04-29 23:50:15,588,218,en
"i just bought noise-canceling headphones: Finally, a way to use technology to isolate myself!",2015-04-29 02:42:37,383,88,en
"wouldn't you like to turn all golf courses into public parks? Now you can, Vote Yes on my ""Go Fuck Yourself, Rich People"" bill",2015-04-29 00:13:25,464,139,en
What did pterodactyl's look like when they were having sex with each other?? I have a few theories on the matter (1/49),2015-04-28 03:21:17,489,92,en
.@Harvard sometimes I tell people I have an English degree from your school and they just believe me,2015-04-27 02:48:49,944,226,en
"Being alone all day-
Hour one: No pants, this is awesome
Hour three: boy I sure think some weird thoughts 
Hour five: I am not a well person",2015-04-27 00:00:10,3124,1375,en
"the children from Stephen King's Stand By Me went out in search of a dead body, but perhaps the true ""dead body"" they found was ""friendship""",2015-04-26 17:02:46,1769,677,en
"I closed my eyes and listened to an entire Creedence Clearwater Revival album, and when I opened them I had a moustache",2015-04-25 22:00:35,625,199,en
Well uhhhh...  Why'd you call it that then http://t.co/oMPqXAyRhK,2015-04-25 20:24:30,934,255,en
y'all need to cool it with saving bees. Bee's can sense that shit and it makes u seem desperate. Just play it cool &amp; bees will come back.,2015-04-25 15:31:32,1199,445,en
"i saw a bro-dude at a bar say, ""when the cat is gone, the mice have fun"" and you could tell he thought it would rhyme. The moment just hung.",2015-04-25 15:11:06,1044,187,en
If had a superpower I'd want the ability to fight abstract concepts. BAM to poverty. KAPOW to tardiness. zzzZZZZap to mental illness stigma,2015-04-25 04:19:59,521,201,en
I just feel like batman would be happy to eat some pussy while superman would certainly NOT eat pussy,2015-04-24 03:27:50,547,128,en
"Diamonds are a girls best friend 
Dog is man's best friend 
David Bowie is famous for his androgeny
And he has an album Diamond Dogs",2015-04-23 19:35:37,654,213,en
"I know why birds bones are hollow. Why they were cursed. I know how high they flew, and the shit they said to god while they were up there.",2015-04-23 05:51:04,489,136,en
for boat safety instructions: sea below,2015-04-22 04:18:20,772,246,en
"[meeting to create the letter Q] 
Draper: thats our idea for the letter Q
Mr. Business: thats an O
Draper (sweating) : I'm... not done yet",2015-04-21 22:37:48,595,206,en
ANY bed can be a death bed if you wow still reading huh turtles are good pets you can tape balloons on them and let them wander your yard,2015-04-21 22:27:11,1043,410,en
"you can explain to me exactly how a snake moves, but I will still not understand it",2015-04-20 04:51:09,756,233,en
I think my self confidence is finally high enough to put myself back out there and get rejected a few more times,2015-04-20 02:22:06,742,303,en
"Muffins, 1915: ""Wow, blueberries baked into a buttery cake, what a treat""
Muffins, 2015: ""I'm a fucking hero because this isn't a donut.""",2015-04-19 19:41:31,442,84,en
"[cooking show] 
chef, intro: I like cooking fresh ingredients simply 
chef, cooking: I'm preparing a risotto basalmic mango glaze reduction",2015-04-19 18:38:38,415,113,en
"Comedian: how about that Justin Bieber? 
*Crowd laughs* 
Comedian: here are some other things for children that I'm better than",2015-04-18 18:53:37,453,100,en
The cool thing about my dog walking business is [picks up poop with a bag] I'm my own boss,2015-04-18 18:48:33,642,181,en
"[watching soccer with British guy] 
Lloyd: good challenge 
Me: they kick the ball so far
Lloyd: knicked it
Me: I couldn't kick it that far",2015-04-18 17:16:44,364,84,en
'Paul Bart: Mall Cop 2' sounds like something you'd tell background extras to say over and over to make it look like they're talking,2015-04-18 14:39:39,516,162,en
"[Boot camp, 1700s Royal Army - Drum Section]
Sergeant: your first instinct is going to be to drum faster when you're shot at, don't do it",2015-04-18 04:15:28,1065,370,en
"It's me your wedding DJ, here I am adjusting audio levels with  fake vinyl dials connected to a macbook, fixing mistakes The Beatles made",2015-04-17 22:16:23,685,184,en
"my hamster is sleeping so I'm whispering ""cheese"" over and over into his cage so he has pleasant dreams",2015-04-16 04:29:30,618,145,en
"when i imagine Donald Trump at a molecular level, he's just made entirely of tiny Donald Trumps all linking arms &amp; tesselated",2015-04-15 02:20:54,750,223,en
You can tell science is more respected than art by people's reaction when both kill a bunch of mice,2015-04-14 02:28:07,515,180,en
"Someone should make a food app that connects to your bank account and only lists restaurants you can afford, could call it Welp",2015-04-12 22:51:35,5447,2924,en
put my salad in a mason jar like one of your Pintrist girls,2015-04-12 17:33:44,591,207,en
"friend: Are you eating a whole frozen pizza by yourself?
me: It was on sale for $4
friend: I wasnt asking because I thought it was expensive",2015-04-10 02:55:43,2124,788,en
purt burt: murt curp 2,2015-04-10 01:04:37,1378,476,pt
name your pug Avocado because he's the good kind of fat,2015-04-10 00:54:15,894,397,en
"Sure, the gourmet coffee was delicious, but I'm not really in the market for another thing to care about.",2015-04-07 21:18:24,485,122,en
"who are cab drivers always chatting with on the phone? other cab drivers probably. so cute, all you cabbies are friends",2015-04-07 06:38:14,370,59,en
"Leaving a store without buying anything is embarrassing. I feel like people think ""farewell idiot who went to the grocery store by mistake""",2015-04-05 21:59:28,3777,1445,en
"Beyonce Instagramed some Easter eggs like an hour ago, and already people are arguing about Obama's birth certificate in the comments",2015-04-05 17:04:38,937,281,en
"I just heard about flirting, haha you wacky kids",2015-04-05 03:50:53,520,187,en
"[Avengers at brunch] 
Iron Man: you bring that shield everywhere, huh? 
Captain America: this shield represents-
Hulk: it's just brunch, cap",2015-04-05 02:32:15,600,219,en
high stakes special instructions for the pizza delivery person http://t.co/F7WuSHrIdV,2015-04-04 04:13:24,1777,662,en
Women like a man with an accent because it means he's from far away and maybe isn't terrible like everyone around her.,2015-04-02 18:23:21,914,350,en
"Prank: Facebook post ""I got engaged!"" And after everyone 'likes' it, edit the status to, ""Like this if you know the holocaust was faked""",2015-04-01 14:17:28,2055,687,en
"A fresh new idea for a TV show would be a guy who is very good at managing his personal life, but is terrible at his job",2015-04-01 03:09:04,381,88,en
"We've secretely replaced this man's coffee with fire, let's see if he notices. Oh wow. He noticed. He is noticing a lot.",2015-04-01 02:07:28,2313,946,en
"[holds cantaloupe up to ear and taps it heavily] 
Ah just as I thought: I dont know a god damned thing about melons",2015-04-01 00:31:41,546,174,en
My abs hurt today because last night I went to the gym and got punched in the stomach,2015-03-31 23:49:08,484,176,en
"Me: I'm going to throw this old sweater away
Singer from Weezer: hey I got a much, much more complicated idea",2015-03-31 01:21:52,2873,1411,en
"Noah: Two? Why two of every animal? 
[God whispers in Noah's ear] 
Noah: nice lol",2015-03-30 22:46:14,4434,2124,en
"My wallet is full of once stamped punch cards, little totems to when I was too polite to say no.",2015-03-30 13:31:54,359,68,en
"Imagine how fucked up it would be if each donut sprinkle color were its own flavor. Pretty fucked up imo. But not as fucked up as say, 9/11",2015-03-29 23:25:04,791,207,en
I'm really not comfortable with McDonald's calling their food list a 'menu',2015-03-29 23:13:08,394,81,en
facing my demons http://t.co/rPFqmdYaUb,2015-03-29 21:57:29,459,144,en
*gets life back together to spite ex*,2015-03-29 16:30:36,1249,302,en
"Things were going well with my date, until she noticed my Roomba was a Frisbee glued to a bunch of rats",2015-03-29 02:49:04,1160,393,en
"This is a serious ""fuck you"" to the dudes over at Reese's http://t.co/QB9ZjYRZb9",2015-03-29 01:08:09,354,51,en
"Prank: paint a snake silver, put it in a box, and ask a friend, ""hand me that wire?"" when they try to grab the snake, hit them with a pipe",2015-03-28 23:49:10,909,383,en
Gentle reminder that your belly is full of puke at all times. Have a great day,2015-03-28 17:34:30,1136,463,en
"There are people who work at gummy bear factories, so it's safe to say: sometimes someone had a bad day of work at the gummy bear factory",2015-03-28 01:03:57,427,107,en
"Hamster wife: i'm pregnant again, what a blessing
Hamster husband: they cut my hours at the wheel, we can't afford another 88 mouths to feed",2015-03-28 00:19:55,716,241,en
if you own a hamster please consider buying it a fashionable leash http://t.co/V2CdgC6Dtu,2015-03-28 00:13:25,805,347,en
"I love holding baby birds in the palm of my hand, I just love the way they [clenches fist] Oh god. OH god. OHH GOd",2015-03-27 23:45:04,447,127,en
it turns out humor was perfected by the Japanese centuries ago http://t.co/TCySfin6LQ,2015-03-27 03:03:49,638,225,en
"When I order something with bell peppers, you'd better not bring me fucking green ones. Come correct with red, yellow, or orange peppers.",2015-03-26 18:00:00,201,38,en
"People always describe Hitler as this great speaker, but I've seen his videos and it just seems like he's yelling all of his jokes",2015-03-26 14:18:06,408,99,en
"Congratulations, Your PET DOG has evolved into a PAINFUL MEMORY!",2015-03-26 02:53:51,509,124,en
"I just tried to open a pistachio but I couldn't, so I had to put it down and act like I changed my mind about wanting a pistachio",2015-03-25 23:13:21,965,288,en
If you're over 25 and I have to read your shirt: I hate you,2015-03-25 01:06:57,925,236,en
"When people tell me they're sad about something i'm just like, ""you're so lucky your emotions are related to external stimuli. mine are not""",2015-03-25 00:45:23,594,179,en
"My coworkers all have desk-photos of their kids and families and things they live for, and I just have a framed picture of me shrugging",2015-03-24 23:56:18,721,219,en
The thing I like best about smartphones is how they're a prison you keep in your pocket,2015-03-16 01:50:34,1586,706,en
I feel like throwing something heavy at something expensive,2015-03-16 01:26:24,546,262,en
http://t.co/pLEkFn2Lg7,2015-03-15 20:45:47,2543,1472,und
"When a woman knows more than you on a home repair project, it's important to still try to take the lead, to show that you don't respect her.",2015-03-15 07:34:17,656,219,en
"if escalators hadn't been invented, and somebody told me they were going to try to make one, I'd look at them like they were a fucking idiot",2015-03-15 05:11:53,703,199,en
My two favorite jazz albums are without a doubt Sad Horn Man Blows The Depressions and Drum Dude Plays In A Way Only He Can Appreciate,2015-03-14 18:34:54,1207,588,en
"cool how inbred kings fucked up half the world searching for spice, and I just unscrewed the the salt shaker top so it would spill as a joke",2015-03-14 17:25:42,461,132,en
When someone makes an account just to correct you http://t.co/VmmU5lP1Bk,2015-03-14 03:41:21,506,39,en
"Wow today is Friday the 13th and tomorrow is Pi Day. What's next, a third stupid day?",2015-03-14 02:22:59,634,255,en
"I just asked a waste management dude, ""bet you see some wild shit, huh?"" And without hesitation he responds ""2 rats boning in a McFlurry""",2015-03-13 17:29:50,3380,976,en
"Friend: Try a piece of this cake, it's so rich you couldn't possibly have more than one piece. 
Me: [laughs so loud the windows break]",2015-03-13 02:18:32,506,162,en
"Once I saw a guy with a shirt that said,  ""It's all fun and games until someone gets hurt, then it's hilarious,"" so I hit him with my bike.",2015-03-13 00:07:16,402,110,en
"I just got a diploma for my online degree in Feng Shui, but I can't figure out where to hang it",2015-03-12 22:26:06,442,145,en
A lake is a great place to go think about the ocean,2015-03-12 14:21:49,307,90,en
"Love it when a cafe has a cute sign out front. If there's one thing I can tolerate in the morning before I've had my coffee, it's whimsy.",2015-03-11 20:41:18,388,88,en
"My fanny pack and roller blades say ""let's bone, "" but my jorts scream ""YOU COULDN'T HANDLE IT""",2015-03-11 18:23:52,525,200,en
"Me: so what exactly is design? 
Designer: design IS EVERYTHING
Me: i don't understand
[Hours later]
Designer: I argue about fonts all day",2015-03-11 18:20:46,353,116,en
Haha this stupid baby on the bus thinks he can cry louder than me,2015-03-09 22:44:01,1360,644,en
My Über driver thought I was friendly sitting in the passenger seat but I asked him to drive me up to MakeOut Point and now he seems nervous,2015-03-09 03:53:40,692,192,en
I sort of hope Prince develops Alzheimers so someone has to explain to him daily that he's Prince and he'll be dubious but then very pleased,2015-03-09 01:12:54,668,194,en
"2 men were arguing over a girls companionship outside of a bar last night and I got in the middle, looked at her, and said ""I also love you""",2015-03-08 22:03:00,523,96,en
Gentle reminder: People who complain about vegans are much much much more annoying than actual vegans.,2015-03-08 19:17:24,1320,565,en
"ask the grocery store if they sell eye patches and when they say ""no"" buy a pack of pepperoni and some dental floss.",2015-03-08 15:31:31,457,138,en
"""Did you watch the Hobbit trilogy?""
-Nah I'm lazy, so I just read the book",2015-03-08 02:02:51,1742,812,en
"Me: You sure did some wacky shit
God: Just because you can't see my intention, doesn't me-
Me: What about anteaters?
God: oh those guys, lol",2015-03-07 22:55:07,653,242,en
"starting today if someone sneezes i'm not saying, 'Bless you' I'm going to say, 'you sneezed, but i'm not mad'",2015-03-07 02:12:14,344,109,en
don't trust anyone who gets mad about a dog jumping on them,2015-03-07 01:18:55,1919,1317,en
"[On museum tour]
Me: these frames are nice
Guide: this portrait predates the Renaissance
Me: like where do you even get frames this nice",2015-03-06 21:07:46,652,226,en
Here are some pics I found of dogs sitting in puddles. I hope you enjoy looking at them as much as I did finding them http://t.co/rc1CMlSRDA,2015-03-06 01:02:31,583,277,en
Horses are the most majestic animal that doesn't stop walking when it shits,2015-03-05 04:17:33,1254,493,en
"[Sees my bus-crush in street life holding hands w/ dude]
Wow you never mentioned you had a boyfriend in months of me silently staring at you",2015-03-04 15:30:27,785,180,en
"I just posted a negative Yelp review for a club I've never been to, and described it as, ""half the size of a cemetery, and twice as dead.""",2015-03-04 04:27:43,677,114,en
"When someone tells me they're a doctor or a lawyer all I can think is, 'wow your parents must have yelled at you to do your homework a LOT'",2015-03-03 18:16:06,531,191,en
Ants are actually very intelligent. The ones in my ant-farm dug their tunnels to spell 'NERD.' Ants are also hella mean.,2015-03-03 03:28:47,770,217,en
"Dang it, it's only Monday and already I made eye contact with one of those crows that shows you  how you will die.",2015-03-02 15:38:50,438,137,en
"My funeral instructions to my family were to have me cremated, and I told my best friends under no circumstances should I be cremated.",2015-03-02 06:18:13,5792,2486,en
"Is this guy bothering you? 

*gestures to self*",2015-03-02 04:31:33,1126,448,en
"Shazam app? Back in my day if you wanted to know what song was playing, you just had to move on with your sadshit life.",2015-03-02 00:06:15,645,220,en
"Doctor: I'm afraid you have a broken wrist.
Me: should I put it in a bag of rice?",2015-03-01 05:08:16,468,119,en
"Camels, or as they're also known ""desert kegs"" are often forced to drink 50+ gallons of beer, and then, months later are cut open for it.",2015-03-01 04:07:48,183,49,en
Watching Russian chess pros on Twitch and i'm using a free translator to send them terrible advice and they yell at me in Russian.,2015-03-01 02:43:55,282,57,en
"Don't forget, breakfast is the most important Instagram of the day",2015-03-01 01:33:36,573,256,en
Want to make $1500-2500 a week working from home? Fuck those online scams: start selling drugs.,2015-03-01 01:31:21,369,143,en
"When I was stuck at the bus depot overnight, I had a lot of time to think about things.  I didn't though because i have a smartphone.",2015-02-27 17:20:49,445,149,en
Ah you love me that's great. Now I'll do a bunch of terrible shit because I need to be sure you love me no matter what,2015-02-27 00:24:50,473,155,en
"Sorry I had to cancel our date, the new sneakers I ordered online didn't show up in time, and I was set on wearing them.",2015-02-26 19:55:01,358,104,en
I've gotten two dozen rejection letters from college this month. Which hurts extra bad because I'm 27 and didn't even apply to them.,2015-02-26 04:21:08,534,118,en
If I were president I'd change the name of America to Canada Jr. and I'd refuse to compromise until I was either impeached or assassinated,2015-02-26 03:49:48,498,141,en
"Do bears have 4 legs or 2 arms and 2 legs? It's an upright sometimes animal to be sure. It also climbs.. but, it runs too? Bears: holy fuck",2015-02-26 03:04:42,1241,499,en
"Kids these days!  Showed my 3-year-old nephew a CD player and he said, ""what's this?"" because he's blind",2015-02-25 21:36:08,614,224,en
"[Telling 5 year plans]
Me: I'd like to be in a leadership role
Coworker: I want to get head on the moon
Me: can I change my answer?",2015-02-25 01:54:31,787,241,en
"Even the hardest rapper is expressing themselves through song, which is kind of cute",2015-02-25 01:29:47,1015,433,en
"me in public: i'm a citizen of the world. how about a healthy thai salad for lunch?
me alone: soccer sucks and I want 9 rice crispy treats",2015-02-24 05:19:17,596,148,en
"Chivalry is dead.
Cut to a soaked patch of earth during a thunderstorm: CHIVALRY's hand bursts through the grave, and omg he has tulips!",2015-02-24 03:35:31,373,127,en
"Facebook drama update: a girl posted a throwback pic from 2008 and a dude responded, ""you look great, have you lost a bunch of weight?""",2015-02-23 18:42:56,688,153,en
"Funny how when I was a kid all I wanted was to be an adult, but now that I'm grown up all I want to do is lay face down on the carpet",2015-02-23 06:02:36,792,488,en
"Bro, do you even drift aimlessly through this slow parade of dying we call 'life'?",2015-02-22 22:22:52,447,208,en
I for one would like to see the designer of the n64 controller take a swing at a vibrator,2015-02-22 21:25:23,366,119,en
"A lady at the grocery store had been looking between the brown and whole grain rice so long I finally had to say ""neither is gonna save you""",2015-02-22 20:36:36,445,114,en
"No one has been beaten to death with a selfie stick yet, but I'm confident it's coming.",2015-02-22 19:19:06,723,319,en
"I wish there was an exercise system where you just smashed junk with a bat, but the bats got progressively heavier. I am not well.",2015-02-22 19:08:41,356,97,en
Coming clean http://t.co/cXSCjPEHZU,2015-02-21 23:44:18,318,77,en
hello darkness my old friend http://t.co/n9FREG29ei,2015-02-21 17:40:00,1341,479,en
Ladies: the best part about being a man is when you shave your face you feel like a washed up cop getting it together for one last case.,2015-02-21 16:01:35,1577,602,en
"Hey guys just a heads up, I did some research and Korn has been making music the WHOLE time since you last thought about Korn, years ago.",2015-02-21 06:06:03,523,179,en
I wish vegetables could scream,2015-02-21 05:35:57,406,187,en
