text,created_at,favorite_count,retweet_count,lang
"[seeing baseball player with long hair] who does he play for, the LA DRAFT Dodgers? Ought to be ashamed. Walking around with hair like that.",2015-11-28 17:33:47,318,47,en
i'm thankful for the time i got my wiener stuck in the garbage disposal but the blades were so dull that i spun round like a helicopter,2015-11-26 17:53:46,992,269,en
i bet when Joseph Gordon-Levitt autoerotically asphyxiates himself he uses a skinny tie,2015-11-25 08:36:02,1430,313,en
[after years of befriending only idiots] whys my facebook so bad lol,2015-11-22 21:59:05,1406,453,en
"Sure, news articles by actual journalists are great, but I still prefer to hop on YouTube and see what someone hot and loud thinks about it",2015-11-22 06:43:29,1048,270,en
i hope pickles get to be the next superfood i love pickles,2015-11-21 22:43:03,839,322,en
oh which date should i tell someone i have a moderately popular twitter account? i'm guessing probably the last one.,2015-11-21 00:56:11,1299,182,en
"Computer: please type in this series of numbers and letters to prove you're human.
Me: you fuckin hypocrite",2015-11-20 00:07:03,1193,389,en
when dogs form wild packs are they all the same kind or do they make an ocean's 11 and have 1 dog of each type &amp; skill set ?,2015-11-19 22:06:08,1122,421,en
I hired those two kids from The xx to redecorate my apartment and all they did was paint a wall black and throw out all of my furniture,2015-11-19 00:20:04,703,201,en
If you recall junior high as a pleasant time in your life you are probably a tremendous piece of shit,2015-11-18 23:47:25,2225,703,en
I saw a classic goth walk past a cyber punk and give him a little nod and the cyber punk returned with a big ol' wink,2015-11-18 21:13:38,491,72,en
"Every conservative politician has the same fit, tan, nice haircuted son, but he's got a strange face cause he was conceived on sailboat",2015-11-18 15:36:18,1622,474,en
I just want to make enough money to live in a neighborhood where Starbucks doesn't lock their bathrooms,2015-11-18 02:34:14,949,239,en
"i just found a notecard in a jacket i haven't worn in a few years that says ""I'm Mayor of Crime Island"" and it's definitely my handwriting",2015-11-17 05:08:16,2099,441,en
when future aliens are sifting through all our debris of information I feel bad for the dude who gets podcasts,2015-11-16 17:03:53,723,182,en
"""I don't 'Get' Twitter"" - guy with poptarts on his Instagram",2015-11-16 16:48:26,690,199,en
[walking into room with two rappers]oh my god. you guys. you both claimed to be the best rapper alive. this must be so awkward,2015-11-15 17:51:34,844,211,en
"Me: Republicans are bad 
Stranger online: actually they're not. please read this article where the website is named after the author.",2015-11-10 18:01:30,1252,331,en
I just got word that eventually BABIES are going to steal our JOBS. I see Republicans already cut funding to schools that's a START,2015-11-10 17:59:19,1299,548,en
some people think I'm an asshole because i'm shy and also a pretty huge asshole,2015-11-09 20:13:38,1187,643,en
Jaiymes and the organic peach,2015-11-08 17:27:34,976,397,en
[after sharing a bit of myself] i should not have done that,2015-11-08 03:43:54,4374,2691,en
"""what do fish do?"" I mused, horizontally from the couch. ""i mean like, how do they spend their days?"" i add, kicking off my other sock.",2015-11-08 03:36:49,829,210,en
"shoutout to all the women who yell ""suck my dick"" when they're mad at someone",2015-11-07 18:31:28,1235,354,en
"Wife: What should we name our baby?
Galilei: How about Galileo Galilei
Wife: thats real close to our last name
Galilei: no its not.  shut up",2015-11-06 03:13:17,1586,540,en
"Shakespeare is famous for creating the prototypical stories: teenagers who drink poison, man wronged by witches, 2 cities are best friends",2015-11-05 17:44:23,650,205,en
i am watching Inside Out and have constructed a small but elaborate system of gutters so that my tears may feed my thirsty baby rats,2015-11-05 03:16:08,892,179,en
"Target cashier: Hi
Me [Adele voice]: Hello",2015-11-04 23:36:40,1721,838,en
everyone in every dolphin documentary talks like they 40% want to fuck a dolphin,2015-11-04 22:08:49,2452,633,en
My neighbors are silently drinking beer on their porch. King of the Hill is very depressing in real life.,2015-11-03 22:28:46,854,178,en
i'm such an introvert. hey you. you over there. did you hear the news? i'm an introvert.,2015-11-02 22:55:03,1721,672,en
[every 3 hours] You know what screw it jm going to treat myself,2015-11-02 03:38:47,1490,763,en
"https://t.co/ZmtYk1p1Uc

I added a laugh track to a full episode of The Office. You should watch, its weird.",2015-11-01 01:59:53,904,221,en
Just wanted to say sure candy and costumes are great but don't forget what this days really all about: letting the devil into your heart,2015-11-01 01:06:00,1430,780,en
"if you had seen only land turtles and then someone told you about sea turtles you would be like, ""dont be ridiculous”",2015-10-29 07:54:15,1991,690,en
"Putin: I have returned Russia to its glory days, once again we have launched a dog into space 
Reporter: when will it return 
Putin: WHat",2015-10-28 20:30:18,1752,694,en
im so single that i live on a canoe with no oars and theres a rat and he my best friend but i'm mad at him because of a thing he did earlier,2015-10-27 05:16:21,1419,445,en
"ugh horror movies are so unrealistic, no real teens have more than one friend",2015-10-27 00:04:38,1206,441,en
"I'm running late because I left late for no other reason than a bunch of character flaws, feel free to eat without me",2015-10-24 01:51:20,6291,3452,en
Not to speak on behalf of women but if a man put his coat on a puddle for me I would leave him for an online man named Mike,2015-10-23 21:36:16,770,131,en
"Some birds can sleep while theyre flying, stay tuned for more lies about stuff you don't know enough about to refute",2015-10-23 00:48:55,2189,1040,en
The kid I went to elementary school with that had a pinball machine fall on him during a field trip just became a cop,2015-10-22 05:27:07,906,164,en
"how about a date something casual no pressure just a cup of coffee, the drink that will sometimes give you diarrhea",2015-10-20 19:22:58,1799,558,en
leaked set photo from set of Avatar 2: https://t.co/HQGOwsj5Qp,2015-10-20 08:34:48,5758,2678,en
like it or not i bet guy fieri eats a mean pussy,2015-10-20 02:38:34,1469,392,en
"it's a victimless crime, like shoplifting from Walmart, or murdering a Vine star",2015-10-17 05:56:53,1638,458,en
"sometimes i wonder how the water in my apartment gets hot.  i could probably learn online but i think No mike, best to not rock the boat.",2015-10-15 03:06:40,1406,332,en
My body type is 'people assume I don't watch sports',2015-10-15 01:27:15,1230,460,en
"imagine if a mermaid was reversed, like the top half was a fish and the bottom half is whatever women look like under their pants",2015-10-13 05:28:58,3000,957,en
"The Whole Foods next to this movie theater is perfect if you want to sneak in your own snacks, but don't want to save a lot of money.",2015-10-12 21:33:38,1935,593,en
i just saw an old lady lick her finger before turning the page on her Kindle and i can see the moisture glistening on the next page / screen,2015-10-12 18:50:40,1304,376,en
"If a coworker leaves his computer open use that opportunity to add ""children's maps that don't acknowledge Israel"" to their search history",2015-10-12 08:01:26,1307,313,en
.@AnnCoulter is it true you masterurbate with a frozen snake?,2015-10-12 01:59:23,499,84,en
"Job Posting: local pond looking to hire tadpole, must have previous experience as frog",2015-10-11 17:11:35,1316,633,en
"There is an elvis impersonator on the bus (tweet is already good) and a very senile old lady thinks he's real, but is disparaging his music",2015-10-10 03:21:15,1198,212,en
Bagel is slang for Bread Angel,2015-10-07 00:20:43,1958,1190,en
"I'm getting worried, my boomerang should have been back hours ago",2015-10-06 17:22:41,3280,1477,en
"I just payed a quarter to get into a public toilet and someone had crapped on the ground. Buddy, you could have done that for free outside",2015-10-05 17:59:23,2038,468,en
I'm watching Friends and everyone is so disrespectful and condescending to Joey. That's probably why he acts out sexually.,2015-10-05 01:17:48,1168,260,en
"PUBLIC: gun control
GOP: Actually shootings are caused by the mentally disturbed
PUBLIC: Well, can we support outreach for that
GOP: Also no",2015-10-03 21:19:10,5816,3581,en
"all of my apps are up to date and my devices are fully charged, why am i still so unhappy?",2015-10-02 02:49:46,2131,969,en
In case anyone wondered what my drafts folder looks like http://t.co/62ssidtFWw,2015-09-30 19:31:38,775,91,en
"When I was little I had a pet rat named Hawaii named not for the state, but after my neighbors dog, Hawaii (named after the state)",2015-09-30 03:29:25,1231,245,en
"if you say ""Bloody Mary"" 3 times into your rear view mirror you can use the carpool lane",2015-09-26 03:19:37,1535,677,en
"[Trump presses the crosswalk button and waits for a while, he presses it again and it changes a few seconds later] 
Trump: still got it",2015-09-24 16:57:10,1710,592,en
"Whole foods is expensive, but not as expensive as say, the Iraq war. #politcshumor #thatspoliticsbaby #humor",2015-09-24 04:05:14,1242,344,en
"People who say ""dont mess with Texas"" are like that weird kid from elementary school who was always claiming to know karate",2015-09-22 20:51:12,2037,747,en
i bet if you were in fine art school and drew a photo realistic picture of Benedict Cumberbacht you'd get like a C- at best,2015-09-22 20:47:46,995,319,en
trying to keep my facebook accurate http://t.co/MvATmuCUrj,2015-09-21 04:26:16,1913,645,en
"A trailer in a movie theater ended with ""November 20th"" and a guy loudly said, ""thats my birthday"" and a random guy said ""happy birthday""",2015-09-19 23:09:27,13605,4768,en
"I lied and told someone, ""I can't go to your party I have diarrhea."" I actually do have diarrhea but historically that hasn't stopped me",2015-09-19 04:17:14,2176,522,en
While you guys were wasting your time talking about politics I got banned from the Yahoo Answers 'Horse' section,2015-09-17 03:08:11,4420,1592,en
"Coming to TLC this Fall: Cake Ghost.  Is it a haunted bakery, or a ghost trying to bake? Fuck you. Fuck you for even asking. Wednesdays @ 8",2015-09-16 23:32:29,1722,736,en
It's exhilarating to think the vitamin people  are so fly-by-night they had to cross out their packaging last minute http://t.co/33DyOadB7J,2015-09-15 02:16:32,1443,351,en
The ocean is very relaxing until you remember whats going on in there,2015-09-14 22:44:22,3010,1509,en
140 character limit? This seems like the place to debate complicated political &amp; social issues,2015-09-13 19:55:44,8553,5639,en
Improv: Not Even If It's Free,2015-09-13 05:30:44,528,83,en
I would Iike to apologize to everyone who was at the full moon blood orgy animal sacrifice last night: what I said was out of line,2015-09-12 22:56:38,1566,614,en
"If someone tries to give you condescending advice, respond: ""is that a line from Frasier?"" and just keep insisting they're quoting Frasier",2015-09-12 16:52:00,2137,821,en
Two strangers on the subway just got into a political argument and now I can see they're each writing Facebook posts about it,2015-09-12 08:26:34,1187,220,en
"Why does everyone make fun of Batmans old suit, the one with the nipples? Bats have nipples. Hell, that's the most sensitive part of a bat.",2015-09-11 06:35:41,1209,341,en
"old people love to comment on news stories ""these are sad times we're living in"" like humans only recently started being pieces of shit",2015-09-11 06:21:08,4355,2448,en
"ugh where are you supposed to meet single people? i tried my hallway, my living room, and even my kitchen. what am i doing wrong?",2015-09-11 02:31:44,2146,938,en
"If the hot air balloon inventor pitched them to me I'd reply ""thats like the last thing we're going to do. Go. home. don't even look at me""",2015-09-11 01:22:20,758,218,en
"Age 15: someday I'm going to own a Ferrari
Age 20: maybe I'll get a BMW someday
Age 25: I hope someone in a Mercedes hits me in a crosswalk",2015-09-09 02:09:47,10637,6298,en
"It's so hot out I want to die. But to be fair, I already kind of wanted to die",2015-09-08 22:42:05,1315,570,en
Not to brag but the front desk lady at the modern art museum said that she's never seen someone go through the entire museum so fast 😎,2015-09-07 23:17:29,1444,327,en
i want to handle clay but without the obligation of creating something,2015-09-07 07:02:46,926,259,en
.@Harvard I bought a crimson Harvard t-shirt and unless you pay me $50 I'm going to wear it to the mall and pee my pants,2015-09-07 02:18:59,5277,1740,en
"Movie Theater Announcement: turn off your phone, the little bit of light is distracting. Also, buy some popcorn: the loudest snack available",2015-09-07 00:25:43,2206,1014,en
i always sleep with a pen next to my bed in case i ever wake up in the middle of the night and need to click something a bunch,2015-09-05 04:57:17,884,197,en
"i respect Texas Instruments because they're like ""Nah, we nailed graphing calculators in 1998 no need to change em. Also they cost the same""",2015-09-05 02:02:15,2042,671,en
"The only thing more pathetic than the men commenting on models Instagrams ""damn u fine"" are the ones trying to start a polite conversation",2015-09-03 06:32:16,1559,426,en
"It's great when people change their profile pic away from their baby. Like ""i found a pic where I look good more than I love my child""",2015-09-01 04:52:44,1720,485,en
Sometimes I dream of moving to a small town where everyone knows each other and systematically wronging them one by one,2015-09-01 01:02:02,1246,340,en
it's always upsetting to find out what someone thinks about something,2015-08-30 19:17:35,898,359,en
I appreciate it when new yorker's remind me me about their bagels. Here I was thinking I was enjoying this bagel when actually it's terrible,2015-08-29 18:17:46,1101,308,en
"Me: lethary &amp; depression are ruining my life
Internet: jogging for 20 minutes a day should clear that up.
Me: Wait- maybe it's not so bad",2015-08-28 19:11:51,2100,753,en
i wish i was 100x my size and i could just lay down and small teams of people with soapy brushes on long poles would scrub me clean each AM,2015-08-28 02:16:08,571,138,en
"Dolphins can speak, thats pretty great right? well, what if one of them said something transphobic? Not so great now huh. Didn't thinks so.",2015-08-26 23:54:09,1208,400,en
my ex girlfriends new boyfriend keeps posting memes on her wall and it's making me feel very good.,2015-08-26 21:59:32,1998,258,en
"If I ever seem like I'm getting a lot of stuff done during the day, I'm only rushing cause I can't wait to be a piece of shit all night",2015-08-25 21:00:40,1083,531,en
someone just asked me why i did something like im some sort of nerd who does things because he has reasons,2015-08-25 00:06:30,948,437,en
"If I were a billionaire I would produce an animated version of cake boss. Just a word for word, shot for shot, animated remake. Why not",2015-08-24 01:24:54,1029,223,en
Wish I could be as cool as people who don't look out the window during an airplane takeoff think they are,2015-08-22 20:51:22,3647,1523,en
"101 dalmation puppies to make 1 coat? thats evil.  jsut wait until they're full grown and 5 make a coat. that way like, you get 20 coats",2015-08-22 00:55:01,1218,401,en
"When people are like ""the museum is huge, you could never see it all in a day"" I'm like 'I dont know, I'm pretty unappreciaticve &amp; basic'",2015-08-21 18:10:56,1378,398,en
"I never buy grocery items that are on sale like ""10 for $7"" because I resent food trying to make me do math",2015-08-20 22:49:19,782,236,en
"I just heard 2 waiters speaking Chinese and then one said very loudly and clearly, 'MEDALLION' so I think some shits about to go down",2015-08-20 19:18:10,719,163,en
I posted the word MOIST in Comic Sans all around the graphic design school next door http://t.co/pqWv1MIcGO,2015-08-19 16:36:58,15122,7739,en
secretely I feel like I'm purchasing nicer bread than I deserve,2015-07-10 21:00:54,1403,441,en
I imagine having self confidence feels like those few moments when an extended tape measurer is flying backwards into your hand,2015-07-09 15:49:10,2751,1249,en
"dudes can get pretty dumb when they see a woman eat a banana, but the ladies go absolutelycrazy when they see me eat a yogurt with no spoon",2015-07-08 23:15:31,1009,346,en
Whenever I get into a cab I watch episodes of Cash Cab loudly on my phone and audibly sigh a bunch,2015-07-08 02:00:09,1880,579,en
"Just found out someone I went to high school with overdosed at the cemetery. I mean, talk about convenient",2015-07-07 04:55:38,945,187,en
"50 Shades of Grey? What is that, a book about the original Gameboy?? Ffolks, there's no reason you can't shit in the shower if it's diarrhea",2015-07-06 02:08:14,1578,373,en
If I die don't let anyone write on my Facebook wall,2015-07-05 16:23:20,816,334,en
JULY 4TH REMINDER: DONT SHOOT FIREWORKS AT YOUR PETS. UNLESS YOUR PET IS A TORTOISE THEN I UNDERSTAND WHY THE LOW RISK MAKES IT WORTHWHILE,2015-07-05 00:08:11,866,254,en
I just want to live to be old enough to start liking trains,2015-07-04 00:54:35,646,188,en
"A person i went to college with Instagrammed a picture of her grocery list and she wrote ""fresh"" in front of all the vegetables",2015-07-03 14:51:54,1664,307,en
"2015: all these ""artists"" are just Instagramming their dinner
1599: all these ""artists"" are just painting bowls of fruit",2015-07-02 22:29:17,1666,773,en
"I wish British people played baseball you know they'd have all sorts of weird slang like, 'let's go out back and whiz a few dingers, chap'",2015-07-01 21:59:30,602,177,en
"Don't vaccinate your kids, I hate kids",2015-07-01 21:31:46,1989,915,en
2015 is the year where Fry's dog from Futurama finally dies waiting outside the pizza restaurant.,2015-06-28 02:38:19,846,484,en
"i put on my pants just like the next guy, slowly over the course of 10 minutes while obsessively refreshing my Twitter feed",2015-06-28 02:15:12,693,224,en
"Donald Trump: i have my favorite muffins flown in each morning
His assistant, later: i put Costco muffins in a suitcase...it makes him happy",2015-06-27 20:40:54,6803,2600,en
if you die on the jumbotron you die in real life,2015-06-26 23:05:32,744,202,en
"Internet Explorer: so about last night
Me: Oh, i used you for flash.
IE: Are we back together, am i your default?
Me: don't make this weird",2015-06-26 05:31:11,3349,1827,en
"On a stormy Chicago night in a hotel bar I watched an old man order a 'whiskey &amp; water, hold the water' I still think of him when it rains.",2015-06-23 03:01:05,810,175,en
Imagine being rich enough to know you were allergic to horses,2015-06-22 13:00:42,3731,1164,en
I just saw a bunch of girls get into an Uber PT Cruiser which is probably the first time a bunch of girls have ever gotten into a PT Cruiser,2015-06-20 18:27:14,728,198,en
[sees it's raining way out over the ocean] nice nice... way to cut out the middle man,2015-06-20 15:19:58,972,242,en
When I ask you something that I could Google it's because I like you and want to hear how you explain it,2015-06-20 13:53:07,7099,3740,en
"fool me once shame on you. twice, shame on me. three times, shame on me. four- ok yes yes i have a weird shaming fetish but keep going. baby",2015-06-20 06:53:10,797,248,en
sometimes i hope a wizard comes to my door to take me away from all this,2015-06-20 05:48:46,822,449,en
"I like how in Scooby-Doo the writers were like ""no such things as monsters, just men in masks... the dog has kinda learned to talk tho""",2015-06-18 14:39:52,1376,473,en
single &amp; ready to mingle. I'm a free agent.  bachelor. goin rogue. the alone man. need someone. crying floor. Help please help even a hug,2015-06-18 00:13:22,893,305,en
"If you ever see a young man wearing a shirt with a famous book on it, be kind to him, he is still working some things out",2015-06-17 22:54:18,652,127,en
"Sure, it's easy to make fun of Donald Trump. But it's also a lot of fun.",2015-06-16 23:34:44,1096,456,en
"They're making 'for men' sunscreen now. Presumably because a dude was rubbing sunscreen on and his buddy was like, ""what's that.... CUM?""",2015-06-16 21:34:06,926,261,en
"I bet people were like ""what's next?"" after the moon landing. I wish I could tell them we get social media and use it to make each other sad",2015-06-15 02:28:23,3154,1777,en
"wow is an acronym for 'wow, oh, wow' and yes it tessellates infinitely",2015-06-15 01:18:37,1270,455,en
the only people who can afford to visit Jurassic Park are so rich that I'm ok with them being eaten by dinosaurs,2015-06-14 02:46:33,1958,898,en
"Fool me once, shame on you. Fool me twice [removes moustache] Gene Parmesan, private detective.",2015-06-14 01:13:49,1081,339,en
"Art is cooler than science because I think most technology would have been invented regardless, but no one else would have written Hey Jude",2015-06-12 14:15:03,1022,346,en
"Instagram is ruining photography? Maybe if drunk college kids can do what you do exactly, it wasn't that great to begin with.",2015-06-11 22:24:28,1110,344,en
I don't have tattoos for the same reason I don't put racing stripes on a Prius: I can't fucking afford it,2015-06-10 04:23:49,688,187,en
Ugh I hate living next to an art school I dragged an old couch outside and a bunch of dudes came over and they're just taking pictures of it,2015-06-10 03:36:11,3050,1163,en
[is hyper sensitive to literally everything] uhhh I'll go on the website where anybody can say anything to anyone,2015-06-10 00:04:33,811,268,en
Contort my hands into gang signs before the rigor mortis sets in so I die legit,2015-06-09 13:49:29,1613,738,en
"oh wow, the main character just HAPPENS to have a bath tub thats clean enough to sit down in.  Typical Hollywood bullshit.",2015-06-08 05:13:07,738,147,en
Feeding dog goldfish https://t.co/6DEpWiTjtY,2015-06-07 21:22:51,432,203,en
"Let me be clear: when I say I don't like crowds, I really mean I don't like myself when I'm in crowds",2015-06-07 06:55:14,505,170,en
congratulations on the rich person horse for winning the Most Horse competition. Truly someone we can look up to.,2015-06-06 23:03:08,809,330,en
Perhaps a new haircut will keep my inner demons at bay,2015-06-04 22:22:53,680,276,en
When a pretty girl jogs by me I fight the urge to also start running. Not to chase her but to be like 'hey me too.' Also: to chase her kinda,2015-06-04 18:09:44,697,113,en
I have a bumper sticker that says COP KISSER explicitly to make it awkward when a police officer asks if I know why they pulled me over.,2015-06-04 03:19:28,1171,435,en
I'm watching a bunch of nuns taking pictures of a raising drawbridge. The universe is presenting a metaphor but I am too dense to understand,2015-06-02 22:00:12,609,144,en
They made the Entourage movie because you all still saw The Hangover Part 3 even after the 2nd was bad. You. You did this to us.,2015-06-02 15:36:14,905,347,en
There's no such thing has lighthouses that aren't haunted.  There's only lighthouses that aren't haunted YET,2015-06-01 02:11:53,584,165,en
"Was at dinner with my grad school friend and I asked him what the best book is, and as he tried to explain art objectivity, i ate his fries.",2015-05-31 23:10:08,450,103,en
"It's weird at the bookstore when the cashier starts talking to you about the book you're buying. It's like uhhh cool, I haven't read it yet",2015-05-31 17:02:02,657,121,en
"[after colonoscopy] 
doctor: ok that'll be $1700
me: wait, I thought you were gonna pay me the $1700",2015-05-31 16:26:48,910,191,en
"A great excuse for being late is ""I don't know how to tell time""",2015-05-31 15:50:16,657,227,en
being up in the middle of the night is great because no one expects you to do anything,2015-05-31 08:41:42,1120,451,en
Whenever I feel down I like to take a deep breath and just try to tough it out for a few more years,2015-05-30 23:17:00,807,322,en
"MUSICIAN: HOW YALL FEELING TONIGHT? 
CROWD: YEAAAA
CROWD: WAHHHH
CROWD: YAHOOO
me: pretty good
CROWD: AHHHHHH
CROWD: GAAHAAH
CROWD: HAUUJJJH",2015-05-30 23:11:40,3358,1612,en
"great when someone says, ""if you don't like America, get out!""Listen buddy, I can't even pay my phone bill on time, let alone move countries",2015-05-30 21:36:43,1035,376,en
making children pledge allegiance to the flag every morning is some seriously hitler shit,2015-05-30 20:19:15,1169,398,en
You don't have to limit yourself to pledging allegiance to the flag. Pledge friendship to some macaroni. speak a death threat into the wind,2015-05-30 20:16:59,841,311,en
Have people who film concerts from their phone never heard a concert filmed with a phone,2015-05-30 05:04:37,1211,424,en
If you have a baguette and walk by another dude holding a baguette you are allowed (but not obliged) to duel him for custody of his baguette,2015-05-28 21:00:07,1769,863,en
"a PT Cruiser just rear ended another PT cruiser in an IHOP parking lot, make a wish",2015-05-28 04:55:40,1455,467,en
i am wearing a t-shirt with a sushi infographic on it and now my friends want to go to sushi and it's going to look like i dressed up for it,2015-05-28 00:32:49,3917,967,en
"Did you know if you put on NWAs Straight Outta Compton 3:26 seconds into Mad Max: Fury Road, you will get kicked out of the movie theater?",2015-05-27 03:56:47,563,175,en
"A lot of people like to ask me, ""Mike, do you do it all for the Favs?"" No, of course not. I do it to for the shame it brings to my family",2015-05-27 01:00:09,634,133,en
