text,created_at,favorite_count,retweet_count,lang
Smirking Towards Bethlehem,2016-02-17 07:37:56,6,1,en
"Everyone is focused on Flint, Michigan as if there isn't a vowel shortage crisis going on in Ypsilanti.",2016-02-17 07:33:20,26,7,en
Why aren't more presidential candidates talking about the INSANE prices of gasolina?,2016-02-17 04:13:17,15,0,en
I'm grounding myself for two weeks.,2016-02-17 04:05:58,10,1,en
Literally everyone I've ever met has told me to see The Big Short because they think I'll love it so let's see if y'all are right.,2016-02-17 04:05:27,14,0,en
Constance Zimmer deserves every role.,2016-02-17 02:41:23,11,0,en
A dating app called Hinder that actually stops you from going on terrible dates.,2016-02-16 23:53:34,68,9,en
America. https://t.co/7EVeQFEgO7,2016-02-16 23:47:48,20,2,und
All facts are fun facts because you can use them to lord your intelligence over the ignorant masses.,2016-02-16 23:44:47,13,3,en
Call me when Trump figures out how to make https://t.co/BJcUvrqtkn redirect to his website.,2016-02-16 23:16:32,13,0,en
"It's pilot season, baby.",2016-02-16 08:04:08,16,0,en
Open relationships don't work because they are still relationships.,2016-02-16 04:35:40,61,7,en
Who left this at my apartment? https://t.co/eT1AB1WpfO,2016-02-16 04:15:49,15,1,en
Can't believe ISIS just won. #GRAMMYs,2016-02-16 02:52:55,13,0,en
Heh anyone else notice in that blinded by the light song it sounds like he's saying revved up like a douche? That's some funny shit man,2016-02-16 01:07:47,17,1,en
"I used to identify with Obama but now I identify with Kanye. What I'm saying is, I'm definitely an awful white dude.",2016-02-15 23:31:36,18,1,en
"If I were a woman I'd definitely own an article of clothing I referred to as my ""flirt skirt"".",2016-02-15 23:30:04,29,5,en
It's oddly comforting to know that if I ever want to really go off the deep end and complicate my life further I can just sign up for Tinder,2016-02-15 21:16:58,29,1,en
Please don't tell my mother I forgot to eat yesterday.,2016-02-15 21:15:43,7,1,en
I have two settings: FLIRT MODE and DEAD.,2016-02-15 20:11:10,62,17,en
Play INXS at my funeral.,2016-02-15 10:57:04,6,0,en
I'm happening.,2016-02-15 10:52:43,8,2,en
What if I was like...oh wait I was thinking of lust.,2016-02-15 09:05:05,15,1,en
I love you all. Good night.,2016-02-15 09:03:47,19,0,en
Love is really all we have. It is what makes humans special. It is what makes us more than our own selves.,2016-02-15 09:03:35,12,1,en
So love as much as you can whenever you can.,2016-02-15 09:03:01,11,0,en
Love is infinite and as long as you let it happen it will never run out. It's not like mass or energy. It's always there if you let it be.,2016-02-15 09:02:44,13,1,en
"All is fair in love and war. Perhaps, but a nazi was never convicted of love crimes.",2016-02-15 09:01:52,11,0,en
But if you love purely with all your heart you can never go wrong.,2016-02-15 09:01:21,6,0,en
Love is not a solid. It's a liquid. And liquids can get you in trouble.,2016-02-15 09:00:59,6,1,en
You can love your family. Friends. A romantic partner. Someone you met on the dance floor.,2016-02-15 09:00:37,7,0,en
Love is so powerful. There was a monopoly on it for so long but I think that's going by the wayside.,2016-02-15 09:00:08,4,0,en
Valentine's Day is over. But here are some thoughts about love.,2016-02-15 08:59:42,6,0,en
I'm cool. Are you?,2016-02-15 08:46:06,14,1,en
Happy Allentine's Day!,2016-02-15 01:25:18,34,1,en
I know I'm growing up because I decided against sending a friend request to the pretty tattooed obsessive compulsive liar I met last night.,2016-02-14 04:20:51,40,0,en
Ben Carson speaks like he's reading a teleprompter that's always malfunctioning. #GOPDebate,2016-02-14 03:58:05,15,0,en
Donald Trump criticizes politicians as if he isn't a landlord. #GOPDebate,2016-02-14 03:55:42,10,0,en
Ted Cruz wants to be president so he can graduate from shutting down the government to shutting down the whole world. #GOPDebate,2016-02-14 03:54:49,16,3,en
Ted Cruz is literally a potato. #GOPDebate,2016-02-14 03:53:58,21,4,en
"I hate Rubio's ""New American Century"" thing. We've been in this century for 16 years now, dude. #GOPDebate",2016-02-14 03:53:30,12,2,en
Jeb wants to sit behind the big desk. In the big house. In the big America. Like his big brother and big daddy. #GOPDebate,2016-02-14 03:51:26,15,2,en
Every time Ben Carson debates it sounds like he didn't talk to anyone all day until he got on stage. #GOPDebate,2016-02-14 03:50:39,15,1,en
Scalia's death is a premonition of the death of the GOP as a whole. #GOPDebate,2016-02-14 03:49:12,10,0,en
"I was expecting Trump to answer the profanity question with, ""Shut the fuck up."" #GOPDebate",2016-02-14 03:39:19,32,13,en
Some blue collar Democrats are actually supporting Bernie. And they supported Clinton in 2008. #GOPDebate,2016-02-14 03:36:59,2,0,en
"Ben Carson, noted financial expert, said that we are on the verge of economic collapse. #GOPDebate",2016-02-14 03:35:00,7,0,en
The Republican Party is ripping itself apart. It's like a Hydra that attacks its own heads. #GOPDebate,2016-02-14 03:33:28,14,5,en
Every once in a while Trump says something that is actually logical and makes sense and that is the most terrifying thing ever. #GOPDebate,2016-02-14 03:29:44,22,2,en
Ironic that the GOP is all about law and order when their candidates are basically engaging in gang warfare. #GOPDebate,2016-02-14 03:19:41,5,2,en
"In a perfect Republican world, every nuclear family owns its own small business. #GOPDebate",2016-02-14 03:17:22,28,5,en
Rubio throwing shade at Cruz for not being able to speak Spanish is muy bueno. #GOPDebate,2016-02-14 03:16:19,15,4,en
This #GOPDebate is so insane. I was listening in my car in traffic and even with only audio it sounds like a bloodbath.,2016-02-14 03:15:16,11,0,en
"God, I love California. Nothing like flying in during a sunset. Save the West for last, I always say.",2016-02-14 01:29:48,28,3,en
Scalia gets to be Chief Justice on the Supreme Court of Hell.,2016-02-13 22:21:33,21,1,en
It's so crazy how I just know I'm gonna love that new show Vinyl.,2016-02-13 02:54:50,14,1,en
"""Please slap."" -Jeb having kinky sex",2016-02-13 02:42:57,42,2,en
I tend to get pretty drunk whenever I do a show that takes place at a brewery. I wonder if tonight will be any different...,2016-02-13 01:50:36,13,0,en
WHOA GETTING REAL ON TWITTER,2016-02-13 00:38:40,10,0,en
All love is true love.,2016-02-13 00:38:25,16,2,en
"Valentine's Day is in two days and if you haven't made reservations yet, don't fret. It's never too late to tell your beloved it's over.",2016-02-13 00:36:24,30,6,en
sup girl u make me question my belief in solipsism,2016-02-12 23:12:34,16,3,en
"""Weird Al"" probably writing this right now:

""Hey, Bernie, baby I got your money.
Don't you worry, I said hey.
Bernie, I got your money.""",2016-02-12 22:53:57,16,1,en
Staying at @heymonroe's and he's playing the new @thethermals album and yeah...I'm home.,2016-02-12 21:34:58,10,0,en
Denver! 8pm tonight at @ratiobeerworks I'm headlining a stacked lineup to celebrate Ratio's anniversary. FREE COME https://t.co/FRskbMHaWi,2016-02-12 21:29:53,5,3,en
I want kids. YOUR kids.,2016-02-12 21:27:01,13,2,en
"T-SHIRT IDEA: ""You call me a fuckboy like it's a bad thing.""",2016-02-12 21:26:52,20,1,en
A band just covered Pillar of Salt by @thethermals. Thinking of bae...,2016-02-12 06:12:21,8,0,en
SOLUTION: Bernie Sanders gets a sex change and everyone shuts the fuck up.,2016-02-12 04:50:51,51,5,en
Sex every day #singlelifein3words @midnight,2016-02-12 04:33:34,11,0,en
"When Beetlejuice is like ""say my name three times and I'll appear"" I was like ""Bitch just come over""",2016-02-12 01:57:19,24,2,en
"Whenever I kiss someone for the first time, Taylor Swift's ""Wildest Dreams"" plays in its entirety.",2016-02-12 01:55:32,20,6,en
"*enters confessional*

""Forgive me, Father, for I have sinned.""

""How so, my child?""

""I crushed too much pussy. I crushed it too hard.""",2016-02-12 01:49:15,26,0,en
Just a reminder that Allentine's Day is right around the corner...,2016-02-11 18:58:57,25,0,en
If Uptown Funk was actually so hot that it made a dragon wanna retire that would be some insane shit.,2016-02-11 14:50:03,14,1,en
One of my favorite things about America is how every major city has invented a crazy sandwich.,2016-02-11 13:57:22,18,5,en
Guy Fieri is the perfect name for Guy Fieri.,2016-02-11 13:48:21,29,4,en
So crazy that I'm the coolest looking person in Terminal 4 at LAX and I'm not even European.,2016-02-11 13:41:15,11,0,en
Seems like every white person I don't know was really upset by Beyoncé and every white person I do know was really upset by Coldplay.,2016-02-11 13:07:07,29,5,en
"No, baby, no. Ya got it all wrong. I'm not a BernieBro. I'm a BernieGoodBoy.",2016-02-11 08:48:53,16,1,en
Pretty crazy that She's All That is an adaption of a George Bernard Shaw play.,2016-02-11 08:00:26,9,0,en
Idk wtf Rachel Leigh Cook was so upset about in She's All That. If someone paid attention to me because of a bet I'd be cool with it.,2016-02-11 07:59:22,24,0,en
"OK, I'll bite. What's eating?",2016-02-11 07:11:10,9,0,en
"Actions speak louder than words, but words sound better.",2016-02-11 06:59:19,11,1,en
"Since Jamiroquai introduced it in 1996, we've made some incredible advances in the field of virtual insanity.",2016-02-11 06:39:32,43,2,en
new phone who...hurt u???,2016-02-11 06:27:41,41,1,en
"""Girl you don't need a life coach you need a WIFE coach!"" -thing Steve Harvey has said, probably",2016-02-11 06:23:19,33,2,en
I like TV shows with a lot of yelling. Yelling is funny.,2016-02-11 06:18:14,24,0,en
The Double Quarter Pounder and the Fury #fastfoodbooks @midnight,2016-02-11 06:14:25,2,0,en
new phone who...am I???,2016-02-11 05:41:45,132,47,en
Kether Donohue is so funny on You're The Worst. Great show all based on my life.,2016-02-11 05:39:57,13,0,en
10 Reasons Why This Male Feminist Is Voting For Trump,2016-02-11 05:04:30,22,0,en
That Machine Gun Preacher definitely works at the Westboro Baptist Church.,2016-02-11 04:46:28,2,0,en
I lay it on thin.,2016-02-11 04:06:50,15,0,en
If I could dunk I would do it multiple times a day.,2016-02-11 04:06:13,19,0,en
Steven Avery is definitely voting for Trump.,2016-02-11 03:58:45,17,0,en
Still so happy that Pete and Trudy got back together.,2016-02-10 19:10:05,14,0,en
"*opens a thing of crackers*

*eats one*

""Take it away.""",2016-02-10 18:56:38,21,0,en
I need someone to do everything for me.,2016-02-10 17:59:26,34,5,en
I wish instead of seeing a white light when you die you saw a black light and some trippy posters and fucking Pink Floyd started playing.,2016-02-10 17:25:06,30,2,en
"Death is the ultimate version of ""getting the light.""",2016-02-10 17:24:15,6,0,en
Just remembered I got recognized by a woman at the after hours place last week who has seen me do comedy. I am insanely cool.,2016-02-10 17:17:13,7,0,en
sup girl i always have baby wipes,2016-02-10 06:32:16,34,1,en
If I had lived back in Salem in Colonial Massachusettes I would have been the biggest ally to witches.,2016-02-10 06:20:20,37,6,en
Damn. Sandy B. in Practical Magic. All right let's do this.,2016-02-10 05:42:38,9,0,en
If I had a time machine I'd definitely go back and hook up with a witch.,2016-02-10 05:31:34,28,3,en
Just a reminder that the two nominees for the Democratic party are amazing.,2016-02-10 04:30:05,21,1,en
"Has anyone coined ""bernsplaining"" yet? idk how 2 google",2016-02-10 04:29:26,19,0,en
I cannot believe I didn't win the New Hampshire primaries.,2016-02-10 03:56:41,15,0,en
Chelsea Does... is one of the best documentary series/unscripted comedies I've ever seen. Watch it on Netflix.,2016-02-10 00:57:08,20,1,en
KANYE WEST INNOCENT !!!!!!!!!!,2016-02-10 00:42:07,18,0,en
This Friday I'll be doing stand-up in DENVER at @ratiobeerworks for their anniversary. Come out and get drunk. https://t.co/VHDmSlSm4T,2016-02-09 23:53:15,5,1,en
Just realized that Bernie Sanders's initials are B.S. The Republicans are gonna have a field day with that one... #politics,2016-02-09 20:58:24,26,4,en
Remember when those scientists cloned that sheep? Shit was crazy.,2016-02-09 20:42:25,11,0,en
You would not believe what I'm wearing right now.,2016-02-09 08:14:18,21,0,en
Steven Avery just called me out of nowhere and told me he did it.,2016-02-09 07:48:44,44,2,en
Bernie Sanders definitely immediately washes his dishes after eating and that's why I'm voting for him.,2016-02-09 07:31:04,216,60,en
Just a reminder that literally no one has any idea what's going on at any given moment.,2016-02-09 04:38:54,93,26,en
The Orifice #NSFWshows @midnight,2016-02-09 04:36:57,16,0,en
"There's a reference to ketamine in ""13 Going on 30"". This movie rules.",2016-02-09 04:07:31,22,2,en
"""13 Going on 30"" has an amazing soundtrack. Note for screenplay: use cool music.",2016-02-09 04:05:23,16,1,en
"Watching ""13 Going on 30"" to research for my amazing screenplay and yeah I'm crying thirteen minutes in. #thirtyflirtyandthriving",2016-02-09 03:54:15,34,1,en
Bernie is Mario. Trump is Wario.,2016-02-09 03:13:35,31,1,en
"Beyoncé's ""Formation"" taught me so much. For instance, I had no idea Beyoncé is black.",2016-02-09 03:07:13,14,2,en
Whenever a dad makes a corny joke it is a huge cry for help. Look into his eyes.,2016-02-09 02:09:27,20,1,en
The best website on the internet is... https://t.co/I1JxoVB0b2,2016-02-09 02:07:40,7,0,en
Y'all ever hit up that secret menu at the barber shop? Ya gotta try animal style.,2016-02-09 02:04:40,8,0,en
sup girl i'm sick,2016-02-09 01:58:56,9,0,en
Back in the olden days if you got ghosted it was because your beloved literally died and became a ghost.,2016-02-09 01:58:28,21,1,en
My electric razor is perfect for when I want to only kind of shave my face.,2016-02-09 01:51:50,14,0,en
"Casey Anthony is starting to work as a photographer and the only thing I have to say about that is, ""Cheese!""",2016-02-08 19:35:10,20,1,en
All tweets today sponsored by NyQuil in the Daytime.,2016-02-08 19:27:08,14,1,en
"I'm into wordplay. Like sexually. I have sex with words. Also, this is wordplay. Also, I'm sexually aroused.",2016-02-08 19:26:47,23,1,en
"When God closes a door, he uses a paper towel on the handle so he doesn't pick up any germs.",2016-02-08 19:23:24,26,4,en
Just another day working on the screenplay that will change the world and normalize relations between men and women forever...,2016-02-08 18:25:57,17,0,en
PRO TIP: Obsess constantly over your mistakes to ensure that you continue to make them on a daily basis.,2016-02-08 18:24:35,49,5,en
Whenever a woman says that Nick is the most attractive Jonas brother instead of Joe I seriously question if they have a vagina.,2016-02-08 13:26:44,13,1,en
"So weird that having a kid means you have to work even harder at life. It should be more like a ""Tag, you're it!"" situation.",2016-02-08 12:48:56,19,3,en
Apparently a big part of turning 30 is being sick all the time.,2016-02-08 12:39:09,17,0,en
i'm like hey wassup hello from the other side,2016-02-08 06:16:19,24,2,en
man i love saying crazy shit online,2016-02-08 05:16:53,32,11,en
I like it when celebrities and athletes act like little babies because honestly respect as a concept is way overrated.,2016-02-08 05:12:11,22,2,en
Ever wonder where those huge American flags they unfold on football fields come from? Mega America. Where everything is 7x the size of ours.,2016-02-08 04:36:05,16,1,en
I think 1 of the coolest things is if u r married and u root for different teams but ur spouse's team wins because u still get 2 have sex.,2016-02-08 04:11:24,12,2,en
I had no idea that my fetish was Helen Mirren telling me not to drive drunk.,2016-02-08 02:56:00,353,131,en
"Even after the game is over I'm gonna be like, ""C'mon, refs, let 'em play!""",2016-02-08 02:52:57,11,2,en
Is Brian Huskey booking enough gigs? I'm really worried about Brian Huskey.,2016-02-08 02:48:28,11,0,en
The Super Bowl was my idea.,2016-02-08 02:41:42,29,2,en
"This game sucks and all the players playing suck, too. #SB50",2016-02-08 02:36:31,3,0,en
my fav pokeyman is prolly that little pikachew,2016-02-08 02:28:24,8,1,en
"Pokemon is 20 years old? OK, I guess I'll have sex with Pokemon then. #SB50",2016-02-08 02:03:53,39,10,en
This halftime show is straight up proof that black people are better than white people.,2016-02-08 01:37:55,24,5,en
Apologies to anyone at the Super Bowl who isn't on tons of drugs right now.,2016-02-08 01:34:40,9,4,en
And they were alllll yellow. And pink. And blue. And purple. And red. And orange.,2016-02-08 01:33:01,5,0,en
Good to know that Janelle Monáe can be bought and sold just like all of us.,2016-02-08 01:30:16,14,1,en
"""And I was all...Hello..."" -Adele clowning on Coldplay",2016-02-08 01:25:21,6,0,en
Ain't no party like a super bowl party because a super bowl party tacitly endorses chronic brain damage.,2016-02-08 01:24:23,20,5,en
Only weird old losers watch CBS.,2016-02-08 01:23:21,11,2,en
Is it too late now to say I'm not sorry?,2016-02-08 01:18:28,7,1,en
Woke up sick today so I don't really care who wins the big game as long as someone innocent is sacrified for my health.,2016-02-08 01:13:20,15,0,en
Congrats to Steve Harvey on being in possibly the lamest commercial I've ever seen. #SB50,2016-02-08 00:39:48,9,0,en
I can't believe Seth and Amy won't talk about how a majority of the beer in this country goes to the top 1%. #SB50,2016-02-08 00:36:46,15,2,en
Where are people watching the Super Bowl next Sunday?,2016-02-08 00:28:44,36,7,en
Go Jags! #SB50,2016-02-08 00:21:56,7,0,en
There was a time when a HUGE selling point for a movie was that it was in fucking color.,2016-02-07 03:00:28,8,1,en
The folding chair seats at the Los Feliz 3 theater should cost a dollar or two less. Sad!,2016-02-07 02:50:34,7,0,en
"All right, that's enough for me. Now gotta cleanse the palate with some Coen Brothers. NOT Koch Brothers!!! ;) #GOPDebate",2016-02-07 02:14:43,15,0,en
I want to be a Republican donor so one day I too can boo loudly at Donald Trump. #GOPDebate,2016-02-07 02:07:25,26,10,en
Trump is Trumping himself. #GOPDebate,2016-02-07 02:06:11,5,1,en
Donald Trump will use eminent domain to get people sick and dying on the streets. #GOPDebate,2016-02-07 02:04:41,2,0,en
Ben Carson is like if Eeyore ran for president. #GOPDebate,2016-02-07 02:03:53,9,1,en
Trump wants to take care of people dying on the street. He's also supporting policies kicking people out into the street. #GOPDebate,2016-02-07 01:59:23,6,3,en
SECRET MODERATORS SHOW UP WHOA WHOA WHOA #GOPDebate,2016-02-07 01:57:40,6,0,en
Chris Christie really wants us all to understand the difference between being a governor and a senator. #GOPDebate,2016-02-07 01:56:14,5,1,en
Rubio may not have experience but he does have the ears of an 80-year-old man. #GOPDebate,2016-02-07 01:41:46,5,0,en
Chris Christie wants to eat Marco Rubio. #GOPDebate,2016-02-07 01:31:55,6,1,en
Everyone I have ever met in my entire life is a completely insane whackjob.,2016-02-06 18:04:27,37,1,en
Haven't met a Wanda since I was a little kid. What gives?,2016-02-06 17:58:23,6,0,en
"""Did you hear that Wanda changed the color of her hair?""

""Man, fuck Wanda.""",2016-02-06 17:57:27,8,0,en
It would be so awesome if we got as mad at our own friends for changing in any way as we do when Twitter or Facebook does.,2016-02-06 17:52:07,11,5,en
When will Twitter really do something that matters and make it so I can use my full name?,2016-02-06 17:37:32,9,0,en
I'm a big fan of the new Twitter. (Does flattery work on algorithms? What about flirting?),2016-02-06 16:56:02,14,1,en
I'm a fiscal liberal. I want the government to spend tons of money.,2016-02-06 16:51:14,12,3,en
Sorry I'm so cool.,2016-02-06 10:37:55,16,3,en
Ppl be talking about Twitter changing like we ain't all gonna fucking die,2016-02-06 08:30:12,37,2,en
About to see @MaryKoCo's band and honestly??? It's tight.,2016-02-06 07:01:55,8,0,en
I just really want Chelsea Handler to be happy.,2016-02-06 04:22:16,22,1,en
Chelsea Handler is such a cutie.,2016-02-06 03:55:43,10,1,en
Boys mansplain because their mothers momsplained.,2016-02-06 03:01:55,15,3,en
It's so crazy that at one point in time the circus was literally the greatest show on Earth. Now most web series are better than the circus.,2016-02-06 02:51:20,39,7,en
"""Millions of Americans are severely affected by clinical depression. Sad!"" -Donald Trump, Psychologist",2016-02-06 02:43:51,26,5,en
"""Well, Son. Your mother and I met when I mansplained to her why she should vote for Bernie in a Facebook post comments section.""",2016-02-06 02:42:38,37,5,en
"""hmm Face/Off that couldn't possibly be about--oh, OK.""",2016-02-06 02:42:02,12,0,en
Completely floored at how substantive and factual this debate is as opposed to any of the GOP ones. #DemDebate,2016-02-05 03:52:19,75,16,en
Ugh Hillary just come out against the death penalty. #DemDebate,2016-02-05 03:43:28,11,0,en
Nice to see both Clinton and Sanders put the Iowa caucus results thing to the side. #DemDebate,2016-02-05 03:27:54,8,2,en
"RE: foreign policy, will voters respect Clinton's vast experience more or will they find her at fault for her Iraq vote? #DemDebate",2016-02-05 03:08:46,3,0,en
"""How are we going to solve this impossible problem that also is probably our fault if you think about it?"" #ForeignPolicy #DemDebate",2016-02-05 03:05:46,12,7,en
A baller move would have been for Sanders to say that Clinton should be his foreign policy advisor. #DemDebate,2016-02-05 03:04:38,44,8,en
Ugh foreign policy shit is so boring. #DemDebate,2016-02-05 03:02:57,4,1,en
27 bucks says that Sanders doesn't talk foreign policy and keeps talking about banks. #DemDebate,2016-02-05 02:58:42,51,12,en
If Jimmy Carter had bad presidential karma then Hillary Clinton has bad campaign karma. #DemDebate,2016-02-05 02:56:31,3,1,en
Clinton is so tough. She's been attacked by the right her whole life and now in two campaigns she's being attacked from the left. #DemDebate,2016-02-05 02:47:31,35,12,en
Hillary is fighting an uphill battle even though she's the one on top. Sanders can attack her without even saying her name. #DemDebate,2016-02-05 02:42:26,12,0,en
It would be so awesome to see a president wear pearls. #DemDebate,2016-02-05 02:39:34,12,0,en
"Ironically, Clinton needs to drop the same type of defensive posture that the Bernie Bros do. #DemDebate",2016-02-05 02:30:35,5,1,en
"Oh, boy. I don't know about that one, Hill. #DemDebate",2016-02-05 02:28:57,5,1,en
Clinton is momsplaining to Sanders. #DemDebate,2016-02-05 02:28:34,21,7,en
Sanders is not walking away from owning being progressive and labeling HRC as establishment. #DemDebate,2016-02-05 02:27:16,1,0,en
Clinton says her VP pick is gonna be her vagina. #DemDebate,2016-02-05 02:26:06,7,1,en
"These are two amazing politicians on stage, man. #DemDebate",2016-02-05 02:22:57,11,2,en
Clinton rattles off the long list of two ways in which Sanders hasn't been entirely progressive. #DemDebate,2016-02-05 02:15:24,10,6,en
Clinton is really gonna try to get down in the details to trip up Sanders. Will it work? Do people care about the details? #DemDebate,2016-02-05 02:11:35,4,0,en
Sanders leans on American Exceptionalism to explain how his goals will be reached. Smart! #DemDebate,2016-02-05 02:10:37,4,1,en
Bernie Sanders: The Unhappy Warrior. #DemDebate,2016-02-05 02:05:32,2,0,en
Martin O'Malley is still here. #DemDebate,2016-02-05 02:02:21,6,0,en
When is March Madness this year?,2016-02-05 01:44:44,11,0,en
I wanna star in a miniseries about Martin Shkreli.,2016-02-04 23:09:16,23,1,en
"this is america dude speak english and use a lot of cool slang like ""lit"" and ""fam"" so we know ur tight as hell",2016-02-04 03:38:44,46,9,en
I can't wait until I am president of the United States of America.,2016-02-04 03:31:38,21,0,en
I'm a Diva Cup guy.,2016-02-04 01:28:30,31,2,en
I would be an amazing King.,2016-02-03 12:16:04,21,3,en
sup girl good night,2016-02-03 11:43:10,3,0,en
Sorry if I'm bad I promise I think I'm being good. whoops.,2016-02-03 11:31:34,5,0,en
All my friends want me to stop having a lot of sex. :(,2016-02-03 11:29:11,12,1,en
"33. Anyway, I am a genius. You're dumb. See ya later.",2016-02-03 10:39:56,29,3,en
"32. ""...and still retain the ability to function."" - F. Scott Fitzgerald",2016-02-03 10:39:41,17,0,en
"31. And now a quote: """"The test of a first-rate intelligence is the ability to hold two opposed ideas in mind at the same time...",2016-02-03 10:38:05,25,0,en
"30. Now smoke weed with me and let's hang out in 2017, when everything we want is legal and free or whatever.",2016-02-03 10:37:11,15,2,en
29. So fucking wake up and realize that and quit eating your own tail.,2016-02-03 10:36:26,8,0,en
"28. If you're even entertaining the idea of Bernie, then in another life at another time you would have been fighting for Hillary.",2016-02-03 10:36:03,16,1,en
27. And acting like you're gonna be pissed because your socialist candidate doesn't win the nomination is so fucking stupid.,2016-02-03 10:35:18,9,0,en
26. This is a fucking adult election. As they all are.,2016-02-03 10:34:50,9,0,en
"25. So don't act like Bernie Sanders is our fucking savior. I love Bernie and will vote for him over HRC, but don't be stupid.",2016-02-03 10:34:29,12,0,en
24. Would we have Obama without Bill? Fuck no! And would we have Sanders without Clinton/Obama? NO AS WELL!!!,2016-02-03 10:33:57,10,0,en
23. Hillary Clinton was part of the fight that laid the groundwork for where we are RIGHT NOW.,2016-02-03 10:33:20,9,1,en
22. Cut to 2016. We are more progressive than ever. More people have more rights than ever. The economy has bounced back.,2016-02-03 10:32:17,7,0,en
