text,created_at,favorite_count,retweet_count,lang
"21. The answer is...NO. But HRC, who tried to push for universal healthcare in the 90s, is now a heretic. A shill. A corrupt politcian.",2016-02-03 10:31:38,7,0,en
20. But HRC has been under a very real spotlight basically her entire life. Do you think anyone really cared when Sanders called Reagan out?,2016-02-03 10:30:48,9,0,en
19. And don't get me wrong. That is cool. Bernie IS cool. Because he was allowed to be!,2016-02-03 10:29:07,11,0,en
"18. Meanwhile, this whole time, some weirdo from a fucking state that doesn't matter has been doing his weird little thing for decades.",2016-02-03 10:28:46,9,0,en
"17. GIVE. ME. A. BREAK. Conservatives may not be smarter than that, but we should be.",2016-02-03 10:27:52,7,0,en
16. She's dishonest! And corrupt! And a liar! And a bitch!,2016-02-03 10:27:19,6,0,en
15. So here is where we are. The wife of the centrist democrat that saved us from the ghost of Reagan is...EVIL!,2016-02-03 10:26:53,7,0,en
"14. And everyone shits on her! Because she is a corporate shill and corrupt and even worse, because she is a damn b-word.",2016-02-03 10:26:01,8,0,en
13. HRCn runs for president. As perhaps the most singularly qualified candidate to ever run for office without being in the military.,2016-02-03 10:24:06,14,1,en
12. Cut to today. Obama has been kicking ass and Hillary has been an amazing public servant and stayed in the game and in the spotlight.,2016-02-03 10:22:06,9,0,en
11. Bill goes on to have an amazing presidency. The GOP has a false victory (in many ways) with George W. Bush.,2016-02-03 10:20:30,7,0,en
"10. The Clintons and America survived all this. Hillary probably suffered more than anyone else, politically speaking.",2016-02-03 10:19:09,9,0,en
9. The GOP hated this. They also hated Bill. And when Bill fucked that woman the GOP ran with it and smeared Hillary.,2016-02-03 10:18:22,8,0,en
8. She also singlehandedly redefined what it meant to be First Lady.,2016-02-03 10:17:58,11,0,en
"7. At the same time, she pushed forth her own agenda (Hillarycare) that was more radical than anything seen before or since.",2016-02-03 10:17:40,11,0,en
"6. Hillary Clinton, Bill's wife and closest political confidant, at times publicly supported these policies. Because she had to.",2016-02-03 10:16:47,8,0,en
"5. If he hadn't done this, he would not have won, and America would be way fucking worse.",2016-02-03 10:16:05,9,0,en
"4. As a result, he supported some policies that now seem really awful and bad. He won on said policies!",2016-02-03 10:15:47,9,0,en
3. Bill Clinton ran against the ghost of the man who was the end result of the rise of conservative politics in this country.,2016-02-03 10:15:14,8,0,en
2. Hillary Clinton IS a career politician who was married to another career politician in the fucking 90s.,2016-02-03 10:14:30,10,0,en
1. OK so instead of just trying to get laid when I get drunk I'm gonna figure out this whole Bernie vs. Hillary thing for all y'all.,2016-02-03 10:13:47,33,0,en
One of my favorite things about me is that I will straight up fall asleep in a suit.,2016-02-03 10:06:25,16,0,en
I'm 30 years old and I still think it is cool that wtf stands for what the fuck.,2016-02-03 00:58:28,29,1,en
I've been having a lot of success recently writing while still in bed. I guess I shouldn't be surprised. I've always done my best work here.,2016-02-03 00:50:15,20,3,en
I wanna go on Shark Tank and pitch them an idea for a TV show called Shark Tank and then I just look straight in the camera and wink.,2016-02-02 21:21:14,36,3,en
I wanna go on that show Shark Tank and pitch them a business idea to make really cool shark tanks then reveal that I am a cool shark.,2016-02-02 21:11:08,21,3,en
I mean even for the liberal media this is a little much. https://t.co/Le1xtg0h2U,2016-02-02 21:07:16,11,0,en
"12. This has been Allen Strickland Williams for a cooler America. Thank you and good night. Oh, it's morning? OK. I'm going back to bed.",2016-02-02 18:04:31,21,2,en
11. SO I suggest the good boys of Bernie and the smart girls of Hillary play nice with each other. It's the COOL thing to do.,2016-02-02 18:02:16,31,5,en
10. But obviously any GOP win would make America a million times less cool. Almost immediately. Trump is making us less cool right now.,2016-02-02 18:01:30,20,2,en
9. And obviously it would get SUPER cool with Bernie. Bernie is like putting a game genie on America and always wearing sunglasses.,2016-02-02 18:00:58,29,6,en
8. You can't tell me that things wouldn't still get cooler with Hillary Clinton as president. Give me a big old break on that.,2016-02-02 18:00:30,22,2,en
7. The truly big division in this country is COOL vs LAME.,2016-02-02 17:59:57,33,5,en
"6. But finally, the real reason is that the BIG division in America is not GOP vs Dem or Conservative vs Liberal or old vs. young or etc.",2016-02-02 17:59:34,12,2,en
"5. Because that's politics in the big leagues, baybee.",2016-02-02 17:58:21,18,2,en
"4. While there are def big policy differences btwn HRC and Bernie, most likely the overall trajectories of their admins would be similar.",2016-02-02 17:57:57,20,3,en
"3. Second, the ferociousness with which each side wants to be right so badly is just boring and v GOP-esque.",2016-02-02 17:56:50,22,2,en
"2. First off, they are both incredibly adept politicians and can do that themselves. Bernie is old but no slouch. Hillary is an A+.",2016-02-02 17:56:08,23,2,en
1. Here is the main problem with Clinton supporters going after Bernie and Bernie supporters going after Clinton...,2016-02-02 17:55:10,14,2,en
Everyone sit down and let me mansplain America to you.,2016-02-02 17:35:28,12,1,en
I wish Benjamin Linus were running for president.,2016-02-02 11:49:21,11,3,en
If Hillary Clinton wins literally everyone I know gets laid so why the fuck is anyone mad about that???,2016-02-02 11:34:44,7,0,en
"Big fan of Bernie but I HATE the antagonism towards Hillary. Chill out, dudes! It's unseemly.",2016-02-02 10:25:37,73,17,en
"Cruz: ""From day one this campaign has been a movement."" Yeah, a bowel movement... #IowaCaucus",2016-02-02 04:26:35,21,4,en
Trump promised we would get tired of winning. I guess he got tired early... #IowaCaucus,2016-02-02 04:21:17,6,2,en
Funny how all these old square white dudes have NO problem hugging Cruz. #IowaCaucus,2016-02-02 04:19:26,11,2,en
"Rand Paul: ""Liberty is alive and well in Iowa!"" And it's drunk and on a bender in New Hampshire... #IowaCaucus",2016-02-02 04:07:58,2,0,en
"O'Malley: ""In conclusion, there is no conclusion."" OK, dude. We get it. You smoke pot. #IowaCaucus",2016-02-02 04:02:50,22,3,en
Martin O'Malley making sure to call out Trump as racist/fascist on his way out. Good boy! #IowaCaucus,2016-02-02 04:02:20,17,1,en
"Dems don't want their white guys pretty. They want 'em frazzled, baybee. #IowaCaucus",2016-02-02 04:01:09,17,0,en
.3% between Clinton and Sanders. What in the hell? #IowaCaucus,2016-02-02 03:59:53,10,0,en
"O'Malley: ""Climate change is the best economic opportunity facing America in fifty years."" So much spin there I got whiplash. #IowaCaucus",2016-02-02 03:59:06,7,0,en
"""I just wanted to make sure I would definitely lose."" -Martin O'Malley #IowaCaucus",2016-02-02 03:57:42,40,9,en
Martin O'Malley suspends his presidential bid to spend the next four years getting even hotter. #IowaCaucus,2016-02-02 03:57:25,44,8,en
I bet Cruz's daughter wishes she had given him a hug now... #IowaCaucus,2016-02-02 03:41:42,15,3,en
"Mike Huckabee drops out of the race but promises a slick, charming moment of bigoted intolerance at least once a year. #IowaCaucus",2016-02-02 03:40:59,37,15,en
"Trump can spin this by saying out of all the losers, he is the winningest one! #IowaCaucus",2016-02-02 03:37:11,7,2,en
Wow. It looks like Rand Paul is gonna take the fifth spot. Only Rubio in the establishment lane. GOP is splintered. #IowaCaucus,2016-02-02 03:36:26,2,0,en
Fate is once again forcing Hillary Clinton into having a Tracy Flick moment. #Iowacaucus,2016-02-02 03:35:03,12,0,en
They're calling the GOP side for Cruz. Never thought I'd be happy Cruz won something. #IowaCaucus,2016-02-02 03:32:01,6,0,en
The only thing I'm not TORN about? My favorite Natalie Imbruglia song... ;),2016-02-01 23:22:23,39,2,en
"OMC's ""How Bizarre"" is probably the best song that ever starts with a description of the band's seating arrangements in their car.",2016-02-01 22:56:51,26,3,en
"BTW there is only one female in my screenplay. It's called ""Too Many Females"" and it fails the Bechdel test with flying colors.",2016-02-01 22:41:26,30,2,en
"""My screenplay."" -Allen Strickland Williams",2016-02-01 22:40:13,23,0,en
"I don't know what it means, but I just outlined a flashback scene for the female character in my screenplay and it made me cry.",2016-02-01 22:40:00,11,0,en
"Wait, @LaraTheGrate @jules_su do you guys actually dislike the taste of truffle oil? Is that a thing?",2016-02-01 22:26:14,0,0,en
Whenever I had a substitute teacher I wouldn't prank them by using a fake name I would prank them by using a fake personality.,2016-02-01 22:22:09,14,0,en
I wanna name my daughter Millennial and I want her to live to be 100 years old.,2016-02-01 22:20:57,11,0,en
All truffle oil everything.,2016-02-01 21:42:17,14,0,en
I'm so cool that I'm gonna name my firstborn child Vinyl.,2016-02-01 21:18:26,26,3,en
I don't mind the wind because it's just the weather flipping its hair to grab your attention so you can start flirting.,2016-02-01 20:11:53,14,0,en
"Why do people always chant ""U-S-A, U-S-A""? I think it should be ""A-S-W, A-S-W!""",2016-02-01 20:10:07,12,0,en
MAKE ALLEN STRICKLAND WILLIAMS GREAT AGAIN,2016-02-01 20:09:09,26,2,en
It's too bad Donald Trump's supporters can't appreciate how ironic it is that they are all losers.,2016-02-01 20:02:31,17,4,en
The McDonald's drive thru employee just asked me if I was being devious tonight. 😈,2016-02-01 10:51:32,31,0,en
"""Low Power Mode Turned Off"" but for my actual life.",2016-02-01 06:19:46,25,3,en
I can't wait to find out which presidential candidates win in a state that doesn't matter tomorrow.,2016-02-01 06:05:54,26,1,en
Marilyn Monroe quote so I know it's real.,2016-01-30 08:58:23,20,0,en
If you can't handle me at my worst then well I guess I'll still eat you out.,2016-01-30 08:53:39,108,16,en
Did u guys ever notice how pretty I am?,2016-01-30 08:51:19,23,2,en
I'm eating the last of this salami by just biting chunks out of it and I've never felt stronger in my entire life.,2016-01-30 01:29:31,41,1,en
sup girl i got sorted into slytherin house,2016-01-30 00:36:00,37,9,en
"Everything is actually part of the matrix EXCEPT the three Matrix movies due to a, you guessed it, glitch in the (real) matrix.",2016-01-30 00:34:10,19,1,en
I'm a fuckgentleman.,2016-01-30 00:22:02,22,2,en
"This War on Christmas is insane. If I want to wish people a Merry Christmas in January, I should be able to.",2016-01-29 23:03:28,17,4,en
I was interviewed about how to perfectly tell a joke because I am perfect and tell perfect jokes. https://t.co/txW4KJEGVP,2016-01-29 22:47:00,27,3,en
It's so crazy how the first state to vote in an American presidential election is populated by a bunch of corn nerds.,2016-01-29 22:44:17,19,0,en
"When I have children, I'll let them drink alcohol at home so I can responsibly teach them how to get super fucked up.",2016-01-28 22:35:26,18,0,en
A horror movie that's just about some mediocre white dude.,2016-01-28 04:24:41,58,7,en
I prefer booty in the fingers.,2016-01-28 00:40:11,17,1,en
Gender? I hardly know...HIM. ;),2016-01-28 00:36:48,43,3,en
crushin so hard u unfollow her insta just so u can follow it again...,2016-01-27 23:10:16,26,0,en
Fifty Shades of ASW,2016-01-27 22:38:37,19,1,en
I'm hosting An Evening with @ericdadourian tonight at @NerdMelt. 9pm. I may wear a bow tie... https://t.co/Ecmgrm3Ahi,2016-01-26 18:54:22,19,3,en
"Just completed my 10,000 hours of being tight as hell.",2016-01-26 18:40:00,60,8,en
"What a great, intelligent answer from Hillary Clinton. A ""When I was your age"" thing mixed with hope and optimism. So smart. #DemTownHall",2016-01-26 03:32:32,8,1,en
i like 1 call it the SeX-Files because i always like to have sex when i watch.,2016-01-26 01:35:31,9,1,en
CONFESSION: Literally anything having to do with Mr. Rogers makes me so sentimental I immediately start crying.,2016-01-26 01:34:24,35,1,en
I think it's cool that women are stoked for Hillary bc honestly I get pretty excited whenever I see a straight white guy running for pres.,2016-01-26 01:14:46,24,6,en
I'm a bye-sexual. I have sex and then I immediately leave.,2016-01-26 01:10:32,39,4,en
"In any relationship, I'm always waiting to hear those three little words: ""luh ya papi""",2016-01-25 19:32:50,40,1,en
I'm pretty.,2016-01-23 11:16:04,23,0,en
The Clueless soundtrack was a big deal for me.,2016-01-23 11:15:57,34,1,en
I'm just a Baldwin looking for a Betty.,2016-01-23 10:38:37,10,0,en
No movie uses voiceover narration as well as Clueless.,2016-01-23 10:38:10,16,2,en
say what you will about the mighty mighty b tones but damn at least they dressed up,2016-01-23 10:14:03,20,0,en
"We all make fun but on the whole dudes are dressing better than they have since before the Cold War. OK, maybe the 80s.",2016-01-23 10:07:23,14,0,en
"""You had me at...goodbye.""

""wtf???""",2016-01-23 09:41:59,3,0,en
Paul Rudd is so cute in Clueless.,2016-01-23 09:41:01,20,2,en
"Clueless and Daria, man. That's my shit. That's what I was into.",2016-01-23 09:39:49,15,1,en
I like Clueless because it highlights how silly yet serious societal norms/rules/customs are.,2016-01-23 09:39:16,8,0,en
"Cher is right, guys, you should use your popularity for good.",2016-01-23 09:36:11,14,1,en
My dad is the dad from Clueless.,2016-01-23 09:22:17,10,1,en
Oh W0W @ericdadourian is Cher from Cher and I am Cher from clueless whoa wow,2016-01-23 09:18:06,15,2,en
I am so Cher.,2016-01-23 09:17:32,5,0,en
sup girl I'm watching clueless,2016-01-23 09:13:39,12,0,en
It's so crazy that I've never done anything wrong.,2016-01-23 09:08:58,30,6,en
I'm back baby,2016-01-23 09:05:46,13,1,en
Aya Cash is so money.,2016-01-23 08:54:02,5,0,en
Let's reboot Frasier. I'm game.,2016-01-23 05:49:21,21,5,en
Do you think you eat more goat cheese than me? Incorrect. You don't.,2016-01-23 00:46:41,23,1,en
Whoa there's a kale reference in Bulworth. Is this like a parallel universe Berenstain Bears thing?,2016-01-23 00:37:54,11,0,en
Halle fine.,2016-01-23 00:03:01,0,0,en
I can't believe I've never seen Bulworth. Well today is the day.,2016-01-22 23:27:11,13,0,en
Golf is the stand-up of sports.,2016-01-22 23:22:17,9,1,en
Damn it of course a documentary about eight-year-old kids who golf makes me want to have kids.,2016-01-22 22:16:58,22,1,en
My spirit animal is Roger Rabbit.,2016-01-22 20:00:03,11,1,en
Kitana Kiki Rodriguez in Tangerine is everything.,2016-01-22 18:57:11,6,1,tl
https://t.co/Md6zmJlL2Y,2016-01-22 18:54:46,8,0,und
Of COURSE I overslept and was over an hour late for jury duty.,2016-01-22 18:02:52,9,0,en
In case anyone was wondering yes I have been a longtime admirer of Wendie Malick.,2016-01-22 09:16:10,11,1,en
Being 30 in 2016 means disagreeing vehemently with your parents' political opinions while asking to use their Netflix account.,2016-01-22 09:09:29,86,20,en
I like going to weddings because either I watch two people I love come together in a beautiful way or it all goes horribly horribly wrong.,2016-01-22 08:49:44,28,0,en
"Palin's meandering, illiterate speech endorsing Trump was a classic example of Schlock and Jaw.",2016-01-22 06:17:13,12,0,en
A tiger can't change its stripes if it is expected to be taken seriously as a presidential candidate.,2016-01-22 06:01:13,10,1,en
sup girl I am v on brand rn,2016-01-22 02:12:28,16,0,en
Of course I like the show Manhattan.,2016-01-22 02:12:14,5,0,en
Each typo you make causes you to lose one year of life.,2016-01-22 01:26:35,12,0,en
"Hulu asked if I wanted an ad experience about a ""noisy bar"" or a ""noisy club"" and girl u know u can find me in the club...",2016-01-22 00:33:59,21,1,en
It's 4:20. Time to jerk off all over my weed and then smoke it.,2016-01-22 00:20:33,35,3,en
YO WHUT UP ITS YA BOY GOD HAHA YEAH THAS RIGHT I MADE ALL YOU MUHFUCKERS AND ALL THIS MUHFUCKING SHIT SO SUCK MY-oh shit my moms textin me,2016-01-22 00:19:59,6,0,en
SPOILER ALERT: Everyone's dad is voting for Trump.,2016-01-22 00:12:33,32,12,en
"*completes one task*

All right let's fucking party!!!",2016-01-21 22:04:30,33,6,en
when those prospectors headed out west in the gold rush they should have just come straight to my twitter feed damn dude this shit is gold,2016-01-21 22:03:58,9,1,en
Malware is a type of software that tells you what Malia Obama is wearing every day.,2016-01-21 21:54:59,18,0,en
SUB TWEET: I wish I owned a submarine...,2016-01-21 21:54:17,11,2,en
"I've assessed the situation with my family and colleagues and yes, Harley Quinn is definitely my type.",2016-01-21 21:52:15,14,1,en
Jesus definitely would have been huge on Vine.,2016-01-21 21:42:28,12,0,en
I deserve all the smoked salmon I eat.,2016-01-21 21:28:24,14,2,en
Tech support dude at the company that hosts my website said he watched my CONAN clip and loved it. So this is what célébrité feels like...,2016-01-21 21:26:15,19,1,en
"The best way to ""Make America Great Again"" would be to go back to a time before Donald Trump existed.",2016-01-21 19:45:44,11,1,en
"Damn, that Sarah Palin sure is good at word talkin'.",2016-01-21 18:50:07,18,3,en
Whoa there is a Sparks song in The Overnight. OK I see you.,2016-01-21 09:44:22,8,0,en
My favorite scene of any rich white people movie is when the rich white people all smoke pot.,2016-01-21 09:43:54,20,1,en
"A booty call but I actually want to have a long, meaningful conversation on the phone with your butt.",2016-01-21 08:38:28,34,3,en
After you watch her set watch Bamford's panel with Colbert it is so beautiful and weird and great. No links. Find it on your own. Worth it.,2016-01-21 07:58:46,10,1,en
Stand-up specials should never last longer than five minutes. An hour special? Are you crazy?,2016-01-21 07:53:27,17,0,en
Maria Bamford is such a genius comedian artist performer special person. We are so lucky to see a bit of her. Watch her Colbert set.,2016-01-21 07:51:30,29,2,en
sup girl i just ordered a teapot,2016-01-21 07:42:13,28,1,en
netflix and still doing this joke premise really?,2016-01-21 07:04:36,29,4,en
"When I look in the mirror I don't know who I am anymore. Not going through an identity crisis, it's just that all white guys look the same.",2016-01-21 04:12:09,36,6,en
If you criticize Bernie Sanders you are definitely an anti-Semite and if you criticize Hillary Clinton you are definitely a misogynist.,2016-01-21 03:27:19,24,3,en
Srsly tho what's wrong with bein confident,2016-01-21 01:53:31,20,1,en
The luckiest you can ever be is to be included in an @ reply with me and @ericdadourian,2016-01-20 22:14:05,9,1,en
Every comedian stole every joke from me. Even the bad comics and the bad jokes. All were originally mine.,2016-01-20 22:10:37,24,1,en
"It's not delivery, it's cesarean!",2016-01-20 22:10:00,57,12,en
The main reason Bernie supporters shouldn't bash Hillary is because a Hillary win means SO much Kate McKinnon.,2016-01-20 22:01:43,27,2,en
"On my deathbed, my last words will just be me smirking and doing the ""jerking off"" hand motion.",2016-01-20 21:35:19,34,4,en
"MOM: If all your friends jumped off a bridge, would you too?

ASW: Idk. Are we talking about a cool bridge? Will I look cool if I jump off?",2016-01-20 21:14:28,34,6,en
"*Bernie Sanders wins the White House*

EVERYONE: But does he have electability?",2016-01-20 19:40:34,32,2,en
Conservatives talk about the perils of socialism as if capitalism didn't bring our economy to its knees in 2008.,2016-01-20 19:24:49,43,9,en
My only issue with Bernie Sanders is that he is waaaaaaaaaaaaay too conservative.,2016-01-20 19:16:55,18,0,en
I stand with Wendy Liebman.,2016-01-20 09:33:11,15,1,en
My favorite movie genre is White Couples Cheating On Each Other.,2016-01-20 09:14:10,22,2,en
The headphone jack on the @RokuPlayer remote is such an inspired idea. Kudos to the ad wizards who came up with that one.,2016-01-20 07:51:35,9,0,en
"I just rationalized my purchase of a TV for the apartment as a way for my roomies to drown out the sounds of me having loud, passionate sex.",2016-01-20 07:46:31,17,0,en
My 30th birthday is an inside job.,2016-01-20 06:58:31,28,0,en
It's my birthday. Please have a few drinks and get high and tell your friends why they are beautiful geniuses you love in my honor.,2016-01-20 06:58:05,39,1,en
About Alex is really good so far. Although I love any movie about college friends meeting up in a cabin somewhere.,2016-01-20 06:43:15,12,1,en
"""I'm with stupid!"" -Sarah Palin",2016-01-19 23:24:39,428,246,en
"If a woman offers me some fresh homemade pussy even if I'm not hungry I'm always like, ""Um...I could eat!""",2016-01-19 23:20:05,60,1,en
"You're the Worst's pilot has all the things I want out of a TV show: cigarettes, drug use, rough sex, a redhead, LA and people being mean.",2016-01-19 22:59:06,23,1,en
"Thanks for all the birthday love, everybody! It legit makes me not care that I'm sick and aging and that the world is a meaningless charade!",2016-01-19 22:54:48,19,0,en
I forgot how awesome the pilot of You're the Worst is.,2016-01-19 22:40:40,18,0,en
"Had to untag myself and report @ghwjresq for posting extremely unflattering pictures of me on Facebook, so yes it is a good birthday.",2016-01-19 15:05:10,6,1,en
"Gave it a few minutes and yeah, being 30 sucks.",2016-01-19 08:05:36,47,3,en
Half an hour left of my twenties. Feeling sick as a dog and going to bed before midnight. This is so off brand it's gonna kill me.,2016-01-19 07:28:46,46,3,en
I can't wait to move to Belize and just be there day in day out wearing a white suit and loafers and no socks ever. 2023 I'm calling it.,2016-01-19 06:45:25,25,1,en
I love Steve Zahn.,2016-01-19 06:32:01,26,1,en
Mozart in the Jungle sucks I thought this was gonna be like a Bear Grylls thing.,2016-01-19 04:43:25,20,0,en
"Sorry, guys. I'm just having a whole life crisis over here.",2016-01-18 23:45:11,31,2,en
I was legitimately depressed about turning 30 until I realized the most beautiful thing about getting older: I can just lie about my age!,2016-01-18 23:30:16,37,1,en
Instead of turning 30 can I just die?,2016-01-18 21:56:13,69,9,en
ugh but I don't WANNA turn 30!!!,2016-01-18 06:51:18,34,0,en
"No coverage from me tonight for the #DemDebate as I am doing my damn but you kids have fun, play nice and destroy the GOP.",2016-01-18 03:06:06,17,1,en
Linda Cardellini on New Girl is bae.,2016-01-17 19:31:07,13,0,en
I eat so much smoked salmon. More than any other living man.,2016-01-17 08:49:15,43,0,en
sup girl i'll be ur seth cohen,2016-01-16 23:58:58,21,0,en
I can't believe there's a three-day weekend in honor of my 30th birthday.,2016-01-16 00:52:18,25,1,en
Guys follow @paigeweldon she is hilarious and should be huge. (I mean like size wise can you imagine a giant Paige???),2016-01-15 23:34:58,16,0,en
I am always paid handsomely.,2016-01-15 21:21:37,24,1,en
Nothing makes me prouder to be an American than the fact that the President is a fan of Kendrick Lamar.,2016-01-15 21:08:50,27,1,en
"Watched the first hour of The Revenant and yeah I pretty much get it. Just one long bad ""case of the Mondays"" kind of thing.",2016-01-15 20:18:34,28,1,en
Hearing these tourists at this Hollywood Bar complain about how the Powerball winner was already super rich makes me so fucking happy.,2016-01-15 08:01:02,23,1,en
No one in this bar knows I'm working on the screenplay that will change the world.,2016-01-15 07:54:39,33,3,en
Performing in front of people IS such a brave crazy insane thing to do. Can you imagine? Performing? For these people???,2016-01-15 07:51:14,17,0,en
I just went to the Magic Castle alone and honestly I'm glad I don't have to share the magic with anyone rn. I needed that all to myself.,2016-01-15 07:42:17,38,0,en
There really is no business like show business.,2016-01-15 07:22:51,4,0,en
Los Angeles is better than New York because Los Angeles has the fucking Magic Castle.,2016-01-15 07:22:31,28,1,en
"Another debate lacking in civility and substance. Lot of anger though. The base likes that. Thanks for playing, folks! #GOPDebate",2016-01-15 04:27:42,8,2,en
"I hope Ted Cruz would ""have the backs"" of the military, first responders, etc. If he wins they're gonna be in more danger. #GOPDebate",2016-01-15 04:26:17,3,2,en
Ted Cruz using his closing statement to plug an upcoming movie. You know I love that. #hollywood #GOPDebate,2016-01-15 04:25:12,6,0,en
"Christie says Obama talked about America at the State of the Union as a ""fantasy land."" He wishes it was a Candy Land. #GOPDebate",2016-01-15 04:22:06,8,1,en
Bush seemed to have an OK night. #GOPDebate,2016-01-15 04:21:29,1,0,en
Just found half a joint on the floor. California truly is a liberal paradise. #GOPDebate,2016-01-15 04:20:55,15,1,en
"Because this is Fox I thought one of the biggest words in that word map would have been ""crocs"" #GOPDebate",2016-01-15 04:14:51,5,1,en
God this crowd is rowdy. Reminds me of a bar show I did three years ago. #GOPDebate,2016-01-15 04:13:33,4,0,en
"Audience members yelling ""WE WANT RAND"" Actually it's just Rand Paul in a disguise chanting from the back. #GOPDebate",2016-01-15 04:07:53,9,5,en
What was that chant? #GOPDebate,2016-01-15 04:06:06,2,0,en
Chris Christie promises a narc on every corner. #GOPDebate,2016-01-15 04:05:00,6,0,en
Trump admits he doesn't know that the thing up in his head is called his brain. #GOPDebate,2016-01-15 04:03:12,7,1,en
